start,end,text2124.32,2127.32," You are unlikely to then feel that you are being moderated. Let's say this doesn't happen either. You're going to be angry at Fox News, which is why you're going to get even more radicalized, who are unlikely to then feel that you are being moderated."
2127.32,2128.68, Let's say this doesn't happen either.
2128.68,2130.24, You are going to be moderated.
2130.24,2133.94," Here's why, even then, showing all forms of viewpoints is something that is bad in society."
2133.94,2136.52," We asked them at a POI, do you think that a Holocaust survivor should be given the same"
2136.52,2140.1, amount of viewpoint as someone who is a Holocaust denier?
2140.1,2143.14, We think that this is absolutely horrible for two structural reasons.
2143.14,2145.86," Number one, in the instances of a pandemic, when there's a time-sensitive issue,"
2146.08,2149.68," every single time you want to have a conversation about vaccines,"
2149.86,2151.78, you need to have anti-vaxxers necessarily come in.
2151.98,2153.5, You need to give them the credence.
2153.7,2156.5, This fictionalizes the entire conversation because debates get stalled out.
2156.56,2159.32," They're much longer, which means that you actually have a much more time lag"
2159.32,2160.3, when actually fixing the issue.
2160.3,2164.2," But number two, you have to understand that some people might actually go on the side of the anti-vaxxers."
2164.26,2167.36, There's no guarantee that if their experts are actually good that is your best case
2167.36,2171.36, that some people will inevitably be drawn towards anti-vaxxers which means these issues never get
2171.36,2175.76, fixed in the first place let's say this doesn't happen either we then believe that people are
2175.76,2180.64, likely to flood to worse forms of social media or what's up on the news consumption i.e from social
2180.64,2184.72, media why does this happen one because your likely reaction to fox news showing being critical of
2184.72,2187.28, trump is to not watch fox troops you go to other alternative forms of
2187.28,2191.28, media like subreddits but number two people are in generally very critical of the government this is
2191.28,2195.36, because the government is often responsible for the 2088 financial crisis so incredibly critical
2195.36,2198.72, of the government now that the government controls the media you are unlikely to then believe in the
2198.72,2202.8, media so you go to subreddits you go to facebook groups these are significantly worse because one
2202.8,2208.16, there are no editorial bodies actually holding them to account but number two everyone can post anything there anonymously there
2208.16,2211.6, is no journalists you actually know so you can't actually call them out on it at the end of this
2211.6,2215.68, debate we tell you the government are going to heavily misuse this even if they don't media
2215.68,2219.2, outlets will never do this properly and even if they do we think that people are just going to go
2219.2,2267.0," to worse forms of media all of their harms are significantly amplified under their side. We are so, so proud to oppose. Hi, am I audible and visible?"
2267.0,2289.28, If you are. between the government or tycoons filtering media and which one is better secondly about what state has better discourse and use quality but before that i'll just engage with the 30-second extension
2289.28,2293.92, on extremism and why we force people to go into more radical news i'd just like to know this
2293.92,2298.48, clash is actually on our state house and where to win it is not contingent on us proving why we have
2298.48,2302.88, decreased radicalism it is about providing people a choice that they believe that they do deserve
2302.88,2313.22," and also about increasing discourse the clear record from from DLO was that if you have extremists and they see that Fox News is being infiltrated with liberal values, they want to go to even worse resources."
2313.58,2314.52, A couple of responses to this.
2314.94,2317.5," Response one, notice that a lot of these radicals have probably changed."
2317.76,2320.2, The reason for this is they want to believe that they're unbiased.
2320.2,2327.86," So if there's a fairness doctrine imposed and it suddenly switches views, it probably also implies to themselves that they are being biased, so that's why they wouldn't want to"
2327.86,2328.86, switch.
2328.86,2329.86, We also think they have ties to anchors as well.
2329.86,2330.86," For example, a Fox viewer probably would have ties to Tucker Carlson."
2330.86,2331.86, That's why they wouldn't switch to even worse extremist views.
2331.86,2332.86," Response two, we don't see opposition that actually exaggerates the harm of these radicals"
2332.86,2333.86, and what they could do.
2333.86,2334.86," Because if news is moderate, per the characterization, under the status quo, I don't really see why"
2334.86,2335.86," this fairness doctrine would suddenly be a tipping point because on our state house,"
2335.86,2336.86, our policy is just an extension of the status quo.
2336.86,2337.86," If it doesn't, then it's just a bias."
2337.86,2338.86," So if there's a fairness doctrine imposed and it suddenly switches views, it probably"
2338.86,2339.86," also implies to themselves that they are being biased, so that's why they wouldn't"
2339.86,2340.86, want to switch.
2340.86,2348.0, We also think they have ties to anchors as well. they could do because if news is moderate per the characterization under the status quo i don't really see why this printer doctrine would suddenly be a tipping point because on our state house our
2348.0,2352.0, policy is just an extension of status quo if it's so moderate as it could be claimed but even if
2352.0,2356.72, it's radical that do a lot of harm society within their already laws preventing that for example
2356.72,2361.84, sedition laws or terrorist prevention laws that do mitigate the harm from opposition response to
2361.84,2368.08," i think under state house even if there's harm it probably isn't circles of left influence because there aren't as many viewers, but even if there are a lot of"
2368.08,2371.76," viewers, criticalization, if we could regulate that on their state house. Fourthly, we don't"
2371.76,2375.48, need to prove why radicals are actually bad. All we need to prove is why our principle path to
2375.48,2379.1," victory, in which we actually allow them more choice, is a better comparative. So even the"
2379.1,2383.88," people who are pushing radicalism, I think that's a net good because you're able to also exercise"
2383.88,2388.08, your choice as well. I want to deal with our first question on government versus tycoon's full-time media
2388.08,2392.64, under this clash i'd like to deal with two things firstly engage with a principal practice victory
2392.64,2397.28, and push it and secondly deal with the claim coming from opposition about government outreach
2397.28,2401.6, the first thing i'm going to say opposition was that on how new since governments are able to
2401.6,2406.24, censor the media and these news media because they notice it they'll also censor themselves as well
2406.24,2410.56, and what is controversial is already subjective a couple responses to this i think firstly i'll
2410.56,2414.48, just like to know now model we made it really clear what these issues look like that have
2414.48,2418.48, large significant importance it looks like those that have large significant societal discussions
2418.48,2422.64, or that do also care to referendums but technically i would like to know on the opposition
2422.64,2428.0," they use the same actor as well so i don't't really think like under State House, we're so biased, why State House would be any better?"
2428.0,2433.0, They actually need to prove the comparative. We actively go to reasons why governments wouldn't really want to abuse.
2433.0,2437.0, So we told you why the government is largely a civil service and is not subjected by partisanship.
2437.0,2443.0, We also told you why you could also have call mechanisms and it directly engages the point about media self-censoring.
2443.0,2448.16, The reason for this is we think that when people more informed on our state house news media they also have an active
2448.16,2451.64, incentive to call out the government if they're constantly being abused within governments they
2451.64,2456.2, also have no direct incentive to also abuse the news corporation as well this is my third response
2456.2,2461.48, this is for two reasons firstly when you say those are in the fcc they probably go into news industry
2461.48,2467.26, after the term in the fcc because they're probably experts in that field So what happens then is that they also want to care about their own reputation.
2467.54,2471.18, So that's why they wouldn't really want to oppress these media because they'll be seen as being corrupt.
2471.44,2474.8," But secondly, though, we think the role of news media is to dig up their own politicians."
2475.12,2480.0," So if you have the SEC regulator that's being so corrupt, we think they also know that the news media might dig up their own."
2480.0,2483.14," For example, your scandal and also the mistrust and all these scandals."
2483.38,2488.08," So that's why on their statehouse, politicians, they don don't on our state house politicians have an active incentive not to be"
2488.08,2491.84, corrupt the next thing that give us on their state housing thank you it's an objective bricks you can
2491.84,2497.04, only they also censor media when it's also perpetrated violence or lies and slander two
2497.04,2501.36, responses i think one we're giving you objective risk on our state house which a lot of these news
2501.36,2504.96, that's so biased on their state and leads to active farms for example marginalization of
2504.96,2507.68, minorities and other people being politic of exercise. So we think
2507.68,2511.12," on our state, we're actually just preventing the farm. Secondly though, we think like value"
2511.12,2515.36," judgment on our state house is actually, value judgment on our state is actually being preserved"
2515.36,2518.96," as a net good for the principal. Now, the claim that gives us for a principal is that people,"
2518.96,2522.72," they don't have, like they could go to like different news channels and that's also a good"
2522.72,2527.64," thing. Couple responses. I think one, we give the active reason why people aren't able to cross-compare because they don't have the"
2527.64,2531.0, time. It also determines on the family they're born into. That's why it's even worse when people
2531.0,2534.84," don't have active choice. But secondly though, we also proven to you on why on their state house,"
2535.16,2538.68, it actually is even worse when people can't democratize the choice that they actually get
2538.68,2542.94, because the issue isn't intervention or no intervention. Intervention happens on both
2542.94,2548.08, sides. One side opposition is directly by these tycoons or media corporations for example mudrock or fox news so that's where
2548.08,2553.28, on your city house when you're able to only propose they support the principle then individuals are
2553.28,2556.96, able to make the choice because we actually told individuals that all these views are important we
2556.96,2561.92, don't have a ceo deciding that before that sure do you think brett kavanaugh cares about his
2561.92,2565.8, reputation when he's pushing forward conservative ideologies?
2567.74,2568.08," We think firstly, he's one of the exceptions."
2572.22,2572.4, We think a lot of these news media corporations and also these governments actually do care.
2577.16,2577.3," But secondly, even if they don't care, we think a lot of news media corporations and also the people will point it out."
2578.28,2578.56, It's not as bad as you claim.
2580.52,2580.78, Second question on whether it scores in news quality.
2582.88,2583.2, The first thing it gives us is that you have less funding and resources.
2584.86,2587.24," So that's why you want to focus on complex issues. A couple responses. I think, one, we're talking about big"
2587.24,2591.16," corporations under this motion. We still do have funding. Secondly, even that's not true. We can"
2591.16,2594.98, also focus on facts and fill in the gaps of discourse as well. You don't need to have a lot
2594.98,2598.94," of opinions. We're able to let people at least know basic facts of everything. But thirdly,"
2598.96,2603.0," though, we didn't even if, like, we have less resources to pour into a lot of views. All these"
2603.0,2607.36," individuals, they know different sides of the issue. They can cross-compare and understand these different issues as well."
2607.36,2610.72," Next time I give us is that presenting both sides of the issue is not good. For example,"
2610.72,2614.72," certain issues don't deserve equal coverage. For example, anti-vaxxers, they pose an actual harm"
2614.72,2619.28," to society. Couple responses. I think first, like not objectively, more people will actually believe"
2619.28,2622.96," in conspiracy theories. For example, the anti-vaxxer theory, we didn't see the more time"
2622.96,2627.6," you actually give to them, people also recognize that's something that shouldn't buy into. Within an understated house,"
2627.6,2631.04," if you don't give them a platform, essentially what they will say is that it's a witch hunt against"
2631.04,2634.16," our views. So that's why you're comparing it on their state health, it's far even worse."
2634.16,2638.16," But secondly though, we think even more people buy into conspiracy theories, that mindset also"
2638.16,2642.4," cuts full void, because a Fox News person might also be influenced by liberal values,"
2642.4,2649.34," but a person with liberal values may also be influenced by Fox News. So I think on the numbers game, it's not objectively true that more people will be influenced by the anti-vaxxer theory."
2649.52,2667.52," Response three, even if that wasn't true and of revenue. Corporate responses, I think one,"
2667.52,2672.32, that is not true because Mudrock for example by Fox he has ties to the Republican party and also
2672.32,2676.48, conservative values. So that's right because of ad revenue he has an active incentive to make sure
2676.48,2680.64, his profit incentives is actually maximized. That's not equivalent to preserving people's
2680.64,2683.84, best interests and also giving them information that they actually need to operate in the
2683.84,2687.24," democracy. Secondly, even though that was true, I mean it's actually impartial,"
2687.24,2690.08, wouldn't we make it just even better on Earth Day House? You have to weigh it on the
2690.08,2694.94," comparative. Next, the idea all gets us, but how news is largely going to be tokenistic"
2694.94,2698.7," on Earth Day House, which you actually intentionally portrayed views incorrectly, and is an illusion"
2698.7,2702.8," of sovereignty. Couple of responses. I think one, on Earth Day House, we have active competition"
2702.8,2709.0," between a lot of news sources. So if you intentionally portray a view wrong, we're able to also call it out and you'll get outcompeted in the media cycle."
2709.0,2716.0," Two, we need people that actually want to hear the views correctly portrayed because they're confident in your views and want to hear it directly engaged with."
2716.0,2719.0," So if it's not portrayed correctly, we'll also want to speak out for a model."
2719.0,2725.24," We'll be able to portray the most accurate views. But three, we think even if it's not true that people aren't able to call out a lot of news"
2725.24,2726.66," that's portrayed incorrectly,"
2726.66,2728.1, we think the audience will struggle overtime
2728.1,2730.0, on our state house and its unique benefit.
2730.0,2730.84, And what should I dare say?
2730.84,2733.36," People just get used to sensationalized views on our state,"
2733.36,2735.32," even if in the short term, you're unable to call out."
2735.32,2736.22," We think it's a norm,"
2736.22,2738.28, and we should be able to also achieve a benefit
2738.28,2739.12, in the long term.
2739.12,2741.16, But what is the response to on-site opposition?
2741.16,2742.36," I'd like to know a couple of things,"
2742.36,2744.0, because I think they have been largely dismissive
2744.0,2744.84, of our case.
2744.84,2748.02," Firstly, on the principle, we have told you why impoverished media corporations"
2748.02,2751.74, basically mean they self-centred and intervene on what youth people are able to access to.
2751.98,2755.42, We think people largely don't have the time to cross-compare. It's also arbitrary whether they
2755.42,2758.92," need to point into a family or whether they're conservative or not. Within our state house,"
2759.0,2762.86," we're actually able to uphold the principle of choice. But secondly though, we also told you in"
2762.86,2766.1, the second argument on why equal chambers also are going to be demolished
2766.1,2766.94," on our state house,"
2766.94,2769.2, and why we're also able in a third-standard argument
2769.2,2771.76, to get more smaller parties also having their views portrayed
2771.76,2773.26, the deal just didn't respond to this
2773.26,2775.5, for all these reasons I'm so proud to propose.
2780.88,2782.54, I thank the speaker for the very fine speech.
2782.54,2807.0, Got a number of a mobile app here. Am I visible and audible?
2807.0,2811.0," Great, thank you. I'll start in 10 seconds."
2811.0,2873.5," Just a reminder, no perfect pronouns and I'll take the words in the chat. Thank you. Starting my speech in 3, 2, 1."
2874.0,2877.36," From first proposition, we get a really idealistic world"
2877.36,2880.1," where they want to change every single thing that is wrong in the status quo,"
2880.3,2883.86, where they want to achieve massive utilitarian outcomes.
2883.86,2887.22," By Prop 2, they realize that they could probably never prove that."
2887.54,2890.78," So at the end of the day, what Proposition's only strategy in this round is"
2890.78,2894.34, to hedge their bet on maximizing choice.
2894.66,2897.9, But the problem of only prioritizing choice in a round
2897.9,2901.38, is that you never proved why choice is inherently important.
2901.72,2905.66," Unless you show to the panel as to why your principle has a unique value,"
2905.94,2912.08," i.e. why this is a fundamentally good thing to do, your principle necessarily doesn't weigh against"
2912.08,2916.7, that much of the outcomes that we're talking about. Let's clarify something. Proposition
2916.7,2920.54," has the burden to prove two things to justify the implementation of the fairness doctrine. First,"
2920.58,2923.48," that the problems inside a school can never be solved in any other way. And secondly,"
2923.48,2927.86, the fairness doctrine can in fact improve things by censoring outlets with significant audience outreach.
2928.26,2937.42," Notice that they cannot only say that they maximize choice because maximizing choice, unless it results in utilitarian outcomes, does not hold any form of value."
2937.66,2943.8," Insofar as we can disprove any one of those burdens and prove that they actually make things worse, we do have an edge."
2944.16,2948.74," From opposition, therefore, recognize our claims were pretty simple."
2949.12,2952.8," First, that the Fairness Doctrine could be, in fact, used for abuse of power by the government."
2952.94,2955.34," And secondly, that media coverage would, in fact, be worsened."
2955.62,2958.22," So therefore, I'm going to structure my speech to answer these two questions."
2958.48,2961.62," First, on the question of could the Fairness Doctrine be used for abuse of power by the government."
2962.0,2967.84, Notice that the way in here is all of Proposition's arguments were predicated upon them proving that this media censorship would be done effectively
2967.84,2972.0, and the policy would be implemented impartially so if we can disprove that all of their benefits
2972.0,2976.0, fall a common feature of both worlds is that politicians ranging from those in western liberal
2976.0,2979.44, democracies like the uk and the us to those in semi-democracies like hungary and brazil
2979.44,2983.6, have an incentive to prolong their tenure and hold on to power the deciding factor then becomes
2983.6,2986.8, was a capacity for them to actually materialize their ambitions.
2986.8,2988.62, Props suggested that the reason they have democratic checks
2988.62,2990.68," and balances is because A, it's a democracy"
2990.68,2991.76, where this debate occurs.
2991.76,2992.92, I have three observations here.
2992.92,2995.76," Number one, democracy is in a monolith, it's a spectrum."
2995.76,2997.94, Here's where Basma's argument about talking about countries
2997.94,2999.3," like Brazil, Poland, and Pakistan"
2999.3,3000.6," become really, really important."
3000.6,3002.7, The ruling parties are getting new legal processes
3002.7,3003.58," to limit media freedom,"
3003.58,3007.62," and that's exactly what happened in Hungary, where V Vides shut down oppositional parties by saying they weren't"
3007.62,3012.42, impartial. Propositions that only claim theirs even if these are semi-democracies people have
3012.42,3016.72, increased political participation. But no you miss the nuance here where you literally give
3016.72,3022.44, active ammunition to the ruling party to clamp down on oppositional coverage by literally saying
3022.44,3029.6," that they are not being impartial enough. This is incredibly harmful because you allow them to consolidate power far, far more. Secondly,"
3029.94,3035.2," even in the US or UK, Basma explained to you that how the administration actually intervenes so much"
3035.2,3039.16, in media coverage like the Watergate scandal. Also look at other cases as to how gerrymandering
3039.16,3043.92, allows them to legally manipulate constituents. What proposition does is legally codifies the
3043.92,3048.46, capacity for these administrations to essentially abuse their power that has been given to them.
3048.68,3053.38," What then is the comparative? Our world relies on objective data to punish outlets, i.e. if an"
3053.38,3056.18," outlet spreads misinformation, they can still be kept in check under our side of the house,"
3056.4,3060.46, relying on facts. Given that we do not rely on subjective perception of an entity as to what is
3060.46,3064.7," fair or how much time should be given to an issue, you allow a terrible metric to overtake media"
3064.7,3069.28, freedom. Here's where Shire's unengaged material becomes really really important he
3069.28,3074.48, explained to you that obviously there are differences between certain announcers on
3074.48,3079.76, one particular opinion show insofar is even if it is true that you both of them are experts
3079.76,3086.24, presumably proposition under side proposition they can never make a conclusive conclusion simply because you reach a deadlock.
3086.48,3091.0, What then they do is rely on enigma or eccentrics of the speaker.
3091.32,3100.42," Presumably, then what side proposition does is push people to make terrible choices where they are essentially flocking towards people who might be on the fringes now."
3100.58,3104.74," We told you that under our side of the house, media organizers can still liberalize."
3105.04,3108.56, Their second claim was that there would be backlash because these are larger companies who own this
3108.56,3112.88," media outlets. First, the government literally has legal defense and evidence that you're not doing"
3112.88,3115.84, enough. The nuance is this is a subjective perception. There is no way that the company
3115.84,3119.84," thinks is fair, would be considered fair for a government that wants to come down on you."
3119.84,3124.64," Secondly, notice that how large outlets are often owned by the same organization, i.e. Comcast owns"
3124.64,3125.28, both liberal
3125.28,3126.34, and conservative and outlets.
3126.34,3128.38," This implies even if one outlet gets slammed down on,"
3128.38,3130.42, they recognize their other outlets will perform better.
3130.42,3132.06, So they have no incentive to protest.
3132.06,3134.4, And their claim was this is a regulatory body.
3135.92,3137.78," Take a step back panel and notice,"
3137.78,3139.7, this literally knives their argument.
3139.7,3142.32, If their intuition is media outlets erode choice
3142.32,3144.86," by forcing down specific opinions on audience,"
3144.86,3145.6, why is it fair
3145.6,3150.64, for one undemocratic regulator to do the same where they decide how much coverage a victim of
3150.64,3155.12, gun violence gets how much covid vaccines are talked about this is literally the same thing
3155.12,3159.52, that they're doing only resulting in worse or outcomes second we told you that given that these
3159.52,3164.88, would be still selected by like say the government the biases would of the administration would seep
3164.88,3165.34, into them.
3165.56,3169.78, The comparative is one where we have international fact-checkers. We have apolitical bodies who are
3169.78,3174.32," not selected by the government. Propositions rely on government's whim. We do not. Therefore,"
3174.48,3178.48, this is the reason why they can never have impartial implementation. This proves that
