start,end,text1134.42,1138.56, needed to answer? Because I think the reason they have to lose this debate is they are far
1138.56,1144.02, too parallel in just arguing in a vacuum about democracy. We gave you argumentation that directly
1144.02,1149.44, had comparatives as to why even in the perfect scenario of opposition what economic redistribution and
1149.44,1154.56, economic prior economic rights could not take a back seat because it was about survivability
1154.56,1159.52, and the livelihoods of individuals right now these safety net mechanisms would only kick in and it's
1159.52,1170.56, far too reactionary but individuals were already lost that was the comparative that was made clear in the third minute of first proposition that saw little to no engagement at all i will do the wing and i
1170.56,1174.88, will do the comparatives later on but that's just something to note at the top of this speech i have
1174.88,1179.12, three things to do in the speech i'll number one give you observations and framing number two i'll
1179.12,1183.76, strengthen the case that was unresponded to and add additional layers of responses and analysis
1183.76,1190.58, and lastly i'll introduce a third substantive argumentation as to how economic empowerment is a healthy democracy.
1190.92,1196.42," No, I'll take one later. Moving on to observations and responses. Note that first on their mechanism,"
1196.78,1201.58, they wanted to just assert that they would have free and fair elections and in response to our
1201.58,1206.86," harm that they did not prepare for, would just simply ban lobbying. Note firstly, this is just a literal frivolous response."
1207.08,1208.58," You can't just assert banning lobbying,"
1208.82,1211.76, especially in the context of post-colonial African states
1211.76,1213.3, where these are nascent democracies.
1213.6,1215.14, And we've also outlined and highlighted
1215.14,1216.76, that even in entrenched democracy
1216.76,1218.24," and strong Western liberal ones,"
1218.54,1219.74, lobbying isn't actually banned.
1219.92,1221.64," But even if we assume this were to be true,"
1221.8,1224.3, they never actually responded with this catch-all response
1224.3,1226.1, towards the argumentation at all.
1226.22,1229.46, Because we told you two unique things regardless if you ban political lobbying.
1229.8,1246.24," Number one, in terms of even if you ban political lobbying, what is the enforcement mechanism insofar as they still haven't told us why the individuals on the ground are financially empowered to actually be act in order to actually be political agents within society to hold them accountable. But number two, social privilege still existed,"
1246.24,1248.5, which meant that the second analysis that came up
1248.5,1252.1, from first proposition as to how the elite control media.
1252.1,1254.96, The elite are the ones that control TV and airtime
1254.96,1257.16," and interviews, only the wealthy and privileged"
1257.16,1259.9, and the words that they say hold weightage in society.
1259.9,1262.22," So regardless, even if you believe you could ban lobbying,"
1262.22,1264.78," these social influences that you had still existed,"
1264.78,1268.78, they need to deal with that in second opposition or they can see the entirety of the harm still.
1269.08,1273.42," But thirdly, we told you even if it was the case where you banned lobbying, it was implicit"
1273.42,1277.7, expectations when you gave massive amounts of money to political donors.
1277.7,1282.54," So it did not matter that I explicitly said, vote for, I will give you a million dollars"
1282.54,1284.78, and therefore you don't vote for certain policies.
1284.94,1289.84, It was about corporations implicitly giving a large sum of money to large political candidates
1289.84,1294.64, and assuming implicitly there's a promise for certain outcomes and certain policies so their
1294.64,1298.42, catch-all response in their own mechanism and their own setup does not actually work and they
1298.42,1302.74, can't just assert that it will be done well because note that it first the Poy to first off
1302.74,1306.0, proposition is entirely entirely disingenuous in
1306.0,1312.06, terms of they want us to defend our broken system that for some reason if we are the same government
1312.06,1316.98, and the same structure on our side it will be done badly on our side these malevolent actors
1316.98,1321.66, will subvert the economic redistribution but on their side in the same actor that would run the
1321.66,1328.62, same political rights they would do it perfectly and give it to each and every individual. Either this debate needs to exist cleanly where we both assume we
1328.62,1333.02," have the fear to institute our policies initially, or their side needs to also argue for discrimination"
1333.02,1337.0," of individuals because you would likely not institute and give Black African Americans,"
1337.3,1342.04," sorry, not African Americans, Black South Africans the same level of political leverages as the white"
1342.04,1348.28, majority because that would quote-unquote anger them. That is the crucial observations and responses. They have to resolve this or their
1348.28,1353.52," case needs to concede to prop. But on to material responses. On the idea of conflict, not that we"
1353.52,1358.36, think it's highly simplistic why conflict exists as the backbone of the case. They said that you're
1358.36,1364.26, angry at the minorities for taking money and redistributing it to individuals. Note that this
1364.26,1366.34, exact same analysis applies to them
1366.34,1371.18," because the majority that was privileged from colonialism under divide and conquer, certain"
1371.18,1375.7, ethnicities benefited more. Certain ethnicities were granted the right to education through
1375.7,1381.32," English schools, for example. Some of them were allocated to more proliferating and more"
1381.32,1386.12," socially uplifting jobs, for example, in the agriculture sector,"
1386.28,1390.46," where some individuals were forced to work in the mines, which means that granting them equal,"
1390.58,1394.62," if not the same political rights, and in a case where they would be the overwhelming majority,"
1394.88,1398.98, would also make you pissed off at minorities and equate to the same kinds of outcomes.
1399.24,1403.62, The only assertion as to why you would be able to correct this is power sharing agreements that
1403.62,1408.24," incentivizes the race to the top, and therefore you co-opt all the propositions benefits in the first"
1408.24,1412.72," place. We told you in our second proposition speaker two things. In terms of number one,"
1412.72,1417.32," political participation is unlikely to exist insofar as the individuals are the most impoverished,"
1417.32,1421.16," which meant that it isn't the race to the top, but rather it's extremely easy to cater"
1421.16,1429.38," to the simplistic needs of individuals on the ground to keep them quiet. It looks like giving them financial aid from politicians and say, vote for me, giving them"
1429.38,1433.8," bags of rice, and therefore that is sufficient for them to vote for you in office, which means"
1433.8,1437.16, that they don't get a raise to their top because it's extremely easy to sway these individuals
1437.16,1442.04, into voting into those systems. So it's likely the exact opposite insofar as you're able to
1442.04,1450.3, exploit the individuals where you don't give them economic resuscitation in order to mobilize but second is more important than reparations all they say here
1450.3,1455.24, is that the right to choose is important and the democracy fosters transparency before i move on to
1455.24,1459.02, the point i'll move on to this i'll take a point she talked about how rich white people are the
1459.02,1462.68, minority but they have the majority of political and economic power so isn't it more likely that
1462.68,1467.32," the black majority will be able to vote these people out and potentially regain some amount of power, which"
1467.32,1472.46, doesn't happen on your side? The entire second argument from first proposition was explaining
1472.46,1477.54, to you why money was important in deciding political outcomes in terms of the social
1477.54,1482.48," influences, the social spheres, because the status quo based on their vote should not be the status"
1482.48,1488.62, quo that we see today. But the only reason of logic for why democracy is more important than reparations is the right to choose. We told you
1488.62,1493.08, straight up from first proposition why the right to choose takes a backseat insofar as exercising
1493.08,1497.68, the autonomy requires you to be in a certain level of financial privilege to access all of
1497.68,1501.84, those sorts of things. Whether individuals even vote in the first place is questionable insofar
1501.84,1506.8, as people care more about their financial survivability
1506.8,1510.78," in the meantime. I think this takes out two of their argumentations, but it was also comparative,"
1511.02,1515.56," the only thing Proposition was willing to do. On to a third argumentation then, as to why economic"
1515.56,1520.9," empowerment is the backbone of a healthy democracy. Three parts. A, economic upliftment is exactly"
1520.9,1528.84," what elevates the social class of citizens to become the working class majority. Quotas for unemployment, land for businesses, and disposable income to increase"
1528.84,1534.0, employability are all the conditions PrEP creates to mobilize the impoverished to the working class.
1534.26,1538.6, This translates to more participation within the education system when children no longer have to
1538.6,1543.84," choose food over school, which increases political literacy within the population. This argument is"
1543.84,1548.32, uniquely explaining to you why only economic rights needs to be first rather than and it leads to an
1548.32,1553.04," eventual organic roadmap to political change. But second, the working class form the largest and"
1553.04,1557.68, most influential persons in every democratic system. We never required the legalization of
1557.68,1563.12," formation in order to associate or the right to vote. Grassroots labor movements, birthed from"
1563.12,1569.0," the economic demands of the most populous and the most empowered, are the individuals that control the system. This is for two reasons,"
1569.28,1573.4," money and critical mass. Money is the prerequisite, as we explained earlier, to increase political"
1573.4,1578.24, awareness and participation. Only when we enable participation do we get the critical mass needed
1578.24,1582.74, to pressure the state to institute change. The same way women's suffrage movements never had
1582.74,1589.0," the right to vote, us being able to be in positions of education and leverage enabled us to mobilize and engage and get the right"
1589.0,1591.06, to vote in the process of advocacy.
1591.06,1594.72, If you want to actually uplift the individuals on our side and the people that are the most
1594.72,1596.72, disenfranchised side with prop.
1596.72,1612.4," I'll take a second, prop speaker, and then the second drop speaker invite the second off"
1613.92,1616.0, i hope i'm audible and visible
1627.36,1627.62," okay i'm going to begin in three p us verbally by, sorry, going to begin in three, two, one. Panel, here's the deal."
1633.14,1642.7," If you have white people being rich and black people being poor, that's because governments structurally prefer the former. Governments are corrupt, governments are discriminatory."
1643.1,1646.94, Proposition gives in the nation and all we do is try to hold them
1646.94,1652.82," accountable. Three questions on team opposition. One, which side gets economic and land reparations?"
1653.12,1660.2," Two, which side gets less toxic spheres? And three, which side gets better foreign relations"
1660.2,1666.68," and investment? But first, I want to clarify something. They make it seem like we don't give people food,"
1666.92,1668.24, water or housing on our side
1668.24,1669.84, and just toss ballot boxes at them
1669.84,1670.88, and ask them to vote.
1671.26,1674.16, Democracy includes certain taxing systems.
1674.38,1677.58," It includes investing in things like healthcare, education."
1677.94,1680.0," However, we just don't prioritize"
1680.0,1681.72, economic and land reparations
1681.72,1683.34, and do something as radical
1683.34,1685.26, as making a post-independent state
1685.26,1691.0, entirely socialist and distributing all the land like trying to do so equitably now which side gets
1691.0,1695.6, economic and land reparations we tell you we get it better because we're able to get it later on
1695.6,1701.1, as the democracy progresses as people immerse why is our likelihood better firstly because their
1701.1,1730.1," side of the house isn't equitable the only incentive that people on their side have, meaning to say, after you are elected, it is likely that the independence party is in charge. These are people that are likely to be power hungry. This is why they sacrifice so much that at the end of the movement, they're able to be in a position of power. We don't think they have any other overarching incentive to do this. We don't think they're messiahs as such we tell you on our side because what happens on their side is simple right there is backlash when they engage in this"
1730.1,1735.02, meaning to say countries in the west due to increasing McCarthyism due to increasing
1735.02,1741.64, capitalist tendencies actively like discriminate against socialist things meaning to say even if
1741.64,1765.68," they prove incentive they do not prove capacity why Aiman says this, we don't get a response. Economic issues are not the expertise of liberation leaders. They often have good oratory ability, right? We tell you that on our side, we have a number of things. Our likelihood is this. We have foreign help from Germany. We have foreign help from the UN, from the US that help us set up democracy. We have"
1765.68,1771.04," elections. They know all the canvassing, all the hotspots of people when it comes to things like"
1771.04,1775.72, elections. The very nature of insurrectionist self-government means they're a lot more prepared
1775.72,1782.04, for this than they are radical economic policy. We have foreign help. We're able to get political
1782.04,1785.12," participation. But we think even though,"
1785.28,1786.44," even if we don't get this,"
1786.64,1789.26, it's better to have a bad democracy
1789.26,1791.42, than to have their best case scenario.
1791.6,1792.86," Because even on their side,"
1792.86,1795.42, you are more likely to even unknowingly
1795.42,1797.64, mess up economic distribution
1797.64,1799.28, than you are to get away
1799.28,1802.2," with democratic backsliding intentionally, right?"
1802.34,1805.54," Better to have our worst than their very best, right? But we think the likelihood is this. On backsliding,, right? Better to have our worst than their very best,"
1805.74,1810.74," right? But we think the likelihood is this. On backsliding, here's what happens. We prove to"
1810.74,1816.16," you that democracy is a prereq to economic and land reparations. We co-opt their benefits,"
1816.38,1821.12," meaning to say you need accountability in order to actually prove things, meaning to say when"
1821.12,1828.54," they say things like the elite or like the elite will still on their side of the house, distribute land in a manner that favors the elite."
1828.54,1831.62," Except on our side, what happens is you are able to protest."
1831.62,1832.82, They say it themselves.
1832.82,1837.2, The media controls the narrative and the media is elite filled.
1837.2,1839.26," On our side, we do not need the media."
1839.26,1841.62, We can have people protesting on the streets.
1841.62,1843.86, We can have people submitting petitions.
1843.86,1845.12, This is a unique exclusive
1845.12,1850.72, benefit that only we get. We get better cooperation when it comes to actually pursuing economic
1850.72,1856.0," reparations. Why? Because when our side, when you slowly immerse into a democratic system,"
1856.0,1861.52, people themselves see the need as a fruit of democratic discussion that land distribution
1861.52,1865.52," is necessary. On their side, they blindly follow liberal leaders."
1865.52,1867.5," On our side, you still have these leaders."
1867.5,1869.72," You still have a post-independent society,"
1869.72,1871.1, because we think the likelihood is
1871.1,1875.04, that you have someone that is either the sun or the liberation
1875.04,1876.48, leader themselves.
1876.48,1878.18, We think you're still able to gather people.
1878.18,1879.76, You're still able to galvanize people.
1879.76,1881.66," But on our side, crucially, you still"
1881.66,1883.88, have less international scrutiny.
1883.88,1891.14," We think with time, McCarthyism does die out after, say, the 1970s. We think you're able to then get better on our side."
1891.4,1896.56," Now, why do we get less toxic spheres? This is something we absolutely win on panel because you"
1896.56,1901.64," do not respond to it. Or even tells you that there are heaps of conflicts within these societies,"
1901.64,1910.08," meaning to say, let us cite the white and the blacks for now right what we think is important also is the tribal conflicts we're able to settle ethnic"
1910.08,1914.76, conflicts with Democratic negotiation we think that's easier to do that with the political
1914.76,1920.28, capacity that democracy brings you on the other hand when land comes into play you tend to take
1920.28,1930.44," take things personally they try to make it seem like negotiation will be fruitful without democracy. I really don't see why. Argument three then, on which side gets better foreign relations"
1930.44,1935.06, and investment? This is an independent path typically. They say we need to solve the problem
1935.06,1939.86, of no resources on our side too. Here's how we do that. This is not contingent on whether the
1939.86,1945.34," democracy is fully functioning or not, because this is contingent only on the existing of a good"
1945.34,1950.44, political system now why does in this why does investment matter panel you are a poor country
1950.44,1955.42, that has been deprived of land power and resources and there are virtually no Industries that exist
1955.42,1960.7, post Independence the only actors here that can help you are those of foreign investors this means
1960.7,1965.12, the amount of money the nation can get in the future is going to be far more than what
1965.12,1969.84, there is now and we secure that. This is also non-contingent on whether the leader actually
1969.84,1975.12, has good incentives or not. Which actors invest? Foreign companies and NGOs of the west are
1975.12,1980.64, irreplaceable. Why? Because they are by miles the richest actor that can invest in other countries.
1980.64,1989.68," Their history of acquiring resources through colonization, their presence of strong institutions help them incentivize foreign investment. We give them two unique"
1989.68,1994.08," benefits that they mitigate. First, we give businesses guaranteed rights to democratic"
1994.08,1998.76, checks and balances. Businesses from the West are used to certain legal practices and norms
1998.76,2003.56," like guaranteed property rights, IP laws, and civil liberties, which means more familiarity."
2004.02,2005.96, They let this be when you have
2005.96,2011.72," people previously owned property forcibly seized and redistributed, especially white contacts that"
2011.72,2016.28," you know. This is bad for business confidence. Secondly, we think during the Cold War, there is"
2016.28,2021.24, heaps of backlash about everything that is even remotely socialist. The US is increasingly
2021.24,2025.64, McCarthyist. They have an incentive as the torchbearers of democracy
2025.64,2029.24, to actively invest in countries that show democratic potential.
2029.52,2031.38, We instantly got that.
2031.56,2032.42, They mitigate it.
2032.66,2035.4," Now, before I get into even their best case in terms of FDI,"
2035.58,2036.16, I'll take a few.
2036.28,2038.8," You wanted to co-opt all of our economic benefits,"
2038.94,2040.16, such as land redistribution.
2040.5,2044.06, So then deal with your own harms of tribal individuals feeling robbed.
2044.16,2049.24, Why are you exclusive and not able to suffer these same harms if you want the same policies just later on?
2049.24,2057.84," I think I made that painfully clear. Later on, democracy works, you have more accountability, you are able to have peaceful negotiation."
2058.28,2069.92," On their side, the powerful tribe can just seize the land of the less powerful tribe and there'll be no one to hold them accountable there'll be no systems of protest time is the factor here we do co-opt your benefits"
2069.92,2075.88, their best case panel is this they get investment but they get investment from the ussr because the
2075.88,2081.42, ussr has a history of going towards socialist orientations and that like that's more likely
2081.42,2089.84, on their side why is this dependence in the ussr bad because the ussr is inefficient as they have no competition in their economy making inefficient machinery also
2089.84,2095.6, it lost the cold war it was in the ussr's incentive to prefer dictatorships over democracies
2095.6,2099.76, because they are far more non-reliant on the changing mood of the populace and easier for
2099.76,2104.4, them to control meaning they actively tried to create them and bribe leaders accordingly what
2104.4,2108.14," are the implications of this we have more more jobs, more economic upliftment,"
2108.24,2112.6, and food security for millions of people over the span of decades. We're able to get
2112.6,2117.52, Western FDI and low-interest loans while giving African countries the sovereignty they deserve.
2117.52,2130.16, We have a long-term cash cow on team opposition. we win this debate
2131.52,2144.0, and i'm second off um
2145.06,2148.12, uh hi am I audible?
2150.92,2153.64," Alright, I'll take POIs in the chat."
2158.56,2159.4," Starting in 3, 2, 1."
2166.08,2170.96," The fight to elevate post-colonial Africa was always meant to be a war against poverty, not against poor people. The problem with the opposition case was a misunderstanding of context. This was not the"
2170.96,2176.16, modern-day Western world. This was 20th century Africa that was rife with poverty and inequality
2176.16,2180.96, when the colonizers left. They can preach of democracy all they want and say accountability
2180.96,2190.0," 10 times in the same minute, but when real and visceral suffering occurred, that was blood on their hands. All of the economic context you hear from First Prop went completely"
2190.0,2194.52," unengaged with by this opposition team. Because I want you to know, if you really look at your notes,"
2194.78,2198.12," their only strategy was just to squirrel around the burden and counter-assert,"
2198.36,2203.4," hey, here's another issue, but only prop-weight specifically both of these concerns with one"
2203.4,2206.94, another. The only thing we heard later on was that some of these policies
2206.94,2209.92," were likely to be given to people anyways, that people won't be dirt poor."
2210.3,2213.7," Obviously, it's true that people will still have some food on the table."
2213.7,2217.36," The question was, was that enough to break you out of the poverty cycle?"
2217.6,2219.56, Was that enough for social mobilization?
2219.9,2222.62, Was that enough for Black people who have been historically oppressed
2222.62,2227.46," to be able to build businesses and start up their own communities, even if they are oppressed by the majority?"
2227.74,2231.34, There was a baseline low-hanging fruit that team opposition wanted to argue for.
2231.54,2233.28, They could not co-opt our benefits.
2233.8,2235.16, Let's clarify the burden here.
2235.42,2241.16, I think the first opposition set an extremely high burden for themselves because they not wanted to defend a democracy.
2241.24,2245.82," They wanted to defend a healthy, flourishing democracy because all of"
2245.82,2250.88," their principles and impacts were contingent upon this initial claim, which meant, given our second"
2250.88,2256.2, argument from first prop explains to you why most of these democracies aren't going to be as healthy
2256.2,2261.38," and as inclusive as they claim, because wealth begets the most power within that democracy,"
2261.38,2265.02, means all of their principles don't fall because their initial
2265.02,2270.52, representation does not work. Given we've proven that people with most amount of power control the
2270.52,2275.62," levers of the democracy, their representation does not stand. But the second thing I want to do is"
2275.62,2280.34, that most of their harms just stem from the original premise that there is conflict. But
2280.34,2284.52, the reason why conflict doesn't make sense is because of First Ops' own setup. They say that
2284.52,2288.8, people have similar wants. If it's true that different ethnicities and tribes have similar
2288.8,2292.96, similar ones then going to conflict makes absolutely no sense because they will lose
