start,end,text
0.0,56.24," Okay, looks like that's working. So without any further ado, I'll call upon the first proposition speaker to open up this debate. Thank you. Okay, great. I think I didn't specify this, but I prefer POIs to be in the chat. Thank"
56.24,73.8, you very much. The biggest purpose of the justice system is to reintegrate criminals. The best way we do this
73.8,80.06," is when we give them a front row seat to justice. Two points on framing, and we'll then continue"
80.06,86.54," to two substantive arguments. First, how will this application process look like? We think that"
86.54,92.16, ex-convicts are going to be subject to an application process like happens in the status
92.16,98.24, quo. Note that ex-cons to leave jails must have completed a process of rehabilitation and
98.24,106.4, retributive justice that society consented to collectively through mechanisms of law over 80 percent of people in jail in the united
106.4,112.96, states today are in there for violent crimes and crimes of context as a result we think that it is
112.96,120.16, unlikely for murderers to get in to these places especially because to get in ex-cons will have to
120.16,130.4, go through background checks and interviews like in the status quo obviously with the consideration that they have extenuating circumstances because of this condition
130.4,135.6, characterizing murderers in the police force would be extremely uncomparative for side opposition
135.6,140.4, to the second we think that there are two scenarios we must clash in this debate first where
140.4,145.18," individuals apply and don't get accepted but But second, a condition where they do and enter."
145.3,147.74, Not clashing here would be damning for side opposition
147.74,152.32, because their material couldn't be impacted on either way.
152.5,155.42, We think there are three conditions you should weigh on in this route.
155.42,158.9," On ex-cons, on institutions, and on societal narratives."
159.18,161.06, My third word will speak about.
161.82,166.74," But first, first argument here will prove to you that this measure is necessary to"
166.74,172.54, improve the miserable conditions of ex-cons in the status quo and uniquely improves these conditions.
172.72,177.72," There's two prongs here. First, on necessity, we tell you that in the status quo, ex-cons are"
177.72,182.66," largely discriminated against. In the status quo, the reason ex-cons can't join the police"
182.66,191.46, in the first place is because there exists a narrative and stigma that they're all extremely violent but the principled reason for the justice
191.46,197.4, system to exist is reintegration and therefore they have an obligation to extend mechanisms
197.4,204.02, for reintegrations that are lacking in the status quo and counter this stigma this means that even
204.02,205.74," if this measure is ineffective,"
205.9,209.7, it is principally legitimate and therefore creates a condition in which the government
209.7,216.04," best fulfills its mutual obligations towards citizens, towards ex-comvicts. The impact here,"
216.16,221.74," panel, lies in the idea of safeness. Crimes don't always occur in vacuums. Criminals are not"
221.74,231.06, inherently bad people who intend to commit crimes due to contextual conditions of injustice. Everyone has a right to be recognized as dignified enough to
231.06,237.4," apply for a job, and this dignity tends to materialize in beneficial things for ex-convicts."
237.58,243.54," In Portugal, drug addicts were given jobs at the peak of their addiction, and for that reason,"
243.54,246.52," they reintegrated effectively into society,"
246.52,253.46," they picked themselves up, and 98% of them ended up quitting jobs. We think the mechanisms for"
253.46,258.42, people to reintegrate have to be proposed by the government. This narrative is especially
258.42,266.4," significant because it humanizes conflicts, it gives them tools to achieve the very things that they have and"
266.4,271.76, in here in their human condition and it limits justifications of violence against them simply
271.76,276.88, because they are ex-convicts note in the status quo this causes conditions of unpunished police
276.88,282.64, brutality for instance that cannot continue to go unchecked because this mechanism is separate from
282.64,285.84, effectiveness palin you must weigh it significantly
285.84,292.24, because we proved two things one why this improved the police force but two why in principle this was
292.24,297.6, so beneficial because it dignified criminals and it helped them materialize their humanity yet
297.6,303.36, further if ex-cons can join we think this measure creates three significant benefits one convex are
303.36,305.04, re-indicated because the institution
305.04,309.28, that oppressed them allowed them to enter it no this creates a unique tipping point towards
309.28,314.88, breaking the stigma because the institution in charge of protecting you as an individual
314.88,321.52, tells you it's okay the institution you charge you with your life with the institution your trust
321.52,326.1, is telling you that ex-cons are trustworthy as well. Panelists is a unique
326.1,331.14, voting condition because this debate's biggest impacts lie on ex-cons on our side. We clearly
331.14,336.78," benefit from them the most because even if they're rejected from this job, they have marginally better"
336.78,342.46," conditions for them in day-to-day society due to this destigmatization. But second, ex-cons are"
342.46,345.26, likely to be less stigmatized because police officers are
345.26,349.02," constantly in contact with them. They know that they're people, they have seen successful"
349.02,353.48," conditions of rehabilitation. We think for this reason, it's likely that this job is beneficial"
353.48,358.24," for them. And for this reason, we think that if you want ex-cons to be better off, you vote"
358.24,363.82," proposition. I'll take your POI before I go into second. Yeah, what does the speaker think is the"
363.82,365.7, main reason why these ex-cons would
365.7,371.5, want to join the police force? We tell you that ex-cons on both sides of the house are disenfranchised
371.5,376.22, and lack opportunities. We think that's the mechanism on why they want to apply. We tell
376.22,381.72," you that for that reason, giving them additional benefits to go in is significant, but we also"
381.72,390.64, think that there is a measure of reivindication. These people want to show society that they are worthy of respect and are therefore also likely to join
390.64,394.88, in the first place. We'll prove to you in this second substantive why this measure improves
394.88,399.98, the police force. We tell you that allowing ex-convicts to apply creates four beneficial
399.98,405.24," conditions. One, society now perceives the police as open to change and adjusting to the changing"
405.24,411.3, needs and narratives of societal behaviors. This occurs separately than if people want to apply
411.3,416.62, or not apply. These benefits aren't contingent and therefore opposition can apply them as so.
416.86,421.54," Even if this measure is ineffective, it still incentivizes an institution like the police to"
421.54,425.6, begin adjusting systems that have been historically oppressive.
425.6,430.28," Simply, panel, the condition of the justice system becoming more malleable is beneficial"
430.28,434.68," because it can marginally better serve society when it's open to feedback,"
434.78,439.04," when on our side it is not seen as a historical institution that never moves,"
439.18,442.62, but as something that can adjust to changing needs of society.
443.0,445.64," Second, the justice system for the first time"
445.64,446.9, receives feedback.
446.9,450.3," For true justice, the system needs to be constructed"
450.3,453.38, and serve the individuals it affects the most.
453.38,455.72, We think principally the justice system falls
455.72,459.26, when it ends up harming disenfranchised individuals more
459.26,461.7, in a retributive justice scenario.
461.7,464.66," On our side, one of the justice system's biggest actors,"
464.66,465.12," the police,"
465.36,471.58," are now accepting ex-convicts. In principle, here, the justice system gives them back the very"
471.58,477.76," condition of humanity that they lost, regardless of effectivity. This is why you vote proposition."
478.06,483.44," On our side, you're constructing a system that serves the individuals it oppressed. Opposition"
483.44,486.08, needs to justify why the status quo
486.08,492.24," is enough when it definitely isn't. Practically, in the status quo, having ex-cons allows policemen"
492.24,497.76, to have greater checks on problematic behavior when they enter these spaces. A marginal benefit
497.76,503.12," proposition is unable to materialize, especially when we understand that policemen have become"
503.12,508.0," increasingly oppressive. But third, as ex-cons become increasingly integrated in the long term,"
508.0,513.0, we think criminals' viewpoints help the institution materialize systems for equity.
513.0,521.0," Panel, these are the most effective because they directly respond to a context and condition of people who understand what the system lacks."
521.0,529.42," So even if these changes are very small, they're very effective for this condition. Even in our worst case scenario where this measure creates backlash,"
529.42,535.84," final, we think you weigh here on scale. Improving an institution that serves the entirety of society,"
535.84,540.46, the police who today are not fulfilling their principled obligation towards those they're
540.46,546.08, designed to serve will always outweigh backlash or even a societal condition of this
546.08,550.64, trust that can be created in our worst case scenario because in the long term we have
550.64,556.64, greater mechanisms for correction of this mistrust as these institutions are constantly subject to
556.64,562.64, feedback and are open towards responding to the necessities of citizens and of those it oppresses
562.64,565.76, for justice this is a clear proposition ballot.
569.06,586.0, I thank the first proposition speaker. Invite first stop to open up their side of the debate. Okay. Just go ahead. Okay.
586.0,596.0, Everybody ready?
596.0,598.0, Perfect.
598.0,607.34, Then my time starts now before moving on to a few key points of rebuttal and finally the opposition case.
607.72,612.02," Firstly, a clarification on the purpose of the justice system. It isn't to rehabilitate."
612.02,615.44, That's a means of achieving the purpose of the justice system.
615.88,622.2, The purpose of it is to protect the harmony and the general fabric that keeps society together in peace.
622.62,625.36, Don't be confused by side propositions framework on that.
625.36,628.88," Look, firstly, I'm going to be talking about their model and why it's inherently flawed."
628.88,632.64," Then I'm going to talk about this point on the humanizing criminals and the trust. And finally,"
632.64,637.2, on this idea that cops will actually become less oppressive or that the institution of the police
637.2,641.04," force will become less oppressive. So firstly, on their model, look, they characterize themselves"
641.04,649.92," and pay close attention to how they did this, that the majority of people in prison were in jail for violent crime and that like the people who would be accepted"
649.92,654.8, into the police force needed to fill fulfill these like extenuating circumstances look i don't think
654.8,658.8, they can out frame and get away with squirreling the motion just to saying that it's going to be
658.8,663.68, a minority of these ex-commons that are going to be the only ones that have access to joining
663.68,669.2, these like these institutions because that already like removes up the ability for them to access the majority of
669.2,674.0, their benefits as to why the majority of ex-commons are going to be able to reap the benefits of this
674.0,679.04, change right so look they need to bite the bullet on this because if the majority of criminals are
679.04,684.88, all like in jail for like violent crime then that also means that the majority of ex-cons will be in
684.88,685.44, the police because that needs to be proportional to the ones in jail right like violent crime then that also means that the majority of ex-cons will be in the police
685.44,690.4, because that needs to be proportional to the ones in jail right like that's very crucial and even
690.4,694.88, the ones and pay close attention to this when they're saying that the ones that are turned away
694.88,698.72, like look we're going to say that like if the majority are turned away then it's literally
698.72,704.0, symmetrical to the status quo or like there isn't any in the in the police force but the only change
704.0,710.54, on side propositions house is that hey you get more wasted resources with the whole like application process and needing to interview all of them.
710.54,728.32," But more importantly, it's going to build more resentment, and it's going to build more stigma, which is the very benefit that they're trying to claim. Look, we flip that because we're telling you that when the majority of ex-cons were trying to access and be part of the police force are turned away because they did very bad things and they committed violent crimes then that's going to be a problem because that's"
728.32,732.48, only going to create more stigma for the prisoners that weren't able to access those and those are
732.48,737.36, going to be perceived worse in society because they were not given the chance at like at
737.36,742.08, retribution by joining these institutions that's why we feel we get more stigma and more resentment
742.08,749.28, inside propositions house look they're claiming also that they're going to humanize these people but they can't claim humanizing if most of them get turned
749.28,754.24, away because again you get that increased stigma to those and and also i'm going to clash this with
754.24,758.4, a lot of my substantive on why we actually get more humanization with the exclusive alternatives
758.4,762.72, that we get on our side but finally on this idea that cops are actually less oppressive in their
762.72,768.96, world look first of all we think that these like idea that cops can only become less oppressive if you're allowing ex-cons
768.96,773.12, like work at like as part of them is false we think that they're like painting a very false
773.12,778.8, dichotomy here we think that actually we can get like the institutions to be like less oppressive
778.8,783.12, still within our alternative because you're giving ex-cons the ability to effect more change and more
783.12,789.84, on that later but you're also going to get this idea that like um cops need to uphold the rule of law and they need
789.84,794.24, to stand for that and the public needs to see that they will always be upholding like a high standard
794.24,799.12, of the rule of law because people who are cops firstly needed to respect the law as citizens
799.12,803.44, and then as cops right so under this idea we're going to be clashing a lot but look first of all
803.44,807.52, let me get into some points of framing like why do people commit crime first and foremost look there are
807.52,811.76, three different types of criminals firstly we're going to talk about the ones that like are actually
811.76,815.92, malicious and they're intense they benefit and they want to benefit from crime and they have no
815.92,819.92, remorse and therefore they have this incentive to join the police force because it gives them
819.92,823.6, a leg up and my partner will be specifically dealing with that second of all we have people
823.6,827.92, who may not be bad but they've made bad decisions be it because they have little discipline because
827.92,831.92, they have a short fuse or they're highly emotional and that leads them to making very bad actions
831.92,837.36, with high repercussion we think that the police by nature of their job needs to be very calm and very
837.36,841.44, like even tempered because that's what allows them to do a good job and finally we think that there
841.44,847.66," are people who like they said in their own characterization have grown up around entrenched poverty, and then we're pushed into doing that. With that being said,"
847.7,852.12, the second point of clash here is that the police have access to a lot of like information rich
852.12,856.86," confidential records, resources and insider information that will specifically be dealt"
856.86,860.6," with in that second speech. And finally, this idea of stigma, look, we agree that whether"
860.6,866.84," unfounded or not, like people generally have poor, like poor views or perceptions of criminals."
866.84,868.58, And that's because politicians have incentives
868.58,869.58, to be tough on crime.
869.58,871.36, That's because the media likes to sensationalize
871.36,872.72, the worst kinds of crime.
872.72,874.78," And we think that that's like exceptionally,"
874.78,877.3," and that's a truth in the status quo,"
877.3,878.5, whether proposition wants to or not.
878.5,880.5," Look, the stance here is that the main metric"
880.5,882.98," or motivator for ex-commits, like they said,"
882.98,884.58, they wanna redeem themselves in the eyes of the public
884.58,888.16, because they wanna be helpful and they wanna be be useful we think that that is only up
888.16,891.92, like that can only happen in our side of the house where they aren't part of the police force because
891.92,896.56, of two or three arguments from side proposition the first is this idea of public trust and how
896.56,900.88, it's based on existing perceptions and second of all why they can't actually help combat them in
900.88,904.8, side props only under our alternatives and finally we're going to be talking about why it facilitates
904.8,907.84, crime look sec this first argument on like public trust and the
907.84,912.64, frame the premise here is the framing that we gave you on stigma and why people are already unlikely
912.64,917.2, to trust cops so when people see that the very ex-convicts the ones that are like guilty of
917.2,922.48, disrupting society take jobs in these very high stakes position you get that one their decreased
922.48,928.72, trust in the institutions that put them there in the first place but second of all there's a decreased trust then in the police force that
928.72,934.32, is built of of ex-convicts as well because the people that are meant to protect them that can't
934.32,939.2, live uh the people that are meant to protect like can't actually live up to their very same promises
939.2,942.96, because they were the same people who were disrupting their society to begin with whether
942.96,948.24, it's true or not there we do think that there can be some ex-convicts with good intentions but people are not going to perceive
948.24,952.64, it as that and that's why you get a fall in like this trust in the key part of the like law
952.64,957.52, enforcement system and that's why you see like an emergence of like saving vigilantism or people who
957.52,961.44, don't trust the cops so they take matters into their own hands and that becomes like that creates
961.44,966.8, a very chaotic society and that like means like a myriad of harms in that sense before i move on yes a very quick point
969.28,975.2, on what on your side what safety nets do ex-cons have to reintegrate that's literally my second
975.2,978.4, point so don't worry about it i'm getting there and second of all let's talk about trust within
978.4,982.8, the police look police need high degree of trust in their partners like not just in the office
982.8,988.5," because of all this information that's like very confidential and very important that I framed, but also and especially in the"
988.5,992.8," field, like the person next to them, they need to trust them with their life because of the person"
992.8,995.66, in front of them that has a gun and that's potentially threatening both of their lives.
995.9,1000.24, What happens when the person next to them used to be the person in front of them? That creates for
1000.24,1004.8," a very mistrusting environment and panel, this is very crucial. So when police officers can't trust"
1004.8,1009.2," each other, not only does it risk their lives lives but it prevents them from actually doing a good"
1009.2,1013.84, job and even from the perspective of the ex-convict they're going to build more resentment because
1013.84,1017.6, even if they have good intentions and they want to do a good job the rest of their colleagues
1017.6,1021.2, aren't going to believe that and that's why they build a very strong resentment against their
1021.2,1024.56, colleagues or the people that they're supposed to be wanting to help and that's going to be very bad
1024.56,1026.76, for these stakeholders but second of all on this idea
1026.76,1030.5, where they can't actually help and these safety nets that team mexico was asking me about look
1030.5,1037.2, what do vulnerable people um like in who like might be susceptible to crime respond to best
1037.2,1042.48, and that's i think the very powerful thing that ex-convicts can do is prevent crime before it
1042.48,1045.74, happens especially or like exclusively outside of the
1045.74,1050.7, like police force in the first place look when you get a cop for example or like people who say
1050.7,1055.82, are in these areas that are like filled with like entrenched crime they see cops again with a lot of
1055.82,1060.34, stigma because of the like harms that they've been done right they see them as racial profilers they
1060.34,1064.46, have a very bad perception of cops within these communities that are wrong that have been wronged
1064.46,1076.02," by them so when they see someone who is part of their community and instead joins them, they see them as traitors or as someone who, like, by their own job needs to put them behind bars because they were forced to commit crimes that they may or may not be in agree with."
1076.3,1077.36," But that's period, right?"
1077.36,1080.02," Like, these ex-cons will still have to put them behind bars."
1080.14,1088.1," So they can't be able to reach them or they can't be able to build trust. Or alternatives, for example, like being part of therapy, of counseling, of motivational speaking."
1088.1,1093.9, This is very important and exclusive to our house because of the fact that they're able to help them so much more
1093.9,1097.1, because they're more likely to reach the very people that feel disenfranchised
1097.62,1100.52, and that feel like they can't trust the police in their status quo.
1100.66,1106.16," Right. So under these frameworks, we're so proud to oppose."
1167.0,1192.78, I think the first speaker on opposition invites second prop to continue their side of the debate. you um am i audible invisible Am I audible or invisible? Please do our POI student chat. The stigma that ex-cons at space shackle them to disenfranchisement.
1192.78,1195.66, We strip away harmful perceptions.
1195.66,1198.28, We are so proud to reintegrate them to society.
1198.28,1202.8, I'm going to note three things about opposition's case that largely take out the whole thing
1202.8,1203.8, that they brought to you.
1203.8,1209.72, The first thing is to note that what we told you in our framework was that 80% of the crimes are non-violent crimes.
1209.82,1214.66, That means there's 80% of people that should have the opportunity to reintegrate. I think the fact
1214.66,1219.18, that opposition one wants to strawman our case lost them a lot of relevant rebuttal. But the
1219.18,1223.16, second thing to note is that they're in a double bind because they can simultaneously say that many
1223.16,1229.28," people will join on our side, that the harms are this bad but they cannot also simultaneously oh not people not many"
1229.28,1233.28, people are going to join because then that means that the harms that we present to you are not as
1233.28,1238.56, bad as they want to say we are not going to fall into vigilante chaotic society as opposition one
1238.56,1242.64, paints to you but the third thing is i think we can out from a lot of the characterizations they
1242.64,1249.28, paint to you when we tell you on our side the fact that these convicts are likely to enter a police force means that they
1249.28,1253.96, will face training that they will be told and treated as employees I think the whole thing
1253.96,1257.7, they want to tell you about look at all the confidential files that they're going to be
1257.7,1261.8, facing look at how the violent attacks that they're going to making are extremely unlikely
1261.8,1269.36, because on our side if ex-convicts are likely to enter the police force they are going to be treated as such and if they face necessary training all that kind
1269.36,1273.76, of stuff to actually make sure their job is actually sufficient first question to answer
1273.76,1278.8, then where is the police force as an institution better off opposition's argument that they gave
1278.8,1283.44, you was like on trust and why you need to be able to trust firstly like people don't trust society
