start,end,text3758.4,3762.52," Well, the two like firstly about tariffs versus investment wars and secondly about the balance of trade."
3762.54,3769.44," So firstly, on like tariffs versus investment wars and secondly about the balance of trade so firstly on like tariffs versus investment wars right so they basically say oh look at everything proposition pointed out like"
3769.44,3773.84, uh china is losing money so it's not likely that they will be investing right i think this is a
3773.84,3780.48, very important like comparative right china does not have like a lot of money to lose so where do
3780.48,3785.94, you lose money is it a when you slap tariffs and sanctions on your neighboring countries?
3786.1,3790.48," Or is it B, when you invest with the hopes of gaining something back?"
3790.72,3795.52," Right. Tariffs and sanctions are effective when we're talking about, like, I don't know, the US versus China."
3795.52,3805.08," But when China needs these trade partners, it's a lot more likely that they will engage in the only scenario which actually hopefully brings them back profit right that is"
3805.08,3809.52, what we've explained down the bench which is why it's still more likely that like even countries
3809.52,3814.38, that don't immediately join this like quad like alliance right this is like our worst case scenario
3814.38,3818.72, the countries that don't immediately join why they still gain benefits right but then on the balance
3818.72,3823.8, of trade so opposition says oh you know these countries are now not able to be like neutral etc
3823.8,3829.28, like okay i think we told you in most of these cases china needs these countries for like trade partners
3829.28,3834.0, it's likely to have the same incentives to still trade with these countries but now have oversight
3834.0,3839.28, right now be less likely to engage in lucrative like you know trading etc because it's got more
3839.28,3846.56," oversight from the west because it is not the only actor taking place in this region anymore, right? But fine, let's"
3846.56,3850.96," engage in our like worst case scenario, right? Which is biting the bullet that probably a lot"
3850.96,3855.58, of trade with China will stop. Caldas did engage with it. This was what our second argument was
3855.58,3860.94," about, how trade with the US and only the US, which is our worst case scenario, is still better"
3860.94,3865.56," than trade with like only practically like with China in the region, right?"
3865.66,3866.88, With China's growing influence
3866.88,3869.46, and its growing need to facilitate even more trade.
3869.6,3872.5," As we've told you, it's likely to become more aggressive"
3872.5,3874.62," if you do not see like, for example,"
3874.72,3876.88," US or like Western interference, right?"
3876.94,3878.96," No response to this down the bench, right?"
3879.06,3880.52," I think it's still more likely,"
3880.68,3882.52," like if we have like Western trade,"
3882.52,3888.38, it's less likely to have all these lucrative loopholes. It it's less likely to have the currency manipulation which is going on in the
3888.38,3892.64, status quo it's incredibly ineffective what these countries are being put through but then onto the
3892.64,3896.48, second clash about the military and like other conflicts right i think the main question here
3896.48,3901.36, is when china is like maximally aggressive because they tell you okay in the status quo there are like
3901.36,3908.92," moderate forms of aggression um you know but that's going to be much worse. Now we're going to have like election meddling. I think like, firstly,"
3909.36,3913.68," basically, this already happens, right? But like the question then is like, okay, when is it"
3913.68,3920.48, maximally aggressive? I think when you talk about like competition with the West versus China being
3920.48,3924.46," the main actor in that region and being able to exploit these countries much more directly,"
3924.46,3933.04," it's a lot more likely that China becomes more aggressive, more lucrative, more exploitative when it doesn't have this competition because it doesn't have this competition."
3933.04,3939.28, Right. I think it's more likely in these cases that China is going to become even more exploitative with their currency manipulation.
3939.46,3948.32, Everything we see in the status quo is going to be worse because you don't have this western oversight and because these countries will have less other partners to like turn to when we give them this
3948.32,3952.46, option and they choose this option like it's a lot better right and then they come up with this very
3952.46,3956.78, flimsy response of like oh look at like the way that china's responded to biden uh you know and
3956.78,3960.58, his like uh i don't know like foreign policy with taiwan i think the problem with the foreign policy
3960.58,3964.84, with taiwan is literally there is not an allegiance in place and the fact that the u.s is able to back
3964.84,3968.48, up at any moment as we've given you an analysis of what the US is like
3968.48,3973.12, with NATO it's not likely to be the same with this like it's not likely to just not completely like
3973.12,3976.88, uh to also go back and forth it's likely to genuinely commit to this alliance that is when
3976.88,3981.28, we genuinely get protection for Taiwan and other such countries panel because we save
3981.28,3997.18," the country that opposition leaves behind, we take this debate."
3997.18,4000.7, Thank you guys for the debate.
4000.7,4001.7, Thank you very much.
4001.7,4002.7, Thank you.
4002.7,4004.7, Thank you all for the debate.
4004.7,4006.82, I'll end the recording.
