start,end,text
0.0,26.82," And then I would like to give the floor to the first proposition speaker to open the debate. Good luck. China's power, Russian imperialism, and US Republicans supporting isolationism is undeniably"
26.82,33.04," like destabilizing the region, and this Asian NATO would help keep the existing fragile border."
33.42,38.02," Now, in my speech, I'm going to have some points of framing, and then three consecutive arguments."
38.72,43.8," Firstly, on why will countries join the alliance? Secondly, on like economic benefits for Southeast"
43.8,45.2," Asian countries? And thirdly, how this will like help safeguard territorial sovereignty of these join the alliance secondly on like economic benefits for southeast asian countries and"
45.2,50.08, thirdly how this will like help safeguard territorial sovereignty of these countries
50.08,55.36, and our second speaker will have an extension on democratic changes in countries right so let's get
55.36,61.28, into framing so who will even join this alliance obviously like first off countries like japan
61.28,69.76, australia us and india right because they're like part of the Quad already. But like likely this like entire organization is like likely to expand and
69.76,74.58," also include other countries like A, South Korea, because they're already like aligned with the West,"
75.18,81.12," B, Vietnam, because of the South China Sea dispute, and C, the Philippines, and possibly also like the"
81.12,87.34," rest of the South Asian countries that are surrounding the China, like the South China Sea."
87.34,89.06, So let's get into our first argument.
89.06,91.28, Why will countries join the alliance?
91.28,93.92," So firstly, like these Western countries are seen"
93.92,96.42," as more trustworthy partners than countries,"
96.42,97.68," again, like China."
97.68,100.8," So A, they're like great economic partners"
100.8,104.4," that don't really screw up their own like neighbors,"
104.4,105.82, as we've seen with the Belt and Road
105.82,111.52, like initiative right be they're unlikely to be aggressors right smaller Southeast Asian like
111.52,115.72, states don't really want to be messed with and they want to run like their business as usual
115.72,121.36, and these um like Western states like the US won't really be as hostile they won't really
121.36,126.8," like manipulate um with stuff like currency which like, which are things that like China has actually done."
126.94,135.64," Right. And see, like Trans-Pacific Partnership already showed like a willingness for some Asian countries to turn away from China."
135.64,140.68, Right. Like in favor of the West. And we've seen this with Vietnam and we've seen this with Singapore.
141.58,147.86," Secondly, right. They have superior they have superior military capabilities. Sure, we all know China"
147.86,153.86," is big, but the US is a military superpower. They have the best equipment. They have boats,"
154.18,158.86," they have airplanes, they have spy equipment. Thirdly, leaders of these smaller Asian states"
158.86,164.28," and smaller Asian countries care about not giving up their sovereignty to China. Plus,"
164.6,165.94, China has become increasingly
165.94,170.24," aggressive. And we've seen that this is like a very big trend in the recent decades, right?"
170.48,176.54," They've literally recently shot at boats, Philippine boats, fishing boats that have"
176.54,181.36," posed no real threat to them, right? Unfortunately, there's already kind of a pro-Western sentiment"
181.36,189.28," there, right? Because historically, a lot of these countries have ties with the West, a lot of times because of British colonialism, which just means that a lot"
189.28,193.36," of people in these countries, they speak English, they already know a lot of things about like that"
193.36,197.76," culture, they probably consume a lot of like Western media and they like agree with a lot of"
197.76,206.0," their like ideological beliefs, right? And also already Western states have helped expel kind of occupation forces."
206.0,214.0, Right. So there is already this experience of the West helping these smaller Asian states with like militarily actually help them.
214.0,219.0," Right. And fifthly, even if even if China retaliates, which is not probably going to happen,"
219.0,225.74," and we're going to explain that later in the speech, more countries will like want to join the alliance at that point,"
225.74,229.82," because they will see that China actually is an aggressor, right? It's not just going to be kind"
229.82,234.0," of like, oh, China kind of has done some bad internal things, kind of outclasses sometimes"
234.0,238.1," as they actually attack, like most of these countries will probably want to join the alliance."
238.1,243.14," And at that point, like Western states will probably make the accession process kind of more"
243.14,246.4," like easier, and they will speed it up at that point."
246.4,248.88," Before moving on to our second argument, I'll take a POI."
251.2,256.0, Will the defense pack be activated if China continues building islands in the South China Sea?
258.08,262.48," Well, China is not going to want to build islands in the South China Sea because they're not going"
262.48,266.76," to want to mess with now these like nuclear, like powerhouses"
266.76,268.38," that defend these smaller nations, right?"
268.38,270.0, They're not gonna want to do that.
270.0,271.76," So moving on to our second argument,"
271.76,275.08," economic benefits for Southeast Asian countries, right?"
275.08,276.82," So before we get into this argument,"
276.82,278.78, we have to understand that this is not only
278.78,280.58," a military alliance, right?"
280.58,284.32, It is inherently about choosing your like strategic partners
284.32,286.0, also for like trade and development.
286.42,287.58, And why is that?
287.74,295.94," Because if countries know that they're guaranteed security, they're more likely to A, make trade"
295.94,300.88," deals with other nations probably that are in this Asian NATO, and B, have long-term"
300.88,302.44, investments put into them.
302.64,306.5," Because economic and defense are very much interlinked,"
306.5,312.24," right? So benefits for countries in the Quad, firstly, just investors are now more likely to"
312.24,318.82," invest in them because they rely on the security guarantees of the West, right? So military"
318.82,325.6, instability hurts a lot of these Quad countries' economies like economies right because as we've seen right
325.6,331.5, now like every time north korea has um like a nuclear test japan's stock market plummets but
331.5,334.94, now they're going to be like maybe in the security quad right that's not really going to happen
334.94,338.72, because there is like this background security and if that is going to happen it's going to be
338.72,344.26, in a much like smaller scale right and secondly like fishing and oil in the south china sea is a
344.26,345.74, very big like issue in the entire region right but now it's like fishing and oil in the South China Sea is a very big like issue in
345.74,350.88," the entire region, right? But now it's like more likely to be secure for these smaller Asian states,"
351.22,355.32," secure like those resources, because they're, again, there's going to be more like U.S. ships,"
355.4,360.16," there's going to be more U.S. equipment, and just like military kind of presence in that area, so"
360.16,369.12," China isn't going to want to mess with them. Thirdly, countries that will experience problems for the Belt and Road Project initiative are now safe, right?"
369.26,372.58, Because it's likely that China won't really want to seize infrastructure
372.58,375.42," and there isn't going to be a Sri Lanka 2.0, right?"
375.66,379.4," And at least the Quad guidelines will tell them,"
379.46,383.12," like these countries, not to give away strategic military targets, right?"
383.32,386.44," And for non-Quad countries, there's still gonna be some benefits, right?"
386.44,388.24, So like third countries will benefit
388.24,390.48," from just investment wars, right?"
390.48,393.2, Because obviously both China and like powerhouses
393.2,395.34, like the US will want to kind of have them
395.34,396.46," join their side, right?"
396.46,398.86, So they will push a lot of investment into these countries.
398.86,400.88," There's gonna be a lot of money flowing in,"
400.88,403.06," like no matter if they join or not,"
403.06,404.46, cause probably that's how they're gonna try
404.46,409.6, to win countries over. Like it's not the 19th century anymore. They're not going to try to like
409.6,416.08," somehow militarily force them to join. It's going to be more like a, you know, who has the best care,"
416.08,420.4, like who's going to give out the best proposal for these countries to join. And we've seen like
420.4,426.4," precedence for this and like the specific Pacific Islands and Taiwan, right? And moving on to our"
426.4,431.16," third argument, how this will, like, help safeguard territorial sovereignty of these countries. So,"
431.24,435.84," firstly, there's going to be nuclear deterrence. Like, countries don't want to go to war with the"
435.84,440.5," U.S. and other, like, Quad nations because they're nuclear states. China doesn't, like,"
440.5,445.04," want to challenge them. And, like, also this kind of protects the rest of the country"
445.04,448.64, that are in the quad since again that means like if china attacks one they kind of mess with the
448.64,451.9, entire thing and they're not stupid they're not going to want to do that right secondly there's
451.9,456.92, just more like troops on the ground thirdly this is not just like a pinky promise it's going to be
456.92,461.76, like an article and like article number five for nato right they're going to be bound by an
461.76,469.52, agreement so there's definitely going to be like this feeling of security in the region right and also like don't let opposition get away with saying that
469.52,473.42, like there is now going to be a bigger likelihood of escalation because that's just not true right
473.42,478.9, China already does stuff like flyers right they send ships through waters that are not theirs
478.9,484.28, like the comparative here is when it comes to like slip-ups on our side right like the military
484.28,485.08, would now just have
485.08,489.66," a lot more experience, they're going to have a lot more like officers that just like know what to do"
489.66,495.34," in these situations that won't let these slip ups happen, right? Like, obviously, like an officer"
495.34,499.2, who has four years of experience in NATO is going to be better than a regular like Taiwanese officer.
499.68,503.9," But be like, even if these mistakes happen, they're not going to escalate. Like everyone's"
503.9,507.88," going to calm them down, there's going to be a major like moderating effect in this region."
508.12,511.16," So panel for countries to prosper, they need to be safe."
511.32,512.36, They need to be protected.
512.6,513.94, And that is what we propose.
524.82,527.88, All right. Thank you very much for that speech.
527.88,533.5," Speaker spoke for 8 minutes, 10 seconds."
533.5,535.82, Just checking that everyone's ready to move on.
535.82,539.5, Then we'll head to the first opposition speaker.
539.5,540.5, Good luck.
540.5,558.94," Thank you. Hi, can I be seen and heard? Sorry about the echo. Yeah."
561.26,595.84," Just a reminder, I prefer my POIs verbally, so please unmute and ask. Thank you. Latvia's case is built on a misconception. They say Asia is aligned with the West. No,"
595.84,603.04," the Asia-Pacific region is dependent on both China and the Quad. The Philippines has zero submarines,"
603.04,605.76," therefore relies on the US for defence, yet"
605.76,613.04," desperately needs China's $24 billion in investment. China is Singapore's largest trading partner by far,"
613.32,619.2, yet our air force is built on almost entirely American aircraft. We will prove that their
619.2,625.84, pact forces nations to sacrifice one of these two essential relationships. What is our stance? We believe the
625.84,631.6," Quad should not create a regional defense pact. Instead, we prefer the status quo, where these"
631.6,636.72," alliances are negotiated on a largely bilateral basis, so countries choose the specific nature"
636.72,642.66, and degree of cooperation with China and the US. So instead of committing to a full-scale defense
642.66,647.74," pact against China, countries like Malaysia or the Philippines can choose to conduct training exercises"
647.74,651.22, or just sign a free trade agreement with the U.S. instead.
651.48,652.6, We have three arguments.
653.0,655.72," One, countries that join face Chinese retaliation."
656.2,659.84," Second, countries that don't join face U.S. retaliation."
659.84,663.78, And my second speaker will explain how they heighten tensions in Kashmir.
664.16,669.84," Before that, some rebuttal. First, they give us a list of countries that will probably join this pact,"
669.84,674.32, like South Korea and Vietnam. I just want to note that this is empirically untrue.
674.32,679.2," Like I framed earlier, many of these states are dependent on both China and the US, so it's not"
679.2,684.4," that easy of a decision. Second, I just want to observe that this list of incentives for why"
684.4,685.04, countries will
685.04,690.24, join doesn't prove anything on its own because they can't just give us a problem of chinese
690.24,695.76, aggression their side needs to give us structural analysis as to why this defense pact will actually
695.76,701.04, successfully stop chinese aggression and solve this problem so it's contingent on the rest of
701.04,705.7, their case before i move on I'll take that point.
711.24,711.4," Given that China backs off when Taiwanese fighters challenge Chinese fighters to Mali,"
714.8,715.64, why would China not back off when forces show now?
720.04,730.92," That's exactly what I was getting into. Your case is contingent on a central premise, that China would cease all aggressive actions, like, for instance, building islands in the South China Sea or engaging in the BRI. Their defence pact would never deter this kind of"
730.92,735.86," aggression because the defence pact guarantees retaliation against a military invasion,"
736.1,741.68," not island building, not some kind of economic exploitation, but military aggression. But if"
741.68,745.28," their defence pact actually forced nations to declare war,"
745.28,752.36," once China makes one aggressive move, like seizing a BRI port, no country would join this pact,"
752.36,757.64, because war would almost be certain for these countries. Countries like Indonesia or the
757.64,762.68," Philippines simply cannot afford to fight a protracted war against a superpower, and war"
762.68,765.22, would be certain if they had to declare war once
765.22,771.38," China flies one aircraft into Taiwanese airspace. So the economic benefits for Southeast Asia,"
771.48,776.54," because investors will be enticed by greater military stability, simply doesn't exist,"
776.72,781.58, because they assume that the regional defense pact will be activated if China pursues any form
781.58,785.52," of retaliation, which is untrue. When they say, for instance,"
785.52,790.0," they protect territorial integrity for Southeast Asia, they also just do not give a mechanism."
790.0,794.24," They assert there will be a moderating effect in the instance of escalation,"
794.24,799.92," whereas the central premise of their case, which has been taken down, shows that this is clearly"
799.92,806.18," untrue. Finally, they try to give one layer of mitigation. They say, but China is already"
806.18,811.82," aggressive in our world, and therefore we don't do anything to stop this. Our case is that while"
811.82,818.28," China does make aggressive moves, China is not maximally aggressive yet. My argument will"
818.28,823.62, demonstrate why China can and will get more aggressive in their world at the point they're
823.62,825.24, provoked by this defence pact.
825.54,830.1," With that, Proposition's case is dead in the water. Second Prop needs to rebuild it from scratch."
830.54,835.48," First argument, countries that join the pact face Chinese retaliation. The thesis of this argument"
835.48,840.76," is that this defence pact sparks greater Chinese belligerence towards states that join it,"
841.04,849.72," rendering it counterproductive. This is true for two structural reasons. One, because it will be perceived as an unparalleled act of aggression. For China"
849.72,855.26," that has already called the Quad and Indo-Pacific NATO, this defense pact will only confirm its"
855.26,860.42, worst fears that the U.S. is attempting to encroach on its backyard. Think about it.
860.42,866.54," If Pelosi, a single U.S. official landing in Taipei, sparked military exercises that amounted"
866.54,873.2," to a blockade, Taiwan joining the defence pact will prompt fire and brimstone. Second, China"
873.2,878.08, will retaliate to deter more countries from joining in the future. Given that the influence
878.08,883.48," of the pact is dependent on how many members it actually defends against China, it has a vested"
883.48,885.24, interest in preventing more states from joining it. This incentiv against China. It has a vested interest in preventing more states
885.24,890.32, from joining it. This incentivizes China to respond aggressively to states that have joined
890.32,897.22," the pact to make other states. We are not saying that these reasons will prompt China to invade,"
897.52,902.32," but there are many other ways for China to retaliate without sparking a war, which their"
902.32,908.58, side doesn't seem to understand. It means trade tariffs that cut hundreds of millions of dollars in export revenue.
908.58,913.14," It means cyber attacks to steal national security secrets, like the hacking of six"
913.14,918.42," US state governments just this year. It means more attempts to meddle in foreign elections,"
918.42,926.24, as it has already done in Australia and New Zealand. This argument wins us the debate by flipping their own impacts of
926.24,931.88, containing Chinese aggression. A pact will only make China more belligerent and bring the region
931.88,938.66," closer to conflict. Second argument, countries that don't join face US retaliation. The premise"
938.66,945.86," is that across the US political spectrum, it has become a top priority for politicians to show off China credentials."
946.02,953.1," No, thank you. Because opinion polls show that 89% of Americans see China as an enemy. This is"
953.1,958.48, why Biden has sustained Trump's protracted trade war and upheld investment bans on Chinese firms
958.48,967.36," like Huawei. Against this backdrop, nations that refuse to join the defense pact will lose the U.S. as an ally for two structural reasons."
967.86,972.12," One, because the defense pact forces a nation to clearly pick a side."
972.48,981.18," While a country can trade or buy arms or receive foreign aid from both the U.S. and China, this defense pact is a uniquely binary choice."
981.5,986.22," You either join it or you don't. Hence, countries must pledge their allegiance to"
986.22,991.62," one and only one superpower on this massive national security issue, which means not joining"
991.62,998.5," the pact will be a direct signal of taking the Chinese side. Second, US politics has a historical"
998.5,1005.52," track record of retaliating against nations on their enemy's side. In the Cold War, the US didn't just retaliate"
1005.52,1012.0, against the Soviet Union. It went after Soviet allies. The CIA mounted operations to depose
1012.0,1017.28, democratically elected leaders in Guatemala and the Dominican Republic because they were left-wing.
1017.28,1025.4," The US not only kept its sweeping embargoes on Cuba, it expanded them in 1999, even after the USSR collapsed."
1031.28,1036.08," Now, the US will probably not assassinate foreign leaders or halt all trade, but when they see a state as a Chinese ally, they will slash developmental aid, they will cut arms sales,"
1036.08,1041.12," and they will reduce the scope of imports. For smaller states that need all the aid they can get,"
1041.12,1046.24," this is a huge blow. In our world, states aren't forced to choose between"
1046.24,1052.56, China and the US by either joining or refusing to join the pact. South Korea can have both its
1052.56,1058.74," exports to China and the protection of US missiles, as it does now. Indonesia doesn't have to pick"
1058.74,1066.6," between its two largest trading partners. Hence, we preserve the delicate balance that many states have currently found between the"
1066.6,1146.26, U.S. and China. A new NATO is ultimately a new Cold War. We go back to the proposition for the second prop speech. Good luck. All right.
1147.76,1148.2, Sorry.
1152.52,1152.96, Okay.
1153.28,1155.58, Let me know if you can hear me and see me.
1156.3,1156.8, It should be fine.
1158.72,1159.24," Okay, great."
1160.64,1161.34, Just a second.
1161.44,1162.06, Just setting my timer.
1168.74,1169.86, All right.
1170.84,1174.5," Starting in three, two, one."
1174.86,1177.3, Side opposition is right about one thing.
1177.3,1183.62, We have entered the second Cold War of democracy against authoritarianism.
1183.82,1187.32, But to not repeat the mistakes of the past panel it
1187.32,1193.62, is time to make allies because alliances are the only way to prevent these hot wars on small
1193.62,1199.2, countries that are within superpower zones of influence and we are exclusively this team that
1199.2,1205.68," provides that before I move on to my own extension about more democratic change in these countries,"
1206.24,1208.1, I'll have multiple areas of rebuttal.
1208.34,1211.3," So firstly, on like Chinese retaliation."
1211.3,1216.02," So basically, opposition says like, oh, China is likely because they don't want to lose"
1216.02,1220.96," allies to respond aggressively through economic terms, et cetera, right?"
1221.1,1224.56," I don't think that this is likely because of like four reasons, right?"
1224.68,1225.02," Firstly, it's because there's already China has greatly lost economically through like etc right i don't think that this is likely because of like four reasons right firstly"
1225.02,1230.66, it's because there's already china has greatly lost economically through like the pandemic right
1230.66,1236.36, secondly they already have a shadow banking like like a problem right they have a housing bubble
1236.36,1242.88, there are tons of these economic factors weighing on china that like greatly minimize the power that
1242.88,1245.88," they can to like you know usurp't know, other countries, right?"
1245.94,1250.14," They don't have that much power in the status quo. They don't have that much money to spend,"
1250.24,1254.98," right? Thirdly, there's a general economic downturn in the world, right? You can't assume"
1254.98,1262.68," that after all of this, after China's economy has already been hurt that much, that they will be able"
1262.68,1265.12, to suddenly slap tariffs on these
1265.12,1271.54," countries. It's not economically viable for them, right? Fourthly, they also have nowhere else to"
1271.54,1275.8," like stash their exports, right? China isn't stupid, right? They know that like Russia is"
1275.8,1280.84," clearly not a good ally, right? North Korea too. I think it's highly likely that Russia will,"
1280.84,1285.28," that China will want to like have these allies in the, in like, you know,"
1285.32,1291.84," in this region, right? Even if these countries align with the US as well, because these are huge"
1291.84,1296.98," growing markets that China does want to tap into, right? So on the question of whether they won't"
1296.98,1301.68," just like, like, I don't know, slash tariffs on these countries, it's just not economically"
1301.68,1307.64," beneficial for them. What we think the more like realistic scenario here is, right, is that we're likely to have"
1307.64,1309.98," investment wars in these regions, right?"
1310.18,1313.52," So in the terms of the countries that have not yet joined this pact, like they like to"
1313.52,1318.38," talk about on OPP, I think it's very likely that both the US and the West and China will"
1318.38,1323.9," want to curry favor with these countries, therefore will compete to fund infrastructure,"
1324.06,1325.44," to fund products, to build manufacturing in these countries therefore will compete to fund infrastructure to fund products to like build"
1325.44,1330.16, manufacturing in these countries these are investment wars and they're very beneficial
1330.16,1335.84, to the countries at hand right and china has an incentive to do so because it's like highly
1335.84,1341.28, unlikely that they will just you know retaliate economically or military militarily because china
1341.28,1347.2," is like a pretty reasonable actor right their? Their whole internal politics is based on, you know, economic"
1347.68,1352.16," upturn, right, on having an economic like being economically successful, right?"
1352.28,1357.6, Slashing tariffs on your neighboring countries by like dozens and dozens.
