start,end,text1396.96,1402.48, think that we think that there is an overarching you know narrative that covers there is a massive
1402.48,1405.36, amount of hopelessness hopelessness means there is
1405.36,1411.28, a lesser motivation to learn or work and things as such in general we think that this lesser form of
1411.28,1416.8, motivation is worse off right but they say oh the hope is something that's you know that's not going
1416.8,1427.24, to last forever and things are such right um what we need to understand then is that what prompts immediate outcomes from individual
1427.24,1428.5, is something that's hope.
1428.5,1432.6," So if you're hopeful right today, you would want to do something right now."
1432.6,1437.76," And these sort of small, small instances are equally important in society to an extent"
1437.76,1443.44, when you are able to actually bring urgent changes in societies in general.
1443.44,1449.92, We think that these people are likely to inherit but even if they say oh hope is something that's like not going to last forever
1449.92,1455.92, we don't see how that that how the change actually occurs on their side specifically when people are
1455.92,1461.84, hopeless when they have no any motivation to actually learn or grow more in general but thirdly
1461.84,1465.92, on the idea of how the governments are imperfect and you know they
1465.92,1470.32, are trying their best. We think that's not necessarily true because because like all the
1470.32,1475.44, governments and the politicians within governments have a lot of incentives to focus on personal
1475.44,1480.32," interests. They're not necessarily working for like people in general. We see corruptions happening,"
1480.32,1485.44," scandals happening, even like US which is like one of the liberal democracies,"
1485.44,1490.04, still has instances where politicians are doing wrong things and doing necessarily harmful
1490.04,1494.94," things in society, which means that they're not trying their best in and of itself."
1494.94,1502.18," But secondly, we think that even in those cases where there is like this privilege bubble"
1502.18,1505.86," or things of such, we think that this privilege bubble needs to be"
1505.86,1511.02, broken in a sense that these people need to realize and take the responsibility for it they're only
1511.02,1516.68, able to take a responsibility when they can when they won't get away by saying oh it is something
1516.68,1522.18, that is probably not able to create as much impact and things as such in general we think that's
1522.18,1529.92," massively important under our side but secondly under this idea of like solidarity that Aba points out, right, we think that friction binds people in"
1529.92,1535.68, groups and that's necessarily very important. Why is the community in general then better off under
1535.68,1543.12," our side? Firstly, the sight of common enemy is not lost at all. Even in our media, we do portray"
1543.12,1545.26," struggle against systems, villains, and things"
1545.26,1550.84," as such. But secondly, the reason we're better off is that a positive outcome implies that being"
1550.84,1555.28," part of the group is something that's extremely meaningful towards individuals. But thirdly,"
1555.48,1561.04," proletarian writers wrote work in order to lift worker of some, inspiring them to accept"
1561.04,1565.6, hope of social change. This revolution came about and it was able to generate
1565.6,1571.08," a communist region. How the communist regime turned out isn't our fault, but the fact that"
1571.08,1576.0," they were moved in such a way that they brought this regime is more important. But fourthly,"
1576.0,1580.82," bickering and fighting not in terms of what they want to do about the problem, but whether"
1580.82,1589.72," they should address is extremely important, right? This looks like Ghetto being distrustful of systematic change, people thinking that there is no resolution"
1589.72,1594.4," to crime and things as such. They need to defend all dishonor their side. Before I move on, I'll"
1594.4,1599.68," take that to you, Aya. So hope means you think your future will eventually shape out to benefit"
1599.68,1603.96," you eventually. So why won't society just tie out the bad administrations of corruption,"
1604.3,1605.1, especially since
1605.1,1611.4, you say social change is so hot because it will just in the future because there are nuances that
1611.4,1617.52, you say that the end result is not a direct outcome but uh but but it is a form of thing
1617.52,1622.5, that you get out after the you know disadvantage that you have gotten but moreover the hope acts
1622.5,1625.0, as an agency to actually bring changes for people.
1625.22,1629.86," In a hopeless world, we don't see how the agency actually works out for people to work actually"
1629.86,1635.84," harder. Thirdly, then, on how political incentives change in general. The premise here is oftentimes"
1635.84,1641.32," politicians use the existing narrative to weaponize the inaction of others, then promoting their own"
1641.32,1646.2, action. This looks like the Biden government winning the election
1646.2,1650.56, just based on the fact that Trump is bad. This is something that Democrats have been doing
1650.56,1657.12," historically, right? But the mechanism of political change then on our side becomes that first,"
1657.6,1668.22," at any point in time, optimism becomes a norm narrative in society that's overarching. Keeping the worst is not necessarily a priority."
1668.22,1671.68," Secondly, then what becomes the priority?"
1671.68,1674.44, The priority becomes challenging politicians
1674.44,1677.68, to bring positive change that are likely and possible.
1677.68,1680.24," Now, the change is not something that's unrealistic"
1680.24,1681.54, or something out of the way
1681.54,1683.5, that they are trying to put you under their will.
1683.5,1684.94, It's something that's realistic.
1684.94,1689.44, It's something that's achievable. So even if they don't reach to the maximum amount
1689.44,1694.08," of change, they're at least able to make something impactful or reach around it that's extremely"
1694.08,1700.0," important. But thirdly, this particular argument is independent of opposition saying that the"
1700.0,1706.08, portrayal of political fiction is unrealistic. This demands change leading to marginal form of
1706.08,1710.96, concessions by politicians which is largely essential in the present world in general.
1710.96,1717.84," The importance then becomes firstly merit which people, in which like people are able to win"
1717.84,1723.44," election in the form of meritocracy. They focus more on electoral debates, manifestos, that's more"
1723.44,1725.46, focused on positive action rather
1725.46,1730.22," than the inaction of another, which is massively important on our world. But secondly, the"
1730.22,1736.94, perception of evil is also something that's very high. So that's when we're able to reduce
1736.94,1742.6, the sort of negative connotations that's generally attached to it. We think that we're better
1742.6,1745.28, able to then like counter their point
1745.28,1750.32," on how benevolent leader and government exist and things as such. We don't think that they are,"
1750.32,1754.32, that's the like right portrayal of people. We don't think that's how people should perceive
1754.32,1758.88," these people, these like governments in general, specifically when governments are working in"
1758.88,1830.4," inactions in the status quo. For all those reasons we're very proud to stand on proposition. you Okay. We thank DPM for verifying speech. Now let's move on to DLO, continuous opposition case."
1830.56,1833.84," Hi, can I double check that I'm audible?"
1835.02,1836.58, Clear and loud. Thank you very much.
1837.24,1857.16," Great. I'll take POIs verbally, so just unmute yourself. Setting up the timer starting in three two one panel an emotion that is far stronger than hope is fear because hope"
1857.16,1863.24, is fleeting and hope is abstract the hope that proposition argued for is tied in outcome that
1863.24,1865.46, only once we achieve and see that something is
1865.46,1871.3, possible can we hope for it. Often hope is only derived when we think that there is the possibility
1871.3,1876.66, of change or else the hope is not enough to actually counteract the impossible scenario.
1877.1,1882.74," On opposition, we're very clear that do we even know, number one, what are these structures within"
1882.74,1885.38, the political scene that we need to call out?
1885.38,1889.34, And can we conceptualize a state to be that malevolent in the first place?
1889.34,1894.54," But secondly, do we have the heightened sense of fear to act that currently exists to want"
1894.54,1898.22, to ensure that the outcome never manifests in the first place?
1898.22,1903.42," Because on proposition, they tell you that even in the worst scenarios in society and"
1903.42,1906.18," in status quo, you can always change the structure."
1906.48,1909.64, What opposition tells you is that society cannot afford
1909.64,1911.94, for the devolution of political structures
1911.94,1914.4, because there's the possibility of no return.
1914.66,1916.96, We told you that was a far greater mobilizer
1916.96,1920.3, when you realize that you need political literacy in the now
1920.3,1922.08," because if you don't educate yourself,"
1922.24,1924.5, the outcomes are going to be cemented.
1924.66,1934.7," Before I move on to a new piece of argumentation as to how the political dystopia applies to all and disables the privileged from insulating themselves from participation,"
1935.12,1939.92," a few levels of responses, observations and rebuilding of the first opposition case."
1940.22,1948.0," The first thing I would like to point out is how contradictory and how the tension in Proposition's case is still unresolved, even after the point out from First Offosition."
1948.36,1949.84, What is the contradiction inherently?
1950.3,1959.84," They want to argue on their side that there exists a sufficient level of anger and mobilization currently, which is why we don't require negativity."
1960.46,1967.16," I think just for the purposes of having a clean debate, Proposition is being far too strategic in wanting to go out both sides of the aisle."
1967.4,1971.74," They want to have their hope, but they also want to have levels of anger and pessimism on their side."
1971.98,1977.54," Here's why it can't work. Because if we have such strong negative and pessimistic individuals in society,"
1977.88,1982.46, then their benefits of hope is extremely minimal in trying to counteract existing biases.
1982.46,1985.62," But second, and more importantly, can only occur"
1985.62,1991.5, if a majority of people are able to overcome the negative biases. So what proposition's burden now
1991.5,1996.7, has to be is proving to me why the consumption of political fiction is going to change the minds of
1996.7,2002.36," the currently hedonistic, nihilistic individuals within society, or else that means they cannot"
2002.36,2009.76, achieve any of their outcomes if people don't actually change their minds which means proposition has two things they need to do but it's likely going
2009.76,2014.34, to be too late either number one they need to concede that they can't have the best of both
2014.34,2019.2, worlds and need to argue that their side likely is going to overwhelm and overshadow the negativity
2019.2,2023.88, and therefore only have the positive narratives as the majoritarian view which means that they
2023.88,2028.52, have to concede the harms that we propose from first opposition in the first and second argument to
2028.52,2033.88," its fullest extent, rather than the catch-all response in second part that they use. Or second,"
2034.1,2038.18," that if they want to still string along on the idea that there is negativity on their side,"
2038.3,2042.72," you cannot credit any of their case to the fullest extent, given number one, the benefits therefore"
2042.72,2048.8, are watered down in terms of it counteracting the positivity but number two they still have not proven to you why individuals would
2048.8,2053.6, pivot if nihilism and the idea that her life is meaningless is far too strong that rebuttal is
2053.6,2057.68, extremely important i would like you to take note of it and hold the third speaker accountable in
2057.68,2062.48, their speech but on to actual responses number one on the idea of hope for advocacy because i think
2062.48,2068.24, it sufficiently responded to you in first opposition but it did not actually want to pay attention and just asserted that we did not
2068.24,2073.36, here's the nuance rebuttals therefore we told you why code that keeps you going cannot be the metric
2073.36,2078.72, because it is inherently tied to optimistic outcomes we question them from first opposition
2078.72,2082.96, what happens when you're unable to achieve set outcomes because i think the problem with
2082.96,2089.36, proposition is they don't mechanize and illustrate how any of their benefits are able to materialize they just say that there's optimism
2089.36,2094.4, and therefore people push we argue what happens in between is what is important and crucial for
2094.4,2099.28, how their argument actually plays out we said and they're considered in second proposition by the
2099.28,2103.6, way when they use the exact terms that you have optimism based on outcome but the problem with
2103.6,2108.78, that is that often activism try to uproot and change political structures is not something that happens
2108.78,2114.42," overnight. Often takes generations, if not decades, and if not in the status quo is still problematic,"
2114.42,2119.06," which is why when you tie it based on outcomes, the thing that we said crucially in nuance was"
2119.06,2123.88," that hope can potentially be fleeting, that hope does not sustain you indefinitely, and you need"
2123.88,2130.08, to be able to see the gains and the wins. but if you tie it to large political outcomes and large structural changes
2130.08,2135.6, the point of your own to achieve this proposition's hope disappears and dissipates and activist burnout
2135.6,2140.88, actually occurs more on their side but second let's assume their best case assuming that you
2140.88,2144.36, did have to push in the short term in order to do this what was the thing that we told you on
2144.36,2146.94, opposition number one we explained to you that hope was never
2146.94,2152.0," needed to initially mobilize these individuals, given oppression and survivability were tangible"
2152.0,2156.32," reasons enough to fight and to advocate for yourself. But secondly, on our side, when"
2156.32,2160.24," it's not outcome based, you're able to better take these small wins in order to prevent"
2160.24,2165.16," things like activist burnout. So in, for example, African Americans, it does not require"
2165.16,2170.38," us to restructure a corrupt internalized system, but rather being able to vote one day, being able"
2170.38,2175.06, to send your children to school are things that can keep you going. You cannot allow feelings and
2175.06,2179.5, things like hope to decide advocacy. It needs to be your certain circumstances that continuously
2179.5,2184.48," pursue. But secondly, on the nuance as to why they can't have cake and they can't have their cake and"
2184.48,2185.06, eat it too. We gave you the nuance if they did they can't have cake and they can't have their cake and eat it too.
2192.62,2193.04, We gave you the nuance. They did not want to engage. They just said that individuals are not individuals are still able to see the overwhelmingly positive outcome.
2199.64,2199.94," The nuance was this, that there is a limit to how large the political obstacle on proper zero can be within their political fiction."
2207.5,2214.16," Because if the story is, for example, one person single handedly being able to overthrow an autocratic government, no one can buy into that. Which is why the structure and the obstacle needs to be lowered in order for the optimism to trump and try to overcome in the end."
2214.36,2220.02," Because individuals need to see that there's a pathway for me being able to emulate said actions, which is why they could not actually co-opt our case."
2220.24,2225.18," But lastly on nihilism, they said we never strategically engaged. We told you why it did not even matter in this debate."
2225.42,2229.14," They have to explain first that we put on the first at the top of the speech, how they"
2229.14,2229.96, change nihilists.
2230.2,2236.98," But second, and very easily, a nihilist doesn't want to die in terms of nihilists choose to"
2236.98,2240.74," live every day, that even if you believe life is meaningless, you also believe that you"
2240.74,2243.64, can feel pain and would not like to live under state oppression.
2243.78,2245.7, Before I'm one sure.
2251.34,2251.44," If it is the case that you get absolutely no changes structurally over like 10, 20,"
2254.58,2254.7," 30 years, then this debate does not make any difference."
2258.98,2259.6, The realistic case is that you do get some concessions in terms of solidifying hope in the real world.
2260.3,2262.1," Yeah, we said you get small concessions."
2262.2,2262.64, We agree.
2262.64,2264.9, You require the large political outcomes.
2271.04,2289.12," And saying that advocacy does not take decades is just disingenuous. Look how long women took to be able to have the right to vote. On to the third argumentation then, state and aren't actually politically participant. Because even when there are real world politics that are"
2289.12,2292.96," toxic and problematic, the privileged or the individuals are able to insulate themselves"
2292.96,2297.96, from that harm. So often narratives of positivity and optimism never really apply to these
2297.96,2301.52, individuals because they are able to shield themselves from the necessary harms that the
2301.52,2306.94," state is propagating. But second and crucially, only pessimism and negativity would affect the upper echelons"
2306.94,2311.02, of society because positive and optimism are able to be shielded and require people to
2311.02,2315.6, live under a position and condition where they feel defenseless and have no power.
2315.6,2319.12," Hence, on our side, when we say that these structures are inherently going to discriminate"
2319.12,2323.44," all individuals, when you conceptualize the world as one that can also be distasteful"
2323.44,2328.24," to yourself, we mobilize the most influential of individuals to be politically participant?"
2328.24,2331.52," Note, panel, that we live in a world where the state literally engineered our choices"
2331.52,2336.24, in Cambridge Analytica. Only under negativity and pessimism can we conceptualize such a malevolent
2336.24,2340.08," state and take preemptive measures against that. On proposition, they would hope the state is"
2340.08,2404.18," benevolent and pray to gods. you Hi, just let me know when to start."
2405.0,2408.24," Yeah, thank you so much."
2408.24,2410.24, I think you're good to go.
2410.24,2416.8," Okay, I was hoping to get a few more seconds."
2416.8,2419.56, My PY preference is strictly through the chat.
2419.56,2421.1, Please don't interrupt.
2421.1,2422.46, That is all I ask.
2422.46,2427.36, No gender pronoun preferences. Say whatever. Just give me a few seconds to
2427.36,2467.82, gather my notes. starting my speech in three two one notice the intrinsic difference between positive and negative political fiction if in
2467.82,2473.14, positive political fiction the agency of what can be done about your situation is placed within
2473.14,2479.02, yourself that is to say the outcomes of a positive conflict for instance is that you end up winning
2479.02,2483.96, if not physically at least you have the moral victory which means that you earned it by doing
2483.96,2487.54, something in terms of self-preservation or survival that they want to talk about.
2487.76,2497.0," Whereas on their side of the house, imagine in 1984, the entire conclusive messaging is that you were never responsible for anything that you did."
2497.3,2501.6," Because necessarily, Conan, at the end of the day, pulls the trigger on Wilson."
2501.88,2505.12, That is the conclusion that you did not have agency in all of
2505.12,2509.74," this. And this is crucial in terms of this debate and where it is better off in terms of outcomes,"
2509.84,2513.74," right? Three questions then in this debate. Firstly, who improves the position of communities"
2513.74,2518.82," and social justice movements? Secondly, is the communication of hope important for people?"
2519.14,2523.3," And thirdly, in terms of where the political climate is healthier? Firstly then, in terms of"
2523.3,2527.84, who improves the position of communities within social justice movements.
2527.84,2529.8," They have two major claims there, right?"
2529.8,2532.66," Firstly, their claim is that pessimistic fiction"
2532.66,2534.52," is effective and secondly,"
2534.52,2537.04, that it indicates for early signs of oppression.
2537.04,2538.52," Quickly on the second point, right?"
2538.52,2540.52, That it indicates early signs of oppression.
2540.52,2543.08, I want to note that media has a large incentive
2543.08,2545.0, to cover it in terms of this reality.
2545.0,2554.0, So this is likely to be symmetric on either side. And also the fact that social media is so globally outreaching means that this is likely to be covered in all facets on either side.
2554.0,2557.0," The difference, however, is that people are not dumb, right?"
2557.0,2568.52," Like, you know, from your lived realities that things are turning south, that certain things are getting worse off. If you're African American, the militarization of policing within your neighborhoods is getting worse because you"
2568.52,2574.12, literally see like police officers with bolsters walking around your streets. That is not the
2574.12,2579.3, difference here. The key difference is that the movie will still show a fictional reality
2579.3,2584.7, wherein the differentiation is literally in terms of feelings as opposed to anything else that they
2584.7,2585.04, wanted to
2585.04,2588.88, talk about within the next speech right like pushing the limits on what people feel and
2588.88,2593.44, things as such the differentiation in terms of movies and books and literature in general
2593.44,2598.72, is hope and is feelings which means that we're better off under this claim right but secondarily
2598.72,2606.58, in terms of pessimistic fiction being effective notice why their claims are in contention with one another. They said that
2606.58,2612.3," at a point in time where we portray viscerality too, that is the only lasting impression. If that"
2612.3,2618.22," is true, then this impact is literally symmetrical on both sides. But we're going to argue that having"
2618.22,2622.68, the impression of hope is something that is probably more realistic and probably something
2622.68,2627.02," that is lasting. Why is this the case? And Ruthen pointed this out, I'll expand upon it, right?"
2627.02,2629.78," It is untrue that in terms of positive portrayal,"
2629.78,2633.76, viscerality gets lost because necessarily the thought process you go through is
2633.76,2637.3," despite facing this violence, despite facing this oppression,"
2637.3,2640.42," you as the protagonist were still able to overcome it,"
2640.42,2645.6, which means that there are instances in which the overwhelming consensus is against you and
2645.6,2651.76, still you can win out and come out on top which is we think an important message right but like even
2651.76,2656.48, if we say that like you know they'll never be successful as opposition wants to point out
2656.48,2668.82, we think the general perception of hope itself is something that is beneficial in sofar as your already pathetic life does not get even more visceral to the extent
2668.82,2674.0," where even when you go to watch a movie for sake of entertainment or for sake of escapism,"
2674.0,2679.02, you're not berated with hopelessness and berated with nihilism and berated with an absolute
2679.02,2705.08," sending effective. They said that it was effective insofar as it pursued the causes of survival. I want to note that in a lot of instances, survival is a positive outcome coming out of these political fictions, which means that that is about survivability relate more to our side,"
2708.52,2708.74," insofar as survivability itself is a net positive,"
2712.36,2712.54, as opposed to being a dystopic portrayal of these government institutions.
2713.8,2715.72," Before I move on, I'll take your point."
2718.98,2719.1," Is it realistic for you to say that in every instance of state oppression,"
2720.62,2720.7, you're always going to be able to win out?
2723.62,2731.52," Because if that's the case, your premise of hope is a premise of something that will never exist in real life your time is over yeah um we didn't say that it is realistic we said that"
2731.52,2736.56, having a perception of hope is generally still better off insofar as every other facet of your
2736.56,2740.96, life is miserable insofar as you don't contest that claim we still don't understand what the
