start,end,text1283.44,1291.04, like society will not trust the the police officers knowing that they're convicts but also like between the co-workers and
1291.04,1295.2, police officers they're not likely to have trust because they have a huge stigma i think the very
1295.2,1300.0, thing first thing to note is that they paint the status quo as a huge issue right that there's a
1300.0,1309.84, huge stigma against these people especially perpetuated by politicians that is the exact same status quo that side opposition is defending where these people have no alternatives are
1309.84,1314.64, shackled within the labels of ex-convicts not allowed to have any opportunities to persuade
1314.64,1318.32, but the second thing i would note about this argument is that it just largely asserts that
1318.32,1322.56, on our side because people don't have trust in the government they will simultaneously just take
1322.56,1329.46, action for their own hands go into vigilantism go into a very chaotic society. I think they needed more analysis to warrant this
1329.46,1334.78," huge, huge impact. But let's talk about the trust that people have. We already gave you a way off"
1334.78,1339.42," from first proposition that I want to highlight very clearly. On our side, sure, maybe in the"
1339.42,1343.26," beginning, people are not going to trust the police. But we think that when you are normalized"
1343.26,1345.74, and when more convicts are actually accepted
1345.74,1346.88," into the police force,"
1346.88,1349.72, then the fact that there's more people that are ex-police
1349.72,1351.64, are normalizing the fact that these individuals
1351.64,1353.96," are key workers within the police force,"
1353.96,1356.6," I think in the long-term, we can get that trust."
1356.6,1358.68," Even in the short-term, if there's a transition period,"
1358.68,1360.94," this is like natural, this is organic."
1360.94,1363.04," We think on the long-term, we get that trust."
1363.04,1365.6, But let's also talk about like the co-workers how
1365.6,1369.76, they're less likely to feel safe the whole perception of like them being ex-traders i
1369.76,1375.04, think for in the i think that we can engage in the case that reintegrating them sure in the beginning
1375.04,1380.0, as i explained to you they might feel disconnected they may not be able to like work as best in the
1380.0,1384.24, beginning but i think the long term of it is really really impactful because inside opposition
1384.24,1388.56, they do not have an alternative to even give them the opportunity to join that force to actually
1388.56,1394.72, work and collaborate with people i think that's a huge part of yes you're going to have small issues
1394.72,1398.96, with co-workers i do not think the harm that they paint to you was as big as they wanted you to
1398.96,1403.28, believe what did we tell you on the point of institutions we gave you a second argument on why
1403.28,1409.42, the justice system is so crucial in being open to having feedback. And this was a key argument that opposition one
1409.42,1414.64, really was not sufficiently able to engage with. Because what we told you is regardless of whether
1414.64,1419.88," ex-convicts join, the fact that you are opening up those applications for those specific individuals"
1419.88,1424.7, means that they're one step towards change because you're more likely to have individuals that can
1424.7,1429.5, talk about their experiences in jail actually shed light onto perhaps the abusive natures
1429.5,1434.14," in the status quo. On our side, we are reintegrating and making sure like forms of"
1434.14,1439.12, checks and balances actually being transparent about what happens in the jail system materializes
1439.12,1443.46, on our side of the house on that point. And the huge principle that we bought to be regardless
1443.46,1449.28, of whether these ex-convicts are being being open to feedback of being open to change is a better alternative than the
1449.28,1454.4, status quo the second question is going to be on x convicts but before that i'll take your point
1455.2,1460.24, yeah so under your model like what metric would you use to like filter out these applications
1460.24,1465.84, would they be treated as any regular applicant or is there a special police forces are going
1465.84,1471.3," to be as any other job, have job interviews, have background checks, make sure that a person"
1471.3,1475.38, is actually viable to take on that job and have to face that training.
1475.38,1479.66, I don't think that the worst case you paint of us having extremely violent and just horrible
1479.66,1482.88, convicts on the police force is extremely unlikely.
1482.88,1486.5, The second question I'm going to talk about is where ex-convicts best off.
1486.5,1488.04, The second argument they wanted to give you
1488.04,1489.86, are like why do people like ex-convicts
1489.86,1492.12, on their side of the house somehow counseling
1492.12,1494.08, and some mechanism to support them?
1494.08,1495.32, I think I would first note
1495.32,1497.34," that there's no exclusivity of that point, right?"
1497.34,1499.06," Because they tell you counseling exists,"
1499.06,1500.32, it helps ex-convicts.
1500.32,1501.76," If that already exists in the status quo,"
1501.76,1503.46," that is a mechanism that is parallel,"
1503.46,1509.6," that is not a benefit for their side. But I would say even if exclusive counselling exists on their side of the house,"
1509.74,1514.34, I think the fact that you are giving them a job opportunity is a bigger benefit. The fact that
1514.34,1519.04," you are recognised as someone to be given and worthy of a job, which is very, very different"
1519.04,1524.0," than in the status quo, where you are painted as someone who does harm and is an aggressor,"
1524.06,1525.44, you are not given a second
1525.44,1529.82, chance. But I want to then bring back the first argument on reintegration and why the principle
1529.82,1534.34," was so important, because they completely just dropped the principled obligation of the justice"
1534.34,1539.26," system. Because if they themselves recognize that the point was to prevent harm, then preventing"
1539.26,1544.56, harm is to make sure that people are reintegrated or actually rehabilitated and can function within
1544.56,1545.12, society.
1545.12,1549.98," We understand that ex-convicts aren't perfect, but on our side, we have better checks and balances"
1549.98,1554.66," for these individuals when they're reintegrated within society, maybe have a place in a police"
1554.66,1559.26," force, are checked and balanced due to like having a job that requires like mental and physical"
1559.26,1563.94," capabilities. We think on our side, you have better mechanisms to treat and make sure that"
1563.94,1569.42, these ex-convicts are doing the best that they can. I think the strategic value of this question is that
1569.42,1573.52," we prove the necessity of the policy, right? Like why this is so necessary while in the status quo,"
1573.6,1578.46," you are simply leaving behind the most vulnerable individuals who require a job, who require"
1578.46,1583.26," redemption, who require an opportunity. Let's then move into our third argument on societal"
1583.26,1589.76," perceptions, where we'll prove to you that these harmful, harmful negative stigmatized views of ex-convicts are enhanced"
1589.76,1593.6, on our side this is directly going to engage on the worst case scenario that opposition wants to
1593.6,1598.8, paint you on why they're going to continue to be stigmatized continue to have resentment we think
1598.8,1603.92, that the problem in the status quo as both sides agree is the fact that these convicts are
1603.92,1605.4, perpetuated and seen as aggressors not reliable actors but is the fact that these convicts are perpetuated and seen as
1605.4,1610.9," aggressors not reliable actors, but also the fact that these police force and these individuals"
1610.9,1612.24, are machines of abuse.
1612.24,1615.5, I think there's two key ways that we change such societal perception.
1615.5,1619.74," The first thing is that if these individuals actually join the workforce, they're legally"
1619.74,1620.74, finding to be protectors.
1620.74,1624.74," They go through the training, are taught to be safeguarding society, the role they take"
1624.74,1629.2," on as a police officer, marginally increases and benefits the societal perception"
1629.2,1633.92, that currently exists in the status quo i think the very fact that they applied to the job in the
1633.92,1638.56, first place knows that they at least want to have a job keep it therefore we'll actually make sure
1638.56,1643.28, that they're safeguarding policies that they're going and aligning with what is necessary for the
1643.28,1648.7," job but secondly on our side we do think we stem, we can humanize the police force, right? Because you"
1648.7,1653.12, are more likely to add nuance to the type of people that are included and represented within
1653.12,1658.36," the police force. These individuals, ex-convicts are directly those who have felt the impact of"
1658.36,1662.54," the justice system. We think that when they're included, when they're represented within the"
1662.54,1667.2," workforce, that humanizes them rather than just simply seeing as corrupt seeing them abusive as"
1667.2,1670.72, in the status quo i think in our absolute worst case scenario where these
1670.72,1674.48, individuals are violent at least they are part of a workforce where they can
1674.48,1678.64, be held accountable can be seen by the public eye i think that wins us even in
1678.64,1682.0, our worst case scenario we proved you the necessity of this we proved you why
1682.0,1700.24, ex-convicts absolutely left with no alternatives we are so proud to propose i thank the second proposition speaker no worries spain i know it's
1700.24,1704.56, easy to do so just everyone make sure that you're setting your two to everyone so that the pois go
1704.56,1705.8, there it happens all the time.
1706.36,1708.18, I invite second opposition speaker
1708.18,1709.18, to continue their side.
1719.04,1720.02," Okay, am I audible?"
1723.7,1724.3," Yeah, right."
1724.64,1724.82, Sorry.
1725.88,1726.08, Yes. Okay.
1734.08,1739.78," Judge, I want to be very clear. Essentially, all of the benefits that Team Mexico gives you,"
1739.98,1750.74," as for stigmatization, as for benefits of the justice system, benefits to ex-convicts, are not exclusive to ex-convicts having access to a job as police. There are other ways to access"
1750.74,1754.7," those benefits on our side of the house, which we are more than happy to support and tell you from"
1754.7,1760.54, first. What we are not willing to do is to worsen societal trust and make situations far worse with
1760.54,1764.4, the harms that we give you that Mexico responds to very weakly. I want to look at two things in
1764.4,1766.68," this speech, the principle and practicality,"
1766.68,1767.86, and then give you a substantive point
1767.86,1771.34, on how Team Mexico side of the house increases crime.
1771.34,1773.1," So firstly, Team Mexico comes up here"
1773.1,1775.28, and gives us like a bunch of principles that sound great.
1775.28,1777.4," You know, the idea that ex-cons deserve the ability"
1777.4,1779.28," to have jobs, that ex-cons deserve the ability"
1779.28,1780.48," to integrate into society,"
1780.48,1782.48, that ex-cons like deserve to be humanized.
1782.48,1783.8," Look, this is fine,"
1783.8,1786.12, but why does this principle fundamentally fall?
1786.12,1787.92, Because none of this is exclusive
1787.92,1790.26, to ex-convicts being policemen.
1790.26,1792.42," Look, they can have access to other jobs"
1792.42,1793.86, that are not in the police force.
1793.86,1795.68, They can improve perceptions by interacting
1795.68,1799.08, on a one-on-one level with people within society.
1799.08,1799.96," We would argue that in fact,"
1799.96,1800.98," that in terms of perceptions,"
1800.98,1803.24, that is far more effective than the hierarchical nature
1803.24,1804.98," that we tell you of a policeman,"
1804.98,1807.84, like interacting with someone on the ground level but look they need to give you
1807.84,1812.72, a tangible reason as to why this principle is exclusive to police when in reality it is not
1812.72,1816.32, that principle false but realistically that's less important in debate more importantly is the
1816.32,1821.28, practicality first thing i want to touch on here is the model so first of all i want to be clear
1821.28,1828.22," that most of the benefits they give you can be accessed without this model look the, the perception of the police force as being static can be combated by things like"
1828.22,1832.5," which are already existing, such as the hiring of more minorities who are not criminals."
1832.5,1835.94," For example, in the United States, we see constantly increasing levels of African Americans"
1835.94,1837.5, participating in the police force.
1837.5,1841.44," This is something that we generally support, but we do not support these people being convicted"
1841.44,1842.44, criminals.
1842.44,1848.72," Look, the idea of like being able to give feedback to the justice system. This is something which ex-convicts are able to do without having access to the police"
1848.72,1852.24, force. I would also note that the police force is largely disconnected from the justice system
1852.24,1856.0," and the courts, so we don't necessarily understand the mechanism. That's exactly why once they're"
1856.0,1859.28," like a low-level police officer, they would suddenly be able to like reform the justice"
1859.28,1863.6," system. I would argue that acting as someone who like, you know, like fights for this justice like"
1863.6,1865.88, outside of the police force would be far more effective.
1865.88,1867.78, But also look at this situation here.
1867.78,1869.98," Look, sorry about like not misunderstanding the idea"
1869.98,1871.3," of 80% of violent criminals,"
1871.3,1874.12," but even 20% of violent criminals who get freed from jail,"
1874.12,1875.5, it's still realistically a lot.
1875.5,1877.48, I wanna contrast this with the idea of the model
1877.48,1878.74, of being able to turn people down.
1878.74,1880.24, So we have two different scenarios here.
1880.24,1882.58," The first of all, is that even if it's a small number,"
1882.58,1884.74, some number of violent criminals are now in charge
1884.74,1888.96," of enforcing the law. Look, you're unable to like filter out all of these violent"
1888.96,1893.36, criminals with the vague model that Mexico gives you. The idea of saying that they go through a
1893.36,1897.6, training program or go through a legally binding process is not enough to mitigate the harms of
1897.6,1902.8, violent criminals who are likely able to get into the police force with this model regardless. Or
1902.8,1908.48, you have the alternative here of so many people getting turned away because you have a fear of violent criminals being on the police court
1908.48,1912.24, force so you are not able to access the benefits from proposition because you cannot change the
1912.24,1916.72, perceptions or access the benefits if the police like if ex-convicts are not being hired at
1916.72,1921.92, extremely high rates look at the like exclusive harms we bring you though first of all is the
1921.92,1928.48," opportunity cost and like a waste of resources if you're just turning people down, that's like minor. But secondly now is the stigma that"
1928.48,1932.72, increases for ex-convicts who are turned away and are not allowed to access this job. If they want
1932.72,1936.56," to look at stigma, I would argue that the stigma is far worse for these people who now get turned"
1936.56,1940.8," down. If violent criminals are such a big problem, I would argue that that number will likely be"
1940.8,1944.8," very high. But secondly, the thing I want to touch on here is why people join the police force in"
1944.8,1948.16," the first place. So generally speaking, you have two reasons. Firstly, you have"
1948.16,1951.44," people who are well-intentioned, and secondly, you have people who are malicious. I'll touch on why"
1951.44,1954.72," malicious people are obviously bad in my substantive, but let's look at well-intentioned"
1954.72,1958.88, people. First to note that Mexico gives a substantive argument on people being well-intentioned
1958.88,1962.64," in the police force, which like drops all of our announcements we give you in first and does not"
1962.64,1968.56, directly clash with it. What do we tell you? That even well-intentioned police officers if their ex-convicts are unlikely to
1968.56,1973.28, help people on the ground because of the hierarchy that you see when they interact with people which
1973.28,1977.44, is to say it's unlikely you shift perceptions when the person that is the like police officer
1977.44,1981.6, trying to persist those perceptions on the ground level is to not commit crime and like that sorts
1981.6,1990.0," of thing or is someone who has power over you, who has the ability to arrest you, this is unlikely to meet like the like universal like respect level that"
1990.0,1993.52," is necessary to shift perceptions on the ground. We would argue that things like therapy, things"
1993.52,1997.4," like counseling, things like, you know, like motivational speaking are far more effective"
1997.4,2001.34, at accessing those benefits because that power imbalance does not exist. But I also want to
2001.34,2004.98," touch on this idea of trust, which is very important. Look, Mexico essentially asserts"
2004.98,2007.84, that these people are going to be trusted this assertion is not enough for them
2007.84,2012.64, to win this debate because look at the harmful perceptions of conflicts which exist convicts
2012.64,2017.28, which exist in society and what is the mechanistic reason for this because the justice system tells
2017.28,2021.84, people who are ex-convicts that they are bad people and even if it's not true this perception
2021.84,2028.0, does exist therefore the difference is now that this lack of trust so like the difference in the status quo between like convicts in general and complex
2028.0,2032.16, specifically in the police force is that trust gets extended to the police force which requires
2032.16,2036.64, public trust to function and lastly this idea here of long-term trust they don't really mechanize why
2036.64,2040.8, this is the case look i think this is likely untrue because the resentment from police officers
2040.8,2044.24, who put their lives on the line to convict criminals now they have to work alongside
2044.24,2047.76, but also the idea that this doesn't work with society is the knowledge that criminals
2047.76,2052.32, exist is enough to lose public trust and also because of the fact that interactions with cops
2052.32,2057.52, firstly are very rare so perceptions on a societal level are unlikely to shift and secondly these
2057.52,2061.6, people do not know that the cops were ex-criminals when they interact with them therefore they are
2061.6,2067.68, unable to shift perceptions on the ground level all of those benefits they are unable to access on their side of the house note that the society is a
2067.68,2071.92, majority in terms of perceptions and they are unable to access them i'll take the point why
2071.92,2077.2, would minority quotas counseling for congress only exist on your side of the house look we're telling
2077.2,2081.44, you that sure to some extent it is symmetrical the difference now is the harms when it comes to
2081.44,2087.84, things like trust and when it comes to things like what i'm going to get into now about facilitating more crime that is what is not symmetrical so how do
2087.84,2091.6, you facilitate facilitate more crime on team mexico side of the house first i want to characterize
2091.6,2094.88, what type of people that we're talking about here we're looking at people who are like so deeply
2094.88,2098.48, entrenched in crime that crime will always be a part of their lives look they like grew up in
2098.48,2102.24, lives lives of crime these are people who like don't have families but have families in terms
2102.24,2108.8, of the people that they interacted with in crime networks in gangs extremely tight familial like bonds something which jail times
2108.8,2114.16, can really not undo now when these people have access to the police force specifically ex-convicts
2114.16,2118.16, having access to the police force they now have access to weapons they have access to evidence
2118.16,2122.24, things like dna or forensics access to knowledge on police raids or like where the police will be
2122.24,2128.16, patrolling at certain times access to a police chief that can be lied to and i also want to note here why is this something that can
2128.16,2133.04, like not be mitigated on on like side proposition side of the house assuming that ex-convicts are
2133.04,2137.36, allowed on the police force at all as per their model because there is no way to know when ex
2137.36,2141.28, convicts intentions when they join the police force which is to say the only thing they have
2141.28,2146.8, access to are likely you know like a record of crimes that they've committed i would argue that like convicts are like realistically if you want to
2146.8,2150.96, look at like interview processes it's very easy to lie and say you are well-intentioned when you are
2150.96,2154.88, not therefore someone who's committed an armed robbery if you're just looking at like face value
2154.88,2159.2, could be equally reformed and well-intentioned as they could be malicious it is likely something
2159.2,2163.12, that will always be a problem so what does this look like it looks like giving these people giving
2163.12,2167.38," false information to the police to force people to like, or to force them to protect criminals that they"
2167.38,2170.74," are friends with to turn their back on crime, which is happening in certain neighborhoods to"
2170.74,2174.7," take bribes from criminals because you are more sympathetic to them. Look, the reason that cartels"
2174.7,2179.18," are such a problem in so many countries in Latin America is because of things like bribes, which"
2179.18,2183.08, allow for this crime to happen. Note that the effects of things like bribery are very similar
2183.08,2189.36, to the effects of ex-convict police officers who are sympathetic to criminals in allowing crime to happen in the first
2189.36,2193.92, place the secondary impact beyond just more crime here is that when people see police officers being
2193.92,2199.84, arrested for example for being moles citizens and police officers both have decreased trust in the
2199.84,2204.08, police force remember why trust is so important specifically in something which upholds justice
2204.08,2208.42," and upholds safety within our society and i want want to be clear here, we understand that this might be"
2208.42,2213.26," an inherently rare situation, although maybe not. But look, even if it is rare, on any scale,"
2213.54,2218.58," the propagation of crime, especially coming from the organization, which is meant to deter crime,"
2218.72,2227.72, is unacceptable on a principled and a practical level. For of these reasons I am very proud to oppose.
2231.72,2256.46," I thank the second opposition speaker and invite third prop to close out constructive speeches for their side of the debate. Hi, can you hear me?"
2258.16,2258.54, Okay.
2259.22,2268.16, Please make all POIs through the chat.
2274.24,2280.8," When the justice system labels people as convicts, potentially taking their destiny from their hands, they have a responsibility to reintegrate them to at least mitigate the harms that they caused."
2280.8,2291.0," First, I want to talk about the decision that makes Team Spain's path to the ballot extremely complicated in this debate, and it's in regards to the counter mechanism they bring."
2291.0,2307.9," Two errors here. The first one is that they never warrant why this is exclusive, and this was even conceded by the second speaker, meaning that all of the benefits they claim on their side of the house can be easily absorbed for hours and therefore this mechanism, thank you very much, helps us a lot."
2307.9,2314.0," But note that they bank their case on alternatives like quotas and counseling, yet never explain"
2314.0,2316.76, to you how they disappear on our side.
2316.76,2319.26, We think that this is incredibly important.
2319.26,2326.46," But secondly, they never take into account that they'll never improve a status quo that they themselves criticize,"
2326.66,2331.4," that they themselves characterize as harmful, that they themselves concede have stigma,"
2331.4,2338.68," have no opportunities for convicts, and still these mechanisms of counseling and all this aren't enough to fix it."
2338.76,2341.38, That is precisely why we're proposing this motion.
2341.74,2345.84, That is precisely why you only have a marginal case that we can largely
2345.84,2350.32, absorb so let's go on to the first question which is under what side of the house do we have better
2350.32,2356.4, conditions for ex-convicts they told you that ex-convicts if they don't get into these jobs
