start,end,text1357.72,1359.4," Kind of this is economics 101, right?"
1359.4,1361.4, It's not economically viable.
1361.4,1364.6, China is a reasonable actor and they're not likely to do so.
1364.92,1365.14," But presuming then that they're not likely to do so, right? But"
1365.14,1370.38," presuming then that they're like characterization of China getting scared by the West and like now,"
1370.54,1376.06," like, I don't know, retaliating, right? Presuming that is true, I still don't think that it's like"
1376.06,1381.26," reasonable. Firstly, it's because like, if we're talking about Taiwan or something, like, I don't"
1381.26,1389.84," know, what exactly is opposition's character? What will China do, right? Will they have like aggressive flyovers? Will they have like boots on the ground? This is"
1389.84,1394.18, what they have in this status quo when it comes to countries like Taiwan. I think quite clearly
1394.18,1398.24," the status quo is not working, but I'll talk about that in the next area of rebuttal, right?"
1398.56,1403.4," But like overall, I just don't think it's like likely that China will retaliate also because"
1403.4,1407.36," like, you know, like the maximum of what they might do, they already do when it's likely that China will retaliate also because the maximum of what they might do,"
1407.36,1411.52," they already do what is possible in the status quo. But furthermore, I think it's much more"
1411.52,1417.6, likely that China exploits weaknesses rather than strengths. This directly responds to their point
1417.6,1423.04, about Pelosi visiting Taiwan. The problem with that in the status quo is that the US constantly
1423.04,1425.56," backs in, backs out. Why?"
1425.56,1426.88, Because they don't have an alliance.
1426.88,1432.7, They don't have an actual physical agreement that they have to protect this country.
1432.7,1437.32," So what often happens is the US shows some support for Taiwan, then backs out."
1437.32,1440.6, Some support for Taiwan because they don't have an alliance.
1440.6,1442.24, China then usurps this.
1442.24,1443.84, They exploit this.
1443.84,1469.86," As we said, China's a reasonable actor. If they're genuinely outnumbered, if they genuinely see that they're circled in and that their neighboring countries are aligning much more with the West, I think it's more likely, rather than China alienating itself, which is not economically viable in the slightest, I think it's much more likely that China has a genuine incentive to economically benefit these countries, right? But as Gaddafi already told you, even if"
1469.86,1474.42," China retaliates, this is more incentive for the neighboring countries, for these like, you know,"
1474.52,1479.9," quad, for these like future quad countries to actually join the quad, because they now are like"
1479.9,1484.74," see what China, like what that actually looks like. The comparative on side opposition, right,"
1484.74,1490.2," is that either, well, it's either twofold, right? Either you have the U.S. being like somewhat in"
1490.2,1494.72," the region, but not having like actual, an actual agreement, right? Like what we see right now with"
1494.72,1499.54, Taiwan. I want to make it like very clear that when the U.S. and when the West has genuinely
1499.54,1505.34," committed agreements, look at the money that the U.S is pouring into NATO right I think it's very likely"
1505.34,1511.22, that the U.S will genuinely like once they have this strong like ground this alliance it's likely
1511.22,1516.26, that they will actually like follow through with their promises right the comparative as I said is
1516.26,1520.64, that they're going to be in the region but have no strong like you know hold they don't have like
1520.64,1525.2, you know the capacity to I don't know like have their military operations in these
1525.2,1529.44, countries and that's very very harmful because this at this lets china exploit their like
1529.44,1534.32, weaknesses right but then the next area of a model on military protection they tell us oh you know
1534.32,1538.48, whatever is in this like the status quo it's good enough because we have peace talks etc i don't
1538.48,1542.48, think the status quo is good enough and i don't think that for five reasons right firstly it's
1542.48,1545.72, because in the status quo china exploits the weaknesses of the West.
1546.04,1550.06, China sees that the Philippines do not have a genuinely as good of a military.
1550.3,1551.9, They bomb ships in the status quo.
1551.94,1553.38," I don't think that's good enough, right?"
1553.62,1557.34," Secondly, in the status quo, these countries do not have good enough leverage over China"
1557.34,1561.98," because they don't have as good of a military, et cetera, as they would if they aligned themselves"
1561.98,1562.7, with the West.
1562.92,1569.84," And thirdly, as they say, no side wants a war. On our side of the house, when China is faced with nuclear powers, they're not likely"
1569.84,1574.3," to go into military conflicts. They're not likely to do all of those things. Furthermore, on the"
1574.3,1578.36," economic exploitation, it's likely that the West will actually protect these countries because"
1578.36,1588.84," they are trading partners for them. Before I move on, I'll take one POI. If, as you say, China is economically devastated by the pandemic and the housing bubble,"
1589.18,1593.34, how will they engage in investment wars and the hot war you talk about?
1594.42,1597.72," Yeah, so it's just more like it's better economically if you invest in countries,"
1597.8,1599.92, and therefore you're providing the carrot.
1600.18,1601.6, They do have some funds to invest.
1601.7,1602.76, It's a completely different scenario.
1602.76,1607.44, When you slap tariffs on all of your neighboring countries meaning you don't get your exports out right
1607.44,1611.2, that's the comparative they're not likely to do that the uniqueness on our side of the house
1611.2,1615.04, on this military protection is that we have more strategic cooperation with the west and more
1615.04,1618.96, troops on the ground but i'll like expand on that in my extension about more democratic change in
1618.96,1623.68, these countries there are four points here firstly when you have like external pressure uh for
1623.68,1625.4, domestic politics to
1625.4,1629.72, change because the West when they like uh invest in these countries they want some like Democratic
1629.72,1633.86, you know checks and balances right so we're more likely to have like more democracy in these
1633.86,1636.74, countries we're more likely to have more accountability in the militaries of them
1636.74,1641.66, like already explained secondly we're likely to have strategic communication in key areas right
1641.66,1649.18, so a for example in manufacturing the West does not want these countries to be as reliant on China right so it's more likely that they will like set up
1649.18,1653.5, manufacturing stations there B when you have like the West is likely to help with like crime and
1653.5,1657.88, human trafficking and drugs and borders we already saw this happen in NATO uh with NATO where like
1657.88,1662.62, they like like really stop the piracy going on in Somalia thirdly you're likely to have cooperation
1662.62,1666.04, military expenditures and fourthly you have more soft power in negotiation
1666.04,1667.7, when you have a larger seat at the table.
1667.7,1671.12," Panel, this is about like either being against two fish"
1671.12,1673.6," on your own, or at least having one on your side."
1673.6,1703.3, We prefer the latter. Thank you very much for that speech.
1703.3,1705.26, We go back to the opposition for the second
1705.26,1729.54, opposition speech. Good luck. Can I check if I'm audible and visible?
1732.16,1733.06," Okay, thank you."
1743.2,1744.48," So at the top of this speech,"
1744.56,1746.76, I want to be very clear about the context of aggression
1746.76,1747.76, that takes place right now.
1747.76,1752.08," I want to just first point out a couple of lies they said, like China bombing ships and"
1752.08,1753.68, placing troops in nations.
1753.68,1756.44," If they did that, there will be a literal war already happening."
1756.44,1761.44, The truth is Chinese aggression in the status quo does not amount to direct military intervention.
1761.44,1767.7," Often, aggression takes place of things like, for instance, election meddling, like we saw when they meddled with elections of countries like Australia, for example,"
1767.92,1771.84," or for example, the use of digital warfare tactics to increase their ability to control states,"
1771.88,1776.82," or even their own example of the BRI. Our point is that, like they concede, China is a rational"
1776.82,1781.56, actor and will never enter an actual hot war or military conflict on either side of the house.
1781.86,1788.16," That is why the context of aggression that takes place in the status quo is about more moderate forms of aggression, which their pact does nothing to"
1788.16,1793.46," stop. With that, two areas of clash. First, how will China respond to this? Second, how third"
1793.46,1798.2," parties are hurt? First, how China will respond to this? And I think the question we have to ask"
1798.2,1802.42," here is, does their policy actually work in solving any of the problems they talk about?"
1802.56,1809.04," They talk about the BRI, for example. how is a military pact that responds to military aggression going to stop this absolutely no"
1809.04,1813.76, response but second the question to ask you is this how does china respond to aggression and
1813.76,1818.48, potential threats and the answer isn't peace and temperance often it's equally aggressive actions
1818.48,1822.64, and there are two reasons why first because c historically fights fire with fire look at how
1822.64,1826.8," for instance they began constructing artificial islands for example,"
1827.1,1828.12, at the point in which the US
1828.12,1829.88, was increasingly involved within the region.
1830.14,1831.04, Or the fact that literally
1831.04,1832.96," the moment Pelosi stepped foot within Taiwan,"
1833.24,1834.78, they are already carrying out things
1834.78,1836.34," like simulated military drills, for example."
1836.7,1837.74, I think what this suggests to you
1837.74,1839.36, is that China is most likely to respond
1839.36,1841.72, to aggression with even more aggression
1841.72,1842.72, on their part.
1842.94,1844.48," But secondly, as they concede,"
1844.74,1848.14, Xi is risk adverse and he wants to deter other states from being able to join these pacts.
1848.44,1852.86," Therefore, he is likely to use these aggression tactics to therefore achieve this angle. That is"
1852.86,1855.8, why the likely counterfactual on their side of the house is that China will respond to this
1855.8,1859.54, even more aggressively. And that is why all of their harms here are far from the truth.
1860.1,1864.9," Next, they say that China is already maximally aggressive. Why? We think that given the"
1864.9,1865.92, contextualization of how China is a rationalally aggressive. Why? We think that given the contextualization
1865.92,1867.26," of how China is a rational actor,"
1867.48,1869.4, obviously it only engages in aggressive actions
1869.4,1871.62, at the point in which the benefits exceeds the cost.
1871.86,1872.94," And that is why in the status quo,"
1873.14,1874.96," if it's truly economically weak, for example,"
1875.08,1877.14, it is possible that they can increase aggression
1877.14,1878.82, in the future if the economy recovers.
1879.02,1880.8, The point is that China isn't maximally aggressive
1880.8,1882.5, and this is just a lie.
1882.7,1883.68," So obviously in the status quo,"
1883.86,1888.78," obviously if they are prompted to act aggressively, they will do so under their side of the house. Finally,"
1888.88,1894.22," they said, well, but China likes to capitalize on weaknesses. When the US isn't involved in the"
1894.22,1898.52," region, then they will start wanting to engage more. Why is this the case? In the status quo,"
1898.94,1903.4," even if the US isn't fully committed, China wouldn't run the risk that the US could possibly"
1903.4,1908.56," intervene because they know that if they engage in a war with the US right now, they would massively lose or even if they"
1908.56,1912.56," wouldn't lose, they would suffer economically and would destroy their country. That is why even if"
1912.56,1917.12," there isn't an explicit commitment, for example, the possibility and the threat that the US might"
1917.12,1921.52, intervene on either side of the house as Biden in the status quo has already committed to defending
1921.52,1929.32," Taiwan, for example, clearly demonstrates to you that this argument is not exclusive. Finally, they said, well, there will be an investment war to attract"
1929.32,1933.56," these states. Why is this the case? If it's true that China is already so economically impoverished,"
1933.72,1937.88," how are they going to engage in these investment wars? But most importantly, we win this point."
1938.08,1941.64," Because you know when investment wars happen? It's when there's no clear line drawn, when you can"
1941.64,1948.18," still win that country over. On your side of the house, they're literally drawing a clear line that these states are supporting the US and these states are"
1948.18,1952.56, supporting China when they join or don't join the pack. That is when investment wars won't happen
1952.56,1956.02, because there's no additional incentive of throwing you free money if you're just going to ally
1956.02,1960.16, yourself with another country anyways. That is why when the clear line isn't drawn on our side of
1960.16,1963.86," the house, we get more investment and we win the investment war. So this point is honestly"
1963.86,1968.78, nonsensical. Second area of question on how third parties are hurt and i want to point out here
1968.78,1973.08, they completely dropped their first speaker argument here because they said oh no but now
1973.08,1976.96, what happens now is that the region is very military unstable and therefore just a disincentivized
1976.96,1981.38, investment after we point out that this is obviously untrue and that for instance foreign
1981.38,1986.44," direct investment inflows within asia for example has been increasing increasing across the past years, they completely dropped this point,"
1986.66,1991.04, which shows that they concede that this is unlikely to be a significant difference in the debate.
1991.24,1993.62," But more importantly, the argument just doesn't make sense."
1993.86,1997.78," This is premised on the assumption that China is going to invade Asia, for example,"
1997.88,1999.84, and therefore this poses a real military threat.
2000.1,2003.88," This is incredibly unlikely, and therefore the argument just doesn't make sense."
2004.08,2005.12," Before I move on, yes."
2007.74,2013.02," Okay, given the Philippine ships that China bombed this January,"
2013.72,2015.78, isn't it more likely that that wouldn't have happened
2015.78,2019.76, had they known that this nation's army was backed by the West?
2020.52,2022.38," No, and here's a very simple reason why."
2022.84,2024.74, If you are going to activate your military pack
2024.74,2025.14, at the
2025.14,2029.0," site of every single small thing that China does, that would be terrible for your side of the house"
2029.0,2033.5, because your side could literally risk starting a world war because any small act of aggression
2033.5,2037.88," and immediately the US will come flying in with their troops. Obviously, they cannot support this"
2037.88,2041.78, because that's just crazy and will create massive conflict that just really don't want to support.
2041.96,2048.16," So if you want to support that, I think we win with that reading the investment and their argument at first figure that they"
2048.16,2052.42, dropped they cannot bring up bring up again in the next speaker finally my substantive argument
2052.42,2056.56, in this argument I'm going to explain to you why they increase the likelihood and impact of an
2056.56,2062.68, Indian initiated war the premise of this argument is that currently Modi breeds a policy projects
2062.68,2066.0, the policy of Hindu nationalism for instance the fact that he's seeking to reclaim Kashmir
2066.0,2068.3," and the fact that, just like recently, for example,"
2068.48,2070.24, they have cut Wi-Fi and sent troops in the area
2070.24,2072.44, to arrest prominent pro-Pakistani politicians
2072.44,2073.72, within the Kashmiri region.
2074.02,2075.28, We think this is likely to be worsened
2075.28,2076.82, on their side of the house in two ways.
2077.18,2080.04," First, because India is emboldened by this policy."
2080.38,2082.16, Now that the US has explicitly committed
2082.16,2084.52," to defend all of its members militarily,"
2084.84,2086.34, we think it's incredibly likely
2086.34,2087.46, that on their side of the house
2087.46,2089.04, India will be emboldened by this policy
2089.04,2091.24, because they know they can get the military backing
2091.24,2092.88, of the US
2092.88,2093.5, secondly
2093.5,2094.44, no thank you
2094.44,2094.84, secondly
2094.84,2096.96, even if the likelihood of war remains the same
2096.96,2098.84, we think that the devastating impact of war
2098.84,2100.38, is magnified on your side of the house
2100.38,2101.92, they want to talk about the Cold War
2101.92,2103.92, I think it's more likely that proxy wars happen
2103.92,2109.04, when you create literal alliances that promise to defend every single country within their alliance
2109.04,2112.32, i think it's far worse on the other side of the house because in this specific context of india
2112.32,2117.12, for example we are more likely to see things like proxy conflict and proxy conflict that will ensue
2117.12,2121.44, as a result of these alliances that's why when these wars do happen and these conflicts do happen
2121.44,2128.64, as they are beginning to in a status quo they are going to be even more devastating within this region and it's causing a lot more civilian casualties
2128.64,2133.36, i want to be clear about the weighing here we think that the actions of china are unlikely
2133.36,2136.96, to be significantly transformed on either side of the house and the reason for this is the cost
2136.96,2142.08, especially on their very best case scenario of military conflict how china were engaged in the
2142.08,2147.38," trouble like invading countries and bombing ships for example example, we think they are unlikely to do this to the full extent because they know that"
2147.38,2150.82," they are economically devastated. Like, they concede, and if they engage in a military war"
2150.82,2155.32," with the US, they will lose. That is why it's incredibly likely that A, Chinese forms of"
2155.32,2158.44," aggression are going to be more moderate, in which case their policy does absolutely nothing"
2158.44,2162.14," because it responds to military conflict, not more moderate forms of conflict, like for instance,"
2162.92,2168.42," election interference, for example. And secondly, this argument independently proves to be an external reason, an external impact that"
2168.42,2173.06," wins the debate, because it proves to you that in another region where conflict is more certain and"
2173.06,2177.04," more likely to happen than in the context of China, for example, we think it's more likely that you"
2177.04,2182.36," create even worse harms within these areas. Finally, I just want to be very clear about"
2182.36,2187.4," the ultimate end goal of this debate, because on either side of the house, it's incredibly unlikely that China will completely"
2187.4,2190.86, change their policy stances. But what we are certain about is that in the short to medium
2190.86,2194.7," term, for example, when they engage in more moderate forms of aggression, our policy and"
2194.7,2199.54, not having a clear explicit alliance that increases aggression mitigates and against
2199.54,2202.66," these moderate forms of aggression. Whereas on their side of the house, their policy, A,"
2202.76,2207.52, does absolutely nothing to stop these moderate forms of aggression and b is likely dependent towards uh ceasing paying
2207.52,2210.72, stance or being more nationalistic and being more aggressive when you respond to them with equal
2210.72,2214.24, amounts of aggression that's why harms are going to be far more worse on gas like the house and
2214.24,2218.08, that's why on outside the house we protect against the most realistic types of harms that are going
2218.08,2222.4, to take place in the status quo at the end of the day a they're failed to prove that comparative
2222.4,2226.72," environment is necessarily better and b i outside of the house, we generally protect"
2226.72,2230.1, far more regions in a more realistic way to actually respond to the specific context of
2230.1,2231.1, the situation.
2231.1,2264.36," For all these reasons, never been prouder to oppose. Thank you very much for that speech."
2264.36,2266.84, We go back to the proposition for the third
2266.84,2316.24," proposition speech. Good luck. Hi, just checking that I'm audible. Okay."
2316.24,2321.18, Framing the team opposition has adopted in this debate has already come to sink their
2321.18,2322.82," case, right?"
2322.82,2325.12," Because at the point at which you basically like make,"
2325.28,2332.42," try to draw symmetries everywhere, except for like the binary nature of economic sort of agreements,"
2332.42,2338.04," you basically, you destroy your case because economic agreements are not of binary nature."
2338.18,2343.62," They're not as simple as, you know, oh, you only trade with your military partners, right? It's"
2343.62,2345.9, far more nuanced than that. There's
2345.9,2351.6," far more to it, and I'll explain it in my speech. So I'll have three main questions. Firstly,"
2351.74,2357.26," about whether the Quad works and people join it. Secondly, about economics. And lastly,"
2357.5,2362.1, about military. So on to the first point about whether the Quad will work. They basically
2362.1,2365.9, conceded up to this point that countries will join the Quad
2365.9,2372.84," and countries have incentives to do it, right? Like, you know, the U.S. provides the Philippines"
2372.84,2377.94," with submarines already. So obviously, if they want more military protection, they will turn to"
2377.94,2383.04," the U.S. because that is where their infrastructure is headed. So we're likely to see a large, you"
2383.04,2385.64," know, expansion of this military alliance to"
2385.64,2391.5, include a lot of countries. I think this point just simply stands for our side. So efficacy can
2391.5,2398.2, exist on our side if we're able to prove the other two points fall on ours. So then the second one
2398.2,2403.94," about economics, which is the main impact in this debate, as they have also tried to describe,"
2404.18,2406.08, right? So the main premise of their side is they have also tried to describe right so the main premise
2406.08,2411.52, of their side is that basically like countries will split apart and there will be tariffs and
2411.52,2419.12, sanctions and exclusive trading agreements i'll take your pois later and so um and so ultimately
2419.12,2426.32, like countries will stand to lose from us so let's look at it from the side of China. So let's say that there's a
2426.32,2433.14," claim from them that basically China will economically retaliate. So firstly, you know,"
2433.48,2438.92," there's very little like negotiating power for China at the point at which, like you said,"
2439.06,2450.3," team opposition, they already called it, you know, Asia-NAT NATO, right? Where is the additional wiggle room to suddenly call it Asian NATO, but with additional characteristics, right?"
2450.58,2455.86," Like, where is the additional political power going to come from to retaliate so much more?"
2456.08,2460.46," Plus, we don't even know what this, like, retaliation so much more looks like."
2460.54,2465.88," Like, Chinese does the, like, you know, you have people like Chen wuha on Twitter like"
2465.88,2471.4, you know throwing swear words at other diplomats right this kind of thing is sort of what riles
2471.4,2477.94, up the nationalism within the country and benefits them the actual like trade you know agreements and
2477.94,2487.6, tariffs and all that hurts them far more so secondly yes China is currently in trouble right they have like you know mortgage crisis
2487.6,2493.28, looming they're suffering from the pandemic they desperately need to get like some sort of chips
2493.28,2499.36, and uh and manufacturing going to support their economy that is going downhill if they suddenly
2499.36,2505.76, at this point right decide to cut trade because this motion happens right now so they either retaliate
2505.76,2511.6, right now or they don't retaliate at all because like that ship will have sailed and they'll have
2511.6,2516.8, sucked it up right so at this point right now panel it's important that the timing of this
2516.8,2523.2, debate as well china cannot afford to simply stop trading with these nations it's far more likely
2523.2,2525.56, that they do something like invest in
