start,end,text3940.22,3969.42," here, nihilism is something that's a major rhetoric of pop culture in everyday life. This is something we have pointed out from our first speech. It's not just this political fiction, but there are multiple other narratives in society that literally propagates nihilism to a greater extent, that promotes nihilism and, you know, hopelessness amongst people in general. their entire point on like how negative, watching negative fiction literally leads them to like,"
3969.8,3976.68," literally leads them to like, probably, the entire point of how watching negative fiction"
3976.68,3982.48," leads them to like going, leads them to like changing things and things as such, right? There"
3982.48,3990.08, is a massive logical gap there. We don't know how they're able to solve it but fourthly they say that state is something that's benevolent
3990.08,3994.72, and uh and something that's not supposed to be uh supposed to be questioned especially because
3994.72,4000.24, they are working in their first speech and in the third speech they go go and say that you know we
4000.24,4005.12, should not we should these states should be responsible instead of individuals there's a huge
4005.12,4010.66, contradiction in general three things to why we win this debate firstly on effectiveness of urgency
4010.66,4016.24, thirdly on community secondly on communities and thirdly on political inactions and climate in
4016.24,4021.8, general right firstly on effectiveness we tell you that hope is something that's extremely important
4021.8,4027.28, under our side they tell us us that survival and hopelessness
4027.28,4031.46, is an instinct that died in the visuals in order to work.
4031.46,4033.22, What we need to understand is that if there
4033.22,4036.14," is a mechanism to why hope does not work is something that's,"
4036.14,4039.56," oh, it's only like something that's going to be short term."
4039.56,4041.9," Understand that things like fare are also short term,"
4041.9,4044.36, or things like survival needs are also short term
4044.36,4050.56, to a massive amount of of cases especially because they have to let go but even
4050.56,4056.64, when let's say fair is something that's long lasting the need to actually feel hopeless and
4056.64,4062.88, not do anything is why is it not overwhelming over the need to actually bring change and things as
4062.88,4069.44, such they never prove to us why that happens we tell you that hope is unique under our side specifically because of
4069.44,4074.72, the fact that we're able to actually materialize these sort of incentives on different ways we
4074.72,4079.28, tell you that urgency and the fact that you know problems generally exist in society and are
4079.28,4084.08, propagated by activists because even in the absence of these fiction there are going to be other
4084.08,4085.28, mechanisms in society that are still going to be other mechanisms in society
4085.28,4087.02," that are still going to be present,"
4087.02,4089.38, because of which there is still a sense of urgency
4089.38,4090.86, that people feel in general.
4090.86,4094.72, This literally means that the distinction of optimism
4094.72,4097.08," is massively important to bring that form of hope,"
4097.08,4099.14, and that's going to be more effective.
4099.14,4102.06," But we also talk about how activism burnout,"
4102.96,4108.86," how activism burnout is something that's like, that's like massively occurs under their side, specifically"
4108.86,4113.68," when hopelessness is an increasing tendency. Under our side, this burnout is less likely"
4113.68,4118.16," to occur, specifically because they're hopeful about the future. We think that's massively"
4118.16,4122.46, important because that's what people like activists are facing right now because of
4122.46,4125.2, the massive tendency of like believing that there is
4125.2,4131.2," hopelessness in general. Secondly on community, we tell you why agency of individuals is something"
4131.2,4136.48," that we're able to prioritize, agency to bring change and all of these things that's likely to"
4136.48,4141.92, happen. But we also tell you that there is an intrinsic form of solidarity within the community
4141.92,4152.64, because there is no internal conflict and things as such it's like massively important the point to state is failure we basically show a better form of solvency but
4152.64,4158.16, thirdly on political inaction we tell you why this inaction is massively likely on your status quo
4158.16,4164.4, and things as such but it's like less likely under our world when we are able to question the state
4164.4,4165.74, or other mechanisms for these reasons for all those when we are able to question the state or other mechanisms
4165.74,4170.52," for these reasons. For all those reasons, we are very proud to stand on proposition. Thank you."
