start,end,text
0.0,11.12," Hello, just to confirm one last time that I'm visible and audible."
12.0,12.48," Yep, you are."
13.62,14.1, Perfect.
15.16,16.68," Again, verbal P.O.I.s."
16.68,23.56," I'll start my speech in 3, 2, 1, go."
24.16,28.8, A doctrine of fairness is a doctrine of truth we propose framing three parts
28.8,33.34, firstly what does the doctrine look like it looks like having a diverse amount of opinions with
33.34,38.1, equal airtime whilst abiding by other current media standards these look like media needs to
38.1,41.68, get political candidates of all sides during debates it looks like interviewing people
41.68,48.88," representing different opinions or using media of different perspectives. Obviously, fact-checking exists on both sides of the house, meaning that"
48.88,54.12," this debate isn't about factual information but about opinion representation. Secondly, this policy"
54.12,58.86, will be moderated by the FCC and other legal bodies. This means that it will be accountable
58.86,63.42, because it will go through democratic check and balances that are subjected to high degrees of
63.42,69.36, scrutiny by other media outlets and lawmakers. implementation involves one in creating a framework that
69.36,74.08, outlines three to five major perspectives per issue that needs to be reported this is sufficient
74.08,78.4, because most issues are narrowed down to a few main camps of solutions anyways for example the
78.4,82.08, refugee crisis can be narrowed down into two main solutions opening or tightening border controls
82.08,88.1," for refugees this also could look like laxing or adding restrictions are the two main solutions, opening or tightening border controls for refugees. This also could look like laxing or adding restrictions as the two main solutions to gun control. Second part of"
88.1,92.04, implementation is that we will fight and take legal actions against channels that fail to
92.04,96.68," implement doctrine. Thirdly, we think that we will also have an appeal system that can be implemented"
96.68,101.68," for certain viewpoints to be implemented retroactively. Third part of framing, presumably,"
101.98,108.86, this debate is about controversial issues. Insofar as it occupies the majority of news headlines and causes the most amount of controversies.
109.22,110.8, We have three arguments to bring to you in this debate.
111.14,113.58," Firstly, why we fulfill the role of media companies."
114.08,117.04," Secondly, why we increase discourse and change human interaction."
117.64,120.96," And thirdly, Sophia and DPM will tell you why we uphold democracy."
121.36,129.84, But now into first arguments and five layers under why we were able to fulfill the role of media companies first point media corporations in this debate definitely have
129.84,135.04, a large audience reach this means the scale of your audience is larger than other media outlets
135.04,139.2, therefore the extent of influence you have and the negative ramifications you cause through
139.2,145.52, a nuanced information is much higher secondly the media the media with significant audience reach have a reciprocal
145.52,151.0," obligation to optimize informational access. Given that they exist successfully today,"
151.36,155.86," due to public and state policy, there is a responsibility to provide a variety of information"
155.86,161.36, means that they internalize information that corresponds best with the world's viewpoints
161.36,166.54," and lived experiences. Thirdly, media corporations are unique actors that people turn to for information,"
166.8,168.48, because people expect news to be trustworthy.
168.94,172.16," This means that news corporations nurture political identity and choice,"
172.4,176.14," because their information influences individual choice and preference,"
176.46,178.82, especially given how frequently people interact with the news.
179.26,183.2," This looks like, if someone is not given the information about how vaccines are made"
183.2,189.44," or the real dangers of COVID, their opinions formed on COVID is probably skeptical, hence illegitimate. This is important"
189.44,194.48," in two-fold. One, information is a prerequisite for a functioning democracy. Without information,"
194.48,199.2," people's capacity to exercise their choice significantly diminishes. Secondly, choice is"
199.2,203.92, a reflection of self-identity. Being able to choose amongst ideas and find out the one that
203.92,205.26, best suits you is the
205.26,210.2," role of the state. But now to the fourth part of this argument. Crucially, news media and the status"
210.2,214.9," quo deprives you of choice, meaning that the fairness doctrine is an important mechanism to"
214.9,219.92, counteract the lack of choice. News media creates a deprivation of choice in three major ways.
220.42,225.38," Firstly, profit incentivizes news corporations corporations means that they deploy sensationalist tactics"
225.38,227.88, to suck you in and continuously watch the news.
227.88,232.62," This means once you opt in, you stay subscribed to the same channel and thus have limited"
232.62,234.5, access to alternate information.
234.5,238.9," Secondly, news companies have perverse incentives to compete against other channels."
238.9,243.0, This means that they will actively demonize other outlets and discourage viewers from
243.0,244.0, searching channels.
244.0,249.42," Thirdly, this form of coercion is long-term because children are born into families with specific ideological"
249.42,254.2," leanings. Fifth part of this argument, how does the fairness doctrine help media companies fulfill"
254.2,260.48," the role? Fairness doctrine mandates an equal and equitable portrayal of the both sides, which means"
260.48,267.8," that consumers have access to differing viewpoints that are not misconstrued. This means that as long as we propose more viewpoints on site proposition,"
268.22,270.68, we fulfill this principle of government argument.
271.34,275.34," This looks like in places where there's more biased ideological leanings,"
275.34,279.28, media corporations are responsible for representing the other political camp.
279.92,289.1," Therefore, this just means that we increase exposure and acknowledgement of the other side's ideals, meaning that we're better able to help individuals construct their own opinions."
289.1,300.6," The implication of this argument is, regardless of the fairness doctrine's practical outcomes, access to information is a principled right, given that it helps individuals know how to act on a day-to-day and maximizes the choice to exercise."
300.82,302.06," Before I move on, I'll take your point."
303.32,310.26," Why do governments have it in their best interest to not abuse the media sphere and turn this into media censorship? Firstly,"
310.74,315.02, we told you already that media censorship is highly unlikely because there is a significant
315.02,319.28," amount of backlash that will happen. Media outlets, if they are shut down for no reason,"
319.28,323.62," will most likely go out and protest. Individuals will most likely protest, right? This debate"
323.62,329.3," probably happens in a sphere where there is actually democracy, otherwise this debate just doesn't exist. Hence,"
329.3,333.98," therefore, the amount of backlash you'll receive as a government for trying to censor material and"
333.98,338.54," do not have a perfect justification means that it is too high of a risk for any government to take,"
338.54,342.8," and even if they do take the risk, it is highly likely that it will have significant consequences."
342.8,346.92," But now to argument two, which is why we increase discourse and change human interactions."
347.4,348.6," The thesis of this argument is,"
348.86,350.38, the implementation of the feminist doctrine
350.38,353.72, counteracts existing polarization and creates less toxic discourse.
354.22,354.68, Three layers.
355.08,356.94," Firstly, how is the news worsening polarization?"
357.5,358.02, Three reasons.
358.32,360.2," One, in the age of social media,"
360.54,362.8, news organizations have to stand up from a sea of information.
363.22,364.94, They have no choice but to sensationalize news
364.94,368.48, and use clickbait titles to attract views and maintain ad revenue.
368.48,372.64, This results in newsroom editors intentionally spreading misinformation to appeal to certain
372.64,377.1," demographic biases, such as poor people are lazy or immigrants are dangerous. Secondly,"
377.1,381.18, the rise of populism around the world post-Trump means that politicians default to mudslinging
381.18,385.1, and demonizing as the most convenient political strategy to gain votes.
389.24,393.74," This new sensationalization feeds into society's political division and treaches legislative paradox. Third reason, media corporations have an incentive to maintain existing viewer bases."
394.12,397.7," Changing political leanings may cause viewers to turn to other channels. Hence, they have an"
397.7,402.56, incentive to not address multiple perspectives and continue to maintain their existing viewer base.
403.24,405.46," Layer two, why does the fairness doctrine solve?"
405.64,406.1, Two reasons.
406.44,409.38," One, we force news organizations to compete with each other"
409.38,411.02, by providing continuous substance.
411.66,414.46, Organizations that can address the best form of opposing arguments
414.46,416.2, will most likely gain the most credibility
416.2,418.52, than the ones that address the shallow version of the same view.
418.84,420.56," This is unique because to the fairness doctrine,"
420.98,425.4, news corporations now compete to represent the variety of viewpoints
425.4,430.5, and better whereas on opposition different news media engage with non-overlapping perspectives
430.5,435.72, appeal to different audiences hence there is no competition at all on-site opposition second
435.72,439.98, reason this reason is awareness on what these issue other issues are right prompting discourse
439.98,443.4, on news channels and interviews as well as prompting individuals to do more research on
443.4,449.36, their own about these issues so what is the impact there's two impacts one we decrease echo chambers echo
449.36,452.96, chambers are hard to form on our site because each topic are exposed to different viewpoints it
452.96,457.92, forces individuals to engage with opposing views whereas they were not previously aware before
457.92,462.8, tangibly when we reduced echo chambers with demeaning views on minorities minorities also feel
462.8,469.52," more comfortable speaking out about their experiences in open discourse. Furthermore, echo chambers thrive on government conspiracies,"
469.52,473.36," they are being silenced for speaking the truth. When they are given the sufficient platform,"
473.36,478.08, it undercuts their conspiracy theory when they have to gain legitimacy through proper reasoning.
478.08,483.36," Now to the second impact, on democracy. People are now making independent decisions instead of"
483.36,486.86, voting based on biased information presented by news media corporations.
487.28,494.52," When people make independent rational choices on what is best for them, then it will most likely be more accurate in terms of democratic representation."
495.06,508.0," Even in one-party states, you are increasing nuance and discourse within the parties themselves because their constituents are introduced to views beyond the party line. Furthermore, when people are later experiencing the consequences of policies that they illegitimately support,"
508.0,512.08, then there is a lack of confidence in the state which encourages counterproductive trends such
512.08,516.0, as decreasing political participation. It also looks like an apathy towards government policies
516.0,527.8," or encouraging governments to further intervene in common life. With all of that, we are so proud to to propose."
528.3,529.96, Great. I thank the speaker for that very fine speech.
529.96,530.88, Calling upon Elo.
530.88,531.38," Yeah, yeah."
541.86,583.62," I'll just take like 20 seconds to wrap up my speech, get my papers in order. Am I audible and visible?"
583.62,585.2," Yes, you are. Okay. Am I audible and visible?"
585.9,587.32," Yep, you are."
587.62,588.92, Okay.
590.48,590.58, I'll take POIs through chat.
592.76,600.04, Please don't unmute yourself at any point of my speech.
602.12,603.78," I'll start in three, two."
606.08,606.36, The fairness doctrine is not fair.
611.2,611.44, It is one that governments can abuse to consolidate power and it leads to reduced discussion of important issues.
612.1,612.26, What do we support?
613.7,613.8, We broadly support the status quo.
615.08,615.22," Specifically, we want three things."
621.52,621.84," One, an independent regulatory body that punishes intentional misinformation, such as the FCC in the US and Ofcom in the UK."
629.44,633.56," Second, instances of unintentional misinformation need to be addressed in a future broadcast once the error has been identified. And finally, enforcement of antitrust legislation to prevent media consolidation. Before I move on, I'll deal"
633.56,637.24," with the responses, right? Recognize the first thing that we get from proposition is that they"
637.24,640.6," talk about their model, right? Where they're going to have the regulatory bodies going to be"
640.6,649.8," something like the FCC and other legal bodies are going to hold them in check. Who elects who stays on this regulatory body? Is this a democratic process? If not,"
649.94,653.56," then presumably the government does that, right? Presumably the government is going to decide who"
653.56,657.92," sits on this regulatory body, which means they have an active incentive to ensure that these"
657.92,661.28," are people who are going to support them, who are going to ensure that the government isn't"
661.28,667.84," being criticized and questioned in the first place, right? We think that this a leverage to the government to manipulate what kind of in what kind of news is"
667.84,671.6, being propagated they had to make it clear why that doesn't happen on their side right but
671.6,675.84, recognize what we get from their side they talk about how choice is important panel this isn't
675.84,680.32, a debate about whether or not choice is being restricted choice is literally once one click
680.32,684.56, away you can go to a different news channel and you can just click and read up what they're saying
684.56,688.96, right this is not about choice this is about how people aren't this like this debate
688.96,693.52, is about how people aren't actively trying to like take up uh to like use that choice right
693.52,697.04, we don't think that is a relevant that is a relevant argument in this debate right but
697.04,700.8, secondly they talk about how like uh but secondly they talk about how like media corporations in
700.8,705.04, general propagate very very like false news and very like uh news that is
705.04,710.56, aligned with one side we think this is we think this is not true because recognized media houses
710.56,715.76, in general have an incentive to propagate news that that is not you know very extreme or very
715.76,721.2, like aligned to one side right because recognized corporations provide ad money which is how media
721.2,727.84, houses run right we think that they still need this money to function we think that on their side this does not happen because corporations do not want to associate
727.84,733.12, with media houses that are blatantly so that are blatantly so you know uh like positive towards
733.12,737.04, one side we think that because of pr these corporations don't necessarily do that but
737.04,742.4, before i move on i'll take a poi if there is one how is the regulatory body on your state house
742.4,746.04, not biased as well given that you want to use the same macro on-site proposition?
746.8,751.82," On our side, at least these media companies have the ability to come up and say what they want, right?"
751.84,755.68, We think there's the independence of the press that exists on our side that doesn't exist on your side.
755.74,757.9, That is the comparative. Moving on to the first argument.
758.3,761.18, This policy hinders a free and fair democratic process.
761.52,768.3," Freedom of press is absolutely essential for any democracy to function. And this largely deals with the POI, right? Because recognize it provides us information"
768.3,772.06," on the government and its actions that people need to decide. Without it, people are unable"
772.06,776.56," to make an informed decision about how to vote, which party to support, etc. In the status quo,"
776.8,781.12," the press is only interfered with under very strict conditions, such as one, limiting"
781.12,785.54," misinformation, lies or slander, or second, like banning direct incitement of violence."
785.78,791.48," In both of these cases, the rules are objective. A fake story is objectively untrue."
791.76,795.88, An incitement is when you have directly caused an objective risk to a person or a group.
795.88,802.94," However, in propositions world, whether a network is covering a controversial issue sufficiently is very, very subjective."
803.26,809.68, What is sufficient coverage and which viewpoints need to be covered are all subjective what are the potential consequences of this first
809.68,814.8, for any political party it is always advantageous to suppress media platforms that challenge them or
814.8,820.0, support oppositional viewpoints in propositions world they are likely to use whatever powers they
820.0,825.28, have to appoint members in this regulatory body in a way that benefits themselves this also deals
825.28,829.44, with the prime minister's response that in a democracy media censorship is not likely because
829.44,835.2, even in the best liberal democracies politicians clearly have this incentive even in the us where
835.2,840.0, commissioners of the fcc are appointed by the president and confirmed by the senate the fcc
840.0,844.56, used the fairness doctrine to force the washington post to reduce coverage of the watergate scandal
844.56,849.26, during the nixon administration it is something they need to defend. But it's far worse in weaker
849.26,854.4," democracies like India, Poland, Hungary, or Brazil. They can keep suing news companies for alleged"
854.4,860.16," breaches and cost them a huge amount of time and money. These lawsuits are intended to censor,"
860.38,864.78," intimidate, and even silence political dissent from news corporations. This is their comparative."
866.0,873.0," This is why they're worse. These are also hard to hold to account, since the public often don't care or understand the details of legal disputes over regulation."
873.0,886.2," Right. All of this has this is all like enabled simply because of all of this is enabled simply because of how subjective the standards of fair representation of all viewpoints is, right? But"
886.2,892.24," even if I take government at their best, even if proposition somehow has the best regulators and"
892.24,896.92," there is no room for abuse, they still need to make a highly subjective judgment with limited"
896.92,901.78," budgets, which will lead to errors. This means when prioritizing the allocation of resources,"
902.1,905.82, they will avoid prosecuting the large broadcasters against
905.82,910.5, whom legal battles are more difficult to win smaller news corporations on their side will
910.5,914.82, be targeted in an arbitrary and discriminatory way with who will be like driven out of the industry
914.82,920.7, due to costly legal battles they cannot fight the industry will be monopolized even further at the
920.7,928.12," end of the argument it's evident that politicians can use this policy to hinder a free and fair democratic process, even in Proposition's best case."
928.5,932.96," On to the second argument, then, about how controversial issues have reduced coverage in their world."
933.26,940.52," Unlike the COVID-19 or Russian invasion of Ukraine, there are a series of issues that are important but are not immediately apparent to an audience."
940.8,943.44," Thus, the broadcaster has discretion over whether to cover it."
943.66,949.68," In Proposition's world, these issues get covered a lot less for two structural reasons one logistical reasons it"
949.68,954.96, takes far more resources to analyze an opposing viewpoint in a broadcast for example complex
954.96,960.16, nuances of a climate bill now need top experts on their side to discuss both sides as a news
960.16,964.88, broadcaster in fear of prosecution by the regulatory body you avoid covering the issue
964.88,968.88," altogether you know this issue is not immediately interesting enough for your audience, so they"
968.88,973.76," don't necessarily tune out because you aren't covering it. And secondly, for ideological reasons,"
973.96,979.18, the most ideologically rigid media organization know that they will lose viewers when they discuss
979.18,984.08," the opposing side to certain controversial issues. For example, when Fox News would avoid"
984.08,985.04, covering the later
985.04,989.92," stages of Bush's war on Iraq, just because recognize that even though these later stages"
989.92,994.68," weren't so central that viewers expected coverage on them, reporting on this could potentially turn"
994.68,1001.26," off your audience, right? The harm of all of this is that you lose out on opinions about"
1001.26,1005.32," controversial topics important to decision making, all because media"
1005.32,1009.84," corporations fear the fairness doctrine. Furthermore, we argue that it is untrue that"
1009.84,1014.46," presenting both sides of the story is always good. This is a direct response to their argument,"
1014.58,1018.44," right? Because recognize first, some of the best journalism in the history of the profession"
1018.44,1023.4, were one-sided biting critiques of specific powerful actors like the Watergate reports on
1023.4,1025.16," Nixon administration, or like the Boston Watergate reports on Nixon administration or like"
1025.16,1030.34, the Boston Globe's reports on sex abuse in the U.S. Catholic Church. The core of the government's
1030.34,1037.34," case in here is that they get a better informed society. This policy, despite its intent,"
1037.64,1042.72," leads to the opposite occurring. But second, two sides of a debate do not always deserve"
1042.72,1047.38," equal coverage, right? On their side, ering both sides on these kinds of issues is dangerous."
1047.76,1049.38, Think about COVID-19 vaccines.
1049.78,1054.24," Anti-vax proponents who are invited on proposition side can be very persuasive speakers,"
1054.62,1060.24, use misleading facts that are hard to rebut in real time and therefore be convincing despite lack of evidence.
1060.24,1062.02, This literally costs lives.
1062.32,1066.36," Think about minority issues in countries, right? Think about"
1066.36,1072.44," how them not receiving, think about how presenting both sides is essentially going to come back and"
1072.44,1077.4," cause literally harms to human dignity, right? This is something side opposition refuses to"
1077.4,1081.88," stand for. On our side, most news corporations naturally refrain from representing the side"
1081.88,1088.88, that is dangerous or immoral. This is because most broadcasters earn their revenue from advertisers particularly large corporations who do not want
1088.88,1093.2, their brand to be associated with a network that is so supportive of what's dangerous or actively
1093.2,1097.84, can be seen as costing people their lives for all these reasons we think that news corporations have
1097.84,1108.06, an incentive on our side to not on our side to remain better. We oppose.
1110.22,1110.38, I thank the speaker for that very fine speech.
1132.0,1135.0," Calling upon DPM here. Hi, am I audible? Yes, you are."
1135.0,1178.56," Okay, thank you. Sorry, just give me a second."
1178.56,1182.32, I'm incredulous at the fact that our principle of choice was brushed off by saying that viewers
1182.32,1184.42, can just be a click away from getting other views.
1184.42,1187.36, We gave you structural reasons as to why they're incentives for companies to brainwash
1187.36,1191.68, their viewers and say exactly why and put them down a path of sensationalization none of this
1191.68,1195.2, was engaged with and because of this our principle of choice still stands and i'm going to prove to
1195.2,1198.24, you why further on this is round winning i have a few things i'm going to do in this debate first
1198.24,1201.92, let's talk about government obligation and government abuse secondly talk about why exactly
1201.92,1207.14, choice will be will be shifted on their house and then lastly talk about why we get better discussion on issues in and of itself.
1207.3,1210.52," So firstly, then on government obligation, I think the first thing that they say underneath"
1210.52,1215.54," this is that governments are abusive, and that regulations will be a gross misuse of power in"
1215.54,1219.06, the SAS code. I have a few responses to that. There are a few reasons why this won't be as
