start,end,text1219.06,1223.44," abusive or why it won't be abusive at all, right? So firstly, on the civil service branch, the FCC"
1223.44,1225.2, is a natural civil service
1225.2,1229.6, industry in the sense that democrats picked it and let's say to approve it so it checks and balances
1229.6,1233.36, so fcc has been doing this for decades they care about transparency and are likely to make the best
1233.36,1237.2, decisions given that you already operate using the fcc and the status quo but secondly there's
1237.2,1240.96, immense food to me right and i think that you cannot underline you cannot underscore this enough
1240.96,1244.16, when there is immense food you need to judge how many people are going to how many people are going
1244.16,1246.96, to view or what can be broadcasted or not there's literally going to be a lot of
1246.96,1250.48, whistleblowing a lot of pushback against if there are wrong decisions being made you're literally
1250.48,1253.84, the ones who are restricting news corporations if you do the wrong step or if you do something that
1253.84,1257.84, is miscalculated they will call you out in of itself right companies that can call the government
1257.84,1261.52, every day do this already right they can fight back because these are large corporations and
1261.52,1267.28, that's exactly why if the government missteps or over does something then they're going to answer calling them out calling them abused and corrupted
1267.28,1270.56, in and of itself that's probably something the government wants to avoid regardless of who's in
1270.56,1275.76, power right but secondly you know fcc also has a lot of transparency this is that they want to see
1275.76,1279.04, there's something unpoliticized they want to see that it's good because if they overset their
1279.04,1282.16, boundaries then the public is going to lose trust in them and that's something that they don't want
1282.16,1287.76, but lastly then cross comparison or call it can exist on our house so the government shuts down a viewpoint on one source individuals
1287.76,1291.84, from all groups can now point that out and cross compare with different users as to what exactly
1291.84,1295.36, has been left out and fill in the blanks by themselves so it's actually very easy to point
1295.36,1298.96, out what the government has done and why something that is so bad and that's why you just don't get
1298.96,1302.88, this massive overviews of power on their skies but lastly i just want to flip this point i want to
1302.88,1306.66," say that if the government understands is so perverse and has such bad incentives,"
1306.66,1308.68, there are much worse ways they can do that on their side.
1308.68,1311.0, And it's also when officials can do a backdoor bribery
1311.0,1312.26," or say, if you produce this,"
1312.26,1313.7," which is already happening in the status quo,"
1313.7,1316.26," if you'd produce this or if you have a storyline,"
1316.26,1317.48, can give you a lot of money for that.
1317.48,1319.18," It's a lot easier, it's a lot harder to call it out"
1319.18,1321.3, on their side of the house when these are behind doors
1321.3,1322.64, and there's no regulation in place
1322.64,1324.86, to actually give equal time to over issues.
1324.86,1327.44, And therefore there can be a disproportionate skew on both sides.
1327.44,1332.86," So I've taken down why exactly the government, because of immense scrutiny and because of cross-comparison, do not overstep their boundaries."
1333.16,1338.14," And why exactly? If they want to rely on regulations, they cannot rely on the fact that government abuse will be so rampant on their side."
1338.34,1342.74," But then secondly, then, I want to bring back the point about choice and tell why exactly it's so important in this debate."
1343.46,1348.4," Their whole obligation, their whole response was one click away is literally is one quickly is already happening and people have"
1348.4,1352.16, this choice already but that misses our nuance right we told you a few things like centralize
1352.16,1356.88, sensationalization and demonization about the other side even if it's not extreme which is
1356.88,1360.16, their mitigation that these are going to be mitigatory views they can still be selectively
1360.16,1363.92, skewed and tilted this is a nuance that they miss in the sense that it's profitable for these
1363.92,1369.0," companies because so long as they have a loyal viewer base, they don't really care about who exactly they're misconstruing and misrepresenting."
1369.0,1380.0," That's why profit still flows in, because advertisers don't care who the voter base is or who the viewer base is. So long as you have a constant and steady large majority base of viewers, then it's okay, a-okay for them, and they'll still fund you anyways."
1380.0,1388.0," So that's exactly why they're putting up funding, or why they have an incentive to be modernized or moderate that simply doesn't work they have an oil fan base and that's exactly why they get more radicalized"
1388.0,1392.8, and more sensationalized on their sales but lastly executives can make political decisions that limit
1392.8,1396.48, choice right so even if you don't want to be you want to be a moderate there still are executives
1396.48,1399.84, at the top who can make these decisions for you and since they have their own biases they have
1399.84,1403.28, their own political views and that's why exactly choice will be restricted when the people who are
1403.28,1407.52, viewing this think that it's unbiased but actually it's been gone through a lot of filtering and politicization
1407.52,1412.16, on their house so last conclusion of points that points to choose is very very limited on this
1412.16,1415.52, house and even if there are clicks away people do not click on it to begin with because of the
1415.52,1419.28, incentive structure of these companies and that's why the government has an obligation to fix this
1419.28,1424.24, but then moving on that why exactly do you avoid why why you don't avoid covering issues the whole
1424.24,1428.88, point underneath this was you lose massive amounts of funding when you have to go to other sources and thereby you
1428.88,1433.68, cover less things lots of these controversial issues in general a few responses this i think
1433.68,1437.36, that firstly on funding they just asserted that it would be a burden or a hinder right if these
1437.36,1441.52, are large multinational corporations who have millions of people tuning in each day i'm still
1441.52,1447.46, very unclear why exactly they'll lose massive amounts of money if they have to go through a little bit more viewpoints or have to do more interviews.
1447.74,1451.34," Likely they can cushion the thing in and of itself. But secondly, large companies probably"
1451.34,1455.18," have the most incentive to cut back on other miscellaneous things like gossip sessions,"
1455.3,1458.68," like other celebrity news stories, and they can redirect money into being more efficient there."
1458.84,1463.46," So we flip this claim so that even if they have to lose money, they will still put these more"
1463.46,1466.32, money onto better things and make it more efficient in and of itself.
1466.58,1470.1," But secondly, these corporations still have incentive to report on diverse issues."
1470.28,1475.4," Right. And for this mechanism, because when you have to report on the same things, you need other ways to differentiate themselves."
1475.6,1479.38, Right. People still want to know about national controversial issues because they still apply to them.
1479.44,1487.14, That's why news corporations will still report on them because they have the most and most ability to make a statement that's why on their side house you actually get less reporting on diverse issues
1487.14,1491.82, when they can only resort on help on reporting on one sort of or one aspect of the issue when
1491.82,1495.72, everyone has to put on the same things again more diversification we flip their point about why you
1495.72,1499.44, avoid issues that's what's happening on their sales before we move on I'll take your point
1499.44,1504.36, if all viewpoints deserve equal representation then would you pit a Holocaust denier against
1504.36,1506.32, a survivor of Auschwitz in the same debate?
1506.32,1508.82," Right, okay, let's move on to my last point."
1508.82,1512.12," Why not everything, why everything should be represented or why they claim about not"
1512.12,1514.02, everything should be represented is simply untrue.
1514.02,1516.12," I think firstly, this is extremely subjective."
1516.12,1517.66, You can trade pick examples all you want.
1517.66,1521.1," There are still a lot of unconventional issues that still have legitimacy, like abolishing"
1521.1,1522.94," prisons, like religious minority viewpoints."
1522.94,1527.04," These are still things that deserve to be represented, even if they are small points. You cannot just collectively pick ones"
1527.04,1530.42," and say this is bad, right? But think about secondly, those based on false truths and"
1530.42,1533.88, misinformation are probably going to be filtered out like in the status quo and still being given
1533.88,1537.28," consent to. So if the officer survivor doesn't want to be in this debate, then we wouldn't invite"
1537.28,1540.2," them on anyways. But there are probably many people who do want to engage in conversation,"
1540.44,1543.46, who do want to be represented on national television. And that's exactly why we give
1543.46,1547.26, them a platform that you don't get on their sales but thirdly at our worst case scenario when
1547.26,1550.68, we represent these viewpoints we get more engagement and you don't fester these bad
1550.68,1554.22, ideologies in the corner right when you bring them to a national stage and you get more awareness
1554.22,1557.7, attention on it that's what you actually call it why it's problematic to begin with this is
1557.7,1561.66, an entire flip on their side because on their side these ideals these ideas never get called
1561.66,1565.06, out on their side we do bring them out to. We do give them more of a national attention
1565.06,1566.64, and that's why they're more likely to be shut down
1566.64,1568.06, and more likely for people to understand
1568.06,1570.66, why exactly it's so bad when you engage them in conversation.
1570.66,1572.28," Then lastly, moving on to my last extension"
1572.28,1573.96, about why you uphold democracy.
1573.96,1575.64," Besides having your own political agenda,"
1575.64,1577.94, existing news sources are biased against smaller parties
1577.94,1579.56, and niche ideologies for two reasons.
1579.56,1580.98," Firstly, a lack of public engagement"
1580.98,1582.66, where more people are aware of existing parties
1582.66,1584.1, or large viewpoints and don't want to engage
1584.1,1586.88," with those from the minority, i..e religious minorities or far-left minorities"
1586.88,1590.8, for who are for abolishing prison they're not small in numbers per se but the majority has
1590.8,1595.2, conflicting viewpoints and that's why they ignore them but secondly nepotism and advantages of
1595.2,1599.84, being more mainstream also impact this so bigger parties can buy up time on articles or news
1599.84,1604.16, sources or tv segments to a much larger extent due to wealth and power like bezos and the washington
1604.16,1606.7, post jobs in the atlantic and Benioff in the Times Magazine.
1607.02,1610.54, Bigger parties tend to have internal connections to the owners of news sources through similarities
1610.54,1613.96," such as status, wealth, or business deals that reinforce news corporations to favor"
1613.96,1614.72, certain ideologies.
1615.1,1618.56," Knowing that is exactly why, under this house, deals are much more corrupt and much less"
1618.56,1618.92, transparent.
1619.12,1621.4," If they're not done through the government, they'll be done through the rich and the elite."
1621.66,1622.36, Why is it so bad?
1622.56,1624.6," See that at first, it corrupts democratic principles."
1624.9,1627.36," In a democracy, people are free to express their viewpoints and have them"
1627.36,1630.88," heard and responded to. When smaller parties are unfairly discriminated against by the media,"
1630.88,1634.48, they're disproportionately unable to express themselves and be engaged in the conversation.
1634.48,1638.48, This certainly clashes with the point about why you present wrong ideas. Because even if they
1638.48,1642.4," are wrong ideas, a portion of the of the of the population still holds them and thus we still"
1642.4,1647.84," deserve to represent them and have them engage in the conversation. This results in a few things, right? Bigger political parties are"
1647.84,1651.14," unable to be called out, and people stay in these viewpoints despite potentially liking another one"
1651.14,1654.6, better. Different viewpoints are being neglected and unable to reach general society means that
1654.6,1658.3, minorities aren't catered to as well. So how do we solve this on ourselves? When we mandate
1658.3,1662.06," means to give smaller parties or ideas a platform that is broadcast to mainstream society, it's"
1662.06,1667.52, easier to enter into the democratic conversation and not to be overshadows.. We humanize the other groups more and they're less likely to buy into
1667.52,1671.44," demonizing narratives and instead be more open to seeking middle ground compromises through politics,"
1671.44,1676.08," through policies, etc. For all these reasons, because we protect the principle of choice,"
1676.08,1677.76, we are very proud to propose.
1687.84,1690.24," Great, I thank the speaker for that very fine speech. Calling upon DLO, here you are."
1690.24,1694.5," Hi, before I start, confirming if I'm visible and audible."
1694.5,1695.5, You are.
1695.5,1696.5, Excellent.
1696.5,1698.28," Once again, preferred pronouns he, him."
1698.28,1701.32, I'll take POIs through the chat if you have one.
1701.32,1728.0," That out of the way, I'll be starting shortly. Starting my speech in 5, 4, 3, 2, 1."
1728.28,1730.46," So in this debate, opposition needs to prove two things."
1730.66,1733.84," First, why are the media houses in the status quo irredeemably bad?"
1734.16,1736.86," Two, how do they actually fix this issue if they are so bad?"
1737.04,1739.6," If we can disprove any one of these issues, we win this debate."
1739.6,1742.44, But we'll do both in the two things that I'm going to discuss in my speech.
1742.7,1743.62," One, on abuse of power."
1743.78,1747.6," And two, on actually improving the quality of information available but before that i want to"
1747.6,1751.6, frame out this whole weird principle that they have on choice in two ways number one i want to
1751.6,1755.36, notice that their entire choice if you think about it if there's a store next to my house where i can
1755.36,1759.6, go and buy diet pepsi but i choose not to their entire principle says that i'm committing an
1759.6,1763.44, incredible moral harm the simple reality of the status quo is that there are numerous amount of
1763.44,1767.76, media houses that are available with the advent of the internet you can choose with the click of a button to access
1767.76,1772.56, any form of news that you want they say that news is coercive sure but then what you're doing is
1772.56,1775.92, equally coercive right because then you're forcing other forms of media outlets to come there and
1775.92,1778.88, express your opinions when you don't want it perhaps you're a liberal person who wants to
1778.88,1782.72, be expressed to liberal ideologies that's why you go to news outlets like jacob why are you then
1782.72,1786.0, forcing your ideas on them their entire principle backstabs on itself.
1786.0,1791.0," But number two, even if you don't buy the initial premise and you do think that it is important that people are met with a variety of information,"
1791.0,1796.0, Basma gave you layers and layers of analysis as to why less news is going to be covered in the first place.
1796.0,1798.0, Media outlets are unlikely to cover controversial issues.
1798.0,1801.0, Media outlets are likely to self-censor themselves because of government abuse.
1801.0,1803.0, Which brings me to my first point about government abuse.
1803.0,1808.24, What do we tell you? We tell you that the media outlets have an important role in our society
1808.24,1812.3, in holding the government accountable and by calling out instances of government abuse.
1812.58,1816.78, We think that this gives the government more capacity to hamper down on media. What do they
1816.78,1820.12, say? The first thing that they say is that this new board that they're going to make is going to
1820.12,1823.88, be incredibly impartial. And the example that they give us is because it's going to be elected by the
1823.88,1828.56," Senate. Guys, the Senate is the most politicized institution currently in the united states their"
1828.56,1832.08, entire job is to hold the president accountable and they don't because they didn't impeach trump
1832.08,1836.72, because the part because senate is in fact elected by republicans and it is incredibly politicized
1836.72,1840.72, and it's bipartisan the simple reality is governments have an incentive to crack down
1840.72,1844.8, on these media outlets and now you give them the capacity to do so because you give them a legal
1844.8,1848.32, right you give them the ability to give these board you get the government gets to
1848.32,1852.0, decide who gets to be on this board what policies are implemented by the board how are these
1852.0,1855.52, policies implemented the likely counterfactual then is the government is going to crack down
1855.52,1858.64, on dissenting voices that they don't like how do they respond to this isn't there ah there's
1858.64,1863.12, gonna be massive backlash no this backlash is not going to be anywhere near symmetric for the simple
1863.12,1867.12, reason that otherwise if the government were to randomly like lock up a journalist there would be massive backlash
1867.12,1870.88, because there's a visceral reaction to it i saw the journalist getting arrested now the government
1870.88,1874.8, hits them with loads of regulation the government hits them with loads of regal battles which people
1874.8,1878.88, are unlikely to notice notice most people don't watch up on like legal eagle every single day
1878.88,1882.56, you don't read up on what goes on in supreme courts every single day you are unlikely to notice
1882.56,1887.92, them let's be charitable let's assume that these regulators are good here's why even then they're still going to be bad actors
1887.92,1891.36, in two ways number one how do you know when something is fair like how do you know the
1891.36,1895.68, two experts are equally skilled if an idea is like underrepresented society because they're advocated
1895.68,1899.68, by a minority is it really fair if you just give it like the same amount of screen time given that
1899.68,1904.08, anywhere else they won't be represented the likely counterfactual then is that their personal biases
1904.08,1907.04, in this own regulatory body are going to come out and they're going to subjectively act
1907.04,1911.44, out on this because subjectively act out on this and then skyfall media number two they will
1911.44,1915.44, selectively exercise this power given that this is going to be subjective it is going to probably
1915.44,1919.92, very hard for you to actually win import battles if they do exist this means that media outlets
1919.92,1923.76, are going to selectively exercise these powers on entries they can think they can win i.e relatively
1923.76,1927.36, smaller media houses as opposed to corporations with billions of dollars in funding that can fight
1927.36,1931.12, off your legal battle why is the comparative important the comparative here is the only other
1931.12,1934.32, instances where the government does actually intervene the business of media and when you
1934.32,1938.24, can objectively prove it you can objectively prove that something is false via fake news you can
1938.24,1941.84, objectively prove that something is liable in a court of battle you cannot prove that something
1941.84,1947.52, is fair because of this degree of subjectivity we win this debate simply on this clash independently because media is the only
1947.52,1951.68, entity that can hold the government accountable in the absence of this government abuse corruption
1951.68,1955.92, uh human rights abuses all of these things go underported this is simply enough to assist
1955.92,1960.08, debate let's say you don't buy that let's say we need to prove why the equality of information is
1960.08,1963.92, better we've proven the first argument why states can use this to control the flow of information
1963.92,1966.96, we've proven the second argument why this causes fewer ideas to be discussed anyways
1966.96,1970.72, and i will prove in my third argument why people are drawn to alternative worst forms of media but
1970.72,1974.0, let's say you don't buy that either i will now respond to this claim that media houses are
1974.0,1987.62," impartial in four ways but before that go ahead okay seeing none sorry If not for the FCC, who regulates these policies?"
1987.78,1990.8, Who regulates what news articles is deemed as fair or not fair?
1991.7,1992.1, Exactly.
1992.24,1993.66, Our counterfactual is that they shouldn't.
1993.92,1995.88, Your literal model is that you have a government body
1995.88,1998.26, regulating what news outlets people should and should not view.
1998.48,2000.04," Even if these government bodies are good,"
2000.22,2002.18," we still gave you incentives where there's like massive,"
2002.26,2004.28, massive capacity for abuse to occur in the first place.
2004.5,2008.62, First response. We think that these outlets have an incentive to be impartial due to three reasons.
2008.88,2011.8," Number one, they get money from ad revenues. They get money from ad companies."
2012.0,2016.9," And while these companies may care about the ratings of these media agencies, they also probably care about their own reputation."
2017.16,2023.9, You would not want your company brand to be associated with a media outlet that is literally spreading false news and is causing people to die because of that.
2024.1,2027.56," Number two, there's often cutthroat competition between other media outlets. If you"
2027.56,2031.28," don't cross the aisle and you show information that the most amount of people you could want,"
2031.5,2035.12, your own people could go away from your media outlets and go to somebody else. You presumably
2035.12,2039.48," don't want that. Number three, you want to reach out to as many people as possible in order to"
2039.48,2043.72," maximize your revenue. Sure, media outlets could only show the ideologies of the far right or the"
2043.72,2048.0," far left, but by definition, there are relatively few people actually on the far right or the far left."
2048.0,2054.0," Therefore, if you are to maximize your revenue, you have an incentive to cater to the center, or the majority of people would actually want to believe it."
2054.0,2061.0, All of this proves that their policy is likely not going to be doing much for the simple reason that media outlets want to cater to it in the first place.
2061.0,2068.24, Let's say that media outlets are biased anyways the likely counterfactual that is that they're going to show this bias in the way that actually implement the
2068.24,2071.04, uh and the way they actually show both of the debate this means that they're probably going
2071.04,2074.4, to give tokenistic representation to all ideologies what does this look like it looks like
2074.4,2077.84, showing someone who's really bad at explaining a particular viewpoint an expert who's really weak
2077.84,2081.76, at explaining an ideology this happens all the time literally ben shapiro goes around college
2081.76,2087.84, campuses debating high school students at like college universities and calling them experts or it looks like you get the most extreme person for the other
2087.84,2091.12, viewpoint to show that this is what their viewpoint looks like every single time you want to have a
2091.12,2095.04, discussion about healthcare fox news gets the most dedicated communists in order to show that
2095.04,2099.2, everyone who cares about uh healthcare is actually a communist what this does is it shows to people
2099.2,2102.8, that this ideology is really really bad they're really french i should not believe in it anyways
2102.8,2106.76, so people are pulled away from those ideas. Let's say exposure is positive.
2106.76,2108.88," Even then, it's going to moderate"
2108.88,2110.08, very few amount of people.
2110.08,2112.08, This is because if you are a Trump supporter
2112.08,2113.48, and you actually watch Fox News
2113.48,2115.36," and you saw Fox News being critical of Trump,"
2115.36,2116.76, your likely reaction isn't going to be
2116.76,2118.0, to stop watching Fox News.
2118.0,2119.4, It's going to be stop believing in Trump.
2119.4,2120.96, You're going to stop watching Fox News altogether.
2120.96,2122.32," You're going to be angry at Fox News,"
2122.32,2124.32, which is why you're going to get even more radicalized.
