start,end,text3464.08,3468.96, you loosen this idea that there's like trust in in the rule of law and law enforcement and second of
3468.96,3474.56, all this idea that like there's um that more people trust like ex-cons when they can reach
3474.56,3478.8, people and that only happens in our side of the house when you reach them as people instead of as
3478.8,3483.44, cops when you get one community that's been like violently affected by crime they won't be reached
3483.44,3489.04," by a cop because that cop even though they empathize with them, if they're going to do a good job, which Team Mexico"
3489.04,3492.94," says that they're going to do, and to some extent, we agree, by virtue of them having to do a good"
3492.94,3497.04," job, regardless of how much they empathize with these people that are affected by crime, they're"
3497.04,3501.0," going to have to put them behind bars, period, right? And even we told you, even if that's not"
3501.0,3504.4," the case, and they empathize with them to the point where they're willing to like skirt the law"
3504.4,3506.94," and like let them off, we're also telling you that that's obviously"
3506.94,3510.6, going to be harmful to society because they're letting criminals away. So under both of these
3510.6,3514.8," frameworks, they're literally not able to reach people, right? So additionally, let's tell you"
3514.8,3519.62," why, like who benefits like ex-cons the most. Oh, sorry. And quickly on effectiveness, we're telling"
3519.62,3524.78," you because of malicious actors, police's like main job is to literally focus on like trying to"
3524.78,3525.36, combat crime outside. This is obviously going to be very is to literally focus on like trying to combat crime
3525.36,3529.12, outside this is obviously going to be very difficult to achieve if they also need to worry
3529.12,3532.4, about the person that's standing in the desk in front of them or that's going into the field next
3532.4,3535.76, to them they won't be able to trust them if that person used to be the person in front of them
3535.76,3540.16, holding a gun right but who benefits ex-cons look we give you a far more nuanced characterization of
3540.16,3544.16, what ex-cons actually look like and we got no response from it we told you that there are cons
3544.16,3548.88, that are like likely came from like entrenched communities um that come communities that were
3548.88,3554.4, entrenched with crimes and we're telling you that these communities of ex-cons benefit from ex-cons
3554.4,3559.28, reaching them again as people instead of like as a cop for these reasons and second of all we get
3559.28,3564.24, the people that made bad decisions and aren't necessarily like criminals like by nature and
3564.24,3568.56, we're telling you that they're more likely to benefit again from therapy and from being reached these people are
3568.56,3572.08, unlikely to want to become cops in the first place we're telling you on these brands we get
3572.08,3579.68, former alternatives on these brands we're proud to oppose i thank the opposition reply and finally
3579.68,3624.62, call upon the proposition reply speaker to close out the debate. Let's take a look at two characterizations of side opposition that largely undermine
3624.62,3625.0, their case.
3625.0,3631.0, The first one is how they engage in what our side of the police force and actually going into these jobs.
3631.0,3635.0, We painted through since violent Valentina speech that we would have training.
3635.0,3650.8," We would have job interviews that these are things that are structurally within an employment within an employment atmosphere, I think to sideline these mechanisms that we gave and create far-fetched scenarios of people taking and stealing weapons, of creating like falsified evidence or"
3650.8,3654.88, very worst case scenario comparatives that side opposition wanted to engage in. But the second
3654.88,3658.88," thing is about the counterfactual exclusivity of the things they defend, right? Because they wanted"
3658.88,3663.92," to bring you minority quotas, counseling and theory therapy. What was different between it"
3663.92,3665.2, was these are
3669.52,3674.16," rehabilitative mechanisms, these are not reintegration mechanisms, and that is why we can appropriate those mechanisms because if they already happen in the status quo then on our side"
3674.16,3679.12, the exclusivity that you're literally giving them a job opportunity that is the mechanism and way
3679.12,3684.32, back into society that is a benefit that the opposition can simply not claim. I think that
3684.32,3692.0," by through painting the status quo of ex-convicts being that much bad, and they do not have the alternatives to actually enhance it, that already lost them the debate."
3692.0,3699.0," But let's look at two flashpoints in the debate. Firstly, on ex-convicts and the perception that they have within society."
3699.0,3705.54," They wanted to bring you two big pushes. Firstly, on the trust from society, how ex-convicts being in police forces are that"
3705.54,3710.18," much harmful. We told you that firstly, it does begin, the trust does begin to change when people"
3710.18,3714.96, recognize that the status quo is simply not enough. You need better mechanisms of checks and balances
3714.96,3719.34," within the police force. On our side, you are making sure that those who have had experiences"
3719.34,3724.66," within jails who do have that impact from justice system are actually included, are actually"
3724.66,3725.5," representative. But we did give you a way off. And sure, in the beginning, they who do have that impact from justice system or actually included are actually representative."
3725.5,3727.02, But we did give you a way off.
3727.02,3729.78," And sure, in the beginning, they might not have that trust"
3729.78,3730.92," because they're not familiar,"
3730.92,3732.5, they're not aware of this condition
3732.5,3734.42, in which ex-convicts are part of a police force.
3734.42,3736.38," But in the moment that you normalize it,"
3736.38,3738.54," you allow more individuals to be part of it,"
3738.54,3740.56," you do see that they are worthy of it,"
3740.56,3743.18, that you do see that they should be trusted with that point.
3743.18,3748.46, But the second thing that they wanted to bring to you was on the resentment of those who are rejected we told you at least
3748.46,3753.68, they had an opportunity to apply for a job on side opposition you do not have those opportunities
3753.68,3758.42, specifically on a police force which many people idolize when you a police force themselves
3758.42,3764.12, recognize the ex-convicts deserve a job are valuable are dignified for having that position
3764.12,3765.76, that is a big benefit on it
3765.76,3770.56, of itself what we told you the first argument was a principled obligation of why the justice system
3770.56,3775.44, and the government have to make sure that people who have fulfilled their do how who have fulfilled
3775.44,3780.32, their depth to society are actually getting mechanisms to reintegrate we told you that
3780.32,3786.08, conflicts are better reinvented or vindicated when you break the stigma in the status quo because police
3786.08,3790.8, the police force is recognizing these individuals as valuable as someone that can contribute to
3790.8,3795.44, society that is a huge push that we have to counter stigma a huge push to take away the
3795.44,3800.64, damaging societal procedures that exist in the status quo the comparative is the alternatives
3800.64,3804.96, on their side that somehow like magically appear on their side where the status quo hoping that
3804.96,3808.52, these individuals can be included that the government is just wanting and in the
3808.52,3812.82, long term hoping for organic change on our side you are pushing and the government is actively
3812.82,3817.92, pushing for these individuals to be included and jobs that is the huge side on why you have to vote
3817.92,3821.9, on our side we are giving them the practical mechanisms not hoping that the government in
3821.9,3828.0, the future does something about it the second second small clash point was on the police system as an institution.
3828.0,3834.0," We gave you a second argument on why it was so important for the justice system to be adapted, to be open, to give you feedback,"
3834.0,3837.0, irregardless of if any ex-convict actually enters.
3837.0,3843.0," The fact that you are opening up to more individuals to apply, to actually have that feedback, is a benefit in itself."
3843.0,3849.52, It is damning that opposition does not respond to this case because if both sides recognize that the police is failing
3849.52,3855.04, the status quo is simply not enough on our side we give a mechanism of pressuring of accountability
3855.04,3860.16, making sure that the police system as itself is more evolving has more progression on our side
3860.16,3866.0, we recognize the cracks in the justice system where convicts are not exclusive or disenfranchised
3866.0,3871.2, on our side we give them the opportunity the key to well-being we are so proud to propose
