start,end,text2185.72,2186.24, I'll take a P.O.I.
2187.44,2190.9, So I think you basically engage exclusively with cases of violent crime.
2190.96,2195.46, Why should a person who commits like a drug crime when they're pretty young serves a few months and doesn't.
2196.46,2198.2," No, I gave you this example, right?"
2198.34,2205.04," If you did a drug crime, that means you were a victim of drug dealing, which means you are likely to despise drug dealers and the"
2205.04,2209.52, effects they had in your community which means you're going to be incredibly harsh on drug crime
2209.52,2214.16, okay i gave you that example so why does this hurt cohesion within the police force we think
2214.16,2218.32, cohesion is incredibly crucial in the police the police need to be able to work together to enforce
2218.32,2223.2, the law because it's an intense job where trust is crucial during an investigation when you're in a
2223.2,2229.28," high pressure situation your life will depend upon your co-workers, given that you need to be making very quick decisions."
2229.68,2233.32, Why is there likely going to be mistrust here? We think the police are likely going to have a
2233.32,2238.66, general hatred towards and prejudice towards convicts. We think the police are likely going
2238.66,2242.3," to be individual to hold a relatively high principled view of the law, and are likely"
2242.3,2249.52," to dislike those who break it. But also, we think that police are likely to associate ex-convicts with the people who put their lives"
2249.52,2254.8, in danger every single day. The final reason why these people are likely to be mistrusted within
2254.8,2259.12, the police force is that they have proven poor judgment and that therefore are likely to be
2259.12,2264.16, perceived to have associations with crime. The point here is that this takes out a lot of the
2264.16,2265.2," proposition case because a lot of the proposition case,"
2269.08,2272.72," because a lot of the proposition case suggests that these convicts might get promoted. They might do well in the system. You'll be able to convince other police officers to do well,"
2272.9,2276.16, but that's not going to happen at the point in which they're likely to be mistrusted. They're
2276.16,2280.72," likely to be ostracized. In fact, that's the reason why these convicts are likely to be even"
2280.72,2285.52," more overzealous, because they need to do an overly aggressive job in order to gain the"
2285.52,2290.96, trust of their other police co-workers in order to be perceived as someone who is not a criminal
2290.96,2295.52, and therefore wants to be someone who is harsher on client at the end of the day black lives matter
2295.52,2299.44, is not a mainstream movement the most powerful people in communities have incentives to push
2299.44,2303.6, the police to be harsh on client which means the police are likely to hire individuals who are
2303.6,2307.76, going to be harsher than ordinary police officers that's our margin we're proud to oppose
2316.0,2326.0," okay thank that speaker for their speech if other judges are ready happy to call up the GovWIP. Hello, can you hear me?"
2327.34,2327.86, Great.
2328.3,2330.32, I'll take verbal POIs.
2331.06,2335.08," I'll start in three, two, one."
2336.28,2340.64, Opposition's case and almost all of their material rely on psychological assertions
2340.64,2345.2," of possible reactions to experiences in prison, of possible reactions to experiences in the workplace, and of possible reactions to experiences in prison of possible reactions to experiences"
2345.2,2349.76, in the workplace and of possible reactions from the community what they never give you are
2349.76,2354.8, structural and analytical reasons as to why our best case scenario which we frame from the top
2354.8,2359.76, is the consistent with most forms of crime is a bad thing on our side of the house
2359.76,2364.56, when punishment is levied outside the courtroom every convict serves a life sentence two themes
2364.56,2365.48, in this speech firstly on convicts and life sentence. Two themes in this speech.
2365.64,2368.08," Firstly, on convicts, and then secondly, on policing."
2368.2,2372.02," And I want to talk about our principal first year, because it receives very, very poor"
2372.02,2372.56, engagement.
2372.94,2378.62, The first thing they say in their second speech is that you can hire criminals to other jobs.
2378.7,2380.48," So clearly, they don't have fiat to do this."
2380.5,2384.04, So they have to convince you and give you some likelihood analysis as to why convicts
2384.04,2387.9," are likely to access these jobs. They give you no such analysis, so you shouldn't count this point"
2387.9,2392.04, anyway. But let me give you some reasons why it's unlikely they hire for other jobs. The first thing
2392.04,2397.02," to note is that police is a uniquely undesirable job, right? It's hard. You're walking the beat."
2397.14,2401.16, You're risking your life. You're putting a lot on the line when you're a police officer. That's not
2401.16,2404.74," true of firefighters, and it's not true of public transport drivers, which are the examples they"
2404.74,2407.6, give. And that means that convicts have a unique advantage when applying
2407.6,2412.24," to police jobs, because they don't have to compete with average people who also want jobs. So we"
2412.24,2416.46, think it's unlikely that people are able to get jobs with the state. We think convicts are unlikely
2416.46,2420.2," to get jobs with businesses, because it just looks really, really bad for those businesses."
2420.56,2423.7," The second thing to note about these jobs, as Anushka points out, and they never deal with,"
2423.86,2429.54, is why it's better to have a convict a like public transport driver who's alone with a
2429.54,2433.56, woman on a bus at night why that same distrust and that same potential for abuse doesn't exist
2433.56,2437.22, on their side so this response doesn't make any sense the second thing they say is this is hinged
2437.22,2440.82, on practical risk and then they kind of give a third response which says you should specifically
2440.82,2444.54, improve the unfairness of the system and these are linked together because essentially what they're
2444.54,2448.56, saying here is whichever side proves a more apt solution to unfairness in the system as
2448.56,2452.88, opposed to genuine guilt is the side that wins this debate and i just want to note here that on
2452.88,2456.24, opposition it is their solution that is general because if you look at the motion they're
2456.24,2460.64, disallowing all convicts not just murderers not just rapists not just people who did assault
2460.64,2469.06," all convicts from working in the police force but it is obvious in this round that not every convict shares a same level of responsibility, and some convicts obviously"
2469.06,2472.9," have no responsibility for their crimes at all, given that some innocent people are convicted."
2473.26,2477.56," And so if you recognize that fact, you just have to consider if we would do what they are proposing"
2477.56,2481.96, to do in any other situation in life. Would we prohibit every single African American from
2481.96,2488.06, working in the police force because they are slightly more likely than other populations to be criminals. Of course we wouldn't because we're punishing
2488.06,2492.84, innocent people who did nothing wrong or did very little wrong to protect the community from a few
2492.84,2498.38," bad offenders. And so principally we think, our principle stands, right? We should weigh the right"
2498.38,2502.32," of these people to work these jobs, to not be discriminated against, not to be treated unfairly"
2502.32,2508.92, over even some minor or even slightly significant harms to social safety. So we think we prove our principle and their responses do not
2508.92,2513.3," stand there. Secondly, then, under the theme of convicts on jobs and the comparative, and I think"
2513.3,2517.42, this is another important theme. So we tell you why being a cop is a uniquely good job on our
2517.42,2520.58," side of the house. I've already dealt with why there are no comparative jobs, but I think this"
2520.58,2524.38," also deals with a lot of their constructive material on abuse, because the question they"
2524.38,2525.72," never ask in their speeches is,"
2526.26,2533.74," what are people, even in their best case, what are these overzealous people who hate the state and hate other criminals likely to do if they can't become cops?"
2533.82,2538.68," What's the comparative? Well, these people are already criminals. They're violent criminals, as characterized by opposition."
2538.92,2543.5," And it seems pretty intuitive that maybe they just keep doing crime. I mean, they don't have access to good jobs, as I framed."
2543.8,2547.42, They don't have access to prestige. They don't really have a way to make a better life. Nobody's
2547.42,2551.32, trained them out of their anger issues. Maybe they just do crimes. Why is it better that these people
2551.32,2556.3," are on the force, even if our worst case? Firstly, because they access a steady income. Secondly,"
2556.42,2560.06," because we give them a sense of purpose at the point at which we give them a steady job. Thirdly,"
2560.1,2563.4, because there's a degree of accountability and monitoring that comes with being a cop. You have
2563.4,2568.5," a partner, you have supervisors watching over you. And fourthly, because we give you psychiatric and"
2568.5,2572.86, de-escalation training that can help manage anger issues that often plague violent criminals. And so
2572.86,2576.9," we think on our side of the house, even in their very best case, where they do get these violent"
2576.9,2580.42," offenders on the force and they aren't screened out, we prove a better comparative because we'd"
2580.42,2584.5, rather these people be under watch than be out on the street. I'll take a PY before I move on.
2585.26,2588.56," Given this is a policy motion, we can have the FIAT introduce an alternative"
2588.56,2591.92," and hire these people in other public services, utilities, etc."
2592.3,2595.34," Yeah, we can have FIAT if we say it in first, not in third op."
2595.4,2595.98, What is this?
2596.24,2597.74, Second theme then on policing.
2598.18,2599.48," Firstly, on policing reform."
2599.64,2603.68, We give you a lot of structural mechanisms that are pretty poorly engaged with on their side.
2603.84,2608.9, They essentially give you a bunch of psychological counter-assertions. So the first and key mechanism in their case is
2608.9,2612.74, that people who are criminals are overzealous against other criminals because they go to prison
2612.74,2616.56, and they get hurt. So the first thing we note down bench is this applies in a select number
2616.56,2620.6," of circumstances, namely when A, these people have actually been victimized by other criminals,"
2620.72,2628.6," which is by no means the case in every situation. Secondly, when they value that victimization more highly than their victimization by the state that imprisoned them. And thirdly,"
2628.64,2633.24, when the specific way that victimization plays out in the real world is like this weird act of
2633.24,2637.82, taking revenge on other criminals in some sort of punisher fantasy. We think this is incredibly
2637.82,2641.8," unlikely to affect the majority of cases, and the analysis we give you is much structurally"
2641.8,2648.7," more reasonable. What is our analysis? Very simple. If you are a criminal, you understand what drives people to crime. If you understand what drives"
2648.7,2652.12," people to crime, you naturally understand other criminals. And when you have understanding for"
2652.12,2656.02," someone, you're more sympathetic towards them inherently. This is a simple mechanism that"
2656.02,2660.42," applies in all cases in the majority of crimes of acquisition of non-aligned offenders, of drug"
2660.42,2664.28," offenders, of innocent people. Most people who commit crimes, this logic applies to. We think"
2664.28,2668.16, we outweigh them on that point. And we think we do access our benefits of better policing here right
2668.16,2672.08, we say these people have more empathy for other criminals they encounter on the street it's harder
2672.08,2675.92, for an us versus them mentality to form when you have somebody who has been on both sides of the
2675.92,2680.56, aisle in the convict world and the police world a lot of bad police encounters in fact the worst
2680.56,2684.88, police encounters where things escalate are caused by this us versus them mentality that's not
2684.88,2687.16, something they ever sufficiently respond to on their side.
2687.34,2692.64," Now, they do say that for some reason, no POC or empathetic people will ever be hired by the police force."
2692.78,2693.92, And I just think this is ridiculous.
2694.26,2700.84," The first thing to note is they make this assumption throughout their case that like you come to a job interview and you're like, I want to structurally reform the police force."
2700.94,2702.74, I don't think that's an interview question that's ever asked.
2702.74,2707.98, I think it's probably you hire people generally based on skills and maybe some reformers get on the police force
2707.98,2714.1, and that's fine the second thing they say is that in the cases where criminals did crimes they're
2714.1,2718.3, just always likely to be worse police officers than the status quo we think that's just untrue
2718.3,2722.8, right even though they say they try to frame that like small offenders still committed crimes that
2722.8,2727.4, I think they're above the law we think there are a lot of other compelling reasons to make crimes. You're economically desperate.
2727.6,2731.3, You made a mistake. Maybe you legitimately changed as a person. All of these things
2731.3,2735.74, structurally factor in why they're not likely to be worse than the average person responding
2735.74,2739.76, to situations. And then we give you additional characterization on why they understand criminals
2739.76,2744.46," better and perception improves. And let's talk about perception briefly then. Well, what do we"
2744.46,2748.56," say in our perception argument? It's specific and clear. The community that you are a part of,"
2748.6,2753.3," the high crime community, sees you as a police officer rather than Derek Chauvin. You are more"
2753.3,2757.26, representative and you have personal contact and relationships with criminals rather than being
2757.26,2761.34, this sort of outside force that's imposed on a community. And so we think the actual community
2761.34,2767.7," you are policing is more likely to trust you. So even if they prove some of their perception stuff, which is kind of silly, they don't"
2767.7,2771.68, prove a tipping point because cops only operate in the community that they're actually in.
2771.74,2774.16, So only trust of the cops within a community matters.
2774.46,2776.22," Arguments specific, theirs is very general."
2776.42,2778.18, Why does their perception argument not stand though?
2778.32,2780.98, I don't think it's a tipping point for most people for calling the cops.
2780.98,2784.6," If you think the cops have like some criminals, you're probably more scared of the crime."
2784.84,2787.56, The difference on our side is years and years of police abuse which needs
2787.56,2792.8, to be overcome not this new policy that just came out yesterday we think finally i've been engaging
2792.8,2796.62, with their best case throughout the whole speech we give you very convincing reasons and stance
2796.62,2800.98, why bad people can't join the force to begin with you have to take psyche vows you have to do live
2800.98,2804.66, fire training that tests your reaction and your discrimination you have to have background checks
2804.66,2805.68, you have a probationary period.
2805.76,2806.38, You have a partner.
2806.7,2808.08, You take low risk jobs initially.
2808.32,2812.36, There's checks at every single step of the way to prevent bad people from accessing these
2812.36,2812.66, systems.
2812.92,2816.44, And so we think even though we win on the best characterization and the best case that
2816.44,2820.44," op gives us something they never do the charity of engaging with on their side, we actually"
2820.44,2823.8, prove a big likelihood why these criminals never joined the force to begin with.
2823.88,2826.18," And in that situation, we clearly win this round."
2826.18,2828.8," So for those reasons, please, please vote prop."
2835.82,2838.22, I think that speaker heard their speech.
2839.42,2840.82, The other judges are ready.
2842.72,2862.68, I'm happy to call the opposition whip. You're here.
2864.04,2867.0," Hi, am I audible and visible?"
2867.0,2870.0," Perfect, thank you."
2870.0,2893.28," I'll take your eyes verbally please. When the police are interviewing candidates to join the force, they're not going to employ"
2893.28,2897.86, the black man who earnestly explains how his own poor upbringing led him to be forced into
2897.86,2901.82, crime and how the police force needs to be reformed if we're going to have better practical
2901.82,2907.0," outcomes for everyone. They want to know that when they're in a firefight with a drug dealer,"
2907.0,2910.0, they want to know you're going to not hesitate to pull the trigger.
2910.0,2915.0, You're going to be tough on crime because those criminals are evil and have shot at their friends.
2915.0,2919.0, That's what this debate was about. And Canada refused to engage with that.
2919.0,2922.0," Three points of passion in this speech, firstly on rehabilitation of convicts,"
2922.0,2928.7," secondly, on who gets better policing and finally on trust in the police. First of all, on the rehabilitation of conflicts. And I'm"
2928.7,2932.44," starting with this because I think it is the least important clash in this debate, and it's very quick"
2932.44,2937.18, to resolve through our side. The main problem with Canada's analysis here is that we are never given
2937.18,2942.06, a reason why the only way we can rehabilitate these people is by letting them join the police.
2942.3,2947.72," The first thing they say is that this is a solid economic opportunity for people who are low-level criminals or people of colour,"
2947.92,2949.98, and we'd rather them have this job than re-affect.
2950.32,2953.82," I'm not sure why this is the only job that they are able to do,"
2953.88,2955.96, which gives them money in order to improve their life.
2956.34,2958.44, What's their response to this claim? Because we raised it earlier.
2958.7,2961.58," They say, well, you can't get any other jobs because everyone hates convicts,"
2961.62,2963.1, everyone's scared of them and they're untrusted.
2963.66,2968.24," Hang on, panel, I want to point out here this contradicts with their later analysis when they say that"
2968.24,2972.32, they're going to massively improve trust in police because somehow everyone loves convicts and feels
2972.32,2976.32," safe when they're patrolling the streets. But secondly, we think in the same way that prop has"
2976.32,2981.2," to be up to allow these people to apply for police jobs, we can let them apply for other public"
2981.2,2986.56," service jobs. We pointed this out at the beginning of Maya's speech as the first point in our stance,"
2986.68,2988.42," and we pointed out again in APOI,"
2988.48,2989.46, at which point they concede
2989.46,2992.24, that this does indeed take out their analysis here.
2992.52,2994.48," And all they can say is that we didn't mention this in first,"
2994.62,2996.26, so we can't be at it in third.
2996.48,2999.2," Now, either Canada were not listening to Maya's speech panel,"
2999.2,3001.26, or they are trying to mislead you.
3001.46,3003.56, Either of those is not enough to win them this debate.
3003.92,3007.9," Secondly, they tried to tie this into a principle. They say that they've served their sentence and they've paid"
3007.9,3011.7," for their sins, and therefore we can't continue to restrict them. We just don't think this is"
3011.7,3016.64," empirically true. We think we regularly convict, we continue to have restrictions on convicts"
3016.64,3020.1, throughout their lives. This is why we have criminal records. This is why we don't let sex
3020.1,3024.56, offenders work in schools. And they accept that obviously we should restrict some convicts to
3024.56,3029.28, some extent. They just say we need to prove a high amount of harm in order to restrict them. Recognised that
3029.28,3033.6, in saying that they can see that this principle is entirely practically contingent so I'm not sure
3033.6,3038.32, why then in the next sentence they say that they're able to win independently on it. But we think that
3038.32,3043.2," this does have a massive amount of practical harm. We think giving them a gun, letting them represent"
3043.2,3048.92," the government, putting them in a position where there is massive trust placed in them is obviously a massive risk which"
3048.92,3052.42, we are not willing to take. And we don't think it matters if they were forced into this crime
3052.42,3056.86," out of necessity, because many people are in poverty and they do not turn to crime. And no,"
3056.92,3061.54," panel, that their final genuinely quite insulting response to this is to say that this is morally"
3061.54,3068.96, equivalent to banning Black people from the police force. We don't ban black people from the police force because that is racism. We ban convicts because
3068.96,3073.76," they present more risks to the force, which is obviously not morally equivalent. We can then"
3073.76,3077.44," we clearly take out their principle and show where their analysis doesn't stand, but let's talk about"
3077.44,3081.84," who gets better for policing because this is the most substantial clash of the debate. Firstly,"
3081.84,3085.78, they talk about reforming the force. They say that these people understand the reality of life
3085.78,3086.86, and they're going to be sympathetic.
3086.86,3087.98, They're going to be less harsh.
3087.98,3090.82, And this leads to structural reform in the police.
3090.82,3094.82," Their first response is that we told you that instead,"
3094.82,3096.3, the people who are likely to get these jobs
3096.3,3097.88," are going to be the ones who are overzealous,"
3097.88,3099.12," who appear tough on crime,"
3099.12,3101.74, who have the same attitudes as the police officers
3101.74,3102.64, in their interview.
3102.64,3103.92," Their first response is to say,"
3103.92,3105.64, not all convicts are those overzealous people.
3105.84,3109.8, That's crazy psychoanalysis from Team England.
3110.0,3111.8," Let me be abundantly clear here,"
3112.0,3114.44," panel, because every one of us has responded to this."
3114.64,3117.72, And I can only assume that Canada are willfully misunderstanding.
3117.92,3120.96, It may be true that many ex-convicts are not overzealous.
3121.16,3124.32, It may even be true that most ex-convicts are not overzealous.
3124.36,3129.48, Take a second to note this down. Our burden was to show that the ones who apply to join the police and
3129.48,3133.5, the ones who are accepted by the police are going to be the ones who are overzealous. And know that
3133.5,3137.48, this doesn't mean they're violent criminals. It means that they've been exposed to violent crime.
3137.56,3141.32, It means that they hate the violent criminals that they met while in prison. And the reason why they
3141.32,3147.72, want to join the police force is to do something about it. They say in response that police forces don't have the incentive to employ someone who appears
3147.72,3152.16, harsh on crime. Three responses here. I want you to take a second to think how counterintuitive
3152.16,3157.36, this claim is. The role of the police is to clamp down on crime. Obviously they want to employ
3157.36,3161.92, someone who will clamp down on crime. We think this very much is a question that is asked in
3161.92,3169.92," your interview because it directly relates to how good you are at your job. Secondly, know that simply asserting that Black Lives Matter happened doesn't mean now"
3169.92,3174.34," that the police are trying to employ someone who, in Canada's own words, are soft on crime."
3174.6,3179.04," We think the police force is dominated by people who have spent their entire lives fighting crime,"
3179.04,3183.84," who have been shot at by criminals, who believe that criminals are evil people who cannot be"
3183.84,3185.2, allowed to continue offending.
3185.5,3189.74," This is the prevalent culture within the police force, not that Black Lives Matter and that the"
3189.74,3194.2, police needs to report and recognise that that is the exact structural reason that police brutality
3194.2,3199.58," is a problem in the first place. But I want you to recognise, panel, that even if the incentives"
3199.58,3204.18," to cut down on police brutality do exist among police officers, they probably prioritise their"
3204.18,3205.68, own safety over the
3205.68,3209.76," idea of improving the force. Because even if they believe that racism is bad, they are much more"
3209.76,3214.16," worried about employing someone who may be soft on crime, or who may not pull the trigger when you're"
