start,end,text
0.0,11.44," I would like my POIs to be strictly in the chat. Just give me a few seconds. Also, I am audible and visible, right?"
13.06,30.32, Yeah. So if you have any kind of gender pronoun preferences and you want two one in the late 40s 1984 was released
30.32,35.36, 30 years down the line people were desensitized to a point that there wasn't sufficient hope to
35.36,40.64, say that a better government than the thatcher government could exist a bit of characterization
40.64,50.58, the knowledge of my arguments first political fiction describes a vision of the world and how it is governed. It gives a what is the direct message here is that it gives what the
50.58,55.26, nature of law is and the nature in which these laws are going to be reinforced. There's also
55.26,61.1," usually some subtext as to what's going on right now in the world. When the 1984 was released,"
61.26,65.88, it was released in anticipation of the tyrannical direction Western democracies
65.88,71.02," were leading to. What does optimism look like? It looks like protagonists being the winner,"
71.38,76.48, moral victory being with the protagonist and justice prevailing. We think that pop culture
76.48,81.9, has a major influence in terms of outcome and understanding our place in the world. To win
81.9,85.84," this debate, we need to show that positive politic political fiction"
85.84,92.16, is better in terms of the consumption the positive political fiction doesn't mean that your movie is
92.16,98.32, entirely cherry on the top but it means that your usual arc of world building resolution
98.32,103.68, is still existing but you still see like stuff like uh sexual violence and stuff like that it
103.68,105.36, just means that the conclusion of the
105.36,112.24, movie is positive or it's hopeful realize that there is like enough anger and pessimism in this
112.24,118.0, status quo to drive you to a social movement it's the lived reality of the people stories of friends
118.0,123.52, and all of this means that movies do not really make a significant impact in terms of anger and
124.08,126.24, pessimism two Two arguments then.
126.24,131.04, Firstly on why the influence of positive political fiction is better in terms of outcomes for
131.04,136.64, consumers and secondly on why the narrative set for entire community of the people is likely to
136.64,142.56, be better on our side of the house. A. First argument. Generally you make a movie in the
142.56,145.52, anticipation of result. the message on either
145.52,151.36, side is to drive people towards success this is only created when there is positive message
151.36,157.68, revolving around the movie it influences the transitional transitional justice but b we create
157.68,162.8, an environment of optimism and we think that's really better the premise here is that optimism
162.8,167.4, is something that's good in terms of people who are fighting for change in the status quo.
167.4,173.28, The mechanism here is that you always see yourself as the protagonist when you're the consumer of their media.
173.76,177.66, Protagonists are the real people which you reflect yourself to.
177.9,185.92," That's how movie and stories are written, because you want to show some form of relatability between the consumers and the protagonists and the"
185.92,192.24," characters of the movie. When the protagonist of that movie or political fiction achieves success,"
192.24,197.84, you feel as though it's a victory for yourself when you consume the media. It motivates you in
197.84,206.32, terms of saying that there is a better outcome and a real hope. This hope is accessible in terms of relative characters being able to get
206.32,212.08, this success being able to get this win the comparison here is that they lose the sense of
212.08,217.36, hope and trust in the justice system in their side of the house why is this important then
218.08,226.08, a the current in the current political climate when you are an activist you're likely to face activism burnout this means that
226.08,232.08, people who are stopping to get leisure time on social movement because you're burnt out people
232.08,238.72, are generally less involved in social movement because of the pessimistic narrative that exists
238.72,246.86, around social movement and how the success from social movement cannot be derived. This pessimistic narrative exists too much
246.86,248.26, in the status quo.
248.26,250.56, That's why you're likely as an activist
250.56,252.6, to face that activism burnout.
252.6,255.56," But secondly, the media's portrays,"
255.56,259.38, since it sensationalizes people who lose hope.
259.38,261.2, This looks like media portraying the death
261.2,266.16, of an environmentalist in a social movement.
266.16,273.52, This also looks like media portraying the loss of the... media portraying the failure of a movement
273.52,278.0, or media portraying the problems within the movement in the status quo.
278.0,282.48," But then see, the current narrative in the society is that everything is nihilistic"
282.48,285.28, because there's also a large movement in younger
285.28,290.88, generation that they glamorize things like nihilism and complain but don't go out and actively
290.88,296.16, involved in movements because they don't have hope they feel like they can't make a change and these
296.16,301.84, people these nihilistic younger generation people when they read these sort of political fiction
301.84,306.4, they're more more likely to get pessimistic after reading that content why
306.4,312.16, do we change this in our side of the house a in our side you get the euphoria of hope which means
312.16,317.76, that you're willing to act in the movement you're willing to commit to rallies in the heat of
317.76,323.36, optimism that you get after reading that political fiction or after watching that political fiction
323.36,335.0," but then b there's a general dilution of the nih of the nihilist people or the nihilism in general, because these political fiction shows that there's a solvency of the issues."
335.0,346.88," There's a greater success in the social media, social movement. And all of this means that the nihilism that these younger generation have is greatly reduced but then see"
346.88,353.04, you have a sense of escapism when you're burnt out you see these books you see these movies and you
353.04,359.92, know that oh there are some like there are some instances where justice is prevailing that justice
359.92,365.28, can prevail you get more hope and even if you read this like you have to read this like when
365.28,371.68, your psyche of not having a solvency gets reinstated even more that that happens in
371.68,377.44, their side of the house where all these consume and all they see are pessimistic content but
378.0,385.1, and but um d we solve this because there's a definite sense of achievement with protagonists getting more
385.1,391.38, success in our side of the house. Why this hope and the general psyche of the people
391.38,396.86, being motivated even better and important in our side of the house? Because you get
396.86,401.32, more motivation to continue your effort even though your efforts are futile because this
401.32,405.52, fiction gives you more hope that justice is reliable it validates
405.52,411.52, your effort in so far as you achieve a success and even if the system is unjust they're still
411.52,417.04, like going to continue their fight for their right in the hopes of getting some form of
417.04,430.96, success in the hopes of changing their lives I think of UI activism often takes generations if hope is tied to tangible outcomes time and time again
430.96,436.56, after failure why is hope likely going to prevail in all instances because like when you're
436.56,442.96, surrounded only by pessimistic narratives you're less likely to even um go into activism you're
442.96,466.16, less likely to um fight for the justice or you're less likely to fight for your own that movement but secondly the narrative set for
466.16,471.44, entire communities of people is likely to be on better in our society house because unlike the
471.44,476.48, first argument the broad implication of movies having political implication is that they affect
476.48,482.32, entire community of the people this looks like that panther being influential and gongu by
482.32,488.76, influencing the feminist movement if we can show that positive political fiction on net betters the binding
488.96,493.36," of the community, then we're still better off than side opposition."
493.56,497.4," A, notice that the side of common enemy is not lost in either side."
497.6,501.56," Even in our side, the media still portrays the struggle against system."
501.76,504.36, It still portrays the struggle against the villains.
504.56,505.44, We're also likely
505.44,510.32, to have more emotionally charged narratives that in terms of these antagonists this looks like
510.32,516.16, man being out to get you the big brother setting a tyrannical government the only
516.16,554.72," difference is who wins this we are likely to win this very proud to propose of course Okay, if all judges are ready, we'll be moving on."
562.2,563.38," Hi, can I be heard?"
564.52,567.5," Yeah, thank you so much. Just a moment. Thank you so much."
570.2,581.1," Mai, ready to move on? Thank you so much. Okay, we thank a verifying speech by Prime Minister. Now let's moving on to leader of opposition to open up opposition's case. Hear, hear."
582.02,582.32, All right.
582.72,584.94, POI preferences. Thank you so much.
586.6,592.3," Yeah, I use sheer pronouns and I'll take my POIs verbally please thank you okay starting my speech in three"
592.3,599.32, two one the state is society's singularly most powerful actor in having apparatuses with the
599.32,605.38, capacity to shape entire populations on opposition we believe it is impossible to be too careful when we hold the
605.38,610.04," liberty of millions in our hands, and it's only on opposition do we represent what the state could"
610.04,615.84," become. Our stance is two things. One, we prefer the majority of negative and pessimistic representations,"
616.18,620.96," which looks like two main things. A, the context is usually very overwhelming odds of usually"
620.96,625.16, dystopian governments and an overreach of state power and B these main
625.16,629.48, characters usually fail in their endeavor to overcome the political obstacles or they are back
629.48,634.82, to square one secondly a positive representation means there's an overwhelmingly good governmental
634.82,639.62, system and proposition then cannot support presentations of predominantly bad political
639.62,644.18, actions i.e as first proposition asserts that there will be representation of sexual violence
644.18,648.96, or other harmful actions because the overall message will definitely still be the positivity.
649.48,669.12," If it is so visceral on proposition, so viscerally abusive, then people will still remember only the most horrible actions, and they won't be able to take a message of hope out of that film. crucially misses a huge part of what political fiction actually looks like because part of political fiction i.e west wing which existed in the info slide humanizes governments as ones"
669.12,673.12, they are trying their best and when they fail it's not because they're malevolent or they're
673.12,676.48, oppressive but it's just because they cannot do their best and we think that is inherently
676.48,680.92, oppressive and harmful to the most vulnerable but before i talk about two arguments from opposition
680.92,688.66," let's deal with the case from proposition in three three ways. Number one, on their mechanism. They try to say in their mechanism that there's enough anger and status"
688.66,693.3," quo so films and media don't make that big of an impact. Three things to say here. Number one,"
693.36,696.92, this is a contradiction because their first argument tells you that the films are going to
696.92,701.98, be so influential that activist burnout is going to happen on a mass scale and they are going to
701.98,708.76, give up on their literal livelihoods. I think we have to characterize what activists are because activists fight for their lives. Proposition is telling us
708.76,713.46, that movies are so uninfluential and yet somehow so powerful that activists choose to give up on
713.46,717.38, their livelihoods just because they watch a movie. We think that's a contradiction that cannot stand.
717.62,721.06," But secondly, when they tell you in your first argument that you relate to the protagonist,"
721.24,728.96, that is exactly why they are influential and why you will be able to take crucial messaging from it. Why is this contradiction crucial? Because we think that is
728.96,734.12," the concession that these films innately encourage anger, and we think that anger and that urgency"
734.12,738.38, exclusively exists under our staff to help. We're going to prove in arguments why this is important
738.38,742.8," when it comes to holding the state accountable. On their first argument then, about how this creates"
742.8,748.1," better outcomes for consumers. That's what they tell you, but I think they don't actually benefit society as a whole. They're only"
748.1,751.98," talking about very specific social movements that don't actually, like they don't even prove the"
751.98,756.8, outcomes in those instances. The only impact they give to you under this argument is activists burn
756.8,761.16," out, people then lose sense of hope and trust in the justice system. Three things to say here."
761.38,768.7," Number one, I think we need to criticize the framework of justice to begin with, and it is not enough to believe in the justice system and think that everything will end up well."
768.94,775.32," The problem with status quo is that it is imperfect, and that it's on the trend towards negativity, and we need to represent that in political fiction."
775.64,789.5," But secondly, I think the loss of hope in these films is directly like these films are set in the future right so crucially political fiction doesn't display the hopelessness of the present they display a hopelessness of the future"
789.5,795.44, where society has like degraded so terribly that there is no more way out opposition crucially
795.44,799.54, says that we are at a turning point and this is where you must act now that is the importance of
799.54,803.92, political fiction incentivizing people to be hopeful for today but thirdly i think hope is
803.92,809.6," not the underpinning of social movements it It's about survival, which means that is their foremost incentive. But also,"
809.66,814.02, we think hope is very fragile. Hope is contingent on positive outcomes to continually refresh that
814.02,818.78," hope, because hope cannot last forever. Insofar as proposition concedes that social movements and"
818.78,822.96," social change takes a very long time, their hope is unsustainable, and they don't actually benefit"
822.96,829.68," individuals. Before I go on to my arguments, i will gladly take that point on both sides there are enough sources of anger"
829.68,834.72, such as news media and things as such on our side we have some balance in terms of bringing about
834.72,839.36, hope on your side that is lost why is this not a good thing on our side right i think it's also
839.36,843.36, unclear why hope is not mutually exclusive like there is things like past precedence or like
843.36,848.0, future like or like thoughts about the future that still make you hopeful but that actually takes me nicely into
848.0,852.96, my first argument about uniquely political fiction empowers all of these skepticisms the first
852.96,856.8, argument then about how we empower the skepticism of the state that is crucial to a healthy
856.8,860.56, government three parts number one i think pessimistic political fiction is the most
860.56,871.0," effective political caricature which hyperbolize the obvious deepest evil of our governmental structures, illustrating the possibility of corrupting the very morality of the structures of our state."
871.0,877.0," This is crucial to impacting negativity, because this opens up a worldview of the ugliest possibilities of humanity."
877.0,889.58," Why is this unique? Two things, because the unique nature of political fiction, absent of all other political advocacy, is that it's not only apolitical, so it is not bipartisan, but also because it's especially crucial for the most disengaged political actors"
889.58,894.14," who usually take for granted their human rights, that the state is going to always respect my"
894.14,899.22, humanity. And this is crucial because we break the bubble of privilege by depicting a relatable
899.22,903.82," protagonist compared with visceral outcomes, and we show you that your life isn't always going to"
903.82,909.04," be perfect, and this is why you must take action now status quo we have voter tampering in literal western"
909.04,913.68, liberal democracies where people engaging with messing up the supreme court in poland for example
913.68,918.72, there is very little and despite all of these harmful status quo action there's very little
918.72,923.68, actor to there's very little action made to strengthen democratic structures clearly even
923.68,929.18, though you can see the action there's a disconnect but you don't see what could possibly happen given that this is only the
929.18,934.1, first step in many of state oppression political fiction world views the process to devolving into
934.1,940.16, a system of pessimism i.e 1984 was perfectly fine prior to the book's beginning but it warned of
940.16,943.94, the importance of post-war nationalism it told you that if you believe too much in government
943.94,948.4, structures and the media that is where you devolve into a system where you no longer are able to have
948.4,953.44, autonomy. We crucially remind people of the autonomy in the turning point only on opposition.
953.44,957.36," Secondly, we think we give individuals the hindsight to be able to recognize early warning"
957.36,961.84," signs of oppression and backsliding. Why doesn't this happen on opposition? Two reasons. Number one,"
961.84,967.84, because of optimism bias. We think you are living your current life now and you can see the mature quality of life that you're living is good
967.84,971.68, therefore you think this will not happen to you or that this will only happen in the most extreme
971.68,976.0, instances not realizing that this is the first step of many to lead to the extreme instances
976.0,980.08, but secondly there's a difficulty in conceptualizing what the repercussions of certain
980.08,984.56, actions entail i.e a government can oppress you but the visceral depictions of your rights
984.56,988.46, literally being stripped from you you're not being able to walk to and from work without
988.46,991.82, being afraid that somebody is watching you and tracking your thoughts that is what we're able
991.82,995.96, to push under our side of the house lastly then this creates the important necessary sense of
995.96,1000.34, urgency for mobilization for two reasons one because we're telling you this is a point of
1000.34,1005.36, no return in positivity you say that this harmful state system is only a bypass. You pass
1005.36,1009.0, this phase and you're going to lead to freedom again because freedom is the end goal that
1009.0,1013.46, prop would like you to take away. We tell you this is the only chance for you to mobilize. You cannot
1013.46,1018.02," act again, so you must be urgent now. But secondly, we improve the sense of self-preservation because"
1018.02,1022.22, these are the only ways that we're able to empower the urgency. This empowers political literacy and
1022.22,1029.14," we are better able to criticize the state. The second argument about how we produce a society that forgives state failures on proposition, we think"
1029.14,1033.0," we're going to engage with a range of representation of what positive political fiction looks like,"
1033.2,1037.34, and DPM must come up and tell us why this happens on their side as well. They can't just defend
1037.34,1042.7," Fahrenheit 451. Two options here. Number one, you're very positive in your outlook of governmental"
1042.7,1048.0," structures, like we told you in setup, like West Wing. This is inherently bad because it relies on the benevolence of"
1048.0,1051.36," government in three ways. Number one, we think they have perverse political incentives, so they're"
1051.36,1055.88," not going to be nice to you. Secondly, they're industrial lobbies that inherently self-incentivize."
1056.1,1059.84," But lastly, we think the state has too much power, and therefore, you must err on the side of"
1059.84,1064.78," caution. They can mobilize the military and media, but proposition gives imperfect government systems"
1064.78,1067.6," too much credit, that the government members are trying their best."
1067.6,1068.6, They're just human.
1068.6,1071.14, Then not everybody can benefit under a democracy.
1071.14,1075.16, All of it as an excuse for marginalizing individuals that doesn't happen under our side.
1075.16,1078.8," But secondly, if you're talking about the context first prop gave you, i.e. bad structures"
1078.8,1081.76," where you can overcome them, we still think that it's inherently harmful."
1081.76,1084.44, The state will always be slated against you.
1084.44,1169.96," If you're a minority, you will always be oppressed. Only opposition presents the reality of the world. you you Thank you. Should I start now?"
1171.32,1172.56," Oh yeah, sorry."
1172.86,1173.58, Thank you so much.
1173.58,1177.14, I was waiting for Maya because I can see Martin is ready
1177.14,1179.52, and Jacob is ready to move on as well.
1180.36,1180.64, Okay.
1181.72,1182.5, Thank you so much.
1182.96,1184.76, We thank Elo for a very fine speech.
1184.9,1186.28, Now let's move on to DPM.
1186.64,1191.8, Your chat preferences as well? Thank you.
1194.44,1234.56," Maybe your preferences in your chat, just to clear it out, just give me a few seconds. Thank you. Is there a reason why?"
1235.28,1240.3, I think our internet died out for a quick second.
1241.2,1242.26, Did the speaker already start?
1242.5,1243.6, We're so sorry if they did.
1244.48,1248.0," No, I think the recording has already resumed."
1248.0,1252.0, Yeah.
1252.0,1256.0," Um,"
1256.0,1260.0," starting in three, two,"
1260.0,1264.0, one. We live in a world where nihilism
1264.0,1267.0, is something that's a popular rhetoric to a massive extent.
1267.0,1272.0," Side opposition literally forgets or probably does not strategically engage with this point,"
1272.0,1280.0, specifically when this is one of the major things that people normally use in society because of the pop culture we are facing a lot.
1280.0,1286.4, We don't see why hopelessness is something that they're constantly trying to disagree with.
1286.58,1288.3, I'll be doing three things in my speech.
1288.64,1292.52," Firstly, I'll be providing a direct response to what they said in their speech."
1292.72,1296.26," Secondly, I'll be talking about hope and the solidarity in general."
1296.66,1301.4," Thirdly, I'll be providing an extension on how political incentives change, why that's important."
1302.02,1306.02," So firstly, on direct responses. So firstly they talk about this"
1306.02,1313.04," visceral, they talk about how our world is not like me specifically when the end goal is something"
1313.04,1317.52, that's like painting a good picture of the world. We think that's not true
1317.52,1323.2," specifically in instances where you know the visceral, the you know victory that comes after"
1323.2,1326.56, the visceralness is something that's largely portrayed. This is to say
1326.56,1333.68," that even in the David and Goliath example, the monsterness of Goliath is something that people"
1333.68,1340.16," generally remember, even when David won at the end of the day. We think that the villains are"
1341.36,1346.16, likely going to even be noticed even in instances when they're not true.
1346.16,1351.52," But secondly, under the idea of anger and the entire point of urgency and things like"
1351.52,1356.12," such, we tell you why this anger is going to be largely symmetric on both sides, specifically"
1356.12,1361.1," because of the large overarching narrative in society, which includes such as A, news"
1361.1,1370.0," media, second experience of people, but thirdly, they're also activists who are actively incentivized to actually work for things like, you know, movements or probably"
1370.0,1374.96," urgent issues that are the problems in the modern day society. If any problems exist in society,"
1375.22,1379.08, they're necessarily going to be talked about. We don't see how it's not going to be talked about
1379.08,1386.24," at all in their world. But even when, even when in these instances these instances are awesome let's see what the distinction really"
1386.24,1392.08, lies right the distinction lies in the point of optimism specifically filled in a world that is
1392.08,1396.96, inherently nihilistic when people are a believing that the world is hopeless and things as such we
