start,end,text3278.54,3284.8, comes 30 years later. We win this debate on FDI. Umar spends only 40 seconds actually responding
3284.8,3285.2, to this.
3285.46,3289.88, They assert that wealth is equitably distributed and that's why the West contributes.
3290.16,3293.88," We tell you that even if it is, there are two reasons the West does not contribute."
3294.18,3305.0," One, that businesses are scared of going to a socialist place simply because they've heard from their white or like white contacts within these nations that land is being seized, land is being distributed,"
3309.74,3314.68," and that property is volatile. And secondly, because of things like McCarthyism, because of the fact that you're unlikely to actually want to like go to a socialist state, because the backlash"
3314.68,3320.8," you face from your own people as the torchbearers of democracy, as the first people to engage in"
3320.8,3326.46," capitalism, you do not get FDI from the West. They give us an even if and say China BRI."
3326.96,3332.76," Obviously, that's not in the scope of any debate, even closely dissembling anything before 2012."
3332.76,3340.72," We tell you then that not only do they miss out on Western funding that we exclusively get, and this is an independent path and I'll prove that later."
3341.02,3346.66," They also have a harmful actor in the form of the USSR, because the USSR steps in"
3346.66,3351.8," where the West doesn't. And we tell you these have insane harms, because the USSR is unstable."
3351.8,3357.5," They lost the Cold War. We tell you that the USSR has a tendency to become dictatorial,"
3357.68,3362.08," become autocratic. This is even worse for their economic and land redistribution,"
3362.38,3366.24," because you're giving it to an autocracy. Now, why does this win us to this bit?"
3366.24,3369.18," Because you can distribute land even to its best,"
3369.18,3371.56," 120% on their side of the house,"
3371.56,3374.12, but the land is still inherently unproductive
3374.12,3375.94, because of the fact that the country
3375.94,3378.16," has been plundered by colonizers,"
3378.16,3380.5," because of the fact that there are no industries in place,"
3380.5,3382.8, because the British took everything.
3382.8,3384.64," Even in the most equitable manner,"
3384.64,3385.6," the West is still much better on our side of the house, because the West is the. Even in the most equitable manner, the West is still"
3385.6,3390.18, much better on our side of the house because the West is the richest actor in the world. The West
3390.18,3394.58," gets Africa into the Commonwealth. Literally, because it's more money, we still win this debate."
3394.82,3399.24," I find it quite funny that their speaker says, well, why would you want to take money from Britain"
3399.24,3404.18, after everything they did to you? Because they did everything to me and now I get to feast on
3404.18,3409.56, their money. Simple response. We get equitable land redistribution. This is a second independent
3409.56,3414.18, path to victory that we don't need but we get anyway. But this isn't important because they
3414.18,3419.5, don't get equitable distribution. We tell you on our side that you have bad on their side you have
3419.5,3423.98, bad actors just like you have on ours. You have people that are elite. You have people with
3423.98,3429.6, political affiliations. People that are power hungry. We tell you liberation leaders are unnecessarily
3429.6,3435.3, glorified because of the fact that they made certain sacrifices that other people did. But
3435.3,3438.96, we don't think that the selfless individuals people make them out to be. We do think that
3438.96,3450.48," they do have political affiliations. Their response to this is that it's symmetric, but panels that cannot be enough, because if we rely on flourishing democracy, they rely on equitable distribution."
3450.98,3455.74, They cannot simply say that we don't get equitable distribution either. But here's why it's not
3455.74,3461.1," symmetric, because on our side, as democracy progresses, as democracy grows, and you eventually"
3461.1,3466.0," have equitable land redistribution, you're able to counteract corrupt forces."
3466.3,3468.58, You're able to counteract the power hungry.
3468.92,3472.3, You're able to mitigate conflict with peace negotiation.
3472.6,3474.54, You're able to do so with protests.
3474.84,3475.68," On their side of the house,"
3475.88,3478.2, let's assume the government does everything right.
3478.42,3481.5, It is still likely then that a powerful tribe
3481.5,3484.06," feasts on a minority, seizes their land,"
3484.18,3486.32, and then the minority has nothing they
3486.32,3490.56, can do because they do not have democratic frameworks that help them protest that help
3490.56,3496.48, them form general assembly as our first speaker said so proud to have won this debate do give it
3496.48,3505.0, to us i thank opera fly and invite shop reply.
3505.0,3510.0," Yeah, I assume I'm audible."
3510.0,3517.0," Okay, good."
3517.0,3526.24, Starting in 321. one. The same way I think it's a shame I have to spend four minutes walking through Team UAE
3526.24,3530.92," with your hand held in order to understand the proposition case, I think that truly is a shame"
3530.92,3536.14, as well. Because the reason why opposition needs to lose this debate is because they could not
3536.14,3542.44, continuously argue for equity because they argued a democracy and they had to accept any and all
3542.44,3545.14, outcomes that individuals voted for and how the political system
3545.14,3549.9, existed. So they couldn't unilaterally blanketly say that in the end we will economically
3549.9,3554.54, redistribute and everyone will be fine. You needed to defend the status quo and note that they kept
3554.54,3559.78, on trying to pin the African status quo to us when a majority of African states chose more civil
3559.78,3564.26, rights than economic rights. So the institutions that are corrupt right now are a byproduct of
3564.26,3569.76," opposition's world, not ours. That in in those same instances that was the democratic process that they protected"
3569.76,3574.4, and never actually ensured individuals on the ground even when gave each and every person
3574.4,3579.2, a vote three clashes in the speech number one an immediate relief versus the rights on paper
3579.2,3583.52, secondly as to wealth as a prerequisite to mechanizing political rights and thirdly how
3583.52,3585.04, economic empowerment sets up
3585.04,3587.32, the condition of a healthy democracy.
3587.32,3589.3, Not only I think opposition in the first class
3589.3,3591.94," continuously tries to engage in a false model,"
3591.94,3594.2, because when African-Americans and women in the US
3594.2,3597.04," had no political rights, that did not mean we defaulted"
3597.04,3599.12, and we are an autocracy and a regime.
3599.12,3601.84," They constantly try to engage in that contextualization,"
3601.84,3603.7, and that is the reason why they can't actually
3603.7,3608.72, engage in our argumentations. And they were highly parallel and non-comparative we use and the only thing they
3608.72,3613.78, have left standing is would we distribute fairly we gave you three mechanizations and three attacks
3613.78,3618.36, that were never actually dealt with and responded to we use number one ops own context against them
3618.36,3622.86, op when explaining why implementing civil and political rights will be done well said that most
3622.86,3629.44, individuals want to work together after coming out of colonial oppression so when we redistribute land if we all wanted to work
3629.44,3634.16, together we wouldn't have the levels of conflict and levels of injustice given we all would likely
3634.16,3639.12, agree to that we told you secondly their analysis was symmetrical it was sufficient because you are
3639.12,3643.12, the only team in this debate trying to argue against the mechanization for any impacts to
3643.12,3648.0, occur because they wanted to defend literally nothing because if we can't implement our policies and we also
3648.0,3651.28, do not have political rights there is no comparative in this debate the same way you
3651.28,3655.6, would install your own family members as members of government would likely apply to you but last
3655.6,3659.92, we say that even when you don't have enough money and know that it's engaged in their best case
3659.92,3664.24, in their best and not their worst because we assume that they will be able to enforce all of
3664.24,3668.26, their rights we told you number one that you always had the initial capital to
3668.26,3672.92, spur and give cash handouts to individuals that you would use to set up and enforce your
3672.92,3677.8, democratic structures. But land redistribution and quotas literally required signing a bill.
3677.8,3681.16, We never understood why it did not require any money. Their only response later on in
3681.16,3688.24, Third Op was that there aren't enough actual jobs. But we think that the job creation and the fdi was the thing that created it not that therefore the only thing
3688.24,3693.28, left standing from them is the idea that they have fdi we told you in a first argumentation
3693.28,3698.16, what fdi was perverse on their side they just never wanted to actually engage with it and try
3698.16,3702.48, to claim it as their own the only thing that that that's the only thing left standing for how they
3702.48,3707.96, can clock our benefits or else up to this debate from force because they never actually engaged in the trade-off or the
3707.96,3712.64, comparative they said that they have more trust because they're not a quasi-democracy we told you
3712.64,3717.04, that the u.s for example or the idea that your democracy is not the singular thing as to what
3717.04,3721.78, determines fbi investment we told you that in third proposition the u.s massively trades trades
3721.78,3727.36," with the ccp a communist regime and a democracy, but there are strong trade relations."
3727.36,3733.76," They didn't even hear our first argument on resource extraction because we said purchasing power is what created good FDI,"
3734.02,3740.18, to set up infrastructure as opposed to FDI where they steal and rob your diamond mines and rob oil from individuals.
3740.3,3743.68," They caught nothing in this debate, no comparative, no trade-off, their burden fails."
3744.42,3748.94," Secondly, I as well pre- prerequisite to mechanizing political rights we told you why their case is"
3748.94,3753.92, their case and ours and ours comes prior we told you in terms of weakening lobbyists and
3753.92,3758.18, platforming and allowing participation required money in order to correct these social imbalances
3758.18,3762.44, that were previously entrenched because of colonialism the current the status quo right
3762.44,3768.52," now of corruption and imbalances isn't because, oh, the democratic structure was corrupt. It's because the colonialists set up these structures."
3768.76,3773.24," We corrected it. Lastly, no engagement to economic empowerment. We told you how we slowly mobilized"
3773.24,3776.92, individuals to levels of political consciousness where we would eventually set up a strong
3776.92,3780.96," democracy where individuals actually held them accountable, side with the prox."
