start,end,text1145.6,1147.92, you are very likely to become a part of a gang.
1148.02,1149.4, You are likely to be a victim of a gang.
1149.5,1151.02, You are likely to be a victim of further crime.
1151.26,1153.04, You are likely to see the very worst things
1153.04,1154.46, that criminals do to each other.
1154.64,1155.94, This is going to be incredibly damaging
1155.94,1157.94," because you perceive yourself as one of the good ones,"
1158.16,1160.68," one who has done their time and paid for their sins,"
1160.8,1162.66, but everyone else you perceive as bad
1162.66,1164.88, because you've seen the worst of what criminals can do
1164.88,1168.88," while you're inside prison. Second, on public confidence in the police we think many people are"
1168.88,1173.2, just genuinely afraid of convicts because they have bad experiences and if you know one conviction
1173.2,1176.8, done something where you've read a media story you can get all like that you view them as one
1176.8,1181.6, for multiple negative group this massively harms us if you implement this policy i know this isn't
1181.6,1187.0," contingent on the first point the perception that convicts are untrustworthy exists regardless of how good they actually are. We think in addition,"
1187.0,1191.0, the media is likely to make this perception entirely worse. This is likely to be a point
1191.0,1196.0," of actual policy, so its implementation will be advertised and prominent in public discussion,"
1196.0,1200.0, and the media will sensationalise these stories and make it dramatic. But note that this damage
1200.0,1203.0," has a particular impact on vulnerable groups like women. Now, when you're walking home"
1203.0,1207.44," alone on a dark street and you think someone might be following you, you are less likely to trust a"
1207.44,1211.6, police officer across the road because they could be a sex offender. Or if you're a member of an
1211.6,1217.04, ethnic minority you know that white supremacist ideology is uniquely powerful among white convicts
1217.04,1220.8," because ganders are organised in prisons along racial lines, you're far more likely to fear the"
1220.8,1225.76," police, you're far less likely to report a hate crime. For all these reasons, I'm so proud to oppose."
1231.44,1233.88, I stopped flowing at 8.15.
1233.88,1235.76, I appreciate that speech.
1235.76,1237.6, If the other judges are ready.
1240.48,1241.8, All right.
1241.8,1263.7, Happy to call up the Deputy Prime Minister if you're here.
1264.68,1266.68," Hello, can you hear me?"
1296.08,1296.44," Okay, I'd prefer POIs verbally if that's possible. The Court of England's case relies on an unproven and somewhat unsavory assumption about who ex-convicts are and how they live their lives."
1310.38,1311.0," According to First Opposition, ex-convicts are overzealous and brutal. They're violent. They think a person convicted at the age of 19 for smoking marijuana or something trivial like that is somehow morally equivalent to a pedophile, according to their POI."
1315.14,1315.64, Canada's characterization of ex-convicts by comparison was more realistic and more hopeful.
1319.52,1324.02," That many of these ex-convicts were people who made unfortunate mistakes, they were in the wrong place at the wrong time, in the wrong color of skin, and that many of these people wanted to"
1324.02,1328.74," make the world better, or at the very least themselves a better shot a shot at a better life Canada thought"
1328.74,1332.3, this was the least they would deserve that is why we are proud to propose I'm going to talk about
1332.3,1336.62, four things in this speech first of all on who these ex-convicts are likely to be and what their
1336.62,1340.36, incentives are second of all I'll deal with the principal class in this round third I'll talk
1340.36,1344.38, about reforms to the police and then fourth I'll introduce a constructive argument on trust in law
1344.38,1347.76, enforcement will should respond to their second claim. On the first issue
1347.76,1352.32," of who these convicts are, I think much of England's case relies on a mechanism about"
1352.32,1356.88, the hiring process for some reason selecting for bad hard on crime people which is like fairly
1356.88,1361.6, unsubstantiated. I'm actually unsure why it is that police units for some reason want to hire
1361.6,1371.06, more violent people. We think it is far more likely that police units want to improve their legitimacy through hiring people who do not crack down or commit brutality.
1371.38,1376.22," This is actively bad press. In the wake of George Floyd, many police units had funding rescinded"
1376.22,1381.92, across the Western world for committing acts of brutality. And this is an active reason as to why
1381.92,1392.58," you would prefer people who are softer on crime. Also, because even to the extent that people within the police force might be somewhat, you know, have violent tendencies in the status quo for reasons they still don't explain."
1392.82,1395.62, There are also other actors that have effects over the hiring process.
1395.78,1407.72," So municipal governments, for instance, that participate in hiring processes of police officers, people who are police commissioners are at the top of the meat targets for reducing brutality in much of the world. So these are all reasons as to why you are unlikely to pick the most"
1407.72,1412.3," deranged versions of the comics. And even to the extent that you do, presumably you could have just"
1412.3,1415.96, found violent people who happen to not be convicts as well. And I'm actually unsure what the margin
1415.96,1420.98," is here. And then they say prisons are really bad. And there are things like gangs, which convert you"
1420.98,1424.98, into becoming more violent. I think our stance largely dealt with this in the sense that we said
1424.98,1425.58, the worst people
1425.58,1426.66, are likely to be filtered out
1426.66,1428.36," for things like psychiatric evaluations,"
1428.66,1429.22, through simulations.
1429.64,1432.28," And even to the extent that they ended up in the police,"
1432.48,1434.52, we talked to you about how in the introductory stages
1434.52,1435.58," of being a police officer,"
1435.84,1438.26," it is unlikely they are put on incredibly high risk tasks,"
1438.52,1440.26, such as facing an armed robbery.
1440.48,1442.34," And it's more likely that at the beginning of your career,"
1442.56,1444.26, they're put in pairs with other police officers.
1444.58,1447.08, They're forced to observe so that they can see how you react to different
1447.08,1450.84, situations. And so the worst apples are likely to be filtered out in our side. I don't think
1450.84,1454.14," they sufficiently respond to that. We also just give you a number of other reasons, which I don't"
1454.14,1459.5, think get response as to why the majority of people who are ex-convicts are nonviolent criminals to
1459.5,1463.96," begin with, how many of them are from racialized groups, how they're unjustly convicted. And I"
1463.96,1468.24, think second opposition speaker probably needs to deal with that secondly then talking about the principled
1468.24,1472.64, crash our claim from first was this unjustly excludes ex-convicts who had already been
1472.64,1476.64, punished i think they respond with examples and not analysis they say we already hold criminal
1476.64,1481.12, records therefore this means that we prioritize the safety of innocent people over people for
1481.12,1484.72, our conflicts the first thing is that obviously like i think we broadly oppose job discrimination
1484.72,1488.14," against people with criminal records and And secondly, they have this like"
1488.14,1492.14," pedophile example, which they repeatedly like. Let's talk about how we decide whether this is"
1492.14,1497.3, more analogous to a job discrimination or like pedophile school teachers. The first difference
1497.3,1503.58, between these cases is on the likelihood of harm. There's some possibility in any case of employment
1503.58,1506.28, that an ex-convict is going to cause some degree of harm.
1506.36,1509.06, So they say they would make the ex-convicts drive buses instead.
1509.34,1514.5," There's probably some possibility that an ex-convict harasses someone on a bus, for instance, or crashes a car."
1514.78,1519.58," So thus, the question in this round is how likely you are in different situations to be relatively more violent."
1519.58,1524.8," And I think in order for this to be analogous in any way to pedophile, I think to prove an incredibly high threshold of increased violence,"
1527.44,1531.02, I don't think they've done sufficiently in this round wrong the second is in the level of moral sympathy there are probably just zero good reasons for being a
1531.02,1535.7, pedophile and assaulting children by comparison there are many reasonable and under and
1535.7,1540.1, comprehensible explanations for why people would commit crime even if we think crime is broadly
1540.1,1549.3," bad we talked to you about how in many countries the the framework for crime is unjust that, that it artificially punishes things like petty crime or like non-violent drug consumption,"
1549.3,1552.96," which are not in reality moral crimes. We talked to you about racialization of crime,"
1552.96,1556.68, we got very little response. So that is why it's different from pedophiles. And notice the
1556.68,1560.82," intuition behind this claim as well, that we should never deprive someone of opportunity"
1560.82,1568.88," for the significant just cause. It is true across most societies, for instance, that racial minorities are more likely to commit violent crime due to structural economic reasons"
1568.88,1573.12, and racial oppression but it would be absurd to suggest as a result we should bar black people in
1573.12,1577.92, the us from the police force or indigenous people in australians from in australia from the police
1577.92,1582.16, force regardless of whether doing so would have marginal instrumental benefits because to bar
1582.16,1588.2, someone from employment on an arbitrary basis distorts their dignity and entitlement to fair treatment in an unacceptable way. So this is why
1588.2,1593.68," we win independently on the principle. Thirdly, in the speech that I'm talking about, the effects"
1593.68,1597.16," in terms of police culture. And I'm not spending a lot of time here, because I don't really respond"
1597.16,1600.82," to a lot of the arguments we give you from first. In terms of why this alters police culture,"
1600.82,1605.0, on why the violent police culture festers due to the absence of the oppressed people
1605.0,1608.74, in the room. The cops can make jokes about the criminals they've locked up. They can get away
1608.74,1613.04," with harassment in interrogation rooms. In the police car, they can make racial assumptions and"
1613.04,1617.12, get away with it because you have no people who are from the relevant community who are represented
1617.12,1620.78," in that situation. Secondly, we talked to you about racial composition, the fact that people"
1620.78,1624.98, from oppressed communities tend to have less internalized biases and tend to be more understanding
1624.98,1627.92," towards those who are racial groups, and that in communities where the proportion that people from oppressed communities tend to have less internalized biases and tend to be more understanding towards those who are racial groups and that in communities where the"
1627.92,1632.4, proportion of people who have were ex-convicts within a specific racial group is high talking
1632.4,1636.88, about a quarter of people in some black communities in the us it is likely to significantly alter the
1636.88,1640.96, racial composition of peace in a way which negatively affects their ability to execute
1640.96,1644.48, justice fairly before i talk about my constructive argument i'm happy to take a point about this one
1648.54,1652.98," who is a police officer who's been shot up by criminals more likely to employ? A black man who earnestly says there are structural problems with the police, or a man who"
1652.98,1657.84, says he hates all criminals and won't hesitate to pull the trigger? So I don't think there is a
1657.84,1661.42," binary between those two. We think there are like, A, I think I already responded to this when I"
1661.42,1674.6," talked to you for the incentives to reduce things like brutality, and there are probably people in between, or just generally dislike the effects that crime has on the community because they've been through that community, and yet think that there is an ability of people in high crime communities to do good."
1674.9,1685.2," On the third argument about how this improves trust in the police, and I'll just flag at the top of this directly responds to their like minute long second argument on public home law enforcement is impeded not only by its own"
1685.2,1689.96, misconduct by the perception that it is punitive and foreign that is an external force designed to
1689.96,1695.04, compromise harmony within communities we reduce this perception in prop in two ways the first is
1695.04,1698.96, through microscopic interactions that you have with the police please spend quite a lot of time
1698.96,1703.0, with ordinary people they visit schools and talk about their stories in many cases they sit in
1703.0,1705.8," coffee shops alongside families and children, and they know people"
1705.8,1706.66, and their personal lives.
1706.72,1709.8," So when you think of the police, now you think of your neighbor, George, who's from the same"
1709.8,1712.02," high crime area as you, rather than like Derek Chauvin."
1712.4,1716.22, This means that people are exposed to a new version and conception of the police.
1716.5,1719.5," They are conscious that these are people who have walked through the same streets, people"
1719.5,1723.2," have made the same mistakes, and people have lived in the same cramped cells and prison"
1723.2,1723.6, hallways.
1723.66,1728.64," On a macroscopic level, it means that the police are more racially similar to high crime communities that they police"
1728.64,1733.52, as we point out earlier and first that keeping these people out of out of the police meaningfully
1733.52,1737.04, tilts the racial composition of the peace towards white privileged people who have very little in
1737.04,1740.8, common and very little personal connection for the communities they please and the important
1740.8,1745.22, implication is that trust receives full engagement with law enforcement.
1749.38,1749.44, It is scary for a woman of color experiencing domestic violence or a Black kid in the U.S.
1752.96,1754.7, who is mugged on the street to speak to a force that they see as oppressive towards their community and as inadequate.
1755.16,1758.68," A sense of personal connection bridges this gap, and because it means that you have the"
1758.68,1762.84," belief that the officer will not be judgmental towards you, you have some common ground upon"
1762.84,1763.62, which you can connect.
1763.86,1768.72," This means that more victims of crime receive justice and hope in our world, and even on their metric of"
1768.72,1773.26," saving innocent people, we are far more likely to have people have justice delivered towards them"
1773.26,1777.38," after the fact. In opposition, these people are less fearful and silent to speak out. We think"
1777.38,1781.78," that is far worse. When punishment is levied outside the courtroom, every convict serves a"
1781.78,1793.5, lifetime sentence. We're incredibly proud of those those i thank that speaker for their speech the other judges are ready i'm happy to call up
1793.5,1796.46, the deputy leader of opposition to continue the case for opposition side here
1796.46,1812.16, my other books Don't let props slander us.
1812.16,1814.36, We aren't assuming things about criminals.
1814.36,1818.12, We are assuming things about the kinds of criminals who are going to sign up to this
1818.12,1820.42, and the kinds of criminals who are going to be accepted.
1820.42,1821.42, We never made assumptions.
1821.42,1822.42, We gave you incentives.
1822.42,1828.54," First, on top of the principle, then on who is likely to sign up and be accepted and why they're going to make the system worse."
1829.0,1833.52," Then I want to talk about trust in the system. And finally, on why you hurt cohesion within the police force."
1833.7,1838.88," First, on the principle, three responses to this. A, we can hire these people in other ways."
1839.06,1849.52," If the important thing is that we give them opportunities, ultimately, we can provide alternative opportunities that do not have the same level of societal risk we can make them firefighters we can employ them in public transport"
1849.52,1855.12, utilities second response prompt two conceded this class was dependent on the practical she conceded
1855.12,1860.0, in the cases where the risk is sufficiently high that ultimately we don't need to hire these people
1860.0,1868.88," i want to prove why that risk is going to be high on their side in the next clash. Third of all, on the idea of unfair imprisonment, the point here is that if certain people are"
1868.88,1874.32," imprisoned unfairly, the solution to this isn't to abolish old prisons, the point is to,"
1874.32,1879.04," the solution presumably would be to eliminate the points of unfairness. Therefore, the idea that"
1879.04,1884.08, people are unfairly treated at one point down in the criminal justice system doesn't mean that
1884.08,1885.28, everything down the line
1885.28,1889.04, should be affected it means you should improve that specific component of it therefore the
1889.04,1894.16, principle is not in the debate first of all on who is likely to sign up i want to take out the idea
1894.16,1898.8, of the two groups of people who they think are likely to sign up one they think people of color
1898.8,1902.96, are going to sign up and be accepted we think this is wrong because as proposition told you
1902.96,1907.4," the police force is likely to be quite racist, which means they're likely to discriminate against those individuals."
1907.72,1908.52, Prop gave you that analysis.
1908.92,1913.18," Second of all, they say the people who sign up are going to be the ones who want to reform the system."
1913.54,1914.1, That's wrong.
1914.32,1921.2," If you're an individual who was victimized by the police in the past, you don't want to join the police because you hate the police and you hate police officers."
1921.42,1927.68, You don't want to go into your job every day and have to work with people. You don't want to cooperate or be subjugated by the system
1927.68,1929.84, because the chance of you improving the system
1929.84,1932.16, is incredibly small because you are a cog
1932.16,1933.68," within a massive, massive machine,"
1933.68,1935.62, which means people who want to reform the system
1935.62,1937.24, or who have been victimized by the police
1937.24,1939.52, have no incentive to sign up.
1939.52,1940.94," On the other, let's respond to the things"
1940.94,1942.24, they told you about.
1942.24,1944.62," First of all, they say, well, there's external influence,"
1944.62,1946.16," the things like municipal bodies, and that of all, they say, well, there's external influence. I think that you need to both bodies"
1946.16,1947.56, and that ultimately they have incentives
1947.56,1948.84, to appear legitimate.
1948.84,1950.44, The problem is twofold.
1950.44,1953.32," First of all, Black Lives Matter is a minority movement"
1953.32,1956.0," and ultimately the most powerful people in communities,"
1956.0,1958.0, those who are most likely to be relatively wealthy
1958.0,1960.76," and privileged are ones who want to be tough on crime,"
1960.76,1963.8," which means their incentives do not be soft on crime,"
1963.8,1968.96, but ultimately to employ those people who are going to be relatively zealous secondly even if you have some kind of external
1968.96,1973.44, influence police unions are incredibly powerful and are likely going to demand a huge amount of
1973.44,1978.48, power over the system the next thing they say elishka says is well what's the margin on both
1978.48,1983.04, sides of the house they're going to be hiring relatively zealous people the the point is the
1983.04,1985.24, degree to which they're likely to be zealous and abusive.
1985.52,1989.84," On our side of the house, you might hire police officers who are somewhat privileged and who vaguely"
1989.84,1994.3," dislike crime. But on their side of the house, you're going to be hiring people with personal"
1994.3,1999.6," reasons to be incredibly hateful towards criminals. That is to say, they're likely to despise"
1999.6,2004.14, criminals and to want to crack down on them as much as possible. What is the reason for this?
2004.14,2007.5," The reason is the point at which individuals go into prison,"
2007.9,2011.16, the biggest threat to you is not the criminal justice system.
2011.4,2013.64, The biggest threat to you is other criminals.
2013.9,2016.62, It's other criminals who are likely going to force you into joining a gang.
2016.9,2020.06, Other criminals who are most likely to make you a victim of prison rape.
2020.3,2022.58," Other criminals who are likely to murder or threaten you,"
2022.58,2027.2, which means your biggest source of personal hatred is towards other criminals.
2027.56,2035.16," These are people who are going to sign up, and they're likely to be significantly more zealous and abusive than ordinary people you might hire elsewhere."
2035.56,2036.78, That is crucial.
2037.14,2040.5," We think, therefore, at the end of the day, the police aren't going to be hiring moderates."
2040.72,2048.56, They're going to be hiring the ones who are victims of drug deals and therefore want to be incredibly harsh on drug crime the next thing they say is well they're going to filter these
2048.56,2052.8, people out we told you this is impossible for the two reasons my gave you that were not responded to
2052.8,2058.0, a you just can't read someone's mind just unclear how this works but b this filtering clearly
2058.0,2062.48, doesn't work in the status quo given the extent of abuse we already see so it's unclear how they're
2062.48,2065.52, going to be able to apply it to criminals.
2070.08,2073.84," Finally, we think ultimately the people who are most likely to sign up and be promoted within the criminal justice system are going to be the ones who are farcist on crime. These are the ones"
2073.84,2077.92," who are going to be making the hiring and firing decisions, which is an additional reason why these"
2077.92,2082.96," people are likely to be bad. So therefore, in the best case scenario, individuals who are likely to"
2082.96,2088.06, genuinely reformed are likely to be significantly more abusive than ordinary police officers.
2088.36,2090.72," But let's talk about the second group, which wasn't engaged with."
2090.96,2096.18," We think ultimately the rest of convicts, convicts that they hire, you open their wrists to other forms of abuse."
2096.18,2098.82," That is to say, it's incredibly difficult to screen individuals."
2099.12,2109.28," And we think that people may not be fully trustworthy, even if they've proven to have some kind of criminal faculties, i.e. they put the law before themselves. These are two unique groups of people, both of them are worse than"
2109.28,2113.92, ordinary police officers. The second clash is on the idea of the perception of the police and
2113.92,2118.24, criminals. Their argument is that it's good to have relatively accessible people who you can
2118.24,2123.12," engage with. Two responses. A. As Maya explains to you, the dominant prevailing narrative is that"
2123.12,2126.06, convicts are stigmatized broadly in the status quo
2126.06,2127.04, because they're viewed as a threat
2127.04,2128.88, to the fabric of society.
2128.88,2131.14," The second thing is even in these minority areas,"
2131.14,2133.64," if there are incentives for the police to appear legitimate,"
2133.64,2135.74, then they can hire certain minority policemen
2135.74,2137.04, on our side of the house.
2137.04,2139.64, The difference is whether you hire minority individuals
2139.64,2142.56, who have hurt that community by engaging in crime.
2142.56,2145.32," Thus, we think that because you as a potential"
2145.32,2149.6, member of the public cannot tell which people were convicts and which policemen were not
2149.6,2154.0," convicts, you're likely to distrust convicts as a whole, given the extent to which crime"
2154.0,2158.76," hurts these people on a daily basis. Therefore, we think the most vulnerable people, i.e."
2158.76,2162.76," for example women who might be subject to, for example, sexual abuse, are ultimately"
2162.76,2165.68, going to be less likely to be able to or to feel
2165.68,2169.68, confident in calling upon the resources of the state given that they're likely to target the
2169.68,2175.6, entire brush the reason is the immediate story saying that police officers like ex-convicts do
2175.6,2180.64, their job well isn't a big story but if a single ex-convict abused their position it's likely to
2180.64,2185.6," be heavily publicized even these stigma against convicts, which means you massively increase stigma towards the police."
