start,end,text
0.0,3.12, I'm just going to start that now.
3.12,4.68," OK, great."
4.68,8.52, So could I check that my panelists are here?
14.04,15.92, I am here.
15.92,17.2, Yes.
17.2,18.16, I see Jessica.
18.16,21.96, I believe we have one more judge.
21.96,23.32," Yes, I'm here."
28.0,32.0, Great. And I'm looking for
32.0,36.0, I think I'm looking for Evelyn.
36.0,40.0," Okay, well, we'll hold on for a moment."
44.0,46.0," It's possible the draw was updated. I'm going to go ahead and start the presentation. Matt, you can start."
46.0,49.0, It's possible the draw was updated.
49.0,52.0, I'm not seeing Evelyn's name on the draw anymore.
52.0,54.0," Oh, let me refresh."
54.0,56.0, That's totally possible.
56.0,57.0, You're right.
57.0,59.0, You're absolutely right.
59.0,61.0," Okay, great."
61.0,62.0, Then.
62.0,64.0, In that case.
64.0,66.52," Let's start with some quick introductions. So my name's Matt, I'll be the chair."
68.32,71.9, Happy to be judging this round. Congratulations to both teams and welcome to round eight.
71.9,75.26," If we could introduce ourselves, the judges,"
75.26,77.72," just name, if you're interested, pronoun"
77.72,79.92," in the order of the draw, that'd be awesome."
82.32,84.42," Hi, my name is Freddie."
84.42,88.0, I use he or they pronouns. Let's have a good debate.
88.0,98.0," Hi everyone, I'm Jessica and I'm on the panel. Congratulations on making it to the final round and I wish you all the best of luck for the round."
98.0,103.0," Great, thanks."
103.0,106.32, If we could have the proposition team introduce themselves
107.12,112.08," in speaking order. Yeah, so Vincent Gao is first prop in reply. He him."
112.96,117.12, Second speaker Anushka Chihar. Third speaker Max.
124.4,126.0," Opposition? Speaking first for opposition, Mike Papilla."
126.0,129.0," Speaking second, Maxwell DiLorenzo."
129.0,132.0," Speaking third, Nick Bracow."
132.0,135.0," And, replying, Mike Papilla."
135.0,137.0," Great, thanks."
137.0,144.0," I haven't judged at this world schools yet, so let me know if I'm missing anything major procedurally."
144.0,148.0," But final reminder to teams, please speak to time."
148.0,150.4," If you speak past eight minutes 15,"
150.4,151.9, I will simply stop flowing.
152.76,155.48, I will not be sending time signals in the chat.
155.48,158.42," If there is anyone who like really needs time signals,"
158.42,160.4," let me know and we can try to figure something out,"
160.4,162.96, but I'm traditionally pretty terrible at doing that.
164.88,168.56," Offer POIs, accept POIs, be good to each other, and enjoy the debate."
170.2,175.3, There are no further questions or concerns. I look forward to this round. I call this
175.3,178.52," house to order, and I'm happy to invite up the Prime Minister to begin the debate for"
178.52,183.12, Proposition side here. Just checking that I'm audible.
184.58,186.1," And POIs in the chat, please."
186.38,188.02, I'll just accept them when I see them.
193.92,197.48, Millions of ex-convicts serve a life sentence in the world of opposition.
198.04,202.58, These are people who care about justly applying the laws that they were unjustly convicted by.
202.72,210.08," Family members who care about their hometowns that see face police subjugation daily, and individuals who care about improving"
210.08,214.84, the police force but cannot in their world. These millions should not be barred by discrimination
214.84,219.06, and stereotype. They should be free to live the lives beyond a sentence that they've already
219.06,224.48," served. When punishment is levied outside the courtroom, every convict serves a life sentence."
225.44,227.92, Proposition has two arguments to make in the first speech.
227.92,229.68," Firstly, on ex-convicts themselves,"
229.68,231.46," and secondly, on reforming the force."
231.46,232.88," But before that, what is our stance?"
232.88,233.72, Three points.
233.72,236.34," Number one, we think it is likely that individuals"
236.34,238.82, with actively violent tendencies are filtered out
238.82,240.76, through existing selection systems.
240.76,243.56, This looks like psychiatric evaluation simulations
243.56,246.0, that put applicants in non-convicts and distress situations.
246.0,253.0," Training on de-escalation procedures, which we already have in place and mentioned, have increased in the aftermath of BLM."
253.0,258.0," Basic background checks that see if an ex-gang member, for instance, is still in contact with their gang and their agency."
258.0,265.52," Notably, a lot of this already exists for non-convicts so we are supporting a continuation of data second"
265.52,270.0, when individuals are new to the job and this also applies to non-convicts too they're likely going
270.0,274.72, to be put in low risk and low tier jobs such as community outreach divisions or being a patrol
274.72,279.6, or regular beat cop until they get promoted b cops are also often paired with senior officers
279.6,284.0, for instance so in our world there's already effectively a probationary period that screens
284.0,287.28," for things like bad behavior violent violent tendencies, and various reactions."
287.68,299.88," Thirdly and finally, in terms of the people who are likely to apply, we think it will and largely be lower level criminals who engaged in crimes of accusation and nonviolent crime, largely because A, statistically, this is the vast majority of crime."
300.22,307.92," But second of all, if you were locked up for decades by the state because you engaged in violent crime it's probably the case that you hate the police you hate the government and you don't want to join"
307.92,314.32, the police force to begin with first argument then to begin a principle it is morally unjust
314.32,318.48, for the state to punish ex-convicts who have already served their sentence and have been
318.48,323.76, deemed fit to enter society and rehabilitated on an objective level these are ex-convicts who have
323.76,330.2, paid for their sins and crimes and suffered the consequences. This is a perpetual punishment that stays well beyond when
330.2,335.02," a sentence ends. On a more nuanced level, however, we think that this is an excessive punishment that"
335.02,338.96, is disproportional. It's not just the case that these people have already paid for their sins.
339.34,343.24, It's also the case that the vast majority of people engage in non-violent crime that isn't
343.24,348.04," that egregious, as petty as breaking a car window or drug dealing, for instance, especially in the United States,"
348.2,353.9," or crimes of acquisition and subsistence, which constitutes already over half of crimes in most"
353.9,359.44," countries. Moreover, however, under the principle, it is often people of color in their world that"
359.44,363.58," are disproportionately punished, who are more likely going to be locked up, who are more likely"
363.58,368.72," going to be served a guilty verdict, who are more likely going to be carded and overplaced on their set of house."
369.06,373.68," So at the conclusion of this principle, this is a fundamentally unfair punishment. A four-year"
373.68,378.0," sentence should end after four years. It does not in the world of opposition. Second of all,"
378.22,382.98," it disproportionately affects low-level criminals, people of color, in which this policy is a massive"
382.98,388.18, overblown and it's not proportional to what exactly these people did and the crimes that these people committed. I'll take the
388.18,393.48," second of all, second part of the argument. This is just a good opportunity, a solid economic"
393.48,398.38, opportunity for ex-convicts. It's a well-paid job where you get insurance and social benefits and
398.38,402.06, healthcare on the side for your children. It provides security for ex-cons who are often
402.06,408.54, overblown by things like crime and jail. It gives them meaning and purpose since they feel like they're actually contributing to society instead of staying in jail.
408.54,415.62, This is especially important in the context where criminals are often blacklisted from other jobs because of their ex-con status in the world of opposition.
416.06,420.84," So rather than re-offending or joining previous crime communities and circles and gangs out of no alternatives,"
421.24,428.94," this job brings people a paycheck and stability for the most vulnerable groups of minorities in the world. Before I go on, I'll take a pee. Would you allow sex offenders"
428.94,434.74, who have served their sentences to become teachers? No. Let's talk about reforming the force.
435.28,440.32, A central issue with the police in the status quo is that there's a large empathetic gap between the
440.32,445.52, average beat cop and the average convict. The police force is comprised of a body of people
445.52,447.42, who never need to be in circumstances
447.42,448.9, where they have to resort to crime.
448.9,451.4, These are often financially stable white individuals
451.4,453.94, or people of the ruling class who cannot empathize
453.94,457.28, with a black teen in Chicago living in economic destitution.
457.28,459.48," These are individuals who have stable families,"
459.48,461.26," stable financial circumstances,"
461.26,463.7, who don't have to engage with the other side.
463.7,465.4, This empathetic and democratic gap
465.4,470.22, maps onto other issues as well. When the average beat cop patrolling your community in the world
470.22,475.6," of opposition knows about the lived circumstances of poverty and violence, they attribute bad"
475.6,480.64, behavior and violence to the person and not to the circumstance. This leads to a greater likelihood
480.64,488.5," of that cop being violent. This individual and that white cop on their side of the house doesn't attribute bad behavior to the circumstance. They just believe that the individual,"
488.66,493.5," that Black teen, is bad in and of itself. In a high crime community where curfew is 10 p.m.,"
493.5,497.2, a cop who has worked only one shift a day for their entire life because they have financial
497.2,502.34, stability does not understand why a Black man is coming home an hour after curfew late after the
502.34,505.04, third and final shift. when the average union or board
505.04,510.72, member on their side of the house is a 55 year old white man policies do not reflect circumstances on
510.72,514.96, the ground when your patrol partner brutally beats a hispanic teen because they believe they are a
514.96,518.88, drug dealer you don't file a report since you have more empathy for your partner that you've worked
518.88,523.76, with for 11 years rather than the hispanic team because you're a white man we fix this issue in
523.76,525.04, two key ways.
528.92,533.2, The first thing to know is that people who join the force on our side of the house are likely going to have desires to reform the system. These are individuals who have been wronged by the police
533.2,538.16," in the past. But second of all, there are plenty of ex-cons on our side of the house who are likely"
538.16,542.56," to join who are going to be people of color. This is true for two reasons. First, in high crime"
542.56,546.22," communities, people of color are often arrested the most to a disproportionate rate."
546.56,566.06," Look at the United States, for instance, where in a number of inner police because they know a family member who has been arrested, for instance,"
566.3,570.04, where they know that the police has historically been bad for their individual group.
570.52,577.22," What does this mean, then? It means that, number one, empathetic ex-cons and people of color hold positions of power on our side of the house."
577.44,583.58," These are individuals who can climb the forced ladder, who can become regional union officials, who can become precinct captains,"
583.82,588.34," and can make policy reforms such as more stringent accountability measures for police that go out of line,"
588.56,593.3," which charges abusive officers, and measures that enforce the wearing of body cams and more"
593.3,598.08," de-escalation training. Second of all, however, even if they don't get into positions of power,"
598.52,602.98, having a presence in and of itself means that you can check what other people say and feel.
603.14,610.06," If you're in a room with another Black man, for instance, who is a cop, you're less likely to do things like policy reforms that are racist,"
610.28,614.58," and you're less likely to do things like think before you speak. Moreover, it is just statistically"
614.58,619.06, better that we have more beat cops and patrols who relate to people on the ground. The weighing
619.06,623.54, of this argument is simple. The background checks on our side of the house are likely going to be a
623.54,626.62, fair approximation of who is allowed to get into our policy.
626.9,633.62, It is unlikely that the most violent and the most psychiatrically mentally ill person is going to get through our policy and going to be screened by.
633.86,648.58," But what is likely in our side of the house is that we have hundreds, maybe dozens in certain precincts of individuals who are actually empathetic to that person on the ground who's able to relate to the black teenager in Chicago in inner suburbs of the United States because they've been in that circumstance and"
648.58,653.38, they know the realities of circumstances of crime and being extremely poor and living in economic
653.38,659.14, destitution this policy therefore dramatically reduces the likelihood of police forces abusing
659.14,663.34, their power and we allow for individuals to be held accountable if it's a case that they abuse
663.34,669.06," their power when punishment is levied outside of the courtroom, every single convict lives a life sentence."
669.06,679.42, We're very proud to propose.
679.42,683.26, I thank that speaker for their speech.
683.26,689.96," If the other judges are not ready, please let me know. Otherwise,"
689.96,705.52, I'm happy to call up the leader of opposition here. Can everyone hear me? Can people hear me?
712.48,717.44," Panel, this policy damages the effectiveness of the police force and the public's ability to trust"
717.44,721.68," in that effectiveness. For that reason, on to the Mingling, we oppose two arguments in this speech."
721.68,728.88," First of all, on why we are delighted to get bad police officers on the cyber position second on how this damages public confidence in the police and in the second"
728.88,732.72, speech my second speaker is going to talk about how this damages the region within the police
732.72,737.12, force and why that's so damaging first what's our stance inside opposition we believe that we're
737.12,741.36, happy to provide jobs for conflicts we think rehabilitation is important the state itself
741.36,747.28," can provide work to these people if they're good for it the stigma isn't as high isn't as highly recognised for their abilities there. They can work with spire men,"
747.28,751.6," in public transport, utilities, maintenance etc. These provide them with a means of living without"
751.6,756.08, unique risk of making them police officers that side proposition wants to take on and we are very
756.08,759.6, happy to encourage them to make amends to the community in other ways or to use them as
759.6,763.28, informants and get information from them in particular cases we just don't think they should
763.28,768.56, be employed to carry out the roles of a police officer what's our response then to the proposition case so four main
768.56,772.4, areas here first of all with their model i told that there's likely to be extensive screening of
772.4,776.88, applicants to stop violent people getting into the system first this is purely an assertion there's
776.88,781.04, no explanation of why this is the case but second line of response is that this screening doesn't
781.04,789.12, work for non-convicts under the status quo it's unclear how it's going to work for pundits we think it's relatively easy to fake these things there will always be individuals who
789.12,793.2, slip through the facts of the measures they can identify exist for example when cousins are
793.2,797.6, very strong second on the principle they only devoted about a minute so i'm going to deal with
797.6,802.64, it very quickly the first line here is that these people have already paid for their sins first we
802.64,808.56, already weigh the safety of innocent people being more important we think we have the existence of criminal records and those kinds of
808.56,813.84, systems so that society can be protected but secondly they literally can see this entire
813.84,818.96, line of their principle in a pure while and we ask would you employ pdf to work in a school now panel
818.96,823.2, you might think this is an extreme example but know that the principle itself was incredibly
823.2,828.32, extreme there was no explanation of where we might impose restrictions on this principle or where it ought to be limited
828.32,832.64, based on that given that they completely conceded this example with no explanation i think they're
832.64,836.8, going to have to do a little more work if they want to be relevant in this debate but then they
836.8,840.88, say this is a disproportional punishment frankly we think this is an assertion but we do believe
840.88,846.76," one side opposition is completely proportional we think you've caused harm to others in the past, you shouldn't be allowed to cause"
846.76,848.24, more harm in the future.
848.24,850.24," Third, on helping ex-convicts."
850.24,852.24, We don't think this is exclusive to their side.
852.24,856.44," The specific analysis they give can clearly apply to other groups, or even to charity"
856.44,858.44, work specifically targeted at ex-convicts.
858.44,862.44, It's unclear why stability and structure are exclusive to their side.
862.44,863.44, This makes no sense.
863.44,865.72," Fourth, on improving the system."
865.72,869.84," We think that individuals who are empathetic to criminals, or those who want to structurally"
869.84,874.38," reform the police, are not going to be selected to join the force. We'll clash with this later,"
874.38,878.82," but note that this analysis is devastating to their case, because they rest their entire"
878.82,882.48, case on this idea that the people who are going to be selected are going to be those
882.48,888.32," who are very empathetic and are likely to make good changes, but don't think this is true first of all we think it's unlikely that"
888.32,891.92, we're going to get lots of people of color for example applying to join the police if you saw
891.92,895.92, your brother or father go to prison while the white man from the right side of town got off
895.92,900.72, spot three i think frankly you'll likely just want to avoid the police in the future otherwise i
900.72,904.8, don't think the earth would have a peaceful dominated almost entirely by white men but
904.8,908.4," no more will be expanding on later in our case, and this is crucial. The police are clear"
908.4,912.08," incentives to discriminate. First, Crop says they'll have more people of colour, but they're"
912.08,916.4, likely to be discriminated against in the hiring process for the reasons Proposition already gives.
916.4,920.8," But crucially, the police force are only likely to want those who are never going to be perceived"
920.8,924.96," as softer on crime, those who are going to be the most zealous, those who are going to insist that"
924.96,928.64, other convicts pay for their sins so that they can avoid the kinds of reputational
928.64,933.28, harms that people think are damaging. This ultimately leads to more brutality under their
933.28,937.84, side. Our first argument then on why a significant number of ex-convicts are likely to make bad
937.84,941.76," police officers. First question, it was what is special about police officers? Why do we want to"
941.76,948.0, limit entrants to this job specifically? we think police officers uniquely hold an immense amount of power they can detain and arrest individuals
948.0,953.2, they hold a great deal of legitimacy no individual should hold that unless we are certain that they
953.2,958.08, are able to exercise that responsibly if they make a mistake justice isn't done so what are the
958.08,961.92, different groups of criminals who might apply and be selected note that this clash is with the
961.92,968.32," incredibly simplistic stuff we get out of cyber opposition, which is these are nice people who are going to be sympathetic and now want to enforce"
968.32,973.28, the law. Let's engage with their best case. We think the ex-convicts who are most likely to sign
973.28,977.28, up and want to reform and enforce the law are going to be those who are most likely to be
977.28,982.0, overzealous and ruthless. The reason is that these people have been through the system themselves.
982.0,987.92, This means that they have seen firsthand the terrible things that criminals do every day in prisons they might be first-hand victims
987.92,993.04, of crime themselves inside prison and note that even if a wider right in ex-convicts applied to
993.04,997.44, these positions even if the group's proposition talks about applied to these positions the
997.44,1001.68, individuals most likely to be selected by the police are going to be the most zealous and
1001.68,1009.76, violent and tough on crime because the police force is going to be incredibly afraid of selecting ex-convicts who appear to be simply court criminals in case they
1009.76,1014.16, end up being soft on crime and damaging the effectiveness or perception of the police force
1014.16,1019.94, they will not select the african-american man who tells them they need structural reform and to lose
1019.94,1024.22, funding so they can give that to social workers they're going to hire the white guy who was
1024.22,1028.36, caught in a drug deal and is now out for revenge on the gangs he believes want him.
1028.36,1032.28, But the second group is criminals who seem to have performed but actually haven't. Because
1032.28,1036.4," aside from the side proposition of assertion, we think it's actually very difficult to tell"
1036.4,1040.84, whether a criminal has truly become a better person. We think all of these individuals
1040.84,1044.76," and the matter of their incentives have been proven to have criminal tendency. In the past,"
1044.76,1048.88, they've decided to put their own interests in front of the law and morality and they are therefore
1048.88,1055.28, uniquely likely to do so again we agree that the rehabilitation is currently extremely flawed but
1055.28,1060.0, note that this analysis itself come back to bite side proposition because it means these ex-convicts
1060.0,1065.76, are highly likely not to be reformed and therefore to do bad things or exercise poor judgment when
1065.76,1069.68, they're in these positions but even if these people only committed crimes of acquisition or
1069.68,1073.92, desperation note that our analysis still stands they're clearly willing to put their own priorities
1073.92,1078.48, above respecting the law a lot of people are in bad circumstances but we don't think that means
1078.48,1082.48, that everyone necessarily resorts to crime we think these are individuals who have shown that
1082.48,1086.8," if they are put under pressures they will likely be in situations where they're working in the police office,"
1087.1,1091.64, they're willing to make this particular decision. Note the nuance here in our argument. We aren't
1091.64,1095.8, saying that these are going to be people who are necessarily inherently bad or make bad decisions
1095.8,1100.04, in every aspect of their lives. It is far more nuanced than that. We are simply saying that given
1100.04,1104.54, all the framing we gave you at the start of this speech about how police officers are in a unique
1104.54,1105.68, position of power.
1105.68,1108.14, Their ability to do harm in these situations
1108.14,1110.04, massively outweighs any marginal benefits
1110.04,1111.9, side proposition might want to bring you
1111.9,1114.34, from a couple of criminals being able to find jobs
1114.34,1115.54, as police officers.
1115.54,1117.68, We think the impact of this is that you either get
1117.68,1120.88, massive brutality because police force are only hiring people
1120.88,1122.2, who are going to be overzealous
1122.2,1124.62, and who are very afraid of being perceived as software.
1124.62,1127.92," Or you get people who are likely to have links to crime themselves, who are going to be overzealous and who are very afraid of being perceived as software online or you get people who are likely to have links to crime themselves who are likely"
1127.92,1132.08, to make bad decisions or are likely to abuse that power before i want to talk about public
1132.08,1137.44, content in the piece sure you say that experience with crime makes you more overzealous but if your
1137.44,1141.12, experience with crime is being a criminal wouldn't it make you more sympathetic to being in your
1141.12,1145.5," engine i think you've misunderstood our analysis here Our explanation is that when you go into prison,"
