start,end,text
0.0,2.24, to order on the given motion.
2.24,4.6, And I invite the prime minister to open the case
4.6,5.52, that stands in their name.
5.52,6.02, Keh keh.
8.62,12.22," Hi, just to check, am I visible and audible?"
12.22,12.96," OK, great."
12.96,15.72," Once again, I use he, him pronouns and POIs"
15.72,16.62, to be given verbally.
16.62,20.22," Please, I won't be looking at the chat."
20.22,25.28," Starting my speech in 3, two, one."
30.54,31.0," The root of all of Africa's ailments is poverty, and when allowed to fester over generations,"
35.9,40.4, opposition forms an ecosystem of chronic inefficiencies that predate on the livelihoods of the most vulnerable in the forms of disease and destitution. We are so proud to propose.
40.84,44.8," Before I introduce two arguments within this speech, what exactly do we support under this"
44.8,49.32," proposition? First of all, a three-pronged model. Firstly, we think post-colonial"
49.32,54.8," African states share a few characteristics, namely, one, strong grassroots movements formed"
54.8,59.66," during colonial rule to fight for independence. Two, their economic system was designed for"
59.66,65.76," colonizers to extract wealth from them, so poverty is rampant. And three, note that all post-colonial African"
65.76,72.34, states in the status quo pursued a mixed bag of political and economic strategies. So this debate
72.34,76.88, must be about reimagining the world on which of the two we should have prioritized at the point
76.88,82.18," of independence under the rule of a good faith government. Otherwise, neither team can deliver"
82.18,89.18," their promise of economic or political rights. Two, the process of fighting for economic and land reparations will be spearheaded by the state."
89.44,90.86, This will look like roughly three things.
91.18,95.46," Firstly, establishing committees responsible for fairly redistributing wealth and property"
95.46,99.36, who prioritize distribution from those who unfairly took wealth under colonialism
99.36,101.54, to the economically disenfranchised.
101.92,105.56," Secondly, establishing quotas within the workplace and schools to ensure"
105.56,110.72," equitable access to employment and education. And thirdly, cash transfer programs to marginalized"
110.72,116.68," groups. Three, we think in reimagining the world, a post-colonial Africa, absent of civil and"
116.68,121.44," political rights, will not be a society that lacks all fundamental human rights. This is because"
121.44,125.34, local leaders in a newly independent state have directly suffered
125.34,130.34," under colonialism, incentivizing them to ensure that the basic humanity which was eroded under"
130.34,135.94," colonial powers is now safeguarded. Therefore, fundamental human rights such as the freedom from"
135.94,140.82," slavery and torture exist, whereas civil and political rights such as expression, the political"
140.82,145.08, expression and assembly are not specifically codified by the law. Two arguments
145.08,150.14, in this speech. The first on how immediate economic relief is second to none in safeguarding
150.14,154.26, the livelihoods and upliftment of African nations. There are three parts underneath this argument.
154.64,159.14," First of all, I'd like to note that in the hierarchy of competing rights, economic upliftment"
159.14,163.82, must supersede political empowerment. This is because economic rights are instrumental to the
163.82,169.56," right to life, because the biggest obstacle is in the state. It's starvation, disease, and intergenerational"
169.56,174.74, poverty. Finite resources mean that millions spent to build voting booths on op could have
174.74,179.0, been used to feed the malnourished and earn acceptable income so their children could go
179.0,183.66, to school instead of being forced into child labor. Perishing means there aren't any political
183.66,189.6," expressions to be made, because when you survive, it becomes your utmost priority. The right to life is a gateway right"
189.6,194.3, that is fundamental to human dignity and comes prior to everything else. Why then is saving
194.3,199.28, lives exclusively a prop? Because it's a time-sensitive issue. Lives are at stake. Democracy
199.28,204.24," requires the state to carefully debate, pass, and implement public policies. So even if you get"
204.24,210.22," political rights, economic policies will only come way after. In the meantime, the lives we lose waiting"
210.22,215.3, for immediate relief are irreversible. But economic policies on the side of op will be far less
215.3,220.94," efficient, as state resources are stretched thin for nationwide projects. On-prompt, direct cash"
220.94,226.92, transfers and land in the hands of the people gives them the agency to ameliorate their specific economic situation.
227.24,233.58, Those who need medical care and shelter can get it directly instead of waiting on the state to develop things like public housing or hospitals.
233.92,238.76," But secondly, we think our economic reparations uniquely empower the people in a few key ways."
239.12,250.1," In many African states, natives were robbed of their land and consigned to barren parts of the country. In South Africa, the 1913 Natives Land Act was apartheid's original sin because it conscripted"
250.1,255.22, Black South Africans who formed 76% of the population and restricted them to land ownership
255.22,259.62," in just a tenth of the country's land, systematically shutting them out of metropolitan"
259.62,273.6," cities. Only we reverse it by the restoration of land rights because ownership over land land improves integration between ethnic groups, because we prevent things like segregation, and we allow individuals to use their land as collateral for things like investment to build their wealth."
273.6,290.02," We don't provide access to education and jobs for disenfranchised groups. It opens up access to income streams where otherwise they would be impoverished, allowing access to upward social mobility but lastly we think economic reparations in the wake of decolonization addresses Africa's crippling underdevelopment"
290.02,295.42, because their underdevelopment stems from foreign powers using them to extract natural resources and
295.42,300.94, exploit cheap labor when consumers are impoverished there isn't a viable market and labor exploitation
300.94,307.14, perpetuates the cycle of poverty because workers never gain adequate disposable income to attract meaningful FDI.
307.5,310.92, Economic reparations means consumers will have purchasing power.
311.24,314.8," Hence, foreign investors won't stop at just setting up low-cost supply chains."
315.04,318.22," Rather, they'll set up businesses and invest in the growing economy."
318.22,323.6, This sparks job creation and lessens the economic burden of the state when FDI contributes towards growth.
323.86,329.84," But without economic reparations, we think opposition creates a unique vulnerability in africa as prolonged destitution"
329.84,334.96, means they're more prone to the outbreak of things like conflicts disease and death the lack of
334.96,340.16, resources exacerbates existing social ills and is insufficient to create any meaningful impact
340.16,351.66," before i move on to the second argument sure i'll take point. In a post-colonial impoverished, largely backward economy like Africa, who creates all these jobs, has enough money to create healthcare and education, and how?"
352.44,358.48," So we think, first of all, if you're going to contest the lack of resources, that is a problem your side needs to deal with as well."
358.68,368.82," Because note that the implementation of rights is also contingent on resources. If you solely want to make this debate the fact that post-colonial African nations are broke and they have absolutely zero resources,"
369.04,373.78, your side cannot claim your benefits as well. Moving on to the second argument as to how civil
373.78,378.04, and political rights cannot be exercised meaningfully without new wealth. Three parts
378.04,382.42," here. The first, wealth inherently allows participants of a democracy to gain the"
382.42,390.0," political system in two ways. One, through lobbying. The financial elite and the state will collude to create an ecosystem of power at the top"
390.0,395.26, where political and economic favors are constantly exchanged. Companies that receive state subsidies
395.26,400.28," and contracts inevitably cement themselves as the dominant market force, and these newly crowned"
400.28,405.16, financial elite then fund political campaigns of the ruling parties to continue receiving these
405.16,409.64," favors. Note that this is a problem that exists within developed democracies as well, where"
409.64,414.4," political rights are strongly entrenched, like in the US, where lobbying actively undermines the"
414.4,419.96," public will. But two, we think meaningful access to free speech and association is impossible without"
419.96,424.64," money, because the financial elite who dominate mainstream media have excessive channels to"
424.64,429.52," exercise those rights, their platforms to shape public opinions in their favor and a greater"
429.52,434.48, influence in determining which parties and candidates get into power thus we leave you
434.48,439.76, not challenged the concentration of wealth the financial elite heavy chokehold on power what
439.76,445.04, keeps them in the driving seat of democracy is to keep others locked in an inescapable poverty trap
445.04,450.16," by the deregulation of industries, low wages, and low redistribution of wealth, which is exactly"
450.16,454.96, what we see in Africa today. But the second part of this argument is how economic oppression is in
454.96,459.84," the heart of African suffering, and political rights uniquely fail to alleviate it. Because"
459.84,464.96," the lack of economic enfranchisement means that while segregation may be abolished on paper,"
464.96,469.46," it's purely tokenistic, because Black South Africans stay trapped in slums because"
469.46,474.42, they simply do not have the resources to move elsewhere while white Afrikaners prosper across
474.42,475.76, city lines.
475.76,479.24, That is the world of modern apartheid that opposition stands for.
479.24,483.44, We think therefore money is the prerequisite for the state to enshrine rights because when
483.44,489.0," faced with limited resources in a nation's coffers, the state has no choice but to trade off certain rights."
489.26,494.12," In those instances, the wealthiest actors who have the largest political say get their rights paradise."
494.26,502.12," Finally, we put power back in the hands of people by giving them wealth, because disposable income empowers individuals to make their political opinions impactful."
503.02,505.5, They're able to fund campaigns and signal their strength
505.5,507.8, to governments because it cements their influence
507.8,509.54, as an important voter block.
509.54,512.48, Hunger rings louder than any political promise.
512.48,515.22," On opposition, they hand the impoverished words,"
515.22,517.2, we uniquely grant them the ticket to survival.
517.2,518.44, I'm so proud to propose.
521.32,523.28, I think the first prop and my first stop.
528.0,553.68," Just a second. Just setting up a timer. Hey, can I just confirm that you all can hear and see me okay?"
553.68,554.68, Perfect.
554.68,561.4, I'll be taking POIs verbally.
561.4,570.0," So yeah, just I will think I'll see it in chat okay starting in three two one"
570.0,573.92, on opposition we're going to prove three things in this debate firstly how we lessen ethnic conflict
573.92,577.6, secondly why democracy is far better than reparations and thirdly i will tell you how
577.6,582.32, we get far better fdi access before that i just want to be incredibly clear on what the enshrining
582.32,588.32, of civil and political rights actually looks like. It looks like ensuring free and fair elections. It looks like having these elections
588.32,592.0, being fair in terms of the election watches there. It looks like lobbying restrictions from
592.0,596.64," companies, for example, because look, coding this in constitutions allows like citizen positions,"
596.64,601.12," for example. Understand this, this is not a four-year thing, right? It's not you voting"
601.12,605.22, every four years. It's a formal culture that's in present. Why is this likely to be done well?
605.5,608.9," Firstly, I want to be clear that most people want to work together because they have a"
608.9,612.92," common interest, i.e. the narratives of the country, the narrative of independence, the"
612.92,614.08, right to self-government.
614.14,614.9, But not crucially.
615.22,621.04," In response to the POY state that this thought asks them, I think that NATO, the UN, and"
621.04,623.7, international treaties are likely to be far greater on our side of the house.
623.78,646.42," And they're exclusive because of the fact that the country is seen as being interested in democracy on their side of the house is one is starting present The first thing I noticed the process of redistribution of like,"
646.54,650.06, or it's going to be like economic operations likely involves things like
650.06,652.0," being dictatorial, like at least, right."
652.12,654.68," If a government, for instance, is all the power and all the resources and"
654.68,656.32, determining how land is distributed.
656.48,659.66, I think they have the ability to give a lot of these land to their friends.
659.66,661.66," They have the ability to do things like cement the dominant,"
661.82,669.28," that their power in some way, for instance, like this happened in Singapore in singapore right okay first argument then how does proposition increase ethnic and political"
669.28,673.52, violence the first thing i note here is that most african countries and nations just have
673.52,678.56, sign they just have like extremely diverse religious parties in general they're incredibly
678.56,682.72, diverse post colonization why because i think the british and french often like actively
682.72,689.88," brought different ethnic groups from their areas and they colonized in order to do things like mine certain precious minerals, for example, or do things like set up railways."
690.2,698.92," Right. Therefore, they needed like large labor pools in that sense. But secondly, I think they wanted to divide and conquer policy so that different minorities could not just unite and rise up in protest against them."
698.92,708.78," And I think that's why they drew borders arbitrarily. Now, here's the thing. Given that most African states are thus multi-ethnic, the failure to truly enshrine democratic rights means that there's going to be far more conflict"
708.78,712.48," between these tribes. Understand how this undercuts a lot of the proposition material,"
712.74,716.22," because to the extent that, let's say, reparations are somewhat helpful, the point of which there's"
716.22,720.36, some sort of conflict means that there's going to be significant economic harm as well on their
720.36,725.2," side of the house. Now, note, why is it going to be hard because like look i think the"
725.2,729.52, failure literally means that you're literally taking away money from that say one tribe and
729.52,732.96, giving that money away from the other tribe it looks like giving taking money from the
732.96,736.88, virtues and giving it the tootsies for example the reason you have this incentive is because
736.88,741.12, the right to let's say the because like right after you become independent you want to get
741.12,748.0, resources right you want to help your loved ones in your in these oppressed tribes but also you don't have like greater tensions until like the negotiation
748.0,752.96, processes actually get ugly let's be clear on what happens on the comparative firstly i think we get
752.96,756.96, far more that we can like power sharing agreements on our side between the majority and minority
756.96,761.68, tribes a lot more because democracy itself involves this process of negotiation to figure
761.68,767.9, out the best way to represent people it It looks like the majority and minority tribes are getting different areas of land and redistribution
767.9,771.36, of natural resources between these tribes because they have that common agreement to
771.36,774.18, help ensure the democratic right to vote is within people.
774.18,776.14, Why is this so much better than their side of the house?
776.14,780.18," The first thing I note here is it involves better relations, no thank you, between parties"
780.18,783.34, and incentives for them to portray these relations with their populace.
783.34,786.0, It looks like keeping each party in check with regards to abuses.
786.0,792.0," That is to say, if one party abuses against their people, for instance, the other tribe can do more to show how they're better."
792.0,801.0," In that sense, I think it also incentivizes each party to give reparations and economic goods to those people on the ground, because there's a ways to the top."
801.0,808.8," Look at the implication here, panel. This literally coop see a lot of population benefits on that sense secondly even if like power sharing agreements"
808.8,813.12, you have shared like the unifying narrative of the government is like really important here right
813.12,817.6, because this is when you look at like the unified this is literally when you like look at the
817.6,821.68, unified history right one of your independence like how you have the right to democracy right
821.68,828.32, the right to self-govern this is better because the narrative is far better because it forces tribes to focus on the common goals either way
828.32,832.24, panel on proposition side there's backlash there's backlash from different stakeholders
832.24,836.0, in post-colonial african states in the case of reallocation of resources from one ethnic type
836.0,840.64, to another the fact that they're like long years of tribalism it means that it's far worse and far
840.64,848.72, harsher because i think like you would refocus on who would come into power right as a result it's going to be less accountability on their side of the house you literally internalize
848.72,853.12, racist narratives what are the impacts of this the first thing is this is a significant decrease
853.12,857.16, in conflict on our side of the house because it involves fewer people notice how bad propositions
857.16,861.66, world is oftentimes these communities get closer to each other and they can be impoverished the
861.66,867.58," fighting that erupts on their side of the house looks like skirmishes between people on the ground. It looks like the destruction of their own houses,"
867.84,872.04, further impoverishing them. This strips away a lot of their economic benefits in the first place.
872.32,876.96," Before I move on, sure. Your argument on preventing ethnic conflict is contingent"
876.96,881.14, on political participation. But if people are still suffering tangibly because their economic
881.14,886.48, needs aren't fulfilled on your side of the house. They simply don't have the time nor the resources to engage in politics.
887.12,893.06," The first thing I note here is that, look, we literally give you two reasons as to why people are incredibly likely to be participating here."
893.28,896.72," Why? Because there are father figure narratives, for instance, there's the narrative of independence."
896.9,900.38," I think on our side of the house, there is going to be political participation. I think that's symmetric."
900.72,904.22, The difference is the fact that there's going to be more conflict on your side of the house. Right.
904.4,906.98," But more crucially, never actually proved to us that you're going to get like fair"
906.98,911.48, redistribution in the first place. The summary of this argument here is that people fight a lot
911.48,915.82," more on propositions world. The fighting worsens the issues on their side. Second argument, I think"
915.82,919.46," this outweighs the majority of the proposition case, because I want to prove here why democracy"
919.46,923.58," is just far better than drug operations. At its most basic level, I think the right to choose"
923.58,925.28, is a prerequisite to utility.
925.28,927.28," Because note, at the point of a nation democracy,"
927.28,928.74, a lot of people have similar wants.
928.74,929.36, They have food.
929.36,929.78, They want food.
929.78,930.44, They want income.
930.44,932.06," They want infrastructure, et cetera."
932.06,934.2, Given that the outcome of the prioritization
934.2,936.02," can be uncertain to an extent, I think"
936.02,939.12," the fact that we get things like more economic and more systems,"
939.12,941.3, the fact that we can ensure longer term structures
941.3,943.64, for politics in general is far better.
943.64,950.08," For example, the right to protest if on their side of the house like these like reparations can be redistributed to wealthy people"
950.08,954.32, only i think this is entirely possible right i think on our side the fact that you can at least
954.32,958.88, protest and get your point of view heard is essential to fixing such kinds of policy moreover
958.88,963.36, the ability to have a true democracy is what ensures policies in general are like far better
963.36,965.12, notes here democracy fosters
965.12,969.04, a culture of transparency and information spreading because it asks for criticism and
969.04,972.96, ideas and checks and balances within the government as a result i think we're far better
972.96,977.36, in this debate panel because we prevent against the worst forms of harms that accrue on site
977.36,982.88, proposition what is the way off here i think we prioritize like the worst forms of harms or the
982.88,985.52, greatest benefit here as the worst harms actually
985.52,989.3, involves like taking away people's rights right there's a simple intuition pump here this is why
989.3,994.22, you like having moral duty to not kill somebody but you do not have a moral duty to do like to
994.22,999.0, give charity to that person notice here voting every four years is quite insufficient you need
999.0,1003.44, the vigor of culture of petitions you need town halls but the second thing i know here and this
1003.44,1006.02, is like this is unpreemptive in general coming
1006.02,1007.02," from proposition, right?"
1007.02,1010.2, I think it's quite clear that money can be stripped away in the future.
1010.2,1014.06, The ability to have a free and fair election and press is literally what guarantees stability
1014.06,1015.06, on the other side.
1015.06,1016.06, Why is this the case?
1016.06,1018.96, Know that future unaccountable politicians can also be in place.
1018.96,1022.94," Like they can put bad economic policies, for example, they can be inflation, they can be"
1022.94,1026.28, political instability that can make your plot of land literally worthless
1026.28,1027.28, on their side of the house.
1027.28,1029.26, The ability to vote is what ensures
1029.26,1030.72, politicians fix these issues.
1030.72,1032.7," Why is democracy so certain, on the other hand?"
1032.7,1034.22, It's because people have similar goals.
1034.22,1036.36, They have similar policies when nation building.
1036.36,1038.78, They stop government abuse on our side of the house.
1038.78,1040.7, They can vote for basic infrastructure bills.
1040.7,1042.24, The leaders on the opposition's world
1042.24,1043.74, are not necessarily going to be that great
1043.74,1048.96, with economic policy in the first place. And this just rebuts a lot of their case as well if leaders
1048.96,1053.04, of such movements have like better experience and knowledge from canvassing and setting up ballot
1053.04,1056.72, boxes because they're often indulging this in the first place they researched these methods
1056.72,1059.76, i think they're far better on our side because on their side they don't necessarily have that
1059.76,1064.16, good experience with economic redistribution in that sense we're better on our side of the house
1064.16,1066.72," because you get far better policy, we help these African nations."
1071.04,1073.6, I thank the first top speaker and the second prop here.
1076.24,1077.76," Hi, can I check that I'm audible?"
1080.0,1091.2," Okay, great. I'm gonna take PO pois verbally so just unmute yourself"
1099.68,1106.8, starting in three two one it seems like a no-brainer at face value panel that we are the black majority if we all had one vote we would control and gain the system. Namibia's largest racial
1106.8,1111.7," group, the Ovambo people, which is half the population, and Black South Africans, which are"
1111.7,1117.42," two-thirds of the population, are statistically in status quo the poorest and the most ill-treated"
1117.42,1123.34," individuals in their homeland. In Namibia's capital and financial hub, Windhoek, not only are most"
1123.34,1125.12," businesses white-owned, but the whites"
1125.12,1129.22," overwhelmingly live in the heart of the city, while the Ovambo people and other racial groups"
1129.22,1134.42, live in the outskirts or outright slums. Was this the will of the people? Was what opposition
