start,end,text1139.06,1143.04," to cater to the specific needs of these minorities in status quo,"
1143.04,1145.96, they often become the swing vote in parties where it's very
1145.96,1148.14, interlocked inside the parliament. This means
1148.14,1149.9, that we can at least make compromises
1149.9,1152.1, and some changes on our side where their
1152.1,1154.06," side is uncomparative. But fourthly,"
1154.32,1156.2, I want to deal with this backlash argument that came
1156.2,1158.2, out in the last 30 seconds of their speech.
1158.86,1160.44," Firstly, I am unclear"
1160.44,1162.18, by the end of the first opposition
1162.18,1164.1, speech on why vote is the tipping
1164.1,1165.86," point for such a big backlash, right?"
1166.16,1170.22, Backlash already occurs in the most populist or the most discriminatory countries in status
1170.22,1170.44, quo.
1170.68,1174.44, Giving them the vote actually minimizes the harms that will come to these people at the
1174.44,1177.98, point in which they can vote against those people who are racist and discriminatory.
1178.26,1181.88, I am unsure why the marginal increase in the backlash that will get on their side is so
1181.88,1182.32, significant.
1182.6,1190.06," Dames will provide an explanation on that later. But second, backlash often occurs because the absence of a voting power"
1190.06,1192.08, is the cause of that legitimization.
1192.38,1194.86," At the point in which you say, these people deserve to vote"
1194.86,1197.96, because they're just equal and as legitimate as citizens
1197.96,1200.3," for giving back to the state the same as us,"
1200.3,1204.02," that's the point in which the bullets, the ammunition behind these"
1204.02,1205.86," populist rhetoric and backlash diminish. Second question then, what's the point in which the bullets behind, the ammunition behind these populist rhetoric and backlash"
1205.86,1208.02," diminish. Second question then, what"
1208.02,1209.84, is the vote? We told you
1209.84,1212.1, that the vote isn't an inherent right.
1212.34,1213.82, That it's a proportional right.
1214.22,1215.9, It depends on the amount of
1215.9,1217.74," investment, the amount of trust,"
1218.02,1219.98, the amount of benefit that you give back
1219.98,1222.14, to your country. This was conceded
1222.14,1223.92, when they answered
1223.92,1225.9, the POI about dual citizens.
1226.2,1228.06, The fact that dual citizens are invested in both
1228.06,1229.78, countries means that we give them the right to vote.
1229.94,1231.96, The fact that migrant workers have lived in the country
1231.96,1233.98, for six months and plan to live in that country
1233.98,1236.02, for longer years means that they're also invested
1236.02,1237.52, and we give them our trust.
1237.78,1239.86, They also concede this when they talk about Ohio
1239.86,1241.82, and another state like California.
1242.14,1244.18, The reason why we don't give Ohio residents
1244.18,1246.34, the provincial election vote in California
1246.34,1248.26, because they're not invested or they're not
1248.26,1250.34, living in California. But we would both
1250.34,1252.54, give them the vote for the national election
1252.54,1254.14," because it's a country's issue, right?"
1254.28,1256.42, Same thing here. What they can tell you
1256.42,1258.16," in response. They said,"
1258.52,1260.4," well, it's more"
1260.4,1261.6, long-term than that.
1262.08,1264.4, You won't get any benefits in the long-term.
1264.6,1268.56, And you need to have a more long-term stake in the country for your vote to actually be beneficial.
1268.88,1269.48, No thank you.
1270.2,1272.1, No explanation on why this is non-exclusive.
1272.42,1274.38, Current citizens often have a very short vision.
1274.68,1278.28," And they say, I want to vote based on what I will benefit off of."
1278.38,1281.32, What policy would benefit me and my family in the immediate sense.
1281.32,1286.02," But secondly, they never give us an explanation on why this business transaction relationship doesn't"
1286.02,1287.94, mean that they all have an equal incentive to make sure
1287.94,1289.88, that that country prospers. Any
1289.88,1291.86," logical person would say, if I'm conducting business"
1291.86,1293.96," in that country, and I benefit economically from that"
1293.96,1295.8," country, it is in my best interest to say"
1295.8,1297.72, I want that community
1297.72,1299.72, to welcome me in the future when I need money
1299.72,1301.76, and I need to work in that community. That's why
1301.76,1303.68, the business transaction that they
1303.68,1305.56, taint as so toxic on their side
1305.56,1306.5, is not actually that bad.
1306.64,1306.94, Go ahead.
1307.34,1309.38, If some person contributes more
1309.38,1311.36," within six months time period,"
1311.48,1312.7, why would you force them to say more?
1313.48,1316.22, Because we at least want some proof of investment
1316.22,1318.14," and trust in our country, right?"
1318.18,1319.48, We think that's a reasonable criteria
1319.48,1321.24, that we give to any other immigrants
1321.24,1322.2, who are trying to become citizens.
1322.46,1323.92, I pass that process too.
1324.3,1324.9," Third argument,"
1324.9,1327.22, how we politically empower our own citizens.
1327.6,1329.96, This is an extremely important argument in the context of this debate
1329.96,1331.18, because we take them at their best.
1331.54,1333.68, Their actor that they prioritize is our own citizens.
1333.68,1336.76, And we actually benefit the most vulnerable of our own citizens
1336.76,1339.06, when we give non-citizen migrants our vote.
1339.32,1339.6, Why?
1339.82,1341.4," Because we say that their interests,"
1341.74,1344.86," the poor and the ethnic minorities of our own citizens,"
1345.24,1350.44, and the interests of these non-citizen migrant workers often align so that they benefit off
1350.44,1354.64," of each other. What does this look like? One, raising minimum wage and improving job security"
1354.64,1358.82," laws so that basic income for these people go up. Second, cheaper healthcare and more"
1358.82,1363.76," accessible educational options. Third, stronger enforcement of non-discrimination laws that"
1363.76,1369.24," prevent employers from hiring based on race or ethnicity. Fourth, more social welfare in general such as food stamps."
1369.56,1375.1," Five, price caps on rent or subsidized or allowances for low-income families. Six, more"
1375.1,1380.24," accountability for police bias with incidents like police brutality. Seven, cheaper transportation"
1380.24,1386.18," and public transport to go by. But eight, more language opportunities and programs provided for free so that they can"
1386.18,1389.1, access services in those languages more.
1389.1,1393.72, What is the mechanism by which we get these policies to go through?
1393.72,1398.52, Notice that oftentimes the poor and ethnic minorities in our own countries are disenfranchised.
1398.52,1402.44, That means that we need a bigger voting body to vote for the same interests for us to have
1402.44,1408.78," an increased chance of those policies passing. What does that look like? One, when you have a larger voting body, you're more likely to"
1408.78,1412.96," have a party that directly caters to you. And even if it's only a minor party that's being created,"
1413.18,1418.78, they often provide a swing vote in the parliament that is incredibly beneficial for these people.
1419.02,1423.84," But second, parties often gain a larger voting base. And this is extremely crucial in especially"
1423.84,1425.48, countries that have a bipartisan system
1425.48,1426.52," where there are only two parties,"
1426.72,1429.42, and they have an incentive to actually garner under them
1429.42,1431.4, the biggest voting base that they possibly can.
1431.62,1434.18, So when the disenfranchised groups in our society
1434.18,1436.68," have a much larger voting base just in terms of numbers,"
1437.02,1438.62," even if their voter turnout is lower,"
1438.9,1443.08, even if there is biases against them in the political system
1443.08,1445.6, that hinders them from giving their political voice out.
1445.78,1447.56, The fact that these numbers multiply
1447.56,1449.64, means that their political voice is improved.
1450.18,1452.22, Why is the vote a unique mechanism to do this?
1452.46,1454.42," Firstly, because when we give them the vote,"
1454.5,1456.2, we're saying that you deserve the trust
1456.2,1457.3, in our government systems.
1457.52,1459.02, And that trust is often given back
1459.02,1460.7, in things like reporting more crime
1460.7,1463.04," when this might harm our own citizens too,"
1463.24,1466.82, or reporting when these policies that we support on our side aren't properly enforced.
1467.04,1470.88," But secondly, the vote is the most sustainable way that we can change these policies."
1471.28,1475.38," Even if changes happen sporadically on their side, they always have to rely on the goodwill"
1475.38,1477.74, of politicians to randomly do these things.
1477.88,1482.3," When political changes happen in tidal waves that benefit or disenfranchise these people,"
1482.52,1486.96," when we give them the vote, that means that these policies are the most sustainable and the most trustworthy"
1486.96,1487.8, for these people.
1487.8,1489.66, We want to benefit the non-citizen migrant workers
1489.66,1491.46," who are disadvantaged on our side,"
1491.46,1492.88, but we also take them at their highest
1492.88,1494.6, and say that the power to vote is people
1494.6,1496.1, who are invested in our country.
1496.1,1496.94, Thank you very much.
1500.28,1502.74, Our burden in this debate has been quite simple.
1502.74,1509.66, That these migrant workers haven't really been in such a horrible state as they paint them to be.
1509.96,1513.02," But even if they are, their policy leaves them worse off."
1513.44,1517.62, But we've gone one step further and given you principles as to why they shouldn't have this right to vote.
1517.62,1523.94," They have tackled only one of these nuances, one of these three layers of principles that we have given to you"
1523.94,1529.0, and expected that that would bring down the entire principle case from our side.
1529.0,1537.0, First point of argumentation from that side was that state benefits directly from these migrants and especially in countries where they depend a lot on these migrants.
1537.0,1548.56," So we should give them votes in return. The problem is that whether or not you are benefited is not a metric on which you give people votes. That is to say, if that were really true, would you give votes to foreigners who give charities"
1548.56,1552.48, or people from other countries who give foreign aids?
1552.48,1557.52," If that were really true, then all those people who are beneficiaries to your state would also be given votes."
1557.52,1561.76," But the problem is that we don't, because metric is never the benefit."
1561.76,1566.58, It's how much the state can coerce you and your lives with that vote.
1566.84,1572.28," That is to say, how much the state's policies can impact you with its decisions in the long"
1572.28,1576.92," run. They have never tackled enough about how state's policies impact these people,"
1577.16,1582.52," at least to the extent that common citizens are impacted. But secondly, if the states"
1582.52,1588.6," get benefited by their labor force to the extent that they, no thank you, paint them to be, we think that in exchange it should"
1588.6,1593.52," rather give wages. And that's exactly the transaction, right? These people work in these"
1593.52,1597.9," countries, give them their labour, and therefore they get wages in return. I don't see why"
1597.9,1601.48," you have to have votes in which you can have say in foreign policy making, in which you"
1601.48,1605.52, have to have say in monetary policies and etc. Many
1605.52,1610.44," of which have nothing to do with you. So the transaction, the reciprocity that their entire"
1610.44,1614.94, case rests upon doesn't necessarily exist. No thank you. Then they tell you that we need
1614.94,1619.62, to give them votes to alleviate these people because they are genuinely denied of their
1619.62,1624.58," rights. First of all, the number of people, the number of migrant workers in these countries"
1624.58,1625.0, are often very small.
1625.0,1627.0, I don't see why they are the tipping point.
1627.0,1632.0," So for instance, even in countries like USA, which necessarily does have a lot of migrant workers,"
1632.0,1638.0, aren't having people enough to the extent that they will break down the deadlock between Democrats and Republicans.
1638.0,1644.0," Especially because even in USA, the Republicans have like 450 seats in the Congress and Senate,"
1644.0,1646.02, where the Democrats have just like 150.
1646.48,1649.86," Which is to say that the balance necessarily, the debt lock doesn't necessarily get broken."
1650.16,1654.44," But secondly, in most countries, the margin isn't small in the first place."
1654.66,1658.1," In most countries, especially with the rise of frightening populism,"
1658.38,1661.08," the fact that most people are victims of demagoguery,"
1661.08,1667.8," where they feel that these migrants are taking away most of the things that we deserve, are taking away what belongs to us. We think most of"
1667.8,1672.9," these people are inclined towards voting right-wing parties,"
1672.9,1679.8, so I don't see why these migrants who constitute at max 1-2% of the population will change all of that.
1679.8,1687.16," But secondly, in states, no thank you, where the migrants are majority, we think there is already an incentive for the states to cater to these migrant workers."
1687.48,1688.38, Why? Two reasons.
1688.68,1691.56," A, because if these migrants aren't, you know, catered to,"
1691.82,1694.34," in the sense that they are denied wages and labour rights,"
1694.6,1695.66, they go out and protest.
1695.96,1699.86," And because they are a majority, those protests make the society in a lot of cases vulnerable"
1699.86,1703.36," to the extent that the people in those countries, the ones that have the voting power,"
1703.72,1705.6," have forced the governments to cater to them. But secondly, no those countries, the ones that have the voting power, have forced the governments to catch them."
1705.8,1711.12," But secondly, not only that, regions that have migrant majority are probably states that respect these labour rights"
1711.12,1714.3, because that is exactly what brings those migrants in the first place.
1714.3,1720.62," If these regions didn't catch them, most of these migrant workers would fear the fact that their lives in these states"
1720.62,1726.0," would be unsafe to the point that the returns of like the returns of the labor, do not overpower all of that."
1726.0,1735.0," But thirdly, local governments, we think in states with minority migrants, the only way to affect the local government is by bringing changes in the federal government."
1735.0,1746.0," But the problem is that, where do these migrants usually go to? They go to smaller states which are less economically consolidated, which means they depend on labor more than capital."
1746.0,1750.0, That's to say states like Louisiana and Massachusetts.
1750.0,1755.0," The problem is that these states already have less seats in the Congress,"
1755.0,1763.0," which is to say, even at their best case scenario, if you do take up a say in the decision making process,"
1763.0,1767.44," because you have less seats in the Congress, means that you do not necessarily impact to a great degree"
1767.44,1770.68, what the federal government wants to endorse as policies.
1771.02,1773.94," So I don't see in conclusion why all those benefits that you want,"
1774.24,1775.04, they happen on your side.
1775.3,1778.22," But first of all, that characterization is false in the first place."
1778.4,1781.16, Because migrants aren't really that vulnerable to exploitation.
1781.28,1782.0," Before I move on, yes?"
1782.32,1788.0, The average citizen is not affected by what our countries have to do with Russian foreign policy.
1788.0,1790.0, Should they have the right to vote on those issues?
1790.0,1798.0," If the country imposes sanctions on Russia, probably your ability to trade with those countries gets hurt."
1798.0,1800.0, Your ability to go to those countries gets hurt as well.
1800.0,1813.88," I don't see why those impacts happen, like, you know, don't necessarily boil down to these people. But most importantly, those foreign policies hit, like, you know, necessarily impact your economic fabric a lot to a greater degree than these minorities, these migrant workers ever get impacted."
1814.16,1817.32," But first of all, the incentives behind the countries catering to them."
1817.54,1821.42," First of all, it's the fact that, you know, relations with other countries do exist."
1821.74,1828.48, The repercussions don't only come from those countries that these migrant workers come from. The repercussions also come from the trade blocs that these
1828.48,1833.64," countries are in. For instance, if you are a country that is in the European Union, if"
1833.64,1838.54," you deny the rights to workers, even from an economically, you know, weaker country"
1838.54,1843.06," like Greece, the problem is that it's not only Greece who has a bargaining chip to attack,"
1843.3,1849.7," like, you know, have repercussions on you. The entire trade bloc gets on the bandwagon and tries to impact your ability"
1849.7,1854.08," to get the benefits from the trade bloc. But second, the fact that Labour Party and Democrats"
1854.08,1858.72, who already recognize that labour rights should exist have an incentive to cater to them because
1858.72,1867.24," that is the exact ethics and morality that they bank on for votes. But last of all, we think that if you want to catch these people,"
1867.62,1869.06, your policy makes it worse off.
1869.3,1869.94, Why is that so?
1870.18,1871.94," Because in the vast majority of cases,"
1872.3,1874.8, your policy brings backlashes to these people.
1875.08,1877.84," If these migrants get votes, their lives get threatened."
1878.12,1878.32, Why?
1878.5,1880.98, Because already citizens feel that their people from other countries
1880.98,1882.36, are hijacking too much from them.
1882.66,1884.8," Their national identity, their ability to get jobs."
1884.8,1885.0," The moment in time you give them votes and have a concrete say in the decision-making process, The people from other countries are hijacking too much from there. Their national identity, their ability to get jobs."
1885.0,1889.4," The moment in time you give them votes and have a concrete say in the decision making process,"
1889.4,1891.0, they feel more hijacked.
1891.0,1893.5, That is when they tilt towards right-wing populist parties
1893.5,1896.3, and therefore you make the society unsafe for them.
1896.3,1897.8, But even that does not happen.
1897.8,1901.9," They are worse off, don't thank you, when they see that the state is not welcoming towards them."
1901.9,1902.8, That is safe.
1902.8,1906.58," When they see that the state's, their ability to live a safe life in the state is to a towards them. That is safe, when they see that the states, their ability to live a safe life in the states"
1906.58,1908.62," is to a great degree lesser,"
1908.62,1911.2, they feel unwilling to go to these countries.
1911.2,1913.6," So if they don't find jobs in their own countries,"
1913.6,1915.5," they feel unwilling to go to these new,"
1915.5,1917.5," the other countries, which means even economically,"
1917.5,1919.46," they're to a great degree lesser,"
1919.46,1921.88, to a great degree left with less choices.
1921.88,1924.24," So both points, their life in the states"
1924.24,1926.14," and in terms of economics, they are higher. But both points, their life in this state and in terms of economics"
1926.14,1927.96," they are hurt. But more importantly,"
1928.06,1930.44, we think states hold rights to citizens and only citizens.
1930.74,1932.16, Why is that so? It is because states
1932.16,1934.4, have a right to command you and your citizens
1934.4,1936.22, and thus you should have a reciprocal power
1936.22,1938.0, over the state. The state has a right to
1938.0,1940.26, conscript you. The state has a right to endorse
1940.26,1942.22, subpoena system where they can force
1942.22,1944.24, you to come to a court and provide evidences
1944.24,1948.56, as a witness. They can financially incentivize you to do certain things for the state that
1948.56,1953.64," even in aging countries, they can financially incentivize you to take up children. These"
1953.64,1958.54, are ways in which the state practices commands and coercion on citizens but not on immigrants.
1958.8,1967.0," If the level of state coercion is so imbalanced, migrants should not have the right to reciprocate all this with the same power over the state"
1967.0,1975.0," as any citizen would have had the say because they, to a great degree, are not having the same amount of impact."
1975.0,1983.0," It is not only the wrong equivalent they are standing for, but also a denial of rights to those citizens who deserve to have greater say."
1983.0,1986.0," Within states has special obligations towards its own citizens,"
1986.0,1988.0, and we are not willing to deny all of that.
1988.0,1991.0," Even if these migrants are worse off in our world,"
1991.0,1996.0, we think in the long run their lives in these states are not as horrible as your policy wants it.
1996.0,1998.0, We are very proud to oppose.
2001.0,2004.0, It was a poor strategic move on the part of the opposition
2004.0,2006.82, to try and undermine the plight of migrant workers
2006.82,2009.68, and pretend that that means that they should not have the right to vote.
2010.0,2015.16," The reality is, in America, there are migrant workers from Central America who are being paid less than minimum wage."
2015.16,2020.16," In Hong Kong, there are Filipino workers who are working in structurally dangerous conditions"
2020.16,2023.34, where their factory may be set on fire each and every day.
2023.72,2029.06," And in Southeast Asia, there is a coercive, phallus sponsorship system where people have absolutely no means of legal"
2029.06,2029.52, recourse.
2029.88,2033.46, This screening is so important because they have to engage with the reality of the day-to-day
2033.46,2034.82, oppression that migrant workers face.
2034.82,2039.16, It is not enough for them to try and outweigh all the benefits of the vote with bad push
2039.16,2043.02, when we see that the vote is the only mechanism to try and change the structural oppression
2043.02,2044.96, that migrant workers face on a day-to-day basis.
2045.0,2047.0, I'm going to look at this debate under a couple themes.
2047.0,2050.0," Firstly, should migrant workers have the principled right to vote?"
2050.0,2053.0," And secondly, what are the tangible impacts of the vote?"
2053.0,2057.0," Starting with the first theme, should migrant workers have the principled right to vote?"
2057.0,2063.0, And note that the framing presented by our first speaker that this argument exists independent of utilitarian impacts has never been tested.
2063.0,2065.12, So if I can prove that in principle
2065.12,2066.46," these workers have the right to vote,"
2066.52,2068.32, then we can win this debate in a state.
2068.84,2069.92, We get a couple of main claims
2069.92,2071.7, as to why migrant workers should not have the right to vote
2071.7,2072.56, on their side of the house.
2073.04,2073.92, The first thing that we get
2073.92,2076.02," is some nationalist conception of citizenship,"
2076.38,2077.64, which is effectively an assertion
2077.64,2079.12, that your ancestors have lived in a country
2079.12,2080.78, and this is something that is important to your own identity.
2081.36,2082.44, A couple of responses to this.
2082.48,2085.36, So the concept of citizenship within itself is
2085.36,2090.08, inherently something that is a social construct as opposed to anything that holds any kind of moral
2090.08,2094.72, value. We can see this through the fact that citizenship within itself constantly fluctuates
2094.72,2099.36," between states and between the policies at stake independently passed. For instance, we have things"
2099.36,2104.24, like dual citizenship that they themselves perceive as something that is good. When we have a refugee
2104.24,2108.2," who enters into a country, we often give them citizenship, even though their skin"
2108.2,2111.58," may be a different color, and their ancestors have not lived in that state for an extended"
2111.58,2115.64," period of time. So ultimately, this shows that some kind of assertion about citizenship"
2115.64,2119.82," doesn't hold any moral value in this debate, and the claim of ancestors is illegitimate."
2120.34,2123.74, The only other claim that they really had is that migrant workers tend to vote on a
2123.74,2127.48," short-term basis, and thus, they should not have a seat within the democratic process."
2127.48,2128.6, A few responses to this.
2128.6,2133.96," So first, short-termism is endemic to any kind of voting that is going to exist within a democracy."
