start,end,text
0.0,19.96," In the war against injustice, it can be all too tempting to demoralize the enemy with"
19.96,23.12, cannons of vengeance and bullets of hatred.
23.12,28.5, But this war must be fought with kindness and understanding.
28.76,32.26," Therefore, the criteria on which this debate must be adjudicated on"
32.26,36.3, is whether we can prove how call-out culture in its way has manifested
36.3,40.68," as counterproductive and toxic, something we should clearly regret."
40.98,42.24, Two arguments in my speech.
42.24,45.62," The first is why call-out culture is principally unjust,"
46.04,50.76," and the second, why call-out culture is counterproductive in a general sense. But before"
50.76,56.72," that, what do we support on proposition? We support any and every action to combat worth and need"
56.72,62.56," without the presence of rage and hatred, without the need to strip people of their dignity in a"
62.56,65.66, public setting and inflame issues even more.
66.14,68.62," Therefore, we will push for call-in culture."
68.98,72.82," As the name suggests, we will have private discussions and non-targeted messaging"
72.82,77.36, that promotes cohesion instead of the misgivings of people.
77.36,82.4," This materializes by pushing more literature on contentious issues like mental health,"
82.68,90.0," like racial disparities, to make it clear in the public consciousness that certain things are categorically harmful."
90.0,95.1," Moreover, since this is a regret motion, we would prioritize campaigns, better education,"
95.1,101.0," social media platforms, the efficacy of all of this severely diluted by this call-out"
101.0,104.0, culture that opposition must defend.
104.0,106.34," Thus, we will also prove how, in retrospect,"
106.92,109.62, individuals would have been much more receptive to these things
109.62,114.64, without all of this call-out culture existing in the first place.
114.64,119.02," The first argument, why call-out culture is principally unjust."
119.32,122.22, It is important to recognize that no one in this world
122.22,126.4," is born racist, sexist, or discriminatory. For"
126.4,130.92," those that grew up and deployed a bunch of offensive language, it's likely they grew"
130.92,137.4," up in a world of ignorance, a world of indoctrination, and negative experiences. Three examples."
137.74,142.88," The first is for negative experiences, someone who grows up sexist may have had bad experiences"
142.88,148.16," with women, associating these issues on a micro sense with the macro sense of women in general."
148.16,153.7, The second example is bullies are more likely to come from broken homes
153.7,156.44, and lack of constructive parental supervision.
156.98,160.84," Thus, they thrive on the fact that they need security and satisfaction"
160.84,164.9, that would be sadly missing within their contracts of their homes and their schools.
165.26,165.78," No thank you. Thirdly, the richer members of society would be sadly missing within their contracts at their homes and their schools. No thank you."
166.12,171.76," Thirdly, the richer members of society would be ignorant of the effect of acute struggles of people in poverty,"
172.16,175.3," in struggles that they would not have to associate with on a day-to-day basis,"
175.66,177.76, and thus are more likely to deprioritize these issues.
178.84,180.94, What do these three examples illustrate?
181.08,185.1," In all these instances, when someone commits an offense there's"
185.1,190.1, always a story behind it. A story where perpetrators are victims and when
190.1,195.12, society itself has failed them from the start. The impact of all of this is that
195.12,201.24, call-out culture exclusively ignores the nuances of all the analysis I've got
201.24,205.56, earlier on. Therefore the offense is viewed with the lens that people
205.56,210.44," that commit these crimes, or commit these actions, are horrible and not someone that"
210.44,216.12, we should engage in the very first case. This makes call-out culture a disproportionate
216.12,221.44," response and over-punishes people that shouldn't be punished in the first place, or predispose"
221.44,228.26, biases that they have no reason to be called out for. The conclusion of this argument is the motives of people's actions
228.26,231.64, are independent of the outcomes of said actions
231.64,236.46, and does not justify discriminating against predispositions
236.46,238.2, like the ones highlighted earlier.
238.32,241.76," Before going on to the second argument about why the call-out culture is counterproductive,"
242.1,243.62, why are motives important?
243.74,245.12, These people aren't being prosecuted.
245.3,247.46, This is about regulating what we think ethical speech is.
247.82,249.54," So, at the point of which we've proved already"
249.54,252.18," that there's principally, we should not punish them,"
252.52,253.56," principally on this basis,"
253.94,256.28, why is call-out culture counterproductive
256.28,257.62," in terms of outcomes,"
257.82,260.0, and why the same change in opposition we're trying to prove
260.0,261.92, won't exist in their world?
261.92,263.38, The premise of this argument
263.38,264.92, of why call-out culture is counterproductive
265.62,267.86, is given there are reasons for people to act
267.86,269.46," in politically incorrect ways,"
269.76,271.94, the lack of nuance in colonial culture
271.94,273.84, is ineffective in dealing with
273.84,275.78, the problems that are so pervasive
275.78,277.58, in our society today.
277.86,279.78," Note when someone is called out, what are"
279.78,281.92, the realistic responses that we
281.92,283.84, see on side proposition? We see
283.84,285.04, two responses. The
285.04,289.42, first is that there are wide range of responses but the commonality in much of
289.42,294.64, the responses is that it is human nature to be defensive. It is human nature to
294.64,299.86, have our subconscious protect our own specific interests and the cost of other
299.86,304.9, people's interests. We have prioritized what we view as sacred over someone else.
304.9,305.8, So now that
305.8,311.32," call-out culture is done in public, we intentionally aggravate someone else. The defensive instincts"
311.32,317.6," within human nature come at an exponential rate, something that opposition has in their world and"
317.6,323.48," becomes the default in dealing with, for example, consultations and confrontations in their side of"
323.48,328.04, the house. They need to tell us why people would have this defensive instinct that would push them
328.04,333.56, to cross the line even further in certain instances. This means it's highly likely
333.56,338.9," that people now respond in kind, a downward spiral of malicious and"
338.9,344.54," over displays of aggression. Secondly, although call-out culture is effective in"
344.54,345.76, trying to silence
345.76,350.34," people, they don't always change or don't often change the opinions of the very same"
350.34,354.88," people that you call malicious, the very same people that are destructive in their world."
355.08,359.72," What is more likely is you're probably going to get accusations levied against them, but"
359.72,371.64," what happens is they rally together. Racists can now rally together and say that they are the victims of society, the point at which day after day they get abused online or threats on the street."
371.94,377.44," All of them rally together as victims, attacked by politically correct society that is going out"
377.44,386.1, of their way to make sure that they could have a viable chance in society. What is the clear harm of this? The harm of this is that a polarizing
386.1,392.38, effect is created with concentrated bursts of vile attacks being levied against each other.
392.72,398.62," So on the comparative, we see that racists get far more entrenched in their ways, the point at"
398.62,403.5," which there's a lack of engagement, that lack of constructive engagement coming from their side of"
403.5,409.0," power. All they want to push for is telling you that you're racist and you're a terrible person,"
409.0,411.0, someone that I should never engage with.
411.0,415.0, What we would rather support is coming out in a private setting
415.0,419.0, with the emotion taken away from it
419.0,423.0, and start engaging with constructive matters that will help both sides.
423.0,427.1, How does this specific issue improve in our world?
427.38,433.32, Communicating with people privately as objective as possible means that it's far easier for the
433.32,438.78," message to sink in. That either wrong may be committed, but it's less damaging to your ego"
438.78,444.68, if one person goes up to you and tells you that they felt uncomfortable. What do they have to
444.68,445.48, defend in their wars?
445.7,449.86, They have to defend the myriad of Twitter wars that go against specific individuals.
450.32,455.08, Individuals that are not likely to change because you're visibly attacking everything
455.08,457.18, they principally stand for online.
457.46,462.26," This looks like, on our side, people are more likely to apologize on specific issues."
462.26,466.82, Because apologizing is far more reachableable the point at which you don't
466.82,472.94, attack them and prima facie attack and prominent attacks as well. Their side needs to tell us why
472.94,478.0," people would ever want to change the point at which they know that they will be attacked,"
478.36,481.8," they know they'll be attacked in droves, and they know that they won't be engaged with."
482.18,487.0, That is the realistic comparative that side opposition needs to push up.
487.0,490.0," They cannot tell us that people will somehow be silent,"
490.0,494.0, the point at which a silent minority can come up and form a group
494.0,498.0," that can actively tackle the specific groups of other,"
498.0,501.0, the specific opposition that exists against them.
501.0,504.0, It is crucial to not fight fire with fire
504.0,508.0, when you're trying to reach a constructive solution. So proud to propose.
512.0,518.0, What Proposition just spent eight minutes telling you is that when there is a wildfire we shouldn't react with a more aggressive
518.0,526.9," weiner, we should use a cup of water and hope that the flames are going to be doused. We don't think that that's how life works. We think that minorities live perpetually hard,"
527.1,528.74," perpetually disenfranchised,"
528.9,531.06, perpetually stripped of their dignity.
531.54,534.06, And what often happens then is that we put the blame on them.
534.06,537.2, We tell them that you reacting angrily is the inherent problem
537.2,539.38, to why you keep getting disempowered.
539.84,540.78, You shouldn't be angry.
541.1,542.44, You shouldn't have feelings.
542.74,545.54," Instead, bottle your feelings, sit down with your perpetrator"
545.54,548.34," and just hope, hope, hope that you can get into them."
548.34,549.5," We don't think that that's fair,"
549.5,550.48," we don't think that that works,"
550.48,552.38," but beyond that, we think that call-out culture"
552.38,553.52, is the one way we can make sure
553.52,556.58, that minorities meaningfully get empowered.
556.58,558.92, Let's talk about what are gonna give results.
558.92,561.34, The case that we present to you is the following.
561.34,563.24, And essentially the criteria here is
563.24,565.86, when do we think we regret a means of social justice?
566.26,568.12, What I'm going to bring to you in my speech is why we think
568.12,570.06, pro-life culture is a legitimate form
570.06,571.9," of justice, but more why we think it's more"
571.9,573.62, effective in protecting minorities.
573.9,576.1, Because they misrepresent the aims of pro-life culture here.
576.36,578.16, Pro-life culture does not exist to change
578.16,580.18, people's opinions. It exists to get
580.18,582.14," them out of the public sphere, but it can keep"
582.14,584.14," harming people. It exists to keep them up,"
584.14,588.3," right? In the same way that sometimes you can see that you might not change someone who's getting a life sentence,"
588.52,592.66," but at the very least they are out of that society and they can't keep harming those people,"
592.9,594.54," the two examples of how great, right?"
594.76,595.64, So that's what I'm going to give you.
595.64,598.86, I'm going to bring you further in the second page is how we think that polar culture
598.86,603.66, is specifically impacting in terms of social interaction stretching beyond the specific minority.
603.66,607.48," But before that, let's first do some clear up, right? First in terms of social interaction stretching beyond the specific minority. But before that, let's first just do some clear up, right?"
607.74,613.12," First in terms of polar culture, because what they do here is conveniently pick the worst version of polar culture"
613.12,614.18, and try to force us to defend that.
614.36,616.48, We don't think that's what polar culture looks like.
616.84,619.76," We have to consider to a degree that polar culture has a lot of anger,"
619.88,624.22, and it has a lot of people who are essentially just angry about their situation.
624.22,627.26, They're not going to defend anything that they're justified in having that anger.
627.48,629.52, But we have to recognize that it exists on a spectrum.
629.86,633.08, It's everything from reporting someone on Instagram for an offensive post
633.08,634.4, all the way to that anger.
634.5,637.68, We don't think that people automatically just jump to that anger.
637.92,642.22, Important context is that it's often proportional to the harm that's been done.
642.22,644.28," So people say really bad things,"
644.48,645.34, like Milo Annapolis
645.34,651.22," saying that Grace Jones is a gorilla, are things that get very bad reactions. But some guy, like"
651.22,655.88," who we don't really know, saying I might not like black people, is not likely to get as widespread,"
656.24,661.18," as violent, as much of a reaction. Polar culture does not just exist jumping to the end of the"
661.18,665.14," spectrum. It works specifically in accordance with the harm being done, right?"
665.26,669.36," The second thing that they try to tell you, specifically in setup, is that they prefer a one-on-one interaction."
669.7,672.72," They prefer an amicable kind of way to reach a solution, right?"
673.0,675.68," We don't think that this is something that usually works specifically,"
675.88,680.68, because what often happens in that amicable solution is that people still believe that they are in the right.
681.0,688.4," That's what often happened with rape campaigns, when people were told that you probably shouldn't rape people, and that no, they're not asking for it, and it"
688.4,693.14, was essentially amicable pleading to end rape. It doesn't work. It has never worked. Rape
693.14,698.12," is still a massive problem, but specifically in light of all those protests, rape continued"
698.12,702.64," to rise, right? We think that these are problems that are indemnity perpetrators, and trying"
702.64,706.18, to appeal to them amicably doesn't deal with the fact that those problems are indemnity.
706.56,708.22, Now let's talk about the matter
708.22,709.96," that they give you. They tell you, firstly,"
710.14,712.08, that it's not justified
712.08,714.06, because you're attacking someone for their
714.06,716.02, predisposition over which they have
716.02,718.18, no control. No deal that they also choose to defend
718.18,720.04, the best of people who just don't
720.04,722.06, know what they're doing. At no point do they talk about
722.06,724.18, people who actually know that they might just hurt
724.18,728.26," all the black people in America with their words, right? But moreover,"
728.34,731.54," at no point do they tell us why this predisposition is something that's justified, right?"
731.54,735.76," We punish people for predispositions a lot. We punish people who are psychopathic for killing,"
735.88,739.86, even though it's not really your fault. And that's because we judge the harm of an action
739.86,743.72," on the harm itself instead of judge the perpetrator who did it, right? We think"
743.72,746.7, that it is just to judge on predispositions
746.7,750.7, because they bear as much harm as someone who could have been doing it on purpose.
750.7,752.2, We don't think that that argument is that.
752.2,755.0," But moreover, they try to tell you that it's counterproductive."
755.0,757.3, I'm already terrified how they misrepresented those aims.
757.3,761.3, I'm going to tell you why they specifically fulfilled those aims later in my matter.
761.3,762.5, But they give you two things here.
762.5,768.6," That one, it leads to a downward spiral of aggression where you can never get any good outcomes. We don't think this is true, right?"
768.6,772.6, We have to accept that in some instances that there may be aggression. But we don't know
772.6,776.6, what often happens that there's actual room for discourse. It looks like things like Trevor
776.6,781.0, Noah on The Daily Show saying that the Heineken advert where the bottle miraculously passed
781.0,785.64," three black people is something that's racist, that we shouldn't accept, that leads to discourse and the withdrawal"
785.64,788.12, of an average. Things that can lead to tangible
788.12,789.96," outcomes, those outcomes being the"
789.96,792.02, removal of offensive things from the public sphere
792.02,793.86, of life. We don't think that this downward spiral
793.86,795.82, is something that's inherent to call out culture.
796.08,798.0," But even if it was, we think that it's something that is"
798.0,799.9, justified specifically in terms of how
799.9,801.66, minorities choose to interact with people.
802.26,804.0, Having operated from a
804.0,806.14," position of disadvantage for so long,"
806.2,808.1, we think that it is justified that they are angry.
808.24,810.02, We think that it is justified that they express
810.02,811.74, their anger. People who have been silenced
811.74,814.18, for as long as civilization has been accepted
814.18,816.14, are justified
816.14,818.02, in expressing the kind of anger that they
818.02,819.88, build up. The next thing that they tell you here is that
819.88,822.32," you don't really change anyone,"
822.46,823.68, but that they rally themselves
823.68,825.16," together as victims, right? We do think that they do that, but that they rally themselves together as victims."
825.36,828.58," We do think that they do that, but that doesn't mean we start accepting that they're right."
828.98,831.88," It looks like the KKK rallying themselves together,"
832.0,835.68," but at no point did anyone say, oh, that's call-out culture's fault, let's stop call-out culture."
836.06,840.46, We often begin to understand them as a group and understand their age.
840.46,843.74," It looks like things like Katie Hopkins putting a target on her head and saying,"
843.84,847.44," this is how it feels to be a white conservative woman in a new age, right? And"
847.44,850.88, people literally saying that's the perfect metaphor because the target is fake and you
850.88,854.3," put it there yourself, right? In that we are able to judge these groups even after they"
854.3,858.4," ran to themselves, we are able to call them out, it doesn't diffuse Kholat culture in"
858.4,861.88," any way. So what you're getting from my rebuttal is that one, it is something that becomes"
861.88,868.56," a just metric of justice, but moreover, even that is something that, aside from not leading to the harm that they give you, can"
868.56,873.54," actually fulfil its aims. Now let's talk about why we think it is just, and specifically"
873.54,876.72," that critical minorities, these points are intertwined. Before that, yeah."
876.86,880.96, So if the main aim of call-out culture is to ensure people don't say or carry out harmful
880.96,885.76," actions, would you support physical intimidation as an effective method of ensuring this is an occurrence?"
886.06,887.9," No, right? Physical intimidation"
887.9,889.88, is something that's done before that. But we think
889.88,891.52, that call-out culture is specifically
891.52,894.06, in terms of trying to address the harms
894.06,896.04," that have been perpetrated onto people, but in"
896.04,897.96, a way that is proportional to what they are saying.
898.24,899.66, We're not just going to physically intimidate
899.66,901.7, everyone we think is saying the wrong thing.
901.88,903.96, It's something that is proportional to what is being done
903.96,905.98," and that harm is endemic to words, can be dealt"
905.98,907.98," with in words. So, why do we think"
907.98,909.96, that colonial culture is essential to the liberation
909.96,912.04," of minorities? And this is central to the debate,"
912.16,914.02, because colonial culture exists to protect
914.02,915.96, minorities in removing harmful
915.96,917.76," things from the public sphere of life, right?"
917.8,920.08," But we think that moreover, they are the most important people in this"
920.08,921.66," debate, on the basis of historical"
921.66,923.82," and current vulnerability, that they're not treated"
923.82,926.0, with equal respect to anyone else.
926.0,928.0, This makes them the people we have to evaluate.
928.0,932.0, The side that's going to win this is the side that proves how color culture actually affects minorities.
932.0,934.0, Let's talk about how we previously engaged victims.
934.0,936.0, And here are two important things.
936.0,938.0," One, it was often very amicable to perpetrators."
938.0,941.0, It used to be very nice to them and beg them to change.
941.0,944.0," But moreover, it put the onus on the victims to then change."
944.0,949.04," It's traditions like ironing women's breasts flat in hopes that they don't get raped, right? A lot of"
949.04,954.16, the onus is put on victims to make sure that crimes aren't perpetuated onto them and that
954.16,958.62, harmful sentiments don't affect them. What colon culture did was make the problem endemic
958.62,963.22, to the person who is the problem. It's things like men are trash saying that men are actually
963.22,966.0," the problem because men are the people who actually rape women, right?"
966.0,971.0, Colour culture is essential to that. But the rise of it means that people are a lot more comfortable in saying that out loud.
971.0,979.0, It means that the bottlenecking of expression that minorities have had to face for so long is something that becomes less and less normalised because colour culture is rising.
979.0,986.78," Colour culture is becoming an inherent part of that society. What we think that it does is it makes that expression of justice easier for minorities,"
986.92,989.98, that they can react in a way that allows them to express what they are feeling
989.98,992.84," and give them that which they had been denied for so long,"
992.9,995.8, but we think that more of it is something that can begin to uniquely protect them
995.8,997.54, by silencing those who harm them.
997.68,1001.12," And on that basis, we think that call-out culture is essential to the sphere of life."
1005.4,1007.88," If we look back at the birth of call-out culture,"
1008.16,1011.32," retrospectively, if we took a different approach to solving the problem,"
1011.6,1015.22," by flooding the media with information regarding mental health, privilege,"
1015.54,1017.4," and why people should be sensitive towards it,"
1017.62,1020.64, I think it's reasonable to believe that for some individuals
1020.64,1022.72," that were predisposed to say offensive things,"
1022.72,1029.52," they would have introspected inside Proposition's model. However, it's shameful that there was little to no response on this"
1029.52,1034.14, characterisation and this line of thinking from the speaker before me. We expect to hear
1034.14,1039.12, one later. We've been able to prove from Prime Minister to a reasonable extent there is a
1039.12,1044.06, likelihood of call-in culture and constructive discussion changing the narratives and perceptions
1044.06,1050.42," of individuals that were ignorant, had one-off negative experiences, or were indoctrinated and just need a counter-narrative"
1050.42,1054.66," towards the negative experiences that they have faced. And more importantly, even if"
1054.66,1058.46," this wasn't true, and the levels of offence would still exist under both circumstances,"
1058.72,1062.66," in Prime Minister we have been able to establish that you don't reduce the levels of discrimination,"
1063.14,1069.7, you rather polarise it and move it to areas where individuals can group up together and offer short bursts of
1069.7,1074.72," offence, which is likely to be even more harmful, even if this wasn't true, the general levels"
1074.72,1079.74," of racism increase, because people group together, those that were racist to a minor degree at"
1079.74,1082.44," the beginning, get affirmation from those at the top."
1082.44,1087.44, We are not putting a cup of water on a fire. We'd rather think of it as a stream of continuous water
