start,end,text1031.0,1034.0," We still have a certain basic idea of knowledge that we want to give to these students,"
1034.0,1037.0," and that this regulation still exists in that sense,"
1037.0,1040.0," but we still have a certain free regulation, like we have no regulations,"
1040.0,1042.0," on the sense of how these students are not going to teach, right?"
1042.0,1045.92," We have no regulations on whether the students are allowed to stand up while they're being taught,"
1046.08,1047.32, or sit down while they're being taught.
1047.5,1050.16," We have no regulations on how these students are actually going to learn stuff,"
1050.38,1052.58," but more on what, in the end, should come out."
1052.86,1056.9," And we believe that the state, these regulations exist because the state actually gives them money,"
1056.9,1059.62," meaning we can impose a basic, certain core curriculum,"
1059.96,1062.16, and this still stands under our side of the house.
1062.52,1064.28," Now, second of all, they gave us a counterattack,"
1064.5,1066.72, meaning that the voucher in itself is not enough.
1066.8,1068.56," Now, they gave us several examples to this,"
1068.82,1070.08," one being, for example, Arizona."
1070.58,1072.52," Now, first of all, we're talking about our model, right?"
1072.68,1074.66," In our model, we stated that these vouchers"
1074.66,1077.38," are actually enough for every private institution,"
1077.72,1079.92, meaning we can also adapt the amount of the voucher
1079.92,1082.9, if it is necessary to actually get into these private schools.
1082.9,1085.78," And second of all, we're talking about this on a principle level, right?"
1085.9,1088.28, We're talking about the idea of a voucher system.
1088.44,1090.86," The idea of a voucher system is actually a good thing, right?"
1090.98,1094.98," We're not talking about in single cases it might have been successful,"
1095.1,1098.02, because there's also cases on our side in which it actually was successful
1098.02,1098.94, and in which it actually worked.
1099.1,1102.58," We're talking about the general idea of whether the voucher system is a good thing,"
1102.58,1105.9, and this is something that we outside proposition believe still stands. No thank you.
1106.42,1111.0," In fact, above, we don't want to clarify that we want private schools to cost more than"
1111.0,1114.1," the vouchers themselves, right? This is also something that our first speaker gave up."
1114.18,1116.98," But in our framing in itself, no thank you, which could stand as well."
1117.46,1121.68," Coming to the attack on our side. Now, they first of all attack the accessibility, saying"
1121.68,1125.62," that not everyone actually has the ability to obtain a certain voucher,"
1125.72,1128.6," and the middle class, soundly, kind of falls through."
1128.94,1132.0," Now, we said that, first of all, due to our model, if you take on our model,"
1132.22,1136.32," which clearly states that everyone under a certain median gets a certain voucher, right?"
1136.54,1139.5, Meaning it is actually accessible for everyone that needs this voucher.
1139.72,1140.7, We believe this still stands.
1140.96,1146.0," And second of all, the middle class could also have the opportunity to go to private schools, right? They have"
1146.0,1147.88, the resources to actually go to these private schools.
1148.36,1148.8, No thank you.
1149.96,1151.94," Second of all, we'd like to clarify that we still"
1151.94,1153.94," put extra money into these curriculums,"
1154.0,1155.64," right? We still put extra money, for example,"
1155.98,1157.7, into schools that give people disabilities.
1158.22,1158.82, No thank you.
1159.7,1161.98," Now, third of all, he kind of attacked"
1161.98,1163.82, the point on it fights against racism.
1164.26,1168.12," That we have to like, yeah, exactly, that it fights against racism,"
1168.22,1170.2, and this simply does somehow not work.
1170.42,1172.78," Yet, ladies and gentlemen, we've clarified to you throughout our first speech"
1172.78,1176.06, that we let people into the schools that they could otherwise not go into.
1176.24,1179.24, We let people from different income classes go into schools
1179.24,1181.48, that they would otherwise not be able to go.
1181.48,1184.1, And we believe that the people within these private schools themselves
1184.1,1187.5," actually see these people and actually get to know these people, and this actually"
1187.5,1191.2," in the end fights against the prejudices they have against these people, right? It fights"
1191.2,1194.76," against the perceived things they have with these people, and we believe this in the end"
1194.76,1198.42, actually fights against a certain amount of racism that we see within society itself.
1199.66,1206.0," Now, coming to my own rebuttal. Now, here are two major points. First of all, the point on the accessibility."
1206.0,1209.0, Not everyone actually gets a voucher and there's not enough money.
1209.0,1212.0," Now first of all, I've negated this in my reconstruction itself,"
1212.0,1215.0, as we're looking at a model in which the idea of a voucher system is relevant
1215.0,1218.0, and not whether it's actually enough for you.
1218.0,1220.0, And certain examples did not work.
1220.0,1223.0," And second of all, they said that they want to put all this money"
1223.0,1227.54, that they have through the voucher system into the public schools. Now we have one problem with this.
1227.76,1231.22," That we already put a lot of money within the public schools, right? And these public"
1231.22,1236.6," schools are somehow, in some way, not really getting better, right? We have deteriorating"
1236.6,1240.24, public schools that cannot actually give a certain quality of education to the students
1240.24,1244.52," themselves, right? We do not have, we already have enough money, we already have, the state"
1244.52,1246.9," already puts a lot of money within this, right? So do not have, we already have like enough money, we already have, the state already puts a lot of money within this space, and we believe this"
1246.9,1250.86, money could actually be used in a more sensible way by using this within the
1250.86,1254.16," vouchers within, where we can actually guarantee the students to get a better"
1254.16,1259.26," education, right? No thank you. And second of all, he said, he gave a point about"
1259.26,1261.84, private institutions about how there's no regulations within the curriculum
1261.84,1265.12," itself. Now I've already negated this with in my reconstruction, but again let's say there's no, that there curriculum itself. Now, I've already negated this in my reconstruction,"
1268.14,1270.42," but again, let's say there are regulations because the state actually has a certain state"
1270.42,1271.22," where the money goes,"
1271.28,1273.32, and the state can actually enforce a certain curriculum
1273.32,1275.5, that in the end has certain...
1275.5,1277.54," However, we do not believe that there's regulations"
1277.54,1279.34, within the way that people should be teached.
1279.78,1282.2," They gave us no concrete harms on their side,"
1282.2,1283.54," and we, on the comparative,"
1283.92,1285.84," still have our benefits standing, right?"
1285.9,1287.8, We still have the benefits of these students
1287.8,1290.12," having been catered to their specific needs,"
1290.34,1291.5," standing on our side of the proposition,"
1291.9,1294.78," which is why, on this side, to this point, we win this debate."
1295.16,1296.68," Now, coming to my own substantive speech"
1296.68,1299.1," about the interest of quality of education due to competition,"
1299.24,1300.44," but first of all, you seem to disagree."
1300.44,1303.22," If the state has a certain amount of budget for education,"
1303.38,1307.0, how are they going to get more money for vouchers on your side of the house if there's no money?
1307.0,1311.0," The thing is, they're going to use this money that they put into education and use it as vouchers, right?"
1311.0,1316.0," They're going to take this money and then put it into the vouchers, and so like every student in a way has a voucher for a certain amount of money."
1316.0,1321.0," The idea is, if these students then go to schools, they then give the schools money, right?"
1321.0,1327.58," The amount of students is actually relevant within the amount of money that the students get, meaning if the students have a certain amount of, like, voucher system"
1327.58,1331.7," money, then they go to these schools and the school gets the voucher money that these students"
1331.7,1335.98," have. So on this side, like, this is how we propose our model under our first speech."
1336.26,1340.54," Now coming to my own substantive. Now, why is the NOA competition in status quo? The"
1340.54,1344.8," state holds a monopoly over public schools by controlling them, right? So there's a significant"
1344.8,1348.94, amount of students who don't have other possibilities than the public schools themselves.
1349.32,1351.0, Why are these monopolies bad? Three layers.
1351.26,1353.9," First of all, there's a lack of incentive to change. Why is this the case?"
1353.94,1355.92," Because first of all, there's only one supplier on the market,"
1356.28,1360.32, and there's little incentive to innovate as this threatens them losing their customers.
1360.46,1362.44," And second of all, there's a lack of allocation of resources."
1362.9,1364.2, Where can we see this within the schools?
1364.58,1367.48," The public schools have, for example, no heating or no cooling."
1367.6,1371.42," They have chemistry labs with inadequate security. We see it within the equipment, the teachers,"
1371.52,1375.14," the general well-being of the students themselves, as well as the attitude and learning atmosphere"
1375.14,1379.44," of the teachers within the schools. Now, the impact of these monopolies themselves is that"
1379.44,1382.72," first of all, there's a low educational quality within the public schools. Second of all,"
1382.72,1386.72," there's little chance for improvement of the people who can actually not afford these private schools, and third"
1386.72,1390.28, of all there's less economic development as there's less qualified workers within the
1390.28,1394.3," economy itself. The second layer of why this is actually bad is the political biases, right?"
1394.6,1398.68," So we have politicians that don't necessarily make the most economically logical decisions,"
1398.96,1402.84, but rather those that have the biggest political benefit for them. This opinion does not represent
1402.84,1405.04," the interests of the entire population,"
1405.04,1409.34," like the market does, due to higher participation or voters with constrained strengths. This"
1409.34,1412.84," does not represent the interests of those most affected by the policy, as the students"
1412.84,1416.72, do not vote and the teachers have the lowest turnout among these groups. Now it's different
1416.72,1420.24," under our model as we have private institutions that pay more attention to these, right, because"
1420.24,1423.5," these are their customers. The third layer is the inflexibility. To government, policies"
1423.5,1425.76," take a long time to go from draft to implementation,"
1425.76,1428.46, when the market can actually react to problems and changes
1428.46,1430.38, faster within days or even weeks.
1430.38,1432.88, The impact of this being is that the market is more flexible
1432.88,1434.68, and therefore you can cater to the interests of your people
1434.68,1435.18, more.
1435.18,1437.84, Why is the competition created through our model beneficial?
1437.84,1439.48, Because the students themselves and their parents
1439.48,1441.1, are the most relevant actor and are given
1441.1,1442.44, the most power and attention.
1442.44,1444.94, They are the ones who decide which school they go to.
1444.94,1447.12, They're the ones on the slick side which is the one who actually gets
1447.12,1450.98, money. And thus schools have to be more attractive to attractive students. The effect of this
1450.98,1455.72," is, first of all, a higher quality of education as there is the incentive to develop, as the"
1455.72,1459.2," incentive to actually earn money through this development, right? Because good quality is"
1459.2,1463.32," attractive. And second of all, diversification. I mean there's more individual offers as it"
1463.32,1467.04, actually sets them apart from other schools and make them more attractive to specific types of
1467.04,1467.24, people.
1467.58,1471.2," The overall impacts of this being that there's better quality of education, which is good"
1471.2,1474.28," for the students, obviously, because they have a better chance at the job world, development"
1474.28,1479.06," of individual character, as well as a certain happiness of being able to obtain education"
1479.06,1480.74," in the right, proper way."
1480.98,1484.32," Second of all, for society, because it benefits the economy, and there's a diversification."
1484.88,1485.0," So because we can vouch for a better future, please, please propose. Thank you for your attention. Second of all, for society, because it benefits the economy and the diversification."
1485.0,1489.0," So because we can vouch for a better future, please, please, oppose. Thank you for your attention."
1492.0,1496.0, The side of proposition already lost their main point in this debate.
1496.0,1501.0," Accessibility. When they tell you that public schools are so very bad and private schools are so very good,"
1501.0,1506.74, but never prove to you how everybody will be able to go to private schools if they're the only and best option.
1507.0,1514.32," And we tell you that even if we accept all of their models and all of their explanations, there are still people left hanging in this so bad public system."
1514.42,1519.54," And we believe that if they don't prove it throughout the debate and they have one more speech left, we believe that they lose."
1519.8,1521.52," Now, I want you to remember our metrics."
1521.52,1523.92," Firstly, accessibility that I'm going to talk about."
1524.12,1529.44," Secondly, quality that I'm also going to talk about in my rebuttal. And thirdly, about justification"
1529.44,1533.68, for spending public money. We believe that justification for spending public money is
1533.68,1537.78, an extremely important principle that I'm going to talk about in my third substantive
1537.78,1541.88," point. But before that, a bit of rebuttal. Firstly, about their model. Now, there's two"
1541.88,1548.76," issues that we tackled on their model. Firstly, about the price. Now there's two issues that we tackled on their model is firstly about the price. Now what they tell you that the price of the vouchers"
1548.76,1552.24, is going to be the same as the price of the private schools. What we believe that
1552.24,1555.96, if the state has so much money left off we believe that that money should be
1555.96,1560.1, funded into public education. But what we tell you is that this never happens in
1560.1,1563.88, the real life because states don't have enough money to fund into these
1563.88,1567.96, voucher systems. We tell you that they fund too little to these kids
1567.96,1571.06, so we have people who still have to pay extra money
1571.06,1572.12, to get into public schools.
1572.12,1574.08," Actually, so we believe that this doesn't work"
1574.08,1574.96, in the real world.
1575.04,1576.38," Secondly, about curriculums."
1576.42,1577.66, When they tell you that we still have
1577.66,1579.94," the basic curriculum hanging on,"
1580.0,1581.26," we tell you, okay, this is true."
1581.5,1583.66, But if you tell us that the states
1583.66,1588.22," are going to regulate these schools, we believe that there is no leverage for these schools to actually do"
1588.22,1592.34," what the sign-up proposition is proposing, to get some specialized sort of programs for"
1592.34,1596.08," kids. We tell you if the state wants to regulate these schools, this will never be possible,"
1596.4,1600.58," so this entire point falls because of their model. Now, secondly, about accessibility."
1600.98,1609.9," Here we have two issues. Firstly, about what I already said, that not everybody can go. Because as Marco already said in his speech, we have this middle class"
1609.9,1614.34, still left standing that has to go to these public schools that are still so bad. And
1614.34,1618.06," we tell them that even if we accept that these public schools are bad, they're going to get"
1618.06,1622.18," even worse for these kids because more money is funded into vouchers, and we believe that"
1622.18,1627.78," we're losing money to actually fund for these kids that are left over, and we believe that we have to take care of everybody in this"
1627.78,1628.08, debate.
1628.38,1630.34," Now, secondly, about the race issue."
1630.56,1634.42," What the side proposition never actually tackled is the structural racism, where we say the"
1634.42,1635.44, problem is the society.
1635.58,1639.48," So even if these kids go to some sort of private schools, they're still going to be treated"
1639.48,1640.02, the same.
1640.22,1644.92," But even furtherly, if we allow these private schools to open in the ghettos and in the"
1644.92,1645.52," poor neighborhoods,"
1645.66,1649.96, they're still going to be bad and as bad as the public schools are in these neighborhoods.
1650.1,1655.06," Because the issue is that these schools know that people don't have enough money to pay for these private schools,"
1655.14,1660.18, so they're not going to be as high quality because they have to be accessible to these people in these neighborhoods.
1660.28,1662.26, We believe that this doesn't change on the side of proposition.
1662.62,1666.12, We will only change this if we equal out the public schools everywhere.
1666.12,1668.74, Now moving on to the point of bug about quality.
1668.74,1672.24, First question that we have for quality for the side of proposition is what is your guarantee
1672.24,1675.24, that you're actually going to get quality under your model?
1675.24,1679.12, We believe that leaving education to the free market is something extremely dangerous and
1679.12,1682.78, there is no guarantee to actually achieve quality under your side of the house.
1682.78,1687.66," But furtherly, we tell you that not all, when they tell you that public education is very bad,"
1687.88,1690.94, we have the issue that not all countries have bad public education.
1691.06,1693.46," They give you the example of the United States, for example,"
1693.52,1694.52, but this is very specific.
1694.84,1697.86, They have this specific issue that is not the case in other countries.
1697.96,1701.0," And we believe that the wrong investment in these schools is the problem,"
1701.0,1703.98," which we can change within the state, not with voucher systems."
1704.24,1707.88," Now, we tell you that long-term, when the state is investing in better public schools,"
1707.98,1710.6, we're going to be better off because of this investment.
1710.7,1715.6," But also, what we tell you, as I already said, is that we're not only putting education,"
1716.04,1720.1," which is so very important for everybody, to the free will of the free market, which"
1720.1,1723.68," we believe is dangerous, but also we have less funding for public schools."
1723.68,1728.42," But at the end, we still have to think about even if we accept that quality exists"
1728.42,1731.96," and even if there are substantive stands, we still only get it from a small amount of people."
1732.24,1733.16, This is extremely problematic.
1733.48,1738.38," Now, on to the point about politicians, how they have the incentive to put less money into these schools."
1738.68,1742.72," Now, this is very interesting because we still have these same politicians in the side of propositions,"
1742.72,1748.14," which means that if they put less money into school, that means that there is going to be less money for vouchers"
1748.14,1751.9, as well. So we have the same problem on the side of proposition. And we believe that what
1751.9,1756.46," is even more problematic is that if the voucher amount was to get smaller, this would mean"
1756.46,1760.22," that not only the private schools, the private schools would not change prices, and it would"
1760.22,1767.2, be even worse for these kids which cannot pay. Now moving on to our first substantive about public money. Now this is extremely
1767.2,1771.32, important and I want you to listen up. That with public money people are paying taxes
1771.32,1775.24," which means that they're diverting their own hard work, their own extra money to"
1775.24,1778.84, give to the state and they expect something in return. Now when the state
1778.84,1782.6, is spending this money they have to respect three principles. I want you to
1782.6,1786.62," write this down because it's firstly they have to provide benefits for everybody in the society, they have to benefit three principles. I want you to write this down because it's firstly, they have to provide benefits for everybody in the society."
1786.88,1789.14," They have to benefit the people, not the private entities."
1789.38,1792.84," Secondly, this money cannot be used in a discriminatory way."
1793.1,1796.04," And thirdly, it has to respect the secularism of the state."
1796.28,1798.92," Now, how do vouchers undermine all three of these principles?"
1799.18,1802.02," Firstly, why is the problem of investing in private entities?"
1802.34,1809.28," Money from the hardworking people is going into the hands of private businessmen, which means that this money, which should be invested"
1809.28,1814.26," in teachers, in curriculum, just a second, in programs, is instead being invested in"
1814.26,1819.2," marketing, PR, and in the end, the extra money is going into the pockets of the private owners."
1819.46,1819.68," Yes, please."
1819.8,1823.3, The fact is we're giving people the money more directly because we're giving them the
1823.3,1825.48," vouchers, which they can then decide where to spend."
1825.48,1825.94," Okay, thank you."
1826.0,1828.2, If you don't assure that everybody is going to get something back
1828.2,1828.76," from these vouchers,"
1828.82,1830.78, we believe that this doesn't stand on their side of the house.
1831.08,1833.3," Now, we have the example of all profit,"
1833.48,1838.08," on average, for-profit schools spend 27% of their money to marketing"
1838.08,1841.6, while non-profit schools spend only 5% of their money to marketing.
1841.72,1843.68, We believe that this is the money that is going to something
1843.68,1847.12, that is never going to be given back to the people. We believe that public money should
1847.12,1852.04," come back to fulfill people's needs, but instead this money is not going to be accessible for"
1852.04,1856.86," everybody on this proposition. Now secondly, private schools are a fertile ground for discrimination."
1857.38,1861.64, We have segregation by voucher schools which can pick and choose students as they please.
1861.64,1865.38, We have the research of the University of Kentucky
1865.38,1867.6, who tracked Milwaukee voucher system
1867.6,1870.76, and found that voucher schools do tend to take students
1870.76,1872.8, that suit their needs that they want to take.
1872.8,1874.5," We believe that this is extremely discriminatory,"
1874.5,1876.96, especially for people who are of different races
1876.96,1878.16, and religion.
1878.16,1879.86, We can see this at the example of US
1879.86,1882.46," where we have all Christian or all of the black schools,"
1882.46,1884.74, which we believe is extremely problematic
1884.74,1888.26," because putting aside the debate of whether these schools are true educationally,"
1888.48,1892.7," it's problematic if they're accessible only to some, based on religion and based on race."
1892.9,1897.56," We can see this at the example of Ohio, in which more than 90% of Viter schools are Christian schools,"
1897.62,1901.34, which means that only Christian people will be available to go to these schools.
1901.34,1904.64," Now, on the side of opposition, public investment includes everybody,"
1904.98,1907.62, which is why we see them as a proper sort of investment.
1907.78,1910.06," Now, thirdly, about religious schools specifically."
1910.42,1913.04," This is very relevant because 90%, as I already said,"
1913.12,1915.64, money used for vouchers goes to religious schools.
1915.86,1918.32, We have two main issues with putting money into religious schools.
1918.46,1920.74," Firstly, is this idea of secularism."
1920.98,1922.86, Because states that worship secularism
1922.86,1925.0, now put their money directly into religious
1925.0,1930.86," institutions. We find this very problematic. Secondly, it's about the curriculum itself."
1930.86,1937.86, We see sending money to religious institutions which choose not to teach based on science
1937.86,1942.24," but rather based on their beliefs, we believe that this is extremely problematic because"
1942.24,1945.4," they will, for example, not choose to teach evolution"
1945.4,1949.54, and so on. It's completely unjustifiable to send public money in schools that do not give
