start,end,text1949.54,1953.52," proper education, but only based on their beliefs. Now, when it comes to education,"
1953.86,1957.9, public schools are justified because they allow an opportunity to all taxpayers to give
1957.9,1963.18," their children education. Giving vouchers, the state will invest a large portion of money"
1963.18,1965.2," to the private sector, which are private schools."
1965.46,1969.22," Now with that, usage of private money does not benefit the public completely,"
1969.5,1972.76," is used in a discriminatory way, and does not respect secularity."
1972.96,1976.16, The state in this way undermines the duty towards the taxpayers.
1976.46,1977.86, We believe that this is not justifiable.
1978.18,1981.5," So only based on this principle, you should judge time off."
1984.3,1986.52, The opposition loses this debate
1986.52,1988.68, at the point where they're focused on people
1988.68,1991.84, still not being able to get to private schools.
1992.18,1992.42, Why?
1992.66,1994.52, Because at the point where we can prove to you
1994.52,1996.94, that there's more people who have the accessibility
1996.94,1998.5," of a better education,"
1998.84,2000.24," and not just everybody,"
2000.48,2001.62, we already win this debate
2001.62,2003.7, because of that opposition's choice
2003.7,2006.24, of making this the most important part of their case.
2006.24,2008.24," Now, three clashes in my speech."
2008.24,2009.24," First of all, principle."
2009.24,2011.24," Second, accessibility and equality."
2011.24,2013.24," And third of all, quality of education."
2013.24,2015.7," Now, first of all, to the principle."
2015.7,2020.16," We bring in our first speech the principle of choice, where this is in general a good"
2020.16,2024.38," thing and makes your education more legitimate in the first place, which we don't hear any"
2024.38,2029.76, response to whatsoever from said opposition. Second point of principle is legitimacy of
2029.76,2033.46," funding, which both sides actually have something to say about. Tim opposition comes up and"
2033.46,2037.68," tells us, well, since we have no control of what's going to happen, since we're not actually"
2037.68,2042.22," giving the money back to the people, it is not legitimate for the government to fund"
2042.22,2047.96," these private institutions. Now, first of all, we need to look at the status quo as our first speaker also already did in her"
2047.96,2052.86," speech, being that in the status quo, these private schools are to some extent, actually"
2052.86,2057.56," very often to a very huge extent, already also funded by the government because education"
2057.56,2062.12," is such an important thing. Now, we see that this funding already takes place, but not"
2062.12,2066.04, everybody has accessibility to that. We see that there we have a natural problem.
2066.28,2069.34, We see funding for these schools happens on both sides of the house.
2069.62,2073.64, Only on our side of the house it is legitimate because we do give people something back.
2073.88,2074.74, Now how does this work?
2074.98,2079.66, Because the side opposition claims that these schools are generally just going to spend their money on other things than the education.
2079.98,2086.82," Well, the point is that these schools need the children to actually attend these schools for their survival,"
2087.04,2090.08, meaning that they actually need to give them a certain amount of education
2090.08,2094.0," because otherwise people will just not choose to go to that specific school,"
2094.0,2101.18, which is why we believe this is the best mechanism of ensuring how exactly we're going to give this money to the people
2101.18,2109.54," because they can then decide which education they're going to spend it on, right? This is why we believe this is legitimately, certainly a point that goes"
2109.54,2113.48, to our side of the house. Now secondly about accessibility and equality. We have several
2113.48,2118.44," problems here. First of all, team opposition says like, thank you, where are we going to"
2118.44,2122.12," get that money? How much money are we actually going to have? First of all, we have explained"
2122.12,2128.4," that to you in our model, right? Which Team Opposition has completely ignored. What we would like to see is a model in which we're"
2128.4,2133.4," having this money going to those people who actually need it, those people who can't afford"
2133.4,2138.18," private schools in the status quo, and then we do not want private schools to charge higher"
2138.18,2142.36," fees than can be paid with that voucher, right? So thank you. Now we say that even if said"
2142.36,2145.4, opposition actually succeeds in telling us that this is somehow
2145.4,2149.52," impossible, which they never do, there's no mechanism whatsoever in their side how this"
2149.52,2153.36," is not going to work, except that there's just not that much money, well then we're"
2153.36,2156.36," just not going to have that expensive private schools, right?"
2156.42,2157.06, Where's the harm in that?
2157.32,2161.24," Now, even if we say that that is actually the case, we still see that there are a hell"
2161.24,2164.56, lot of private schools that actually are accessible with these vouchers.
2164.86,2168.06," Why? Because that is something that people have an incentive to build up,"
2168.1,2172.18," right? Because that is something that they can get money with, that a huge amount of"
2172.18,2175.76," people are actually searching for, which is why we believe this is certainly something"
2175.76,2180.26," that is going to exist. No, thank you. Secondly, they tell us that these schools are just not"
2180.26,2184.7, financially stable and therefore people who try to get their education at a private school
2184.7,2188.66," will actually end up with no education whatsoever. Now, two problems with that. First"
2188.66,2192.18," of all, this is certainly not going to be the majority of cases because people do inform"
2192.18,2197.06," themselves, because people do ask other people who have went to that school before when they're"
2197.06,2200.96, making their decision about which school they're going to send their children to. This means
2200.96,2212.22, that the most schools that are actually financially unstable are in the worst case scenario only existing for one or two years and then there's a very minimal harm to what that opposition claims to be.
2212.38,2215.1," No, thank you. But secondly, we have to compare this to the status quo, right?"
2215.3,2221.98," Where people go to public schools that have far too many children to teach, that cannot concentrate on the specific needs of these people,"
2222.2,2228.64, where there's actually a lot of children coming out of school not having any benefit of that education.
2228.64,2232.56, Can you show us one example in the status quo where vouchers work?
2232.56,2236.76," Well, for example, those vouchers work in Sweden, but we do not see that that is actually"
2236.76,2239.86," something that we really should care about in today's debate, because as we also said"
2239.86,2246.04," in our second speech, we do not want to have this debate about single examples that do"
2246.04,2253.86," happen in the status quo, because we believe that there are certain flaws in current systems"
2253.86,2257.98," that do not need to be there, that are not inherent to school voucher system in general,"
2258.22,2261.72," which is why we believe that this is not relevant to today's debate, because we are trying to"
2261.72,2269.12," tell you that in general, this is something that in most cases when it is implemented, not completely bad, will actually help a huge"
2269.12,2272.62," amount of people. So this is what we're talking about in today's debate, as we have already"
2272.62,2277.22," told you. Now, so coming to the next point under accessibility that our side of the house"
2277.22,2281.36," brought to you, and that is that you really need these children to get more confidence"
2281.36,2289.3," in order to fulfil their potential, right. Also something that opposition has never ever responded to. The huge point that stands on our side of the"
2289.3,2293.92, house at this point in the debate and will continue to stand until the end of the debate
2293.92,2298.64, is that there is a hell of a lot of people who just are not able to get the education
2298.64,2303.0, that they need. Looking at public schools in the very big majority of countries in this
2303.0,2308.66," status quo, we see that children are just like this, very huge classes, right? There is one teacher for something"
2308.66,2313.84," like 30 to sometimes 50 kids, which is just impossible to cater to every single one of"
2313.84,2318.28, their specific needs. We're going to have smaller classes by giving people more different
2318.28,2321.54, schools because there is an incentive for people to establish these schools because
2321.54,2325.16, you can get money even if most people could otherwise
2325.16,2330.46, not pay for that in the status quo. So we see that actually we solve a very huge amount
2330.46,2334.82, of problems that we see in the status quo by giving people the possibility to have a
2334.82,2340.08, more specific choice as to what exactly they are going to cater to. Now why is it so important
2340.08,2344.48, that the opposition has never tackled this point at all? Even if we say that Team Opposition's
2344.48,2345.7, points all stand
2345.7,2348.68," that we're having minor harms for minor groups of people,"
2348.9,2352.06," for example being people who still are not able to afford private schools,"
2352.14,2357.34," which is far less people than there is actually in the status quo, right?"
2357.48,2359.02," We see that even in that scenario,"
2359.28,2362.32, the huge benefit that we see to people who are actually able
2362.32,2364.38," to choose the school that fits them best right now,"
2364.38,2369.6," to choose the school that they actually are going to take the education with them that they need for their later life,"
2369.6,2371.1," we win this debate, right?"
2371.1,2376.9," Because this is such a big group of people that we actually see that even if we say that there are harms inside opposition,"
2376.9,2378.9, this is not enough for them to win the debate.
2378.9,2383.2," Now, next point about accessibility and equality being racism, right?"
2383.2,2386.8, We see that we have brought you an analysis on our side of the house that has not quite
2386.8,2389.64, been responded to by the opposition how we're going to solve this.
2389.64,2391.14," It is very simple, right?"
2391.14,2395.94," We're having different kinds of people going to the same school, getting to know these"
2395.94,2400.76, people and actually making friends with them and therefore being less racist in their later
2400.76,2401.76, life.
2401.76,2402.76, Why?
2402.76,2403.76, No thank you.
2403.76,2406.24," Because these people are just going to choose their schools for other reasons, like which one is"
2406.24,2408.1," closest to them, or which one their"
2408.1,2409.72, ethnicity is actually going to
2409.72,2412.26," be dominant on, because"
2412.26,2414.46," they're just having these different possibilities, right?"
2414.74,2416.42, This is something that has not
2416.42,2418.3," been tackled by said opposition at all, right?"
2418.48,2420.16, Because we do see that as they claim
2420.16,2422.5," they still have a choosing process, they have not,"
2422.6,2424.04, right? We tell you in our models
2424.04,2428.58, that people do need to actually be allowed to get their education at these schools in
2428.58,2432.16," the end, which is why we believe that that is actually a huge benefit for racism in the"
2432.16,2435.06," status quo that we get on our side. So the opposition just comes up and says, well, that"
2435.06,2440.38," is not enough, we have other structural barriers, right? But if we say, if that's true, we still"
2440.38,2450.68," have one thing that we change, one benefit that we have, which is enough for this point to go to our side. Now, last point being the quality of education. The big problem that"
2450.68,2455.48, the opposition has here is stuff like religious schools who are not going to teach what the
2455.48,2459.82," government wants children to learn. First of all, we tell you there are regulations"
2459.82,2464.52," as to the main curriculum, as to the very basis of what people really need to know."
2464.76,2465.98, And everything that comes on top of that
2465.98,2468.6, can be different to what most people need.
2468.74,2470.1," That is the whole point, right?"
2470.24,2471.5, Everything that comes on top of that
2471.5,2473.68," is supposed to be individual, right?"
2473.92,2476.14, So we think that the harm that they are telling us
2476.14,2477.84, that some public schools are going to lose money
2477.84,2479.12," is first of all no problem,"
2479.32,2481.44," because there's less people that they have to cater to,"
2481.64,2483.44," and second of all, the big majority of people"
2483.44,2486.8," is actually going to have a huge benefit on our side of the house, which is why we're in this debate."
2486.8,2487.3, Thank you.
2489.84,2495.12," Ladies and gentlemen, Team Germany, ironically coming from a country that is taking the fourth"
2495.12,2501.86," place due to the quality of public education, throughout this entire debate gives you not"
2501.86,2506.18, one single example of where the voucher system succeeded.
2506.18,2511.22," And no, it is not enough for them to just prove you the vague principle of how"
2511.22,2517.46, this could work somewhere and somehow. They have to show you practically how
2517.46,2523.78, their system works and where their system worked for us to believe what
2523.78,2525.26, they're saying.
2526.9,2527.44, Three points in my speech.
2531.18,2531.26," We started this debate taking three things that we have to prove,"
2534.28,2534.8, and those are exactly the three clashes that happened in this debate.
2539.54,2540.02," Accessibility, quality, and the justification of spending public money."
2541.54,2542.44," First of all, about the accessibility."
2547.54,2547.8," What we tell you through this entire debate is that accessibility doesn't really happen,"
2553.34,2553.78," first of all, because only the few get the voucher, but also because vouchers are partial."
2555.22,2562.26," Now, here are the examples. We tell you that it comes to so banal examples where Louisiana had a system"
2562.26,2568.6, where they literally gave vouchers based on the principle of lottery.
2569.08,2576.08, Meaning that the right to education was given to someone based on whether they were pulled from a vote.
2576.48,2577.24," No, thank you, madam."
2577.52,2580.86, This is not a system of accessibility that they're talking about.
2581.2,2588.5," Secondly, we tell you that in Arizona, vouchers cost $4,040 compared to a $10,050 fee."
2589.46,2593.54," In Georgia, what happens is the $5,060 voucher"
2593.54,2596.6," compared to the $10,600 fee."
2596.6,2599.8, Those are not entire vouchers that they can just simply
2600.92,2606.6, make bigger or improve because they have a limited budget just like we do and
2606.6,2610.38, that's what we're all aware of in this debate. Now what we tell you is that
2610.38,2616.5, accessibility is not when somebody has to pay the entire fee or even half of
2616.5,2622.0, the fee because what we ask them is how are the people below the
2622.0,2625.14," poverty rate, which are the group they're talking about,"
2627.88,2628.4," ever going to be able to pay those $5,000?"
2630.14,2631.78, This is the question they have to prove if they want to talk about accessibility.
2632.22,2634.62, This is not an accessible or a sustainable model
2634.62,2635.58," on their side of the house,"
2635.88,2638.58, especially with no example for all three speeches.
2639.14,2640.88, But the issue that we're talking about
2640.88,2642.98, is exactly the wrong distribution of money
2642.98,2644.5," that happens on their side,"
2644.72,2646.12, where the state doesn't really know
2646.12,2647.86," what to fund, so they fund the vouchers,"
2647.94,2649.56," and they fund the public system, and they fund"
2649.56,2652.32," everything, pretty much."
2652.5,2654.06, And what happens is that the state literally
2654.06,2656.08, has no money to make anything
2656.08,2658.04," high quality. They can't fund vouchers,"
2658.26,2659.98," they can't fund the public system, and"
2659.98,2662.06," on their side of the house, what happens is"
2662.06,2664.34," that so many people are left behind,"
2664.64,2669.6," and they have to go to the underfunded public system, which is what they concede in the third speech."
2670.14,2674.62," This is not the quality of education that they're talking about, neither the accessibility."
2675.34,2679.22," But on the second point under accessibility, where we talk about the racial bias, from"
2679.22,2686.1," the beginning we tell you that this is a structural thing, that the racial bias does not simply just not exist"
2686.1,2691.92, on their side when you have a private owner. Those people also are racially biased. Those
2691.92,2696.6, people also have the stereotypes that they're talking about. They're also going to not let
2696.6,2701.38, people in. But what we tell you is that what also happens is the self-segregation. In our
2701.38,2708.76," third substantive, we talk about religious schools. We talk about all black schools. The schools that really aren't that accepting as they're talking about. Now"
2708.76,2712.72, what happens there is exactly the issue of the choice that they talk about as the main
2712.72,2717.88," point in their speech, where people literally choose to take the schools which aren't so"
2717.88,2722.62, accessible to everyone and go to only the schools of their religion or only the schools
2722.62,2725.94," of their race. But also, we tell you,"
2726.18,2731.54," the choice is also not inherently an issue on our side. We tell you that in Europe, people"
2731.54,2735.26," literally can't choose which public school to go to, which is why we don't really think"
2735.26,2739.64, this is an issue in this debate. But what happens on our side of the house is that the
2739.64,2744.78," state is held accountable to the public, and the state has to give education to everyone"
2744.78,2746.02," on the same quality. And under our model, we the state has to give education to everyone on the same quality."
2746.32,2750.28," And under our model, we're going to give this education to everyone because we're going to"
2750.28,2755.36, distribute all the money and all the funds for education to the public system. And we're going
2755.36,2759.9," to make it accessible and we're going to make it high quality for everyone, which is going to"
2759.9,2768.06," improve the social mobility that we're both talking about in this debate. But when it comes to the second clash about equality, the first"
2768.06,2771.7, issue we have on their side is that they literally talk about regulation
2771.7,2776.06," of the market, which is where they even concede that we do need"
2776.06,2779.6, the state as a factor. So here comes like two clashes.
2780.28,2784.06," Two questions. If we need the state to regulate, then why just not let"
2784.06,2790.06, the state have the public system and do everything in high quality according to their wishes for everyone?
2790.54,2792.72, Question they literally never answer.
2793.14,2797.32," But secondly, we told you that it's really not that easy to regulate the private sector."
2797.58,2809.2," And we see this with many companies where you literally can't do nothing to them because they're the ones who have the capital. Now, what they have to prove to you is that this regulation is in the first place going to be possible on their side,"
2809.2,2812.94," but also that it's so needed, which they never do throughout this debate."
2813.76,2818.14," But now, to talk about the regulation that they talk about."
2818.44,2826.16, The regulation that they talk about and that is happening today is that 119 charter schools are closing every year. The regulation
2826.16,2831.92, they talk about is those schools spending 27% of marketing. No thank you matter. The regulation
2831.92,2837.28, they talk about is the Harambee Institute that is turning into a nightclub when there's no kids in
2837.28,2841.36, school. And the regulation that they're talking about is the Florida charter schools which
2841.36,2845.04, literally have no classrooms which are their third substantive
2845.04,2849.74, point. So what we're asking you today is how exactly are you going to achieve this quality
2849.74,2854.3," and how are you going to refute those examples? Yes, madam. Are you saying that in the status"
2854.3,2857.56, quo the public schools are actually having a lot better quality than what you're just talking about?
2857.7,2862.12," Yes, madam, because we give you examples and you give us none. We tell you that there are examples"
2862.12,2867.96," of the Scandinavian countries that have an amazing sustainable model of public education. You have Denmark, you have Finland,"
2868.1,2872.66," you have all those countries, you have literally Germany where you're from. Those countries"
2872.66,2878.0, are the countries where you have a sustainable and high quality public model accessible to
2878.0,2883.1, every one of those citizens. And this is the model that we're talking about and the model
2883.1,2885.24, that we're proposing in this debate.
2889.56,2893.98," Now, this is why we tell you that the state accountability is so important and crucial because it's the only way that the state is actually going to have a curriculum for everyone,"
2894.2,2896.4, that the state is going to have high quality for everyone.
2896.66,2900.98," And we tell you that if the state makes a mistake, the public is going to react to those mistakes."
2901.3,2904.68," When the private owner makes a mistake, no one is going to react to those mistakes."
2904.9,2908.7, What's going to happen is you're going to leave children with no education in the end.
2908.7,2912.96, But when it comes to our third clash about the justification of filling the
2912.96,2916.98," private sector with public money, literally what they never, never refute"
2916.98,2921.62," and it's a very, very important point on our side. We tell you that what happened"
2921.62,2927.26, in Careers Australia is that they gave $40 million to their private owner.
2927.56,2929.46, This is not something that we stand for.
2929.68,2934.32," We think that the public money that comes into education has to go back to the education,"
2934.56,2936.08, not just to some private owner.
2936.08,2942.08," If we as the public do really invest in education and want our children to be educated in high quality,"
2942.26,2949.84, we don't want just some guy who invested in a school to get all this money and buy a yacht. This is not what we stand for on our side of the house.
2950.06,2954.8, But we also tell you that the state is not justified to fund the schools such as religious
2954.8,2960.14, schools that do not make it accessible for everyone and that do have the segregation that
2960.14,2964.14, we talked about in our second class. And then could we show you that it's our side that gives
2964.14,2965.1, you accessibility. It's our side that gives you accessibility.
2966.56,2969.5," It's our side that gives you quality because we're the only one who can really, really regulate"
2969.5,2973.36, and it's not justified for them to fill the public money
2973.36,2974.56, into the private sector.
2974.9,2976.22, It's us who win this debate.
2976.48,2976.88, Thank you.
2979.84,2981.58, There is a certain amount of money
2981.58,2984.04, that the state has to put into education.
2984.04,2986.38," This is what both sides of the house agree on. The side proposition of money that the state has to put into education, and this is what both sides of the house agreed on."
2986.5,2989.36, The side proposition never showed that the state doesn't have enough money
2989.36,2992.32," to put into either private or virtual schools, so this stands."
2992.68,2995.08," Now, having this in mind, what the side of opposition tells you,"
2995.24,2999.18," let's put all of this money, this big bunch of money that we agreed on we have,"
2999.44,3003.32," into public schools, which means that public schools are gradually getting better over time,"
3003.32,3008.08," as we have seen in the examples of Finland, of the old and new northern countries, and Germany"
3008.08,3013.42, itself. We believe that this stands and that quality over time grows in all areas of our
3013.42,3017.88, countries. So there's more and more quality and more and more equal chances for everybody
3017.88,3022.36," because quality grows everywhere, which means that most of the people which are middle class"
3022.36,3025.86, people can go to these schools in whichever areas that they live.
3025.86,3031.24, Forest people can go to these schools because they also grow in these areas where poor people live.
3031.24,3036.36, This also means that the poor black kid can also go into these schools because they grow everywhere.
