start,end,text3036.36,3041.24," Equally and fourthly, the rich kids can go either to private or to public schools"
3041.24,3043.36, because they're at this point equally as good.
3043.36,3046.0, We believe what we achieve is accessibility for everybody.
3046.52,3050.44," Now, the standard proposition tells you, let's put all of this money into vouchers,"
3050.64,3053.06," which means that public schools are getting better and better,"
3053.22,3056.0," there's more public schools and everybody can go to public schools,"
3056.22,3059.2, but it also inherently means what the standard proposition never tackled
3059.2,3061.12," is that there is less money for public schools,"
3061.22,3064.12," which are getting worse and worse over time, and this is highly problematic."
3064.6,3068.8," That means that most of the people, which are the middle class, will have to go"
3068.8,3074.1," to these horrific and these horrible, bad private and public schools, because they're"
3074.1,3078.46, getting worse over time because there is no money. So most of the people will get worse
3078.46,3082.64," and worse over time inside proposition. And on the other hand, they still have the rich"
3082.64,3088.44," kids, which could, on both sides of the house, go to private schools. They have the poorest kids, which are the minority,"
3088.78,3093.52," going to private schools. But comparatively, the biggest bunch of people are worse off"
3093.52,3097.24, in their size of the house. And we believe that that's the point that we ask. Where is
3097.24,3101.66, the accessibility? For whom is this accessibility? Where is this choice on the side of proposition
3101.66,3108.44," that they're talking about? The only thing that they get is achieving better education, so-called, for the minority of the students."
3108.72,3112.52," But further on, we tell you, this is if we assume that this quality actually exists."
3112.74,3115.52," We tell you that quality in private schools does not exist,"
3115.72,3120.84," because there is no regulation, as we have shown you on our explanation and examples on our side of the house."
3121.12,3127.28, We tell you that there is profit-driven people who are going to funnel more money into marketing and PR
3127.28,3129.04, and their own profit than they will
3129.04,3131.02, into actually teaching kids.
3131.02,3134.66," Now, not everybody can go on their side of the house"
3134.66,3136.24, and that's a huge problem.
3136.24,3139.4," But even further on, now let's put aside this accessibility,"
3139.4,3140.64, let's put aside the quality.
3140.64,3142.24," Let's think about the entire society,"
3142.24,3144.76," which the CIDR proposition never, ever tackles."
3144.76,3148.44," We can't put people's money, their own hard-working money, into something that"
3148.44,3152.52," is not going to be accessible for everybody. We have three principles, which we've shown"
3152.52,3157.68," that the side of proposition breaks, out of which they defended none. So we still have"
3157.68,3162.56," not putting money into benefiting everybody, putting money into something that is discriminatory,"
3162.82,3167.6," and in the end, putting money into something that doesn't respect secularism. We believe that this is highly"
3167.6,3172.92," problematic. But okay, everything can look good on paper, but can it actually work in"
3172.92,3176.9, real life? The side of opposition says no. We as the side of opposition show you problems
3176.9,3181.46," with private education in the status quo. We show you problems with vouchers on examples,"
3181.46,3188.74, and we show you good public education that exists right now on which the standard proposition tells you well in real life
3188.74,3192.18, everything is a bit flawed so we don't really have examples but generally it
3192.18,3196.04, will work okay if it generally works where is then not even one example of a
3196.04,3200.52, successful voucher not even one example of a flawed public system we believe
3200.52,3204.02, that if they prove this maybe their principles would stand we tell you
3204.02,3208.38, without any examples they're only talking into thin air
3208.38,3210.72, because nobody is actually going to believe this.
3210.9,3212.72," Okay, you can explain it as a perfect picture,"
3212.88,3216.08," but if it doesn't work in real life, I'm sorry, you have to go side-off."
3216.26,3217.02, Thank you very much.
3219.42,3222.62," Opp went into this debate with a mindset of how the debate should run right,"
3222.86,3228.62, but they never really engaged with the actual debate that the Yannzai proposition and the actual model that the Janszai proposition
3228.62,3231.9, gave to them. Now in my last piece I'm going to do a few things. First of all I'm going
3231.9,3237.9," to take a look at the clarification, what were the points that were not quite clear."
3237.9,3241.4, Second of all I'm going to take a look at the three questions I saw in this debate.
3241.4,3245.58," Which system is more accessible and which is more justified, and in the end, who will"
3245.58,3246.38, benefit the most.
3246.7,3248.76," Now, first of all, coming to the clarification itself."
3249.22,3252.96," Now, they gave us several examples of, for example, Scandinavian countries or Germany"
3252.96,3253.68, in which this works.
3253.94,3257.66," Now, ladies and gentlemen, in Scandinavian countries, you mostly have a voucher system"
3257.66,3260.08," and public schools still work, right, ladies and gentlemen?"
3260.3,3263.98, This is not an example that is actually under side opposition to it.
3264.3,3266.64," Second of all, Germany is not representative, right?"
3266.76,3269.86, Because it's a liberal democracy and it's a fairly rich country itself.
3270.08,3270.82, Why is this important?
3271.08,3272.98, Because the accountability doesn't work everywhere.
3273.38,3276.46," We don't have that level of political biases everywhere, right?"
3276.78,3279.58," Now, second of all, they have a big strategic law"
3279.58,3283.68," and only engaging with a very specific model of the few examples that they brought up,"
3283.8,3287.76," but not the general model, the model that we on-site proposition actually proposed. So they never"
3287.76,3291.8," really engaged with the real debate that we on-site proposition gave to them. Now second,"
3291.94,3296.84," third of all, they had a strategic flaw in bringing completely new continents within"
3296.84,3300.18," their third speech, something that we cannot adequately reply to, something that we should"
3300.18,3305.2," not believe counts. Now coming to the three points. First of all, accessibility. Now this"
3305.2,3308.82, was the most important point to opposition. Now what opposition said was that it's not
3308.82,3312.54," accessible for everyone, it's not everyone gets a voucher, right? And that the voucher"
3312.54,3315.94," money in itself is not enough, and that the middle class in itself falls through. What"
3315.94,3319.42," we on side proposition said is that first of all, the model caters to those who need"
3319.42,3323.14," it most, right? It caters to those who are under the median, who need this money the"
3323.14,3325.32," most, and have the most need for this money."
3330.28,3330.62," And second of all, they also have the incentive to actually use this, because they have the incentive to obtain a certain better education."
3333.86,3337.8," And again, the second class about how the voucher money is not enough, side proposition said that the voucher money is exactly as much as the tuition fee,"
3338.06,3343.38, or the tuition fee is not higher than the vouchers can actually get.
3343.62,3345.56, Meaning this point absolutely falls down.
3345.84,3349.4, Meaning on side proposition it stands that it actually is accessible to those
3349.4,3352.36, and actually gives those people that are trapped under a current system
3352.36,3355.36," that we see in status quo, gives them the chance to actually grade free,"
3355.56,3357.86," to actually get a better education, ladies and gentlemen."
3358.36,3360.54," So first and second of all, let's come to the justification."
3360.94,3363.8, What we heard on opposition was that we cannot give money to private entities
3363.8,3368.04," as we don't control them. What we said was three things. First of all, this is the case"
3368.04,3371.94," in status quo. Second of all, we still have certain basic regulations. We still have a"
3371.94,3376.36," certain basic curriculum. We have free choice on how you actually choose to teach this curriculum,"
3376.52,3381.86," free choice on the small points of this curriculum. And third of all, because we are giving things"
3381.86,3385.76," back, we give them choice, right? We give them a certain choice and give them a certain competition."
3385.76,3387.24," Now third of all, let's take a look"
3387.24,3389.24, at who in the end will actually benefit most.
3389.24,3391.04, Now what we had outside of opposition
3391.04,3393.56, was to assume that there's no benefits to the students.
3393.56,3395.76, There's simply no benefits under POP's model.
3395.76,3398.06, Now they give us no real mechanisms as to why this is.
3398.06,3399.9," And we have actually shown you benefits, right?"
3399.9,3401.36, We've shown you the diversification.
3401.36,3403.54, We've shown you that we cater to specific needs
3403.54,3404.6, of the students themselves.
3404.6,3407.0," We've shown you that we give these students, in the end, a"
3407.0,3410.0, better education and we give them the choice to this better education.
3410.0,3416.0," Second of all, they have the point on that schools will somehow not benefit as these"
3416.0,3420.0, public schools are simply underfunded and they will simply have a problem with this.
3420.0,3424.0," They never showed us the problem with this underfunding itself, and we said about the"
3424.0,3427.3," change in public schools, if there's less students that actually go to these public schools,"
3427.46,3429.26," then they obviously don't need as much money, right?"
3429.5,3431.16, Because this is simply the way this works.
3431.52,3433.38," These students still have these doctor systems,"
3433.5,3436.4," meaning these students actually still bring money into these public schools,"
3436.4,3441.18," meaning that education within these public schools is actually, in a way, going to get better."
3441.52,3444.64," Now, what we gave you were the benefits for the schools themselves."
3444.88,3446.62," I mean, the private schools themselves stay the same,"
3446.82,3449.06," and the public schools' problems actually get better,"
3449.14,3451.94," because these public schools are now not overcrowded anymore, right?"
3452.18,3454.7, They're not overcrowded anymore.
3454.98,3458.3," I mean, the middle class students that side opposition found so important"
3458.3,3460.22," don't suffer either, because these public schools"
3460.22,3462.54, actually do give them a certain amount of education.
3463.0,3464.7," I mean, that even if we accept in this debate"
3464.7,3467.26," that there's harms to a very, very few amount of people,"
3467.52,3469.72," we still see that in the greater amount of people,"
3469.9,3471.44, because we actually benefit more people
3471.44,3473.62," because we give them the chance to a better education,"
3473.84,3475.26, we believe this debate should stand.
3475.34,3476.02, Thank you for your attention.
