start,end,text1087.0,1092.0," If my rapist doesn't have the courage to apologize, even if he does not mean it,"
1092.0,1099.0, it's way more important than prosecuting individuals who are not directly my perpetrators.
1099.0,1103.0," We know that they've ordered these things, yet they're not my direct perpetrator."
1103.0,1108.88, They did not rape me on the field. This other person rate me on the ground. This is what
1108.88,1112.9," justice we're looking at. But second of all, on prosecution, on our side of the house,"
1112.9,1117.28," people who fail to apply for amnesty or fail to get amnesty, these individuals"
1117.28,1121.6," are going to be prosecuted by national authority, so we do not lose prosecution."
1121.6,1126.32," On your side of the house, these are the individuals who are going to live without prosecution."
1126.66,1131.24," Why? Because the ICTY focuses on certain atrocities, certain problems."
1131.88,1135.04, Other people are getting out without any punishment.
1135.4,1136.38, They're not being imprisoned.
1136.54,1138.84," On our side of the house, we're focusing on the little ones."
1138.9,1139.72, I'm not going to take it.
1139.96,1141.52, Then we're focusing on the others.
1142.1,1144.3, On the idea of corruption and budget.
1144.3,1147.08, We've told you that the UN is going to participate
1147.08,1148.5," and is going to offer help,"
1148.74,1150.74, as they did in Sierra Leone before.
1151.06,1152.26, So we're not talking about something
1152.26,1153.9," that did not happen before, first of all."
1154.18,1155.0," But second of all,"
1155.26,1158.24, the UN has symmetrical incentives to be part of this
1158.24,1160.36, as they've initiated the ICTY.
1160.64,1162.46," They have the same incentives to create peace,"
1162.68,1164.62, the same incentives to help the victims
1164.62,1165.0," on our side of the house. We believe that the UN is going to peace, the same incentives to help the victims."
1165.0,1170.0," On our side of the house, we believe that the UN is going to participate, so you cannot argue corruption, you cannot argue budget,"
1170.0,1175.0, because it's actually the same between the RCTY and the TRC.
1175.0,1179.0, Moving into why the Syrians are going to testify in other countries.
1179.0,1182.0," We're not saying that these individuals should testify in other countries,"
1182.0,1187.72," we're saying that these individuals should testify in their own country in order for them to get amnesty, so we're not looking"
1187.72,1191.2, to testify in Croatia or other places.
1191.2,1192.8, So what do we get then?
1192.8,1195.38, Why are these testimonies important?
1195.38,1198.76," Because on our side of the house, as we've told you before, we're creating a regional"
1198.76,1206.0, TRC in which it's getting the reports from national TRCs and then it's pushing for a mega narrative that's
1206.0,1211.12, collected from all the national TRCs.
1211.12,1218.16," And moreover on retribution, they told us that retribution is actually effective."
1218.16,1221.84," We did not see how it's effective, we did not see how the people are satisfied."
1221.84,1225.24," This is our status quo. In our status quo, there's fragile peace."
1226.06,1226.32, There's still hatred.
1227.18,1227.76, There's still discrimination.
1228.46,1229.66, This is not... I'm not going to take it right now.
1229.86,1232.1, This is not what we're looking for.
1232.78,1235.1, And why are they going to participate?
1235.28,1235.86, Two main things.
1236.22,1237.68, The individuals who are going to participate
1237.68,1239.78, are individuals who are afraid of being prosecuted
1239.78,1240.58," without amnesty,"
1240.9,1241.88, so they're going to participate.
1242.18,1242.72," But second of all,"
1242.8,1248.48," societal pressure is going to push them into participating. It's a domino effect. When someone's going to participate, the others're going to participate but second of all societal pressure is going to push them into participating it's a domino effect when someone's going to participate the others are"
1248.48,1253.36, going to participate in in the fear of getting prosecuted in the fear of societal pressure but
1253.36,1257.44, second of all we would argue that the victims participation is way more important than the
1257.44,1261.52, perpetrators because the victims are going to participate and they're going to testify
1261.52,1272.5," it helps them in reconciliation helps them in their in their healing passage. But second of all, these testimonies could be used for prosecution"
1272.5,1278.12," of individuals who did not apply for amnesty, who weren't granted amnesty. So I'm going"
1278.12,1279.12, to take it from here.
1279.12,1284.68," Yeah, just to clarify your model, can the Serbian sect of the TRC grant amnesty to individuals"
1284.68,1286.0, who come to the Serbian sect of the TRC grant amnesty to individuals who come to the Serbian TRC?
1286.0,1293.0," Yes, they can, but on our side of the house, these TRC commissioners are not going to be people from within the government."
1293.0,1296.0," These commissioners are experts in reconciliation, experts in diplomacy."
1296.0,1299.0, We might use help from other TRCs.
1299.0,1303.0," We might, like Desmond Tutu in South Africa."
1303.0,1308.8," So we're looking into experts in diplomacy, experts in reconciliation, and civil society leaders."
1308.8,1315.84, So they're most likely not going to give amnesty unless this person really deserves amnesty in which there is a criteria.
1316.26,1322.28," And even in the slightest possibility of these individuals getting amnesty when they do not deserve it,"
1322.38,1324.62," if they're going to get amnesty, they're going to testify."
1328.68,1334.1, So their testimony is way more important than your arbitrary prosecution. Moving to the second idea about peace. They told us that wartime leaders are
1334.1,1338.76," going to continue. Well, we did not see this. The ICTY couldn't prosecute Milošević until"
1338.76,1344.34," he was thrown from his power. So the same applies for us. On our side of the house,"
1344.44,1349.0, the only thing that's different is that we're pushing for more societal pressure in order to achieve change.
1349.0,1357.0," But second of all, on peace, they did not show us how we achieved peace on their side of the house. On their side of the house, peace is not achieved."
1357.0,1370.38," We're seeing military tensions between countries. We're seeing Kosovo and Serbia still now having their conflicts, so they did not achieve peace. What they achieved is a fragile peace that is not important."
1370.38,1379.04," And moving on to my argument, my third argument is about creating better governance. First"
1379.04,1382.36," of all, civil society is going to be hard on our side of the house and our side of the"
1382.36,1388.52," house only, because the NGOs and the commissioners are getting more power. NGOs are participating more when"
1388.52,1392.62," they have more knowledge about what happened. But second of all, commissioners are getting"
1392.62,1397.6," more power in our... these commissioners are civil society leaders, they are religious"
1397.6,1402.16," leaders like Desmond Tutu and like many others. So these individuals, when they are getting"
1402.16,1405.96," more power, we are improving the civil society, which achieves more democracy."
1406.12,1409.92," If they are going to argue democracy, we would argue that democracy is better on our side of the house."
1410.2,1414.74, The second point is delegitimizing mid-rank generals on their side of the house.
1415.12,1420.88, Toxic mid-rank generals are going to stay in power because they are not prosecuted by the ITTY on our side of the house.
1420.98,1423.68, They are either going to apply for amnesty or going to be prosecuted.
1423.84,1428.2," Either way, they are going to be delegitimized and they're going to be thrown out of the government."
1428.2,1431.0, So we achieved this in the worst-case scenario.
1431.0,1436.5," And moving on to why do we create better relations, international relations?"
1436.5,1440.3," Less toxic nationalism. On this side of the house, there are narratives such as"
1440.3,1445.06," the only massacre that happened, the only genocide that happened in the Balkans is against"
1445.06,1449.24, Serbia. These narratives do not allow for international relations and these narratives
1449.24,1452.44," are exclusive to their side of the house. On our side of the house, we achieve less"
1452.44,1457.28, toxic nationalism through better historical records in which individual victims are participating
1457.28,1469.4," in it. It's being written by reconciliation experts. Moreover, we also get better testimonies and records because if I know that an ICTY"
1469.4,1474.7," is going to be established, I'm going to preserve the records which allows me to get better"
1474.7,1481.7," records. So that's why we get better records. So on who achieves justice, we achieve justice"
1481.7,1487.0," that's better for victims. On who achieves better collective historical record, we achieve it,"
1487.0,1494.0," and on who creates better governance and better civil society on our side of the house, we empower all of these."
1494.0,1495.0, So proud to propose.
1498.0,1503.0, The wounds that people have from the Yugoslav war are never healed with a simple apology.
1503.0,1508.44," To the survivors, justice denied is a profound insult, a mockery of their pain and resilience."
1508.44,1514.24," It is a cruel reminder that a world can turn a blind eye to their suffering, proud to oppose."
1514.24,1516.44, My speech will consist of three main aspects.
1516.44,1519.44," First, some top-level engagement as well as clarifications."
1519.44,1520.8," Then, on victims."
1520.8,1521.8," Finally, on peace."
1521.8,1525.36," Firstly, I have three main notes I want to make at the top that"
1525.36,1530.6," largely deals with a lot of their claims. Firstly, that proposition has massive burdens to fulfill in"
1530.6,1534.96, this debate that still go unfulfilled at this point in this debate. They have to prove to us
1534.96,1540.1, that individuals are actively going to come to the TRC and the deputy's one-second response to this
1540.1,1545.2, POI cannot stand in this debate. Proposition wants you to believe two main reasons why people are
1545.2,1550.32, actively going to come to the TRC. They firstly tell you that these individuals want amnesty and
1550.32,1554.8," fear persecution, then secondly on societal pressure. About the first one, I'm going to deal"
1554.8,1560.08," with this in two main ways. One, that people are not persecuted under the TRC. Second, that these"
1560.08,1566.62," leaders especially have very little incentive to put themselves in. Firstly, people are not persecuted under the TRC."
1566.72,1570.9, There are so many people who do not come to the TRC that the TRC and the national court
1570.9,1575.66," system lacks the manpower to persecute everybody, which is why tens of thousands of individuals"
1575.66,1580.22, whose amnesty proposals got denied in South Africa never got persecuted and walk free
1580.22,1581.02, to this day.
1581.34,1585.4, This means that people do not have to fear persecution and proposition
1585.4,1589.92," because people are unable to get persecuted. But secondly, I also want to note that leaders"
1589.92,1593.78," have very little incentive to turn themselves in, especially because these institutions"
1593.78,1598.54, can massively be coerced by themselves. The fact that there is a Serbian sect of the TRC
1598.54,1602.1, and that it is the only organization to which Serbian individuals have to be accountable
1602.1,1605.44, for means that the Serbian leaders no longer have to feel accountable.
1605.44,1608.18, They have so much power in this institution.
1608.18,1611.9, The second problem analysis you get is to say that there is societal pressure.
1611.9,1617.18, This is just wrong because the prerequisite of societal pressure existing is for some
1617.18,1619.5, people at the beginning to be pressured in the first place.
1619.5,1622.04, We proved to you that nobody feels this pressure.
1622.04,1627.12, The implication of the first clarification then is that the proposition has to fulfill this burden of people actively coming
1627.12,1633.2, to the TRC. The second clarification is that the fact that
1633.2,1636.98, proposition wants to clean this idea of a multinational TRC that extends beyond
1636.98,1641.36, borders is the entire downfall of their case. From Contaro's speech we give you
1641.36,1648.02," three main reasons why this is likely to fail to which the only response we get from proposition is to say, well, the incentive to create peace"
1648.02,1650.68, and to be good for victims exists in all of these countries.
1650.98,1651.98, Two problems with this.
1652.24,1655.52," Number one, each country has different ways by which they accomplish this."
1655.72,1658.16, This is why the ICTY was especially functional.
1658.52,1662.9," But also secondly, the ICTY was uniquely forced when in comparison the TRC is voluntary."
1663.3,1669.6, Nations and these wartime leaders who still retain power after the war ended have very little incentive to actively cooperate with the
1669.6,1674.72," TRC, which is an institution that is coming out to get them. I also want to note that this idea"
1674.72,1680.48," of a multinational TRC, and especially the response to the POI I give them, is massively"
1680.48,1688.76," detrimental to their case, because I ask them if the Serbian sect of the TRC can grant amnesty. They say yes. The problem with this is that"
1688.76,1692.78," there's massive bias that remains inside the TRC. This is why, for example,"
1692.78,1697.28," when you look at the South African TRC, zero cases of war crimes committed by"
1697.28,1701.1, black individuals was ever persecuted because the leaders who they claim are
1701.1,1708.68," experts, people like Desmond Tutu, were incredibly biased against white people, which means that TRC was only functional in one way, justice, not"
1708.68,1709.68, multinational justice.
1709.68,1713.18," I want to talk about victims now, but before that, PY, go ahead."
1713.18,1715.78, You're talking about punishing those individuals.
1715.78,1720.24," On your side of the house, you were only punishing less than 161 individuals."
1720.24,1723.72," On our side of the house, even if we do not get debate leaders, at least on our side of"
1723.72,1724.72," the house, there are..."
1724.72,1729.34," Yes, but we punish the right individuals. On victims, our argumentation tells you that the TRC"
1729.34,1734.62, and the victims get tokenistic apologies on proposition. We also tell you that many of our
1734.62,1738.9," individuals are too vulnerable and a lot of individuals are unable to speak out, which means"
1738.9,1742.94," comparatively, uniquely, when we bring justice from the top, we can target everybody, we can bring"
1742.94,1746.12, justice for everybody. We get zero response to this argumentation.
1746.2,1748.14, I think that this massively harms their case.
1748.56,1750.76, Let's look at their argumentation you get from PM.
1751.26,1752.5, They give you a couple of things.
1752.58,1756.78," The first thing Proposition wants you to believe is that the UN is going to spend a lot of money in these reasons,"
1756.98,1759.16, and this is going to help things like mental health efforts.
1759.16,1759.96, Two things.
1760.3,1764.0," One, in the history of the United Nations and the history of the TRC,"
1764.3,1765.16," the UN has never established significant the history of the TRC, the UN has never"
1765.16,1769.72, established significant monetary support alongside the TRC.
1769.72,1773.88, It has only been always through the TRC because the TRC is obviously out of their control.
1773.88,1778.68," But secondly, even if you don't state that, specifically in this situation, in this post-Yugoslav"
1778.68,1783.9," society, it is unlikely that the UN does this because the TRC is dysfunctional."
1783.9,1785.68, All of our other mechanisms are prerequisited
1785.68,1790.34, upon this unless they can improve the functionality of the TRC. The UN has no incentive to drain
1790.34,1791.76, their resources into this.
1791.76,1797.94," The second prop claim to get is on NGO support. We agree, NGOs, amazing institutions, brilliant."
1797.94,1801.98, The problem is that this is a comparative debate. There is zero analysis as to why NGOs
1801.98,1805.36, are in any way unique. NGOs exist in the world as well.
1805.78,1809.44," Thirdly, proposition will have you believe that they create a better historical record,"
1809.72,1813.72, but the ICTY is just as well able to gather information. But let's take their best case.
1813.74,1817.24, Let's say they're talking about different kinds of information. Maybe they're talking about more
1817.24,1821.72, victim-centric information. The problem with this analysis is that we prefer a world in which
1821.72,1827.36," victims are unaware of what happened to their relatives, because we believe that this allows for better rationalization."
1827.78,1832.22, It is better to have information hidden from you as it allows you to rationalize and deal with the trauma.
1832.56,1835.1," Rather than finding out that your son was abused and tortured,"
1835.4,1838.92, you craft this idea in your head that he died an honorable death in the battlefield.
1839.32,1842.16," Rather than finding out that your mother was raped and beaten to death,"
1842.34,1844.7, you believe she died peacefully in your father's arms.
1844.98,1847.76, Imagination is the antithesis of depression.
1847.76,1851.6," I finally want to talk about this case that you get from the intro, that these individuals can"
1851.6,1856.48, just forgive and move on because of the wonderful institution that is the TRC. The problem with this
1856.48,1861.28," case is that forgiveness cannot happen. An apology cannot redeem a person who raped you, who abused"
1861.28,1868.16," you, and who basically messed with your entire life. Maybe a few people will forgive their perpetrators, but for the vast majority of individuals who"
1868.16,1871.52," are not going to look a murderer in your eye, once they say sorry you just go,"
1871.52,1876.96," oh all is forgiven, let me move on with my life. This victim argumentation is massively important"
1876.96,1881.36, because this argumentation is the only argumentation that holds any ground in this
1881.36,1885.48, debate. The ICTY and TRC are just fundamentally not strong enough
1885.48,1887.26, to create massive change in society.
1887.58,1890.26, They're unable to do things that create massive scales of peace
1890.26,1891.68, or massive scales of conflict.
1891.96,1894.22, We think that the only large impact in this debate
1894.22,1896.78, and the only impact that is massively important in this debate
1896.78,1897.56, is on victims.
1898.28,1899.8," Next, I want to deal with peace."
1900.32,1902.16, Proposition has a couple of analysis here.
1902.24,1903.2, The first thing is NGOs.
1903.34,1906.24, I've already told you NGOs exist just as much in our world.
1906.24,1908.34," Secondly, they tell you about mid-rank generals."
1908.34,1910.24," But once again, there are two problems with this."
1910.24,1914.2," One, that you get no analysis as to why mid-rank generals even come to the TRC."
1914.2,1917.14," And second, that they're unable to prove the comparative to you, that mid-rank generals"
1917.14,1921.76," are not prosecuted under the TRC, that the TRC does not prosecute individuals."
1921.76,1925.44," Thirdly, proposition tells you a case about finger pointing and how"
1925.44,1930.72, we uniquely bring this idea that we point fingers at each other saying the other person is wrong.
1930.72,1934.88, The problem with this is that finger pointing is not against ethnicities in our world but rather to
1934.88,1939.84, wartime leaders. The ICT right specifically focused persecution on leaders and did not label one
1939.84,1944.16, ethnicity as the bad guy which means finger pointing did not happen in our world. But I
1944.16,1947.44, also want to flip this argumentation because because the finger-pointing that the leaders
1947.44,1950.78, did rather reduced ethnic division.
1951.12,1954.72, This is to say that once you're able to blame the leaders for the conflict and see that
1954.72,1958.38," they are the fundamental reason why conflicts happen, and that they are the demons that"
1958.38,1962.78," manipulated others to orchestrate feelings, that is when you can vent your anger."
1963.26,1968.8," The conclusion of this argument, and the conclusion of this debate, is that Team Japan takes this debate in two main ways. First, we"
1968.8,1973.24," protect victims. This is the most important class and this is debate 20. But second, we win on"
1973.24,1980.16," propositions metric on peace. We do not think the ICTY is perfect, but the TRC is a dysfunctional"
1980.16,1985.92," mess of prejudiced individuals that does nothing to solve the post-Yugoslav crisis, to absolve"
1985.92,1991.78," the traumatized individuals, or at the very least to ease their pain, the ICTY was absolutely necessary."
1992.32,1997.04," We believe that in this debate, side opposition was blinded by the idea of prosecution that"
1997.04,2002.4," supposedly satisfied victims as well as served the nation justice. We believe that, as they said,"
2002.4,2008.68, the only mechanism for them to prove this case was through the prosecution of these oppressors. We believe that their
2008.68,2013.68, entire case neglected three core ideas within our speeches which is first of
2013.68,2017.34, all we get a platform in which accurate history is written. This has a lot of
2017.34,2021.72, benefits for victims as well as the nation. Second on the idea of closure and
2021.72,2033.96," how beneficial it is for these victims lives and lastly on acknowledgement of atroc, which is fundamental in a way in which we allow these victims to feel that these oppressors acknowledge the oppression that occurred,"
2034.24,2037.34, as well as taking responsibility of all the atrocities that they committed.
2037.6,2039.66, We believe that we win on two main points.
2039.78,2043.22," First, on the idea of providing victim relief and the right to know."
2043.32,2048.16," And second, on the idea of how we better deal with the aftermath of the war and therefore we get better outcomes"
2048.16,2049.02, for the nation.
2049.3,2055.22," First off, we agree completely with what opposition said, which is the goal of the TRC was never"
2055.22,2056.06, about prosecution.
2056.26,2058.14, This was never a priority within our case.
2058.34,2062.16, We believe that the prosecution that they were fighting for within their entire case
2062.16,2069.82, simply did not work in the status quo. What we saw was is that people on the edge of their grave are getting prosecuted for
2069.82,2072.94, like four years after like 17 years of trial.
2073.22,2074.54, This was a waste of resources.
2074.54,2081.28," This was a long, long-waited verdict that simply did not serve these victims anything"
2081.28,2085.56, beneficial because these leaders were not
2085.56,2089.76, put in a corner in which they had to confess for the crimes they did. They still had
2089.76,2093.88," legitimacy to deny everything they did, they still had the legitimacy to get out of"
2093.88,2098.26, jail and continue living their lives with a lot more legitimacy than
2098.26,2101.56, they would have on their earth at the house because of things like narratives that
2101.56,2107.94, Milozovic was still a hero even after he was prosecuted because the guy didn't even acknowledge the atrocity that he committed towards his own
2107.94,2108.26, people.
2108.58,2113.96," Therefore, an important note to highlight here is that even if we assume that something"
2113.96,2117.72," like this was very detrimental when we're talking about no prosecution, we still did"
2117.72,2122.32, not get full access to amnesty to whoever wanted it.
2122.32,2125.44, We gave very specific metrics as to how the CRC
2125.44,2130.26, globally worked. It was meticulous ways in which individuals needed to provide
2130.26,2134.7, significant information. They needed to be cooperative with the court. They could
2134.7,2138.6," not get amnesty as they pleased. They had to abide by certain criteria. Therefore, we"
2138.6,2142.64, do not see how their points on how these individuals can simply still walk freely
2142.64,2149.08, is true. Even if we do not get their prosecution we still believe that we win on a lot more by delegitimizing these politicians which
2149.08,2153.28, I'll be getting into later on in my speech but even with our worst case scenario in which
2153.28,2157.6, prosecution simply does not exist under our side of the house we have a lot more mechanisms as to
2157.6,2162.6, how we benefit the people within our status quo when we're talking about the idea that victims
