start,end,text
0.0,6.0," Since the 1980s, the influx of tourists travelling to Barcelona has only increased."
6.0,10.0, It has been unchecked and not really regulated because of the illusion of economic benefit.
10.0,19.0, Over-tourism is something that is inherently harmful because it means that locals are pushed out of their own communities because of rapid gentrification.
19.0,25.8, Suppose that dollar signs that the opposition might tell you about clearly don't matter at the point at which individuals are marching in the streets of
25.8,30.4," Santorini and Barcelona telling tourists to go home, proud to propose."
30.4,32.4, A few arguments come into the problem.
32.4,36.2," The first is on why we benefit the economy, the second is on culture, and the third argument"
36.2,38.8, in the second speech is an argument around the environment.
38.8,40.4," Before that, what's our stance?"
40.4,42.8," One, we aren't banning tourism, that's absurd."
42.8,44.8, We're rather limiting the numbers in the industry.
44.8,54.0," We believe that any industry can have economic benefit, but it is the duty of the state to regulate against unchecked growth in order to ensure that the possible harms don't outweigh the possible benefits."
54.0,59.0," For clarity, we want tourism to not overshadow the carrying capacity that currently exists."
59.0,61.0, What then does our model look like? Five things.
61.0,67.8," A. It looks like establishing quarters, particularly during peak season. So for example, limiting the number of individuals that can access something"
67.8,72.68," like a tourist visa. It looks like how Greece's admins has put a cap to 20,000 individuals"
72.68,76.76," per day, down from historically with their number of 40,000. This significant reduction"
76.76,81.28, is going to be determined by states alongside relevant experts in the field. B. We're looking
81.28,84.82, to impose restrictions on tourist-centered accommodation. So this looks like how Berlin
84.82,91.0, has put a regulation on short-term rentals requiring a permit to be signed when you are apportioning the apartment in residential areas at a time.
91.0,96.0, C. We're looking to also support the implementation of additional premiums for specific areas.
96.0,101.0, So this looks like how Venice has an increased five-year fine for visiting Venice on day trips if individuals want to live in there.
101.0,105.28, D. We're also willing to support all other reasonable initiatives
105.28,107.76, to limit the number of tourists within these major destinations
107.76,110.4, and also prevent the inflation impact that currently exists.
110.4,114.0," Lastly, this cap would be determined from country to country basis,"
114.0,118.92, but it would be a cap determined on the basis of reducing the country's dependency on tourism.
118.92,121.6, That's what the most important thing in this debate is.
121.6,122.92, Second part of the strategy.
122.92,126.0, We're willing to trade off the constant influx of money for tourism
126.0,130.0," because of three reasons. One, government's responsibility to support local populations"
130.0,134.0, first and foremost because of social contracts. Hyper-tourism uniquely has a blanket form
134.0,137.0," to its individuals, and most instances the money from tourism doesn't actually go to"
137.0,140.0," locals and we're the ones who put the silver back into it. But two, tourists are still"
140.0,145.0," able to visit on our side, we're not completely undergoing the economic benefit that exists,"
145.0,147.0, we're just maintaining a lack of sustainability.
147.0,151.5," Third, access to tourism creates a dependency that forces governments to have pervasive interests."
151.5,155.5, So the idea that the government of Brazil is now likely to not have an incentive to face your vendors
155.5,159.5, because they have a reliance on slum tourism is something that they can never trade off on their side.
159.5,161.5, Arguing then as to how we benefit the economy.
161.5,163.5," Before I preach, I want to take a P.O.I."
165.44,169.04," Arguing then as to why we benefit the economy. Before I preach the argument, let's take a P.O.I. Arguing that as to why we benefit the economy. The framing here is very simple."
169.04,174.0, Unchanged tourism has led to harms to the domestic economy because oftentimes there is a prioritization
174.0,178.64, around the needs and comforts of wealthy tourists over the poor population. Why then do we have more
178.64,183.44," economy? Firstly, the allure of tourism is certainly that politicians often don't take the necessary"
183.44,189.0," means to regulating it until there's a critical tipping point, so private interest overshadows the domestic population's well-being."
189.0,208.0," Air gain across the world has led to increased demand for short-term rentals, increasing the general cost of living in city centres, which leads to a real human cost, at the point at which pensioners and local individuals can't out-compete with tourists in terms of like on a many reasons. That means then, it should likely do harm to these individuals and increase the prices of food in that area."
208.0,212.16," The minimum wage in Spain is a little over a thousand euros a week, but on average tourists"
212.16,217.6, in Madrid spend about a thousand euros. This leads to an enemy out-of-place and very veganization
217.6,222.08," impact out of volume. Secondly, there's a seasonality around the world. So tourism centers"
222.08,226.0, are in peak seasons where markets pop up and there's accommodation that's putting tourists out.
226.0,231.0," The seasonality is harmful because when tourism is allowed to grow unchecked, you create a dependency on the tourism."
231.0,234.0, That means then that out of season there's no real economic benefit.
234.0,238.0," This is especially important because even in the best case when they do provide jobs, those jobs are still on steam."
238.0,242.0, Particularly pernicious in the instances when the government needs incentivised mass training.
242.0,246.74, Because those are the types of things like hospitality training that are short-term in nature and they're very volatile.
247.14,250.76," Third, the massive gains from tourism on their side just leak out of the country."
251.0,255.56, Because MNCs are the largest corporations that have the ability to create large results on tourist destinations.
255.92,259.58, 70% of all of the money tourists spend in Thailand ends up leaving their country.
259.58,265.72," Because international allies don't benefit the local economy, local vendors often get bought out by MNCs looking to gentrify."
265.72,270.72, The reason as to why MNCs and leakage are inherent to scale and are a hand to mass tourism
270.72,275.18," is because they enable MNCs to gain more economies of scale, to keep prices low, and fundamentally"
275.18,277.8, is a greater likelihood of that happening on their side.
277.8,281.52," But even if leakage exists on either side, it is far worse on their side, because more"
281.52,287.84," and more people come into these local communities, making those economic issues far worse. Especially important in all points is going to make any"
287.84,291.12, argument about developing world economies that are worse for the opinion that they're likely to
291.12,295.68," be talking about. On our side, however, destinations in particular don't get overwhelmed. There's less"
295.68,299.84," inflation pressure on the poor and the middle class comparatively. One, locals are always going"
299.84,304.56, to outnumber tourists but they need to be able to live in cities that can have economic economy
304.56,308.8," to help the broader economy grow. Two, on our side, states can invest into more long-term,"
308.8,312.72," durable economic opportunities because when tourism decreases, it's likely other industries"
312.72,316.96, can grow because there's more utility that's provided. Even if gentrification occurs on our
316.96,321.28," side, it is still likely to be better because that gentrification is going to happen organically and"
321.28,328.0, not to be needed to have a lot of tourists. So you don't have MLCs pushing for rapid development and things like high-rise buildings. It's going to happen head-to-head to global.
328.0,334.0," On their side eventually, the appeal of the novelties is going to be let off. The country is going to be let off. No other means is sublimating that value."
334.0,347.0," Tourists are going to move on and the trade is going to be over, like we've seen in the Spanish islands. So that means then that you don't have the capacity for the country to build again. The impact of this argument is twofold. Firstly, we see this home existence in wealthy countries,"
347.0,349.0, and I think now regulation is an especially important
349.0,351.0, empowerment for developing nations that are
351.0,353.0, looking to become tourist hotspots.
353.0,355.0," Cape Town, a city in South Africa, has the most"
355.0,357.0, ABM visa in the world because of pro-business
357.0,359.0, government who want MNCs to buy up and construct new
359.0,361.0," tourist accommodations, leading to a vast"
361.0,363.0, disfaces. Tourists just don't care because they
363.0,366.3," don't have an attachment to their country, And even when they are aware of this,"
366.3,367.76, they prioritize their own comforts
367.76,368.94, over the comforts of others.
368.94,371.18," But second, there is a real human host"
371.18,372.88, to all of the things we are talking about.
372.88,375.02, It is the mother who was laid off from her resort
375.02,376.64, because that resort isn't making money.
376.64,378.24, It is the young couple that cannot afford
378.24,379.82, to start a family and build a home
379.82,382.46, because homes are too expensive because of gentrification.
382.46,385.4, That is the type of world that exists on the other side.
385.4,388.4," Second argument then around culture, before I give this short."
388.4,393.4," For nations like seashells, they have to do tours because no alternate economy has worked."
393.4,396.8, What alternate economies would they comparatively shift to in your world?
396.8,400.4, We gave you two structural reasons as to why these economies are likely to diversify
400.4,402.0, and they're likely to have under industries grow.
402.0,403.4, You need to actually engage with those.
403.4,405.44," Argument number three. We improve cultural participation and social communication, and you like it and let industries grow, you need to actually engage with those. Arguing with the government will be important."
405.44,409.6," We improve cultural participation and social communication, especially in the developing world,"
409.6,411.6, because there's an increasing demand for tourism there.
411.6,416.8, It's taking the characteristics of the exploitative nature as opposed to being appreciative of that culture.
416.8,419.76, There's a disrespect for culturally and spiritually significant areas.
419.76,425.6," So for example in Peru, they had to limit the tourist numbers that existed in order to better ensure that those harms don't exist too much."
425.6,429.62," In Greece, they had to literally arrest individuals because they were defacing things like the"
429.62,431.72, Coliseum and historically significant architecture.
432.12,436.22," These are not isolated instances, but they're structurally true because tourists just don't"
436.22,438.42, have the same appreciation and they just don't have the same attachment.
438.72,441.48, They're individuals who want to look cool and get an Instagram post of them.
441.74,446.0," Currently, all across Europe, major tourist clubs are seeing an increased protest from individuals"
446.0,447.52, because individuals don't like these things.
447.52,449.6, Spanish individuals are spitting in tourist drinks
449.6,451.6, and telling them to leave their country.
451.6,453.8, This is because institutions are set up
453.8,455.24," to cater for tourist individuals,"
455.24,456.84, not necessarily the locals of their country.
456.84,459.52," So complaints about drunk, water-drunk, or loud tourists"
459.52,461.32, just don't matter to the institutions.
461.32,463.4," We solve these issues because comparatively,"
463.4,465.0," on our side, we have smaller numbers of tourists,"
465.0,468.0, that means then it's easier to regulate those individuals as opposed to in your side.
468.0,472.0," This argument is especially important because if we better maintain the culture of the nation,"
472.0,475.0, it's likely individuals who do actually care about those things are going to visit that country.
475.0,478.0, So we maintain tourism over a longer period of time.
478.0,482.0," If they're going to argue about tourism in one of the five years, then our case is simply prior to theirs."
482.0,485.0, What proposition? Because we make tourism work for locals again.
485.0,492.0," Not international payment, not international businesses, not amenities, but for people who live to deal with high prices in large areas and their homes and homes."
493.0,497.0, Significant restriction on tourism is a significant restriction on the economy.
497.0,500.0, We will forward two arguments from Japan in this debate.
500.0,506.0," First argument on why we better the economy, and our second argument will be brought by our second speaker."
506.0,512.0," Before argumentation, three pieces of set up. And note that this will take down the majority of their argumentation."
512.0,516.0," Firstly, what is our stance in this debate? We are willing to take a hard stance."
516.0,521.0, We support substantial increases in tourism and we encourage more and more tourists to come in.
521.0,525.32," Secondly, what is the characterization of these tourist cities?"
525.32,530.72," Major tourist destinations often feature distinct tourist zones, bustling with hotels, attractions"
530.72,535.32," and shops catering to visitors, while local population areas are more residential and"
535.32,538.78, cater to the daily needs and lifestyles of the locals.
538.78,543.8," This separation ensures that tourism infrastructure is concentrated, preserving local culture"
543.8,549.52," and community life in separate, less commercialised neighbourhoods. Third, what alternative policies are we willing"
549.52,554.24," to support? Because we agree that to some extent, regulation is necessary. We think that cities"
554.24,558.32," should basically do whatever is necessary for their nation, but there are a few examples,"
558.32,563.2, such as 1. Spreading tourist traffic. Promoting business during off-peak seasons can help
563.2,567.48," distribute the influx of tourists more evenly, reducing the strain on popular destinations."
568.18,573.36," 2. Improving infrastructure and facilities. For example, Barcelona's expansion of its"
573.36,577.76," metro system has been instrumental in managing tourist traffic more efficiently, spreading"
577.76,581.78, visitors across the city. 3. Severe punishments for destructive behaviour
581.78,587.62," by tourists. Therefore, the problems that they talked about can be fixed without significant limitations on the number of"
587.62,592.12," tourists. On this piece of frame though, I want to make two additional important"
592.12,596.8," notes. First, this regulation is exclusive to our world because the tax revenue we"
596.8,601.02," get from tourism, which is necessary to implement these regulations, can only be"
601.02,605.0," gathered in our world. This means Proposition cannot co-opt these alternative regulations. Second, Proposition cannot say these alternatives do not gathered in our world. This means Proposition cannot block these alternative"
605.0,610.38," regulations. Second, Proposition cannot say these alternatives do not exist in our world"
610.38,614.88," because we just have to support the status quo. And in the status quo, Vienna already"
614.88,620.34," has rent control, Barcelona already bans Airbnb. Therefore, the Proposition's burden in this"
620.34,628.86," debate is to change the status quo. These milder policies are our side of this debate. And before I move on to our first argument, I'll take a POI. Speaker, if it"
628.86,632.78," is that you're investing so much into having to maintain tourism, why don't you have any"
632.78,638.6, spillover effects to other parts of the economy? We think that it is very unlikely. Our speakers
638.6,643.64," will extend upon that, but we think that the crucial reason why the economy won't diversify"
643.64,648.1," is because those places are not attractive, right? That's the crucial reason why, apparently, these"
648.1,653.42," places are not popular. We'll prove to you this further in our case. Okay, the"
653.42,656.18, first argument on the economic development. And note that this
656.18,659.86, argumentation will directly clash with their argument. The thesis of this
659.86,663.86, argument is that tourism boosts the economy and creates jobs. There are two
663.86,670.56," layers to this argument. Firstly, how does tourism stimulate the economy? There are four notes on how much money tourists"
670.56,676.5," spend which proves the stimulation that tourists bring. One, tourists uniquely want to spend money."
676.5,681.62," This is because tourists inherently have a strong inclination to spend money during their travels,"
681.62,687.44, times of excitement and relaxation where they are prepared to indulge in various activities and experiences.
687.44,696.0," 2. Tourists often come from countries with stronger currencies, meaning that their money has a greater purchasing power in destinations with weaker currencies."
696.0,703.6," This difference enables them to afford more luxuries and experiences than they could at home, which leads to increased spending during their travels."
703.6,708.8," 3. Travelling itself is inherently expensive. When tourists visit another country,"
708.8,714.8," their expenditures extend far beyond just airfare and accommodation and extend to public transportation,"
714.8,719.6," dining, souvenirs, entertainment and various services such as guided tours or taxis."
719.6,724.24, Each of these expenditures contributes a substantial influx of money into the local economy.
730.2,734.82," 4. And lastly, it creates spending on unique services. For instance, locals have homes and sublets so they don't use hotels as much. Locals cook home food so they don't"
734.82,738.84, regularly go to restaurants. Locals barely use taxis as they have cars and
738.84,743.22," public transport. Locals don't consume souvenirs. Therefore, the implication is"
743.22,747.04, that the types of spending that tourists do is extremely unique and valuable.
747.44,749.18," Before we move on to the second layer, I'll take a quick one."
749.32,754.12," Speaker, you literally just said that individuals can use public transport, and then you say that they can use cars."
754.28,755.78, Which one is it? Because they're both contradictory.
756.26,761.64," We don't think it's contradictory, and it's very unclear what the implication of that, even if there is a contradiction."
762.5,767.0," Second layer of this argument, how the proposition's comparative harms the economy."
767.0,769.0, There are six main impacts.
769.0,770.0," One, job loss."
770.0,774.5," Intuitively speaking, this economic failure will lead to massive job loss for people in"
774.5,777.5," the service sector and tourism sectors, unlike they claim."
777.5,781.0, These are jobs that are very accessible to low skilled workers.
781.0,785.34," These are workers with very few transferable skills, no education, and no experience, which"
785.34,790.24, means it's incredibly hard to find a new industry to house all of these unemployed workers.
790.24,794.68," Furthermore, when an entire city is suddenly unemployed, it also means more crime happens."
794.68,798.12, It means there are no longer support networks for the unemployed.
798.12,799.92, Job loss is a massive impact here.
799.92,800.92, 2.
800.92,801.92, Promotion of service work.
801.92,829.0," The types of jobs created by the tourism industry are often more favorable compared to alternatives in many developing countries, while manufacturing jobs, which many developing countries rely on, oftentimes involve roles are far less physically taxing. These service sector jobs are much more desirable because these positions offer a better work"
829.0,831.24, environment and greater job satisfaction.
831.24,832.24, 3.
832.24,833.82, Loss in government resources.
833.82,838.5," The immediate effect is a substantial loss in tax revenue, which typically comes from"
838.5,842.56, both tourism-related jobs and the expenditures of tourists themselves.
842.56,845.06, Governments also oftentimes have to take a lot of debt
845.06,847.44, to cover welfare expenses for the unemployed
847.44,850.44, and incur additional debt to sustain social services
850.44,852.24, and economic stability.
852.24,854.36," For many nations, tourism constitutes"
854.36,856.5," a considerable segment of their economy,"
856.5,860.0, thus replacing this lost economic activity
860.0,861.98, as a task that leads to prolonged periods
861.98,864.72, of financial instability and economic decline.
864.72,870.52," But fourthly, there will be less foreign direct investment, or FDI, meaning less corporations come in."
870.86,875.86," Firstly, the immediate short-term losses from a curtailed tourism sector make it less profitable"
875.86,879.62, and riskier for investors to allocate capital to the affected country
879.62,885.88, due to the anticipated return on investment diminishing as the tourism industry revenue stream dries up.
885.88,890.54," Secondly, the signaling effect of such a drastic policy shift creates broader concerns about"
890.54,892.28, the country's investment climate.
892.28,897.14, By effectively declaring war on its largest industry after years and years of promotion
897.14,909.78," and support, the government signals unpredictability and potential hostility towards other sectors. This erodes investor confidence as we fear that similar abrupt and detrimental policy changes"
909.78,915.0," might impact their ventures in other industries, ultimately leading to a reduction in FDI."
915.82,917.6," Fifth, losing foreign currency."
918.1,922.36, Tourists bring in foreign currency that supports the local economy and exchange rate.
922.72,926.54," Therefore, without this, the country faces a deficit, weakening its currency."
926.96,932.04," A weaker currency makes imports more expensive, causing inflation and reducing purchasing power."
932.04,939.18," This can lead to a cycle of declining investor confidence and further economic problems, causing this vicious cycle."
939.54,942.28," Sixth, and finally, this also leads to bankruptcy."
942.88,947.76," Tourism businesses often invest heavily in real estate, infrastructure, and services,"
947.76,949.24, expecting steady revenue.
949.24,954.14," Therefore, when tourism stops, they can go bankrupt, leading to job losses and long-term"
954.14,955.14, debt struggles.
955.14,960.68," These bankruptcies affect banks, causing significant losses and tighter credit, which slows economic"
960.68,961.68, growth.
961.68,965.22," Therefore, the implication of all of these six mechanisms is simple."
970.68,974.8," This economy is massively impoverished when tourism is significantly limited. Significant restriction on tourism is significant restriction on the economy. For all these reasons, I'm"
974.8,975.66, very proud to oppose.
976.66,983.3, The COVID-19 pandemic plunged the economies of a lot of tourist destinations around the
983.3,985.52, world into essential disrepair.
985.52,990.9," That looks like economies like Thailand, who lost 30% of local GDP when it came to the"
990.9,993.44, decrease in flooding in some tourist areas.
993.44,999.02, This is because an over-extension of tourist economies creates a dependency on something
999.02,1002.32, that's inherently short-termist and inherently unequal.
1002.32,1008.46," It's something that can never be depended on, but you create the direct incentive for states to do so at the expense of their local"
1008.46,1012.36," populations. On South Africa, we believe that areas ought to benefit the"
1012.36,1016.26, individuals that live in them that we've been proud to propose. Three things in
1016.26,1020.1," this speech. Firstly, on context and strategy, I'm asking the question where"
1020.1,1024.54," are these areas? Secondly, on the policy limitations when it comes to limiting"
1024.54,1028.94," the amount of tourists, and lastly then, on the economic benefits that we bring through through"
1028.94,1033.52," our policy. Contextually speaking then, let's talk about the development of over-tourism"
1033.52,1038.1, and how it's something that came about. What we told you was that when the 1970s allowed
1038.1,1042.76," for mass long-haul flights to become something that is commercially viable, it also created"
1042.76,1049.74, an incentive for states not to consider the capacity of their regulation. That means they jumped straight into the inviting
1049.74,1053.96, of tourists into their nations. There was way more demand than there actually was supply.
1053.96,1057.72," But because they didn't consider these things initially, we now have the problems on our"
