start,end,text
0.0,10.0," The brutality of the Yugoslav war left us with an aftermath that can only be characterized as individuals losing access to basic social and economic rights,"
10.0,18.0," fragile peace that lacks sustainability, and people not knowing where their loved ones are after the chaos of the war has unveiled."
18.0,29.94," Instead of prioritizing the reconciliation of the region and the rehabilitation of the most vulnerable in the region, we see the ICTY to fully focus and fixate on the weakest form of quote-unquote justice, which"
29.94,34.32," is the punitive form. We stand for a more effective form of justice, a more reformative"
34.32,41.32," form of justice. We also value the betterment of civil society, incredibly proud to propose."
41.32,51.12," Before I get into my argumentation, a few points of framing and setup. First, what does our world look like? Our world is one where there are eight"
51.12,56.12, national TRCs in each country within the Yugoslavian region. They report back to one regional TRC.
56.4,60.46, These TRCs are going to be implemented by a local decree with the help and support of
60.46,66.24," the UN, similar to Syria and Union. Those TRCs are going to be non-judicial internal"
66.24,69.16, bodies created from the people and not to the people.
69.6,72.02, We see those TRCs to be made out of three fundamental committees.
72.3,78.2, The first is one that receives and processes applications for amnesty and conducting public
78.2,78.52, hearings.
78.88,82.9, The second is one that is responsible for compensating and rehabilitating victims of
82.9,87.0," the war and the most vulnerable, similar to the R&R within South Africa."
87.0,91.0, And the third and final one is a committee that is responsible for giving out recommendations.
91.0,93.0, Recommendations in three different ways.
93.0,100.0, The first is recommendations of reparation actions to be adopted by the UN and local governments that seek to help and reconciliate.
100.0,105.42, The second is recommendations of prosecutions to national courts.
105.78,109.72," And thirdly, publishing a joint historical record every two or three years"
109.72,111.98, to continuously update the historical record of the war
111.98,114.32, and to not miss any details of atrocities or crimes that are committed.
115.86,120.08," Second idea is, what are the conditions of the amnesty that will be given or asked of the House?"
120.3,121.86, We see three conditions.
122.24,126.12," First, full disclosure on all atrocities or crimes committed and or witnessed."
126.5,129.0," Secondly, the crimes that are committed will have to be politically motivated."
129.8,136.18, An individual has to have a certain level of authority forcing him to do that crime in order for amnesty to be valid and to be granted in the first place.
136.5,148.42," Thirdly and finally, agreeing on doing public hearings and giving our testimonies to the public and giving the public full access to the testimonies that are given by individuals who got amnesty. Thirdly, we think that the implementation of those TRCs is likely to"
148.42,152.64," be effective on our side of the House because of local and presidential decree, funds and"
152.64,156.78," administrative power that is given by the UN, and the fact that the commissioners of"
156.78,161.18," the TRC in the first place are likely to be individuals who are civil society leaders,"
161.18,170.0, are likely to be experts of diplomacy and reconciliation. Fourthly and finally is the fact that the kind of justice that we're explicitly following and pursuing on our side of the house
170.0,174.5, is a reformative type of justice and not the punitive kind that ICTY supports.
174.5,180.5, Our stand is victim-oriented. We don't think that victims get justice when they see a leader who's committed multiple genocides
180.5,189.3," being put behind bars for eight years. We don't think that that's the kind of justice that victims seek on our side of the house. When it comes to argumentation, three arguments."
189.66,194.36," First, on how TRCs lead to better victim satisfaction. Secondly, on how we establish peace in the"
194.36,199.9," region. Thirdly and finally, on how TRCs on our side of the house achieve better governance"
199.9,203.2," in the region. When it comes to the first argument, we prove this in three ways. The"
203.2,207.36, first idea is compensation and access to mental health facilities. It's very important to
207.36,210.72, know for a fact that the incentives of the UN to participate in the region will likely
210.72,215.4, remain the same on our side of the house. We see any kind of financial support from
215.4,221.14, the UN to be reallocated towards establishing the necessary facilities and to provide mental
221.14,228.32, health support for victims and individuals who are most vulnerable of the war and we also see direct financial compensation being given to such people.
228.32,234.92," Secondly, we see scores from NGOs and donors because of more information that we get through"
234.92,241.16," accessing more testimonies, because we are able to record and report on more atrocities"
241.16,247.2," and crimes that are likely to happen, we accumulate records for such crimes and atrocities that happen,"
247.2,250.74," we get a better understanding and a better record on what actually happened,"
250.74,254.28, this is fundamentally important because it gets the region more
254.28,257.58, attention from NGOs who will likely support the civil society. And with the
257.58,261.28, fact that we get victim testimonies and the fact that we allow victims to
261.28,264.48, access the necessary platform in the first place to share their
264.48,266.22," stories and to share these experiences,"
266.6,270.82, this mobilizes individuals that are more sympathetic on our side of the house
270.82,274.08, to support these individuals and to support the region and to donate to it
274.08,276.84, and to volunteer in the region in a way that is supportive
276.84,278.8, and in a way that benefits the most vulnerable.
279.62,283.0," And also, the supportive NGOs will likely be more effective on our side of the house,"
283.2,285.56," no thank you, will likely be more effective on our side of the house because of the recommendations and records that are likely to be given be more effective on our side of the house"
285.56,288.64, because of the recommendations and records that are likely to be given by TRCs on our
288.64,289.64, side of the house.
289.64,293.88, Any NGO that wants to support and be active in supporting the region on our side of the
293.88,297.34, house will have access to information and will have access to more details that is likely
297.34,301.84, to help them and make the allocation of their resources to be fundamentally more effective
301.84,302.84, on our side of the house.
302.84,306.72, The impact of this analysis is that we get better approach towards
306.72,309.92, healing generational trauma and establishing more efficiency
309.92,312.56, in managing resources in the first place and allocating them
312.56,316.08, more effectively towards empowering the civil society.
316.08,317.92," Before I move on to my next mechanism, go on."
317.92,323.2, PRC relies on a passive system where perpetrators have to willingly come out
323.2,327.76, and apologize. Why will it work specifically in the context of Yugoslavia?
327.76,330.6, We think that perpetrators will come out and choose to take the amnesty because they fear
330.6,332.24, to be prosecuted in the first place.
332.24,335.76, They see this as an opportunity to alleviate some of the prosecution that might likely
335.76,338.32, happen to them.
338.32,342.08, We see incentives for them to participate in the TRC to take amnesties and to give out
342.08,344.38, testimony so that they do escape prosecution.
344.38,348.0," Second idea on a more accurate historical record, we have more witnesses on our side of the house"
348.0,353.0, that are testifying from civilians and victims because they do have the incentives on our side of the house
353.0,357.0," to participate because of things like A, platform that is not available in the ICTY,"
357.0,361.0," not everybody can actually go, not all victims can go and testify in the ICTY,"
361.0,363.0, not every individual has access to such platforms.
363.0,367.04," B, the opportunities to face the perpetrator and actually tell the story and actually have"
367.04,371.44," the perpetrator acknowledge the suffering that they have caused to them. C, access to compensation"
371.44,376.0, that is likely to only be granted in case of testifying and actually going out and speaking
376.0,381.12," in the TRC. And finally, the fact that we actually build more momentum to testify because once"
381.12,385.42, individuals who were fit of prosecution choose to step up and testify
385.42,388.82," in the first place, we see that people on the ground are likely to become more committed"
388.82,393.72," and to get a certain level of momentum towards giving out testimonies, they themselves, which"
393.72,397.28, will get us more valuable testimonies because these individuals or people on the ground
397.28,399.02, are more quantity in testimony than the first place.
399.34,404.14, This means that we establish a better joint historical record in the first place that
404.14,405.6, is likely to be written which will help
405.6,410.24, which will help reconciliating experts and will give us the necessary perspective
410.24,413.36, of different victims and different perpetrators.
413.36,416.72, The second idea is that we actually get less toxic nationalism and media war.
416.72,419.68, Less toxic nationalism because we actually now have better education
419.68,422.56, because we give people a better historical record on what actually happened.
422.56,430.04," We focus more on heroic stories that actually show some initiatives of soldiers, for example,"
430.9,434.4, who are supportive to minorities or who are supportive to victims in the region.
434.64,438.64, And we also get better testimonies that give us a better collective image on what actually happened.
438.92,444.16, But what is fundamentally one of the biggest failures of the ICTY is the fact that they failed to manage the media war.
444.16,446.78," On their side of the house, they have narratives that say that Slobodan"
446.78,449.54, Milizavich is a hero. On their side of the house they have narratives that say that
449.54,452.56, these individuals are actually not the perpetrators but are
452.56,457.82, actually the victim. Each country within the region is saying no we're
457.82,461.08," victims, they're victimizing themselves but they're not willing to"
461.08,464.42, accept the fact that they were perpetrators at a certain point.
464.42,467.5, Second argument is on the fact on how we establish better peace in the region.
467.5,470.0," Because of the joint historical record that we get on our side of the house,"
470.0,472.5," by focusing on journalism and public hearing,"
472.5,476.0," on our side of the house, soldiers will only kill and commit crimes,"
476.0,480.0, and do things that are detrimental if they're incredibly pushed to do so.
480.0,485.0," On our side of the house, we have less soldiers who have the mindset of going out and simply obliterating individuals against them"
485.0,490.0, because they do understand that to a certain extent they too are perpetrators and not only the victims in the case.
490.0,496.0," This means that we get more possibility of peace talks, especially because of the social pressure that is likely to manifest on our side of the house"
496.0,499.0, as we're seeing a shift in democracy in the region after the war.
499.0,508.2," Over 200 political parties were established after the war and with the less toxic nationalism that's produced on our side of the house, we bring more possibility for diplomatic and peace talks, war is used"
508.2,509.32, as we are proud to propose.
510.08,514.0," Justice is a prerequisite to reconciliation, not an alternative."
514.62,516.04, We are extremely proud to oppose.
516.4,517.64, I'll do a few things in my speech.
517.9,519.22," First, I'll talk about characterization."
519.9,521.74," Second, some responses to the Prime Minister."
522.2,524.34," And third, I'll forward two arguments from Team Japan."
524.72,527.02," First, on why we better achieve justice for victims."
527.36,529.5," And second, on the achievement of regional stability."
529.98,533.24," Before argumentation, I want to note a few things on praying we do not agree with."
533.62,539.04, We think there are three major differences between the ICTY and the hypothetical TRC we must note.
539.38,541.12," First, on the existence of punishment."
541.6,545.1, The ICTY's main goal was to persecute the most important leaders who
545.1,550.64," spearheaded the war. On the flip, the TRC's goal was to move on. They almost always granted amnesty"
550.64,555.36," to war criminals, meaning this TRC was also systematically unable to persecute individuals."
556.04,561.92," Secondly, on who has authority in each of these institutions. The ICTI was created and is"
561.92,567.08, controlled by the UN to ensure fairness. It was established outside the region by a third party.
567.08,571.28," The TRC on the other hand is created more locally, often by the new government."
571.28,575.74," In this specific scenario, it would be difficult to choose where to place the TRC, but the"
575.74,578.12, point is it would be done inside Yugoslavia.
578.12,583.52," Thirdly, on the budget, the ICTI had a massive budget incomparable of that to the TRC, reaching"
583.52,589.38," ten times the budget of most TRCs. That being said, I want to make a few engagements with the PM and disprove"
589.38,593.62," their claims. On the first thing, they talked in their characterization as how this is going"
593.62,597.92," to work miraculously, where you're going to place different TRCs in eight different countries"
597.92,601.84," and we're going to have one main TRC that's going to work. However, I don't agree with"
601.84,609.3," this because they never, I'm confused by this on two levels. Firstly, this is not going to work, right? There's no incentive for a Serbian to go"
609.3,614.62, to a Croatian TRC and confess. You're seen as a traitor by all your friends and family. You have
614.62,619.4," to get on a plane, travel miles to Croatia just to apologize. But secondly, and most importantly,"
619.68,624.38," the perpetrators are literally in other countries, right? I don't see how this is going to work."
624.54,625.74, This needs to be explained better.
626.24,630.62," The second response I have, their first argument is about better victim satisfaction."
630.8,632.24, I have two problems with this argument.
632.64,636.88," Firstly, they never answer why people will come and testify in the first place."
636.88,639.5, Their only response is that they want to escape persecution.
639.78,649.08," But the fact is that when people do not come and confess in TRCs, they often get away with it with no punishment. Look at South Africa, look at other cases of TRCs. We think there's literally no"
649.08,653.66, incentive for people to come to TRCs. But the second problem they miss is that why people are
653.66,657.2, going to accept their apologies in the first place. We're talking about victims who have been
657.2,661.38," raped, who have had their families killed. We think it is impossible for someone to just accept"
661.38,669.76," an apology when they go to a TRC. They need to prove this from DTF. Moving on to the first argument then, on how the thesis of this argument is that the ICTY"
669.76,674.04, provided better closure and catharsis for the victims who suffered from the war. There are two
674.04,678.66, mechanisms for this argument. The first mechanism is that the leaders got retribution and punishment.
678.66,683.88," Under the TRC, the victims got a tokenistic apology from soldiers. This was inadequate in"
683.88,686.64, curing the deep pain these victims experienced.
686.64,690.96, There are two reasons why the apologies done in the TRC were seen as tokenistic.
690.96,694.32," First, because the only people who went to the TRC were those who,"
694.32,697.36," for entirely selfish reasons, wanted to get amnesty."
697.36,700.08, They didn't come to apologize because they felt sorry.
700.08,702.24, They came so they could justify their actions
702.24,705.26," and show that it was politically motivated, as PM conceded."
705.62,708.8, Those who apologized for selfish reasons did not make genuine apologies.
709.28,713.34," But second, even if the perpetrator were to give an apology from the bottom of their heart,"
713.58,719.7," victims were likely to perceive the apology as tokenistic, as you envision the perpetrators to be inhumane."
720.04,724.38," To these survivors, justice and resolution were unachievable by an insincere apology."
724.74,729.4, It is cruel and wrong to say that a sorry could pay for the suffering these people had faced.
729.78,733.66," In the comparative, under the ICQI, leaders were effectively imprisoned."
733.78,734.38, I'll take it later.
736.86,742.08," This meant that the leaders, the ones who were responsible for all actions committed, were punished."
742.56,745.76," Soldiers and local military generals were merely puppets of the leaders,"
746.06,747.84, cogs in an ever-turning car machine.
748.06,749.18, We punished the real villain.
749.5,750.14, We did it right.
750.24,752.06," We placed the blame where it rightly belongs,"
752.16,753.48, and we brought justice for the infighting.
753.6,754.16, I'll take it later.
754.16,758.9, The second mechanism is that ICTY brought justice even to those who could not speak out.
759.16,762.9," In both worlds, many people were unable to speak out due to extreme trauma."
763.24,768.78, They are individuals who went through such horrific crimes that they are unable to come forward due to humiliation and trauma.
769.04,773.16, It is forcing people to remember the worst moments of their life.
773.84,778.82," The people that come to court hearings are the brave ones, but hundreds and thousands have to scream in silence."
778.82,782.06," For those people, the ICTY can uniquely achieve closure."
782.48,786.52," Under the ICTY, we covered everyone by punishing the leaders who ordered the horrors."
786.76,790.28," This means that when Milosevic got jailed, when people heard this on the news,"
790.68,792.94, all victims of his horrors could place the blame on him.
793.02,794.24, They could point the finger at him.
794.24,796.56," They all felt some catharsis and reprieve,"
796.66,800.3, even if the specific individual who committed some crime upon them was in jail.
800.66,804.26," The ICTY gave everyone, including the most vulnerable, a sense of justice."
804.5,809.0," The conclusion of my argument is simple. We protect victims, we give them catharsis, we give them justice."
809.0,811.0," But before moving on to the second argument, I'll take your QI."
811.0,820.0," On your side of the house, the ICTY punished... there was an arbitrary punishment in which a 75-year-old person was prosecuted and imprisoned,"
820.0,825.24, and Milosović specifically died before the verdict. He died before found guilty.
825.24,827.88, So how do you solve for this arbitrary prosecution?
827.88,832.44, I think you're missing the point because the comparative on your side is you do not punish Milosevic at all.
832.44,834.44, We think it is rather worse on your side of the house.
834.44,836.44, Moving on to the second argument.
836.44,838.44, The second argument from Japan is on peace.
838.44,843.94," The thesis of this argument is that the persecution of the most dangerous leaders is necessary for safety and peace,"
843.94,847.68, which was uniquely achievable under the ICTY. The premise of this
847.68,852.18," argumentation is that under the TRC, wartime leaders stayed in politics. This"
852.18,856.5," fundamental function of the TRC, which centered around not punishing, means that"
856.5,860.22, leaders went unscapped and could stay in politics. Why then would the
860.22,863.76, proposition's world where leaders stay in politics have inflamed conflict and
863.76,869.54," hampered development? Two mechanisms. First, wartime leaders and their ideologies would lead them"
869.54,874.34, to engage in massively harmful actions. These ruthless leaders who committed war crimes are
874.34,879.66, going to continue this foreign ideology. This is because these leaders have to maintain a strong
879.66,885.72, man leader object to maintain where they must be must be seen as a consistent leader and one that
885.72,886.72, will continue to fight.
886.72,890.54, This is amplified especially in chaotic times like war.
890.54,893.18, Leaders are therefore unable to change course or moderate.
893.18,897.66," These leaders, the masterminds behind these mass massacres, continue to rule and continue"
897.66,898.66, to destroy.
898.66,902.88," But secondly, even if these leaders moderate, the existence of these leaders in politics"
902.88,904.44, in of itself would have been harmful.
904.44,907.62," There are three reasons why this is true. Firstly, nations in the"
907.62,911.94, Yugoslav region obviously feel antipathy and antagonism towards opposing nation's
911.94,916.16," leaders. Secondly, major Western institutions like NATO and EU is highly"
916.16,920.46, unlikely to admit post-Yugoslav nations as they are seen as unchanged. This means
920.46,926.16, that nations are unable to access a lot of the monetary and military benefits these institutions offer.
926.76,933.94," Third, and finally, many economic powerhouses in the West, like America, are likely to never reinstate their social economic ties with these nations."
933.94,950.0," The fact that an authoritarian dictator like Milosevic continued to wield power was enough, but the leaders' firm anti-West stance further exacerbated this. This all means that when these leaders maintain power, countries are less likely to negotiate trade deals, maintain regional cooperation,"
950.22,955.84," create economic ties, and improve post-EUCO class stability. So the question is, why was the ICTY"
955.84,960.6, able to solve this? The mechanism by which we achieve solvency is extremely simple. We have
960.6,965.02, jailed tens of these genocidal leaders. The fact of the matter is that people want change.
965.24,967.12, The citizens' will is to create change.
967.42,969.4," Therefore, new leaders will cater to this will."
969.6,973.82," They created a new age of leadership, one that was more democratic and one that was more moderate."
974.22,976.18, The empirical evidence is clear on this matter.
976.48,979.96, Croatia's new leader democratized Croatia and stabilized regional conflicts.
980.34,983.74, Serbia worked to democratize the nation and integrate with Europe.
984.2,986.6, Slovenia and Croatia have returned to the EU.
986.6,989.6, Serbia and Montenegro are candidate countries of the EU.
989.6,992.6, This leads to the conclusion of my speech.
992.6,995.2, ICTY allowed for peace to be achieved in the region.
995.2,998.0, This is why we are able to compete here in Serbia today.
998.0,999.2, Extremely proud of those.
999.2,1005.94," Side opposition is supporting a word in which ICT wise, first of all"
1005.94,1008.14, the punishments were
1008.14,1009.94, not effective. We are seeing
1009.94,1012.14, 75 year old grandpas being
1012.14,1013.78, imprisoned and prosecuted
1013.78,1016.04, and some of them died before having
1016.04,1017.64, a guilty verdict.
1017.96,1019.4, Milosevic died before
1019.4,1022.16, being found guilty. And even
1022.16,1024.02," when they are imprisoned, they are imprisoned"
1024.02,1025.6," in five starstar hotels,"
1025.6,1028.1, tour-prisons. They are not even prisons.
1028.1,1032.8," There are hotels with television, with access to gyms, libraries, etc."
1032.8,1035.9, So we are not looking into real punishment on their side of the house.
1035.9,1040.8, This punishment is an arbitrary punishment that does not allow the victims to reconciliate
1040.8,1046.0," and does not allow the victims to take their rights, their rightful rights on their side of the house."
1046.0,1050.0, So what am I going to do in this speech? I'm going to do three main things in this speech.
1050.0,1054.0," The first of which is rebuttal, the second of which is present my third argument,"
1054.0,1059.0, and the third is to show how we win this debate and how Team Japan needs to respond to us.
1059.0,1065.82," For the first thing on rebuttals, on prosecution, they told us that we do not get prosecutions on our side of the house."
1065.82,1067.14, We would argue two main things.
1067.14,1071.86," First of all, that their prosecutions are arbitrary, they cost a lot of resources, and"
1071.86,1074.82," second of all, they are not really effective for the victims."
1074.82,1079.38," For the victims, I do not really care if the president is in prison, I would really care"
1079.38,1082.44, if my rapist is acknowledging that he raped me.
1082.44,1087.0, I would really care if my rapist failed to apply for amnesty to be prosecuted.
