start,end,text1057.72,1062.42," side that haven't been addressed. But secondly, we told you that this is concentrated in developed"
1062.42,1065.96," nations for three main reasons. Firstly, because of cultural compatibility."
1066.46,1071.06," That means that British tourists would rather go to Ibiza, for instance, on holiday"
1071.06,1073.24, than a country in Africa or Asia
1073.24,1076.76, because they believe they're going to be more integrated into that culture when they go.
1076.96,1078.24," But secondly, on availability."
1078.62,1081.38," That's to say that the lines, the planes, the flights available"
1081.38,1084.28, go into those regions where things are more easily accessible
1084.28,1089.58," and tourists then channel to those areas. But lastly, on safety and stability. Afghanistan is"
1089.58,1093.96," a great country when it comes to views, a great country when it comes to history and culture,"
1094.08,1097.4, but it's something that people are unlikely to visit because they don't think they're going to
1097.4,1102.78, be welcomed in a safety and political stability sense. What does this analysis then do? It frames
1102.78,1105.88, out the majority of their instances when they talk about
1105.88,1107.98, nations in the developing world that are going
1107.98,1109.9, to be harmed by this policy. Because the five
1109.9,1111.94, biggest nations when it comes to tourists are
1111.94,1113.88," New York, a lot of cities when it comes to tourists"
1113.88,1116.06," are New York, London, LA, Paris"
1116.06,1117.76," and like, um, and like"
1117.76,1119.94," yeah, and New York City. And these are"
1119.94,1121.58," things, we think, that are directly"
1121.58,1123.94, able to benefit from other mechanisms
1123.94,1125.12," other than tourism. Which means the direct harms that are directly able to benefit from other mechanisms other than tourism,"
1125.12,1128.98, which means that the direct harms that are created on the individuals in those states
1128.98,1133.22, are things that need to be prioritised. But the second thing strategically is the idea
1133.22,1137.82," of inherency, the fact that they provide generalised benefits of tourism without showing why all"
1137.82,1142.36, the tourism that we see under status quo is something that necessarily has to be maintained.
1142.36,1146.04, Firstly then on the policy and the ability to limit tourists on their side.
1146.22,1148.26, We give you three responses to their analysis.
1148.54,1152.58, The first thing is that all regions of the city have the biggest tourist destinations.
1152.76,1154.88, What you're doing is competing for centrality.
1155.06,1156.8," That's nightlife, that's access to amenities,"
1157.16,1161.72, that's the things that individuals and tourists are directly in opposition for
1161.72,1165.64," because they want to experience those amenities and the centrality of the city,"
1165.74,1169.8," which means there's a direct competition that they can't engage with on their side. But secondly,"
1169.96,1174.64," note the inherent difficulty on policing large crowds and the disincentive there is to do so,"
1174.72,1178.64," because tourists are going to like your area less when they feel like it's a police state,"
1178.7,1181.92," when they feel like they're being actively cracked down on, which means unless you have"
1181.92,1187.7," small crowds that you can regulate using smaller security services, you aren't able to regulate the larger crowds on their"
1187.7,1193.6," side because it detracts from that ambience. But lastly, on the behaviour of individuals."
1193.6,1198.24, We note firstly that tourism creates an environment where people feel like social norms are suspended.
1198.24,1202.38," We're in a place to have fun, we're going to do that at all costs. But secondly, on"
1202.38,1209.28," the capacity to spend, they talked about currency disparities. That's directly worsen on their side because people are able to absorb larger"
1209.28,1213.28, fines and are psychologically inclined to do so because they come in with the intention
1213.28,1218.44, of spending money. That then frames a direct incentive to pivot away from over-tourism
1218.44,1223.1," that exists under status quo, but also shows you why our mechanism is uniquely beneficial"
1223.1,1229.12, in that regard. The second conversation is the idea of economic benefits and the capacity to diversify.
1229.12,1233.08," Here we just think they don't engage with what exists under status quo, where tourism"
1233.08,1237.0, creates a direct incentive to lock yourself into particular markets.
1237.0,1240.26, And here is where we talk about the fact that tourism is effectively seen by governments
1240.26,1241.88, as a free source of money.
1241.88,1245.06, It's like something that's based on the natural features and requires
1245.06,1248.28, minimal investment when it comes to the development of regions.
1248.28,1252.58, Note then that policies that rely on developing areas within your nations are disbeneficial
1252.58,1257.42," to states in two regards. Firstly, they require more active investment because of that development,"
1257.42,1261.52," but secondly, there's a sacrifice that needs to be done. So if you have to run, for instance,"
1261.52,1264.86," protectionist measures to protect a nascent industry, that's something that's going to"
1264.86,1268.06," cost you trade deals, that's something that requires political inertia"
1268.06,1269.34, in order to happen.
1269.64,1274.26, That then creates an incentive or a structure where states are able to lean on tourism over
1274.26,1278.14, more because it doesn't require political sacrifices in order to get off the ground.
1278.28,1282.14, This looks like nations like Thailand that have nascent manufacturing industries that
1282.14,1285.88, they disregard because of the incentives that tourism creates.
1285.88,1288.18," Also note, tourism creates two harmful incentives."
1288.18,1292.52," One, it creates the incentive to just look away from social problems, that's Airbnb cutting"
1292.52,1294.02, deals with the city of Cape Town.
1294.02,1298.06," But secondly, it creates incentive to actually entrench these social issues."
1298.06,1302.56," So Thailand is notorious for sex tourism, that's something that Western people go to"
1302.56,1307.24," to experience, and it's something that the government won't regulate because of that economic benefit."
1307.24,1311.46," But note then, they also didn't engage with the litany of harms that we brought to when"
1311.46,1313.46, it came to disparities in purchasing power.
1313.46,1314.96, And they agreed to these harms.
1314.96,1316.76, They told you tourists come into spend.
1316.76,1320.92, And what that means is the generalized increase in standard of living and property taxes for
1320.92,1327.98," the demand of short-term tourist accommodation, all of these things then are impacted on their side. How do we weigh out then? We weigh out because they"
1327.98,1333.74, create a diffuse harm and we create a concentrated benefit. A diffuse harm with a concentrated
1333.74,1337.98," benefit. So they're able to benefit the few people that are employed in these areas, in"
1337.98,1342.04," these cities, while generalising and decreasing the standard of living. That's through the"
1342.04,1347.32," clashes between tourists and individuals, the large cities, that's through the increase in standard of living, which means individuals"
1347.32,1351.46," aren't able to benefit. Comparatively, we get a large-scale benefit for everyone who"
1351.46,1356.44," exists in the city on a marginal cost. Before I move on to my argument then, sure, I'll take a part."
1356.44,1361.38," When you limit the context of this debate to developed nations, it is factually true that countries like"
1361.38,1365.6, America or Britain are not entirely dependentated on tourism for their economy.
1365.6,1368.7, How can you say that diversification is necessary for development?
1368.7,1372.7," Okay, so I just gave you two different contexts that we need to engage with."
1372.7,1378.5," On one side, you have developed economies, which creates an increase in the standard, in the cost of living within these nations,"
1378.5,1382.3," and pushes people to the outskirts of countries, of cities, like LA."
1382.3,1387.68," That's something that's directly disbeneficial, and's something that can be fixed easily because we have the GDP reserve"
1387.68,1391.34, to just not rely on tourism. In developing nations you create the direct
1391.34,1395.12, incentive to lean on tourism as a mechanism and you allow for regulation
1395.12,1398.38, not to take place. Those are two different harms that you create and you need to
1398.38,1401.46, engage with them respectively. On the idea then that you create harms to the
1401.46,1404.56, environment. The framing here is that we have an increase in environmental
1404.56,1407.98, tourism under status quo. These are regions that carry appeal because
1407.98,1411.84, of their aesthetics. These are regions that are also uniquely fragile because ecosystems
1411.84,1416.14, are dependent on balance. Note how this is harmed in three ways on their side. The first
1416.14,1421.0, way is the increase demand for accommodation and luxury. This means the construction of
1421.0,1427.08, tourist regions. What that means is tourism expands in popularity and companies work on increasingly more extravagant and
1427.08,1430.68, resource-intensive projects in an attempt to corner the markets. This looks
1430.68,1434.86, like the Guaypoh Islands in Dubai that required a massive amount of sand to be
1434.86,1438.24, pulled in order to build them and destroy reef infrastructure in the
1438.24,1442.26, process. That means that those ecosystems are irreparably damaged and can't be
1442.26,1448.96," maintained. But secondly, note that tourist presence creates pollution and environmental harm. That's firstly in terms of resource use."
1449.14,1453.6, So there's massive resource-intensive hotels that are going to divert resources away from
1453.6,1457.62, locals. Dubai literally couldn't fight its wildfires because it didn't have the water
1457.62,1462.28," that water was being diverted to the hotels in the region. But secondly, on waste products."
1462.38,1467.62, Note that tourism are uniquely dependent on single-use plastics because they want to vent in the region for a
1467.62,1471.1," long time. You're eating out more, you're going to create more waste products in"
1471.1,1475.0," that regard. Based on all of that then, they fail to benefit the individuals who live"
1475.0,1479.02," within particular nations and we get that benefit, never been prior to a proposed."
1479.02,1488.32," I want to firstly deal with their economy. They give you three main mechanisms in their first argument, I'm going to deal with each"
1488.32,1489.32, one.
1489.32,1492.04," But before dealing with each one, I think it's imperative to note that they don't"
1492.04,1493.88, prove through a comparative in this debate.
1493.88,1498.18, They have two burdens to fulfill in the comparative that go unfulfilled at this point in this
1498.18,1499.18, debate.
1499.18,1503.5," Firstly, they still have to prove to you that alternatives to some extent do exist."
1503.5,1509.12," That the asserting POI response that, oh, alternatives probably do exist, cannot prove to you that that is true."
1509.12,1514.0," In the Maldives, the reason why the nation is relying upon tourism is because no other"
1514.0,1518.84," industry adequately can replace the economic impact that that has. In Seychelles, the reason"
1518.84,1524.68, why the economy is 40% dependent on tourism is because nothing can replace that GDP impact.
1524.68,1526.26," Therefore, they still have to prove to you"
1526.54,1533.44," alternatives do exist. But secondly, they then have to prove to you that these alternatives are in any way better because their homes are not in"
1533.44,1538.08," any way unique to tourism. Look at, for example, their claim about diversification or"
1538.5,1543.96, higher cost of living. That claim is basically going to be symmetric in every other alternative you can bring.
1543.96,1546.0, Let's say you shift to manufacturing.
1546.0,1549.6, Let's say you have car companies come in and build infrastructure in your country
1549.6,1551.36, and hire people in your country.
1551.36,1554.32, These car companies are going to bring in hundreds of foreign workers with them
1554.32,1557.52, who are similarly going to push the economy into overdrive
1557.52,1559.84, and are similarly going to increase the cost of living.
1559.84,1562.16, The problem is not unique to tourism.
1562.16,1564.48, But I also want to look at each of the mechanizations.
1564.48,1566.8, The first mechanization is on cost of living.
1567.12,1569.58, I have two levels of response against this at the top.
1569.88,1572.28," One, that we frame from our second piece on frame"
1572.28,1574.64, that is unengaged by their speaker
1574.64,1577.54," to say that, well, oftentimes the tourist areas"
1577.54,1580.8," are very far apart, or at the very least in different areas"
1580.8,1582.4, from where the locals live.
1582.56,1584.7," And governments do have incentive to structure economies,"
1584.92,1586.16," to structure societies this way,"
1586.34,1588.5, which is why in Amsterdam there's a tourist district
1588.5,1589.98, and then there's a locality district
1589.98,1591.86, where the cost of living is a lot lower.
1592.18,1595.4," But secondly, I don't believe that the cost of living going up"
1595.4,1597.64, is just unique to the cost of living going up.
1597.8,1599.38," But rather, things like eats,"
1599.6,1601.8," things like salaries and infrastructure go up with it,"
1601.8,1605.46, which means we can match the pace of inflation with the salaries.
1605.46,1611.32," But finally, I want to weigh our argumentation on things like vulnerable jobs and the general"
1611.32,1615.18, economy as a whole above this cost of living claim in four crucial ways.
1615.18,1619.76," Number one, that having a job and being employed is the prerequisite for you even caring about"
1619.76,1620.76, cost of living.
1620.76,1624.38," If you have no income, the damage of cost of living is highest for you."
1624.38,1627.62," Secondly, that high cost of living has some amount of solvency. You are"
1627.62,1631.62," helpless in getting an income out of strats as an unemployed individual, but"
1631.62,1635.06, there are many ways to do things like cut expenses or just move to another area.
1635.06,1639.64," Thirdly, high cost of living largely only applies to more rich individuals. The"
1639.64,1643.38, price increases in this debate impacts luxury goods and not everyday goods.
1643.38,1648.82," It's restaurants, not grocery stores, that are impacted. It's hotels in the city structure, not rent in"
1648.82,1653.68, the outskirts. It's the cost of living that disproportionately only impacts tourists or
1653.68,1658.36, those who are rich. The unemployment disproportionately impacts the poor. That is the impact we all
1658.36,1663.04," care about. But fourthly, that the state has some amount of more moral obligation to these"
1663.04,1665.0, individuals than they do to them.
1665.0,1670.7, Because the state is actively at fault for the reliance of these workers that they have on the tourist industry.
1670.7,1674.0," Not only did they allow for it, but they did not create good alternatives,"
1674.0,1677.2, and for years actively encouraged tourism and tourist jobs.
1677.2,1679.2, And now they're stabbing them in the back.
1679.2,1681.9, The state has a moral obligation to these vulnerable individuals.
1681.9,1684.7, That is why cost of living is unimportant in this debate.
1684.7,1687.12," Secondly, let's talk about their seasonality claim."
1687.12,1691.88," Two responses. Number one, this is structurally untreatable. Off-season"
1691.88,1695.54," vacationing is incredibly common. It's cheaper, it's less crowded, a lot of people"
1695.54,1700.34," do that. But on the flip, furthermore, we're willing to strongly encourage such"
1700.34,1703.78," policy where we encourage off-season touristing. From our frame, we tell you"
1703.78,1708.18, this is a viable alternative. The second response I want to make is that the seasonal analogy
1708.18,1712.86, claim is highly uncomparative because at worst we have a season of prosperity and a season
1712.86,1715.76, of stagnation and therefore they have constant stagnation.
1715.76,1720.6, Their third claim is that these massive gains leak out through multinational corporations.
1720.6,1728.68," We've provided to you various mechanizations from our argument. We have six of them, none of which are heavily reliant upon MNCs being"
1728.68,1732.42," willing to trickle down the economy. For example, our second mechanism, our"
1732.42,1735.84, second impact was on the shift to service industries. This means that even
1735.84,1739.6," if these corporations suck up all of the money, the fact that the"
1739.6,1743.3, economy shifts in that direction in and of itself is a benefit and in that way
1743.3,1745.32, trickle-down still does happen.
1746.9,1747.16, Let's talk about our argumentation.
1752.58,1754.82," Our argumentation gave you six reasons, six impacts why this economic benefit to tourism brings is uniquely and massively important."
1755.28,1759.14, The proposition fails to heavily engage to any of these mechanizations.
1759.14,1762.9," I think that this alone is debatable, but especially on vulnerable jobs."
1763.0,1764.18, I think that one does this debate.
1766.8,1767.16, Let's talk about culture then.
1769.88,1770.14, The claim of culture is basically tourist disrespect culture.
1771.78,1771.84, I have two layers of engagement to this.
1775.84,1776.64," Number one, that cultural importance for locals or indigenous people can still be protected in our world."
1776.88,1779.36, We can literally do things like subsidize these areas.
1779.36,1783.58," For example, the U.S. natural reserves do give communal ownership to indigenous peoples"
1783.58,1785.1, to allow them access to that.
1785.1,1790.3," But secondly, that touristy cultural sites and important cultural sites are oftentimes massively different."
1790.3,1794.0," For example, in India, people are obsessed with beautiful mosques,"
1794.0,1799.4," but the actual mosques that are regularly visited are ones that are further away, far less used, and far less touristy."
1799.4,1804.5," The second level of response is to say, well, all of this due and disrespect for cultural sites"
1804.5,1807.12, can heavily be mitigated by forms of regulation.
1807.12,1809.08, This is not just policing coming in.
1809.08,1813.6," This is also, for example, people who are visiting the site alongside you, telling you"
1813.6,1817.24, you should actually take off your shoes when you walk into a Japanese temple.
1817.24,1820.24," Now, proposition gives you various reasons why this is probably true."
1820.24,1824.42, They say things like competition or how you cannot police this or individual behavior.
1824.42,1825.76, There's two levels of engagement here.
1825.76,1829.56," Firstly, on the level of incentive, I think states have massive incentive to do this."
1829.56,1833.16," Yeah, sure, being seen as a police state is probably not that much of a good thing, but"
1833.16,1836.12, being seen as a dysfunctional state is far worse of a harm.
1836.12,1841.24," Also, you have some amount of incentive to cater to your voters who hold you accountable,"
1841.24,1843.94, which means you do have to care about your citizen population.
1843.94,1848.48," The second level of response, on the level of capacity, it's actually fairly easy to regulate this."
1848.48,1853.84," Just find people more, or just get more people, just get more police, or in the case of slum tourism,"
1853.84,1859.12," just ban things like gambling. I don't think it's that hard, I think we've proven capacity."
1859.12,1863.2," Finally, on the environment, they say two things, we have three responses."
1863.2,1869.5," Number one, that the delta is massively small, that at best they just limit tourism, some"
1869.5,1870.5, harms still go true.
1870.5,1874.9," Secondly, we can regulate this, please use paper rather than plastic, those are policies"
1874.9,1878.76," that are being implemented in the status stone, states have massive incentive to do so."
1878.76,1882.96," And thirdly, I don't think this impact is as important or as positive as the varying"
1882.96,1884.9, other economic impacts we've given you.
1884.9,1887.8, These are unique impacts that are only manifesting under tourism.
1887.8,1889.8, I think that this takes this debate.
1889.8,1893.3," I want to run an extending argument in my last minute then, on liberalization."
1893.3,1897.3, There are three reasons why liberalization happens when tourism is massive.
1897.3,1903.8," Number one, a large influx of tourists puts a big and immediate pressure to relax urgent policies that are oppressive and conservative."
1903.8,1907.7," Because when governments continue to get massive revenue from the tourist industry, they have to maintain"
1907.7,1910.32, this positive image and avoid international backlash.
1910.42,1910.88, Look at Qatar.
1911.48,1916.72," Secondly, active tourism necessitates easing of restrictive laws and implementation of"
1916.72,1922.14, consistent policies as authorities face challenges in selectively enforcing regulations on tourists.
1922.42,1926.26," Initially, authorities may try to say, well, tourists, you don't have to follow these laws,"
1926.26,1928.56," but at some point, the influx of tourists"
1928.56,1929.4," is going to be too much,"
1929.4,1932.1, governments will have to make liberal black-ed policies.
1932.1,1933.92," Thirdly, on normalization,"
1933.92,1935.94, when tourists openly engage in behaviors
1935.94,1937.5," that are restricted or stigmatized,"
1937.5,1940.0," such as same-sex relationships or liberal dress codes,"
1940.0,1941.92," it gradually normalizes these behaviors,"
1941.92,1944.5, and all of this leads to softened local prejudices
1944.5,1945.52, and inclusive policies.
1945.62,1950.96," This looks like, for example, Saudi Arabia's introduction of tourist visas being accompanied by social reforms"
1950.96,1953.72, like women being allowed to travel without male gardens.
1953.72,1957.46," This looks like Bangkok, which is a renowned destination for LGBTQ tourists,"
1957.46,1960.84, where it could have never have evolved in this way if it weren't for tourism.
1960.84,1967.56," This is important not only because it benefits the larger society in forms of freedoms but also for the most vulnerable minorities, LGBTQ"
1967.56,1970.98," individuals, women who suffer in conservative societies. Liberalization is"
1970.98,1974.44," massively important for the tourists, for the economy, for the vulnerable"
1974.44,1983.22, individuals of public. The burden of the opposition was quite high. They couldn't depend upon the already existing benefits of tourism as they are right now.
1983.22,1986.42, What they needed to justify was why over tourism
1986.42,1988.8," was likely A, going to continue those benefits"
1988.8,1990.34," in a way that is sustainable,"
1990.34,1992.56," but B, wouldn't have any adverse effects"
1992.56,1994.58, in the instances in which they do fail.
1994.58,1996.78, Given the fact that we've had two speeches
1996.78,1998.68, from the opposition side that haven't provided
1998.68,2000.52," justification for any of these things,"
2000.52,2003.2, it's quite clear that your ballot goes to Team South Africa.
2003.2,2004.8, Two questions that I'm going to be asking
2004.8,2012.72," with interactions. The first is on economic benefit, the second is on cultural harm. But before that, I just want to deal with a couple of things in terms of context in this draft."
2012.72,2025.6," Firstly, on the context between developing nations versus developed nations. Let's assume that this case takes place in the world of the opposition, where we specifically look at developing nations. Why exactly do we think that this is bad? We think that the increased dependence on tourism harms them in terms of the opposition, where we specifically look at development in Singapore. Why exactly do we think that this is bad?"
2025.6,2029.9, We think that the increased dependence on tourism harms them in terms of the shocks
2029.9,2032.2, that they are likely going to be facing on their side.
2032.2,2033.8, Two reasons why that's the case.
2033.8,2038.6, The first is because the majority of the benefit that they get on their side is likely going to be seasonal.
2038.6,2044.1, That is to say that you only get a minimal income in the season in which tourism is most likely going to be affected.
2044.1,2047.72, In the cases in which they want to derive the off-season benefit.
2047.94,2051.84," We don't think that the majority of people visit the majority of these countries in off-seasons,"
2051.98,2055.82, mainly because of the fact that the conditions that allow them to go there aren't necessarily
2055.82,2056.36, there.
2056.42,2059.14, So they cannot enjoy natural beauty because of extreme weather.
