start,end,text3222.16,3225.92, individuals get no justice in proposition. This alone is debate winning.
3225.92,3229.76," But finally, the second clash on peace is obviously going to our bench"
3229.76,3233.2, because they concede to us in this debate that leaders being in power is bad.
3233.4,3236.04, And we prove to you from an unengaged argumentation
3236.2,3238.88, why these leaders can uniquely be ousted in our vote.
3238.88,3241.68, I think that this argumentation alone can take this debate
3241.68,3246.0, to crouch to stand on the opposition bench where we actually care about the victims?
3246.0,3250.0, A late supposed justice is a justice denied.
3250.0,3254.0," This is the side that opposition is defending, on our side of the house."
3254.0,3259.0," Even if we do not achieve prosecution for the leaders, we're not looking for this."
3259.0,3263.0, Because prosecuting the leaders takes more resources and it's arbitrary
3263.0,3265.62," because it's not going to benefit the victims,"
3265.62,3271.28," it's not going to create any change because these leaders, when they were prosecuted,"
3271.28,3275.12, they were thrown out of power before getting prosecuted.
3275.12,3277.62, So the prosecution is actually arbitrary.
3277.62,3281.94, What's more important is delegitimizing toxic mid-rank generals.
3281.94,3285.36, This was analysis that was never engaged with from side opposition.
3285.36,3289.2," Moreover, what's more important, it's achieving closure to these individuals."
3291.68,3300.0, A child who's waiting for his father to go back from the war is way more inhumane for him to wait
3300.0,3306.28, without knowing that his father died 20 years ago. A wife who's still waiting for her husband to go back
3306.28,3313.26, and to bring her something is way worse on their side of the house
3313.26,3315.58," because on our side of the house, by the worst thing,"
3315.82,3319.4," we achieve closure, we achieve the real reality that happened there."
3319.86,3326.0, So I'm going to do the three main questions in this debate.
3326.0,3329.0," First of all, who helps the victims more?"
3329.0,3333.0," First point of clarification, they told us that the NGOs are symmetrical."
3333.0,3337.0, Throughout the debate we've proved that NGOs are not symmetrical.
3337.0,3342.0," On our side of the house, the NGOs are more incentivized to cooperate and to work"
3342.0,3345.28," because NGOs, when they know that there are atrocities that were"
3345.28,3351.76, discovered in the ICTY that are getting discovered in our TRC they're more likely going to create
3351.76,3357.04, part of this but second of all on our side of the house when we get the testimonies of the victims
3357.04,3360.48, which is exclusive to our side of the house because on their side of the house these victims
3360.48,3368.0," do not have the needed platform to testify on On their side of the house, we have a small amount of victims."
3368.0,3372.0," On our side of the house, we have a bigger platform for these victims."
3372.0,3377.0," So even if the perpetrators are not going to participate, the victims are way more important."
3377.0,3380.0," But second of all, talking about participation."
3380.0,3385.66," On our side of the house, these victims are going to participate because they want to get the platform to talk about their problems."
3386.06,3388.78, They're going to participate in order for them to get compensation.
3389.3,3395.64," But third of all, these soldiers and mid-rank generals that are going to participate in the fear of getting prosecuted,"
3395.64,3401.72," even if there is not as much prosecution as we want to have,"
3401.98,3407.38, but the fear of the possibility of getting prosecuted is way more important
3407.38,3412.56, and it's going to incentivize many leaders and many generals and many normal soldiers
3412.56,3413.56, to testify.
3413.56,3417.12, Moving into closure and acknowledgement and why is it important?
3417.12,3422.44," It's not simply about an apology, it's about not denying the atrocity, not denying the"
3422.44,3423.44, crime.
3423.44,3426.46," On the other side of the house, these leaders are denying the crime."
3426.74,3431.56, What's worse than a perpetrator going free after telling the truth
3431.56,3435.64, is a perpetrator going free because of a not guilty verdict
3435.64,3438.94," after denying the truth, after denying the atrocity."
3439.26,3440.24, This is side opposition.
3440.74,3443.46, Moving into who achieves a more collective historical record.
3443.46,3448.58, They told us a multinational regional TRC is not going to work. We've told you that they're
3448.58,3453.08, going to cooperate under their own administration but second of all why this TRC is
3453.08,3456.5, way more important than anything from side opposition because on our side of
3456.5,3460.46, the house each TRC is going to provide their own report and they're going to
3460.46,3466.82," report back to the regional TRC. This regional TRC is going to be responsible for, as we told you before,"
3467.36,3474.52, this TRC is going to be responsible for providing a historical record that is being written by different POVs.
3474.7,3477.18, And this is way more important than anything else from the opposition.
3477.54,3479.02, Moving into peace.
3479.22,3481.44, They told us that they achieved peace.
3481.58,3482.7, We did not see this.
3482.7,3484.96, We're saying Kosovo is part of Serbia.
3485.36,3490.16, We're saying the only genocide that happened is against the Serbs. These are narratives that only happen
3490.8,3494.56," on their side of the house, on our side of the house, where the victims are going to testify,"
3494.56,3499.52, where the soldiers are going to testify. It's way more important than arbitrary prosecution
3499.52,3505.04," of grandpas and imprisoning them, and some of them are not even imprisoned. So proud to propose."
