start,end,text3056.0,3060.0," And yes, tourism industry was massively harmed by COVID, but so was every other industry."
3060.0,3063.0," With that said then, I want to talk about two far more important sub-clashes."
3063.0,3066.36," First, on jobs. Are there jobs in our world?"
3066.36,3068.6, They say two reasons why this is untrue.
3068.6,3070.76," From our first speaker, we flip all of this."
3070.76,3075.12," We tell you that things like service industries, training, vocational training, state support"
3075.12,3079.12, can only exist in our world where the tourist industry is in some way successful.
3079.12,3081.2," Therefore, there are jobs in our world."
3081.2,3084.4," On the comparative then, are jobs going to exist in proposition?"
3084.4,3089.82," We say no, and the response to just do vocational training isn't a valid alternative when"
3089.82,3094.62, the poorest individuals who are only employed in our world are absolutely messed up because
3094.62,3099.24," they can't access vocational training in their world. And secondly, it's unclear what"
3099.24,3103.62, money they're doing this vocational training with when Seychelles is incredibly poor. This
3103.62,3107.12," means that this argumentation, which I weighed for four mechanisms from my speech"
3107.12,3108.84," alone, can run as this debate."
3108.84,3110.84, This is more important than any other claim.
3110.84,3113.18, Let's also talk about this claim on displacement.
3113.18,3115.66, We outframed and outweighed this argumentation for a second.
3115.66,3118.24, I don't think it stands and the web didn't bother extending.
3118.24,3122.56," Finally, and thirdly, on seasonality, we proved to you that this is not only untrue but also"
3122.56,3127.24," comparatively better in our world, but it's also wrong here why this is so especially bad."
3127.24,3130.96, Like ski resorts earn all of their money in the winter and have enough money there to
3130.96,3132.82, carry them through the next year.
3132.82,3136.88," This means that seasonality is not an inherent harm, they have to prove to you it's harmful."
3136.88,3139.58, Let's talk about culture in the second question.
3139.58,3142.24, We gave you three unresponded mechanisms from second speaker.
3142.24,3149.0," One, we can just subsidize culture, we can do things that allow communal ownership of it. Secondly, that tourist sites and cultural sites"
3149.0,3154.4," are vastly different. And thirdly, that people do enforce these on them by themselves, even if state"
3154.4,3159.86," regulation were to somehow fail. I think that culture is obviously our site. Finally, let's talk"
3159.86,3164.0, about the environment. The important framing of this environment argument is that this is an
3164.0,3166.88, intensely unimportant argument in the context of this debate because
3166.88,3170.9, tourism and its CO2 emission pales in comparison to a lot of other industries
3170.9,3174.24," like multinational corporations and their industrialization, cruise ships,"
3174.24,3178.18," cars, wars, all of those emit more and insofar as they're not even vouching for"
3178.18,3182.26," the entire abolishment of tourism but just simply the limitation of tourism, I"
3182.26,3191.6," don't think that this is a high-delta clash. I don't think, therefore, that proposition was adequate in proving to me that they can now magically solve the entire problem with sea levels that Maldives has."
3191.6,3193.6, This environment clash is low-Delta.
3193.6,3196.2, What is a Delta is three important things.
3196.2,3202.6," One, for conservative nations where vulnerable individuals are hung, we liberalize them in one way or another."
3202.6,3208.0," Two, for jobs, we don't put people out of business, we allow for employment to continue."
3208.0,3211.68," And thirdly, for the nation's economy, tourism is a necessity."
3211.68,3213.88," We may not want it to be so, but it is."
3213.88,3216.32," For all these reasons, proudly stand on the opposition bench."
3216.32,3217.32, Thank you.
3217.32,3221.5, The exact time you can trace that an opposition loses a debate is the point at which they
3221.5,3229.14, make an argument that is so profoundly unstrategic that they then down-bench disregard the engagement we give to you on it. Because we told you
3229.14,3233.56, why liberalisation is something that isn't going to function. We told you why countries
3233.56,3238.72," use tourism as a front to pretend as if they're liberalising and then do things like use slavery,"
3238.98,3243.28," the Kafkala system, to build up the systems that enabled that tourism in the first place."
3243.36,3246.82, And we also told you why these countries are uniquely not dependent
3246.82,3251.04, or leaning on the public perceptions of individuals in the West to survive.
3251.26,3253.92," So if Saudi Arabia is perceived to be a police state,"
3254.1,3259.18," generally we don't think the opinions of Western tourists are things that largely shifted in that regard,"
3259.28,3261.92, but we think secondly that those opinions were easily manipulated.
3261.92,3266.28," That's engagement we gave you, that's engagement that's unresponded to. And so their alternate"
3266.28,3268.24, path to victory is out of this debate
3268.24,3269.98, quickly off the top of the speech.
3270.18,3272.16," Three things then. Firstly, on context."
3272.34,3274.32," Secondly, on the economy. And lastly,"
3274.54,3276.02, on the preservation of culture.
3276.3,3278.32," Contextually speaking, we already told you"
3278.32,3280.02, why developed nations are important
3280.02,3282.02, in this debate. They aren't dependent on
3282.02,3284.14," tourism, and so the limitation when it comes"
3284.14,3289.3, to the populace generally is something that is marginal. And note then that the focus of people in
3289.3,3294.08, the nation is something that is uniquely overshadowed by headline economic figures in the state.
3294.26,3298.24," So the mayor of Paris, for instance, accepts broadly that things at the Olympics are going"
3298.24,3302.0," to happen, while not listening to the outcries of the populations that have to deal with"
3302.0,3308.0," those Western tourists on a day-to-day basis. But also, their point on this being empirically untrue just disregards the way the world functions."
3308.0,3313.0, We told you why the tourists who have the money are more likely to flood into countries
3313.0,3317.0," they're more capable or comfortable in, but we also told you why this is something that's"
3317.0,3322.0, uniquely impacted within these states. And so all of our analysis on the majority context
3322.0,3328.34," in this round is something that still stands. But secondly, don't their assumption that tourism just ceases to exist, demand still"
3328.34,3334.12," exists, that the demand side is still pretty high on our side and we're just regulating"
3334.12,3338.36," the influx of tourists within a nation, we have yet to prove why this is so disastrous"
3338.36,3340.48, when it comes to the individuals themselves.
3340.48,3344.36," So at this point then, understand that the majority context is one on our side and the"
3344.36,3347.0, individual clashes will take out the externalities.
3347.0,3352.0," On the first conversation, on the economy and the harming of people in those nations, we told you two things."
3352.0,3355.0, The first thing is that you compete with tourists for resources.
3355.0,3359.0, And note that this is something that's supported by every bit of analysis they give you on tourist spending power.
3359.0,3368.16," These people are inherently short-termists, they're able to spend your monthly wage in a week and that's what they come there to do. What is their response? The extent of their response is just tourists have"
3368.16,3372.62," different places that they're competing with individuals with. So it's not a direct competition,"
3372.62,3378.08," but largely the harms occur in different places. We gave you two responses. Firstly, on centrality,"
3378.34,3382.74," that is, you as a tourist want to be in the centre of a city where the economic activity is,"
3382.92,3388.24," where it's bustling, where the nightlife is accessible. The same center that individuals who have jobs want to be accessing"
3388.24,3392.32," as well. That creates direct competition that can't be regulated out. But secondly,"
3392.62,3397.6, note the impact of the increasing cost of land on our side. Because that doesn't just isolate
3397.6,3402.68," one area, it isolates the majority of instances where that land is going to increase in cost."
3402.78,3407.2," When Airbnb buys out a massive amount of properties, there's less properties for you to have your"
3407.2,3411.46," supermarket on, increasing your cost and ability to provide for locals. But"
3411.46,3414.88," secondly, they told you the creation of jobs is something that occurs. But we"
3414.88,3418.66, told you that you uniquely lock out alternative economies from developing.
3418.66,3422.38, You lack development of other economies because of the lack of incentives they
3422.38,3426.72, have. They don't have the necessity to generate alternative economies and they're going to ignore
3426.72,3430.62," those economies as a result. Thailand ignores its manufacturing, nascent"
3430.62,3434.46, manufacturing center because of the tourist income it generates. And as a
3434.46,3438.24," result then, we also told you that tourism is uniquely unstable because"
3438.24,3442.28," it's the first thing to go when a shock like COVID-19 happens. So sure, things are"
3442.28,3445.32," able to decrease when it comes to bad economic circumstances,"
3445.48,3447.92, but tourism is uniquely unstable in that regard.
3448.18,3449.12, Two deadlock breakers.
3449.32,3452.36," One, interest develops or decreases in the long term."
3452.52,3454.16," So like Spanish islands, for instance,"
3454.3,3455.6," had less attention on them,"
3455.78,3458.14, and that's something that means the money is less long-term.
3458.3,3461.36," But secondly, the investment in rebuilding the farms you create,"
3461.52,3463.82," like rebuilding shores from those like construction,"
3464.08,3464.84, is something that's bad.
3464.9,3466.32, So that money doesn't even get funneled down.
3466.56,3467.88," Secondly, on cultural preservation,"
3468.18,3470.32," we told you there are regulations that are panacea,"
3470.46,3473.24, and you can't regulate tourist behaviour as effectively.
3473.58,3474.98, Note then that we win on this debate
3474.98,3476.46, for the people who live in these countries
3476.46,3477.56, that we've been proud to propose.
